SrcDatabase-来源库,Title-题名,Author-作者,Organ-单位,Source-文献来源,Keyword-关键词,Summary-摘要,PubTime-发表时间,Year-年
CJFD2016,基于协议分析与模糊测试的SIP漏洞挖掘研究,李进东;王韬;吴杨;雷东;,军械工程学院信息工程系;,计算机工程,会话初始协议;;协议分析;;漏洞挖掘;;模糊测试;;测试用例,"针对会话初始协议(SIP)可能存在的安全漏洞以及对SIP漏洞挖掘研究工作不足的问题,基于协议分析与模糊测试,提出一种SIP协议漏洞挖掘方案。该方案在分析SIP协议语法、格式和会话流程的基础上,对可能出现漏洞的SIP消息生成对应的畸形数据包作为模糊测试的测试用例,并在会话建立的过程中随机发送畸形数据触发测试目标,在监视到SIP客户端发生异常时记录异常信息,并分析导致异常的错误是否能被利用。实验结果表明,该方案能更全面地挖掘出由协议分析结果和模糊测试发现的SIP漏洞,提高挖掘数量和效率。",2016/8/15,2016
CJFD2016,浅谈图书馆大数据的服务模式创新,熊哲夫;,永州职业技术学院;,电脑知识与技术,大数据;;跨界数据;;数据运营平台,"传统图书馆现有数据、创新的环境保障、改善现有数据业务的分析,让现有数据诞生新价值,跨界数据获取,构建完整数据运营平台,提出图书馆大数据基于数据运营平台进行流程再造和商业模式变革。",2016/8/9 16:13,2016
CJFD2016,基于大数据的路桥汽车用户线上2C运营方案研究,张恒;张磊;程新洲;陈崴嵬;,中国联通网络技术研究院;,邮电设计技术,大数据平台;;汽车运营;;用户画像,"通过分析汽车行业的大数据现状,结合目前路桥汽车用户收费模式,提出基于大数据的汽车用户线上运营方案。该方案包括了大数据平台建设和APP业务运营全链条,通过运营商和汽车本身数据分析,形成完善的汽车用户标签,通过APP向用户提供精准的车主、广告和金融等服务,提升车主服务体验,形成基于大数据的运营服务。最后在高端车主画像和挖掘方面进行了研究,通过大数据分析,形成一套高端车主的挖掘算法,为后期精准运营提供了技术参考。",2016/8/20,2016
CJFD2016,记忆计算:概念、特性及研究进展,郭斌;陈荟慧;李文鹏;於志文;姜佳君;王文辉;,西北工业大学计算机学院;,计算机科学,普适计算;;记忆计算;;情境感知;;数字记忆;;移动及可穿戴设备,"随着信息技术的发展,尤其是移动互联网与物联网的发展,有关个人工作和生活的数据呈指数型增长。这些海量的数据中蕴含着丰富而有价值的个人信息,如何从这些数据中挖掘出有价值的信息成为当前信息领域的重要问题。针对该问题,介绍了普适计算领域新兴起的研究主题——记忆计算。记忆计算旨在通过各种带感知和计算功能的设备,比如智能手机、可穿戴设备等,实时感知和捕获用户线上线下活动的数据,分析并挖掘其内在价值,进而组织和管理有意义的记忆数据,实现基于情境的记忆数据呈现,以辅助个体记忆,支持社群交流与协作。讨论了基于移动情境感知的记忆计算的概念、特性、系统模型以及当前研究的关键技术与挑战,综述了记忆计算在生活日志、记忆...",2016/9/15,2016
CJFD2016,基于公共体育理论考试成绩自动化管理体系设计研究,张海芳;,陕西中医药大学体育部;,自动化与仪器仪表,公共体育理论考试;;成绩自动化管理;;体系设计;;实现,"旨在实现公共体育理论考试成绩自动化管理,方便教学质量的自动化分析,结合学生成绩通用公开的特征,保证考试成绩自动化管理中有着更加简捷以及科学的特征。通过提出一种数据挖掘技术,应用ASP.NET技术,并结合SQL Server数据库形式,促进软件的有效性开发和分析。系统功能的设计,结合系统管理以及成绩管理的主要模式,做好测试类型的有效性管理,将测试项目管理和成绩分析模块实现。关于系统架构的设计注重数据的有效性处理和数据自动化清洗过程,通过对决策树创建,结合学生成绩现状,做好学生成绩的综合分析。公共体育理论考试成绩自动化管理体系的设计,实践结果表明,系统有着稳定的运行,同时也将公共体育理论考试成绩自...",2016/6/25,2016
CJFD2016,DICOM数据的语义查询及优化,冯雪;于戈;马宗民;詹永丰;,东北大学信息学院;解放军沈阳军区总医院信息科;,计算机工程与科学,DICOM结构化报告;;语义查询;;知识库;;智能Agent,"医学信息领域用DICOM类型的数据存储由各类检查设备产生的医学图像信息。DICOM标准的优点是标准化和语义化,它使各类医学图像设备和医学图像处理系统之间有了统一的数据交换模式。一个DICOM图像包含丰富的语义信息,包括患者相关、检查相关和图像相关的信息,但目前各类系统对其应用得还不够,尤其是数据挖掘方面,大多系统是通过构建关系数据库来存储和描述图像相关的信息。针对DICOM图像本身所携带的语义信息进行的挖掘还不够多,这违背了当初创建DICOM标准的初衷。造成这个应用现状的主要原因是国内系统厂商只利用了DICOM标准信息交换的功能,却对其语义的理解有欠缺。为了解决上述问题,对基于DICOM语义信...",2016/8/15,2016
CJFD2016,基于改进的关联规则挖掘算法的用户兴趣挖掘,李珊;邵兰洁;孙丽云;,燕京理工学院信息科学与技术学院;,计算机时代,关联规则;;置信度;;数据挖掘;;用户兴趣挖掘,"研究发现,传统的关联规则挖掘算法在用户兴趣挖掘的应用中,摒弃置信度这个度量值。究其原因,在于网站结构中置信度不能准确度量用户兴趣。提出了一个可以替代传统置信度的、在网站环境下能正确反映用户兴趣的确定性的度量值,并结合用户的浏览速率进行用户兴趣挖掘。对比实验结果表明,此方法挖掘用户兴趣的效果明显。",2016/9/15,2016
CJFD2016,改进的K-means算法在客户分类中的应用,崔晓云;王欢欢;钱慎一;,河南省烟草公司郑州市公司卷烟配送中心;郑州轻工业学院计算机与通信工程学院;,现代计算机(专业版),客户价值;;K-means算法;;客户关系管理,"对客户价值的划分,可以为企业进行准确的客户定位,制定良好的市场营销战略。利用优化K-means算法初始值的选取,建立客户潜在价值和客户当前价值表,并以某物流公司现有的实际数据为基础进行实证分析。将所有客户分为重要客户、次重要客户、隐含价客户三类,分析各类客户的消费特性,提出针对性的客户营销及管理方式。",2016/8/25,2016
,,,,,,,,
