SrcDatabase-来源库,Title-题名,Author-作者,Organ-单位,Source-文献来源,Keyword-关键词,Summary-摘要,PubTime-发表时间,Year-年
CJFD2016,基于“互联网+”的教育新图景,李英;,广东科学技术职业学院;,电脑与信息技术,互联网+;;大数据;;教育;;个性化,"当下信息技术与教育革新的前沿,就是制定""互联网+""的行动计划,推动大数据与教育的融合,促进教育持续、健康发展,从而引领教育在新领域创造出一种新生态。文章分析了""互联网+""时域下大数据革新教育的新图景,总结出与大数据同行的学习就是未来的教育。",2016/6/15,2016
CJFD2016,网络信息推荐系统存在的问题及发展方向,付建清;,福州职业技术学院现代教育技术中心;,科技创新导报,网络信息系统;;推荐;;数据库;;需求,"在网络环境下,信息的种类和数量越来越多。网络信息推荐系统是面向用户的系统,怎样向用户推荐感兴趣的信息,在用户对信息的个性化要求日益明显的情况下,个性化服务技术就变成网络信息推荐系统的关键问题。因此研究和开发先进的推荐系统就越来越被人们重视。该文主要分析了目前网络信息推荐系统存在的问题,以及未来网络信息推荐系统的发展方向。",2016/6/7 15:01,2016
CJFD2016,基于投影的高效用项集挖掘算法,王敬华;罗相洲;吴倩;,华中师范大学计算机学院;,小型微型计算机系统,投影;;高效用;;频繁项集;;模式挖掘,"随着高效用模式挖掘算法在实际应用中的重要性逐步显著,因而其得到了越来越多的关注和研究,但是已知的一些算法存在着多遍数据集扫描以及会产生大量候选项集、时效性不高等问题.这些问题使得高效用模式的挖掘效率大大降低,故本文提出一种新的基于投影的高效用项集挖掘算法HUPMP(high utility pattern mining on projection).采用基于投影的方式将项集的信息存储在数组中,能有效的减少前人基于树结构建树所产生的耗时.同时HUPMP算法将多次数据集扫描减少为只需要进行两次数据集的扫描便可挖掘出所有的高效用模式.另外,针对会产生大量候选项集的问题,提出了一种不同于闭包属性的新性...",2016/6/15,2016
CJFD2016,基于符号熵的序列相似性度量方法,张豪;陈黎飞;郭躬德;,福建师范大学数学与计算机科学学院福建省网络安全与密码技术重点实验室;,计算机工程,符号序列;;相似度;;熵;;层次聚类;;序列聚类,"现有序列相似性度量算法在子序列相似性度量中仅考虑其局部相似度,忽略了其所属序列的整体结构信息。为此,提出一种以单个符号的熵为基础的序列相似性度量方法,根据同一序列中相同符号的位置及个数信息得出符号熵。通过凝聚型层次聚类结果验证序列相似性度量方法,在多个领域的符号序列数据集上的实验结果表明,与现有的基于子序列局部相似性方法相比,该相似性度量方法有效提高了聚类结果质量。",2016/5/15,2016
CJFD2016,近场通信技术的安全研究进展与发展趋势,张玉清;王志强;刘奇旭;娄嘉鹏;姚栋;,中国科学院大学国家计算机网络入侵防范中心;西安电子科技大学综合业务网理论及关键技术国家重点实验室;北京电子科技学院;,计算机学报,近场通信技术;;安全威胁;;研究进展;;发展趋势;;网络安全;;信息安全;;网络空间安全,"随着移动互联网和移动支付的发展,NFC技术因其天然的安全特性和便利性,成为运营商、银行、厂商等热捧的对象.由于涉及到移动支付和敏感信息的传输,该技术也受到安全研究人员和攻击者的广泛关注.虽然国内外安全专家和学者对NFC安全问题已进行了一定的研究,但目前还没有详细和全面介绍最新安全研究成果的论文.为解决此问题,该文分析和总结了国内外最新的研究成果,并对NFC安全问题未来的研究方向进行了展望.首先,介绍了NFC技术的基本特性、通信过程、协议栈、工作模式等,分析了该技术面临的安全威胁,包括通信安全、安全漏洞、安全元件、恶意软件、网络钓鱼等内容.然后,通过分析相关研究工作,总结了NFC技术的安全研究现...",2015/11/19 12:32,2016
CJFD2016,基于K-means聚类算法的公交行程速度计算模型,高曼;韩勇;陈戈;张小垒;李洁;,中国海洋大学信息科学与工程学院;,计算机科学,公共交通;;平均行程速度;;K-均值聚类算法;;数据融合;;数据挖掘,"定位与无线装置在公交系统中的广泛应用使得获取实时公交数据成为可能。为挖掘这些数据中蕴含的道路交通状况信息,提出了一种基于K-means聚类算法的数据融合模型,来计算相邻公交站点间的平均行程速度。首先对K-means聚类算法进行改进:(1)聚类数K不是预先设定的固定值,而是不重复样本数的平方根,不同路段不同时段K值不同;(2)初始聚类中心不是随机选取,而是根据K值按一定规则选取。其次利用改进的算法对样本数据进行聚类,然后对各类数据进行加权融合,计算出平均行程速度。最后通过折线图对青岛市4个城区的行程速度进行分析,挖掘交通流的演变规律。研究结果为交通管理、居民出行等提供了强有力的支持。",2016/6/15,2016
CJFD2016,软件开发中的活动模式挖掘,吉才盈;代飞;李彤;蒋旭东;,云南大学软件学院;云南省软件工程重点实验室;,计算机科学,过程挖掘;;原子活动;;活动模式;;折叠;;软件过程,"如何获取实际运作的软件过程(而非经验过程)是一个关键问题。软件过程的事件数据呈现记录多、无明确活动与独具过程特性的特点,使得现有的业务过程挖掘方法难以被有效应用。首先获取事件日志的原子活动;然后采用折叠的方法从软件项目开发实例中挖掘活动模式,获取软件过程,对不同时期的软件开发行为进行分析;最后通过一个开源项目的实际案例来验证该方法。",2016/6/15,2016
CJFD2016,HFS:一种面向软件缺陷预测的混合特征选择方法,陈翔;贺成;王宇;管怀文;,南通大学计算机科学与技术学院;南京大学软件新技术国家重点实验室;,计算机应用研究,软件质量保障;;软件缺陷预测;;特征选择方法;;实证研究,"在软件缺陷预测研究中,若考虑了大量度量元会造成数据集中含有大量特征,其中冗余特征和无关特征会降低缺陷预测模型的性能。提出一种两阶段混合特征选择方法 HFS,具体来说,首先基于特征子集评估器移除已有特征集中的无关特征和冗余特征,随后基于特征排序评估器进一步移除其中的无关特征。在实证研究中,以基于实际开发项目的数据集作为评测对象,以NONE、CFS和CAR三种方法作为与HFS方法比较的经典方法。最终基于三种不同类型的分类器(包括决策树法、支持向量机和最近邻法)上,发现HFS方法不仅能够选出更小规模的特征子集,而且在大部分情况下,尤其以决策树作为分类器时,能够有效提高缺陷预测模型的性能。",2015/11/2 10:59,2016
CJFD2016,点击欺诈群体检测与发现,董亚楠;刘学军;李斌;章玮;,南京工业大学计算机科学与技术学院;中国人民解放军73677部队;,计算机应用研究,点击欺诈;;欺诈群组;;孤立点检测;;贝叶斯分类,"针对目前存在大批网络用户,以群体形式来欺诈点击的问题,提出了一种检测点击欺诈群组的方法。首先使用频繁项集挖掘算法来发现共同点击过大量广告的个体用户,作为疑似欺诈组。然后,在对组内用户点击行为属性分析的基础上,运用孤立点检测方法找到与组内其他用户有显著差异的疑似欺诈用户。最后,运用贝叶斯分类方法对检测到的所有疑似欺诈成员分类,得到真正的欺诈群组和欺诈用户。在真实的数据集上进行的实验,验证了该方法的可行性和有效性。结果表明,该方法为点击欺诈检测问题提供了一条新的思路。",2015/9/29 11:19,2016
CJFD2016,大数据下微博推荐算法,张磊;吾守尔·斯拉木;买买提依明·哈斯木;于清;,新疆大学多语种信息技术实验室;,激光杂志,数据挖掘;;社交网络;;并行计算;;推荐系统,"为了提高微博推荐算法的准确率和解决社交网络平台海量信息的问题。基于LDA(Latent Dirichlet Allocation)三层模型提出C-LDA(Collaborative Latent Dirichlet Allocation)四层模型,该模型不仅考虑被转发者对转发者的影响而且考虑了关注者产生的影响。综合特征词热度、用户负样本反馈以及遗忘曲线等因素改进吉布斯采样算法,使用改进后的吉布斯采样算法近似求解C-LDA模型。然后运用模型中用户与微博的主题概率向量计算相似度,进行Top-K微博推荐。与以往方法相比,该方法适用于具有时效性和互动性的微博应用场景,推荐的效果更加理想。最后基于Had...",2016/6/25,2016
CJFD2016,基于Hadoop的图书推荐系统研究与设计,南磊;,江苏省信息中心;计算机软件新技术国家重点实验室(南京大学);,计算机与数字工程,MapReduce;;并行计算;;关联规则;;图书推荐;;Hadoop,"经过近些年的发展,图书市场在种类规模和总体数量等方面有了长足的进步。但是同时也带来了图书过多,使得读者难以选择合适图书的困难。常规的明细分类使得读者可以针对每一种类型的书进行选择,但是其每个分类下依然有成千上万中书籍。论文完成的是一种基于Apriori算法创建关联规则的图书推荐在Hadoop上的实现。利用在豆瓣读书上获取的图书评论数据,使用Hadoop生成图书的K-频繁集,并计算相关的图书推荐置信度。论文实现的算法能够高效地为读者提供推荐服务。",2016/6/20,2016
CJFD2016,基于数据仓库技术的社会实体渠道虚假销售行为分析与研究,赵纯坚;魏莉;,湖南电信郴州分公司;湘南学院 软件与通信工程学院;,中国新通信,数据仓库;;社会实体渠道;;异常用户模型,"随着4G业务在中国市场的逐步商用,各通信运营商把渠道战略作为业务竞争的一个关键因素而纷纷加大投入。运营商必须建立一套能够时刻监控渠道变化的预警机制与控制系统,研究和制定各种应急处置预案,从而提高对实体渠道的掌控力。本文通过抽取实体渠道新增用户数据样本,对新增用户的受理属性和通信行为进行挖掘分析,建立异常用户模型,以某地电信岁末年初营销社会实体渠道行为进行了模型验证,完成了社会实体渠道虚假销售行为的分析与研究。",2016/6/5,2016
CJFD2016,基于对抗的智能态势感知预警模型与实践,曹嘉;肖岩军;,北京神州绿盟科技有限公司;,保密科学技术,态势感知;预警模型;预警技术;DDoS;网络安全风险;内存数据库;分布式数据库;网络安全领域;自动化平台;信息安全;,"近年来,随着安全控制手段的日渐成熟,安全工作逐渐从事后的评估和响应走向预防为主,走向关注自动化安全运维保障、风险持续监控保障、风险态势感知预警,走向关注风险的可视化能力以及安全的预警和保障。安全从早期希望能够一招打天下的人海战术模式,开始向精细化、模块化、系统化、规范化、自动化平台模式开展。随之而来也产生了新的研究课题,如风险可视化技术、态势感知技术、态势感知预警技术、风险持续监控技术等。",2016/5/20,2016
CJFD2016,广电网络数据分析平台数据质量治理策略与方法探讨,胡其权;,深圳市天威视讯股份有限公司;,广播与电视技术,数据质量;;数据分析;;数据仓库;;商业智能;;数据挖掘,"本文基于广电网络运营商在数据分析平台建设中对数据质量治理的实际需求,对数据质量治理的策略与方法进行了论述,为广电网络运营商的数据分析平台的数据质量治理提出了相关建议。",2016/5/15,2016
CJFD2016,大数据在企业精益管理中的探索与应用,时小麟;薛训明;陆琨;石蕴玉;汪飞;,安徽中烟工业有限责任公司;,电脑知识与技术,大数据;;数据挖掘;;应用探索,"""大数据""是近年来兴起的热门词汇,并在很短时间内迅速渗透到每个行业,成为重要的生产因素。基于大数据的预测、分析将逐步融入企业管理和决策中。大数据技术和思维将影响企业管理与决策的各个环节,本文通过实例介绍了大数据在卷烟制造企业的应用。",2016/5/26 11:27,2016
CJFD2016,一种基于形式概念分析的软件质量评价方法,金腾辉;孙龙;,工业和信息化部电子第五研究所;,电子技术与软件工程,形式概念分析;;概念格;;二值背景;;软件质量,"形式概念分析是一种有效的知识表示与知识发现工具,在数据挖掘、知识发现、信息检索、软件工程等领域得到了广泛的应用。本文描述了形式概念分析在软件测试领域对软件质量评价的一种方法,利用概念格表示分析和统计软件测试结果,根据软件测试结果建立形式背景,从而建立概念格,用于对软件测试结果进行分析,为软件质量评价提供了一种新的方法。文中主要描述了形式概念分析在软件测试阶段的应用。",2016/6/22 9:27,2016
CJFD2016,大数据视角下的互联网视频用户行为,韦安明;何亚维;王晓茹;,国家新闻出版广电总局广播电视规划院;,广播与电视技术,大数据;;互联网视频;;用户行为,"短短10余年间,互联网视频便以其强娱乐性、高个性化、高质量的特点征服了广大用户。规模较大的互联网视频服务网络往往拥百万级的用户数,其每日可采集到数百万条用户行为数据。通过挖掘用户行为数据,发现隐蔽其中的用户行为规律,是提高互联网视频运营企业节目生产、投放能力和改善运营服务能力的有效手段。本文中,我们以最小二乘法、相关性分析法和信息增益法为数学工具,对国内某大型互联网视频运营商采集的用户行为数据进行了深度挖掘。通过研究,我们发现了一系列的用户行为规律,并对其进行了归纳,还对影响用户行为和用户参与度的诸多因素进行了分析。",2016/3/15,2016
CJFD2016,基于智能交通数据下的否定关联规则实验研究,孙剑斐;叶娅;,河南师范大学新联学院;,电子世界,智能交通;;数据挖掘;;否定关联规则,"目前,交通系统中的数据增长越来越快,特别是公交系统的数据采集和技术分析日益纷杂,伴随着数据的快速增长无疑是告知我们智能交通的大数据时代已经来临。当然,公交数据这类资源和其它资源相比,又有着其特殊性,一种快速且高效的公交数据采集方法,对于城市的公交系统有着其重要的作用,倘若数据这类资源不能得到有效利用,那么给市民出行带来将会是一种沉重的负担。本文主要利用大量公交IC卡刷卡的相关数据进行有效处理与分析,对否定关联规则算法进行深化研究。",2016/7/23,2016
CJFD2016,车削轴类零件的轮廓轨迹提取与真实感显示,陈智渊;,青海师范大学民族师范学院;,计算机测量与控制,可视化;;轴类零件;;数据处理;;真实感;;OpenGL,"图形数据信息的可视化一直是计算机图形学与可视化领域研究的重点内容,图形数据的挖掘、提取与显示都需要借助计算机图形学的知识来完成;本研究重点探讨了计算机图形真实感处理技术在计算机辅助数控车削自动编程加工系统中的应用,通过运用计算机图形处理技术编程提取DXF轴类零件的轮廓轨迹曲线,采用曲面构造算法作数据处理,生成零件真实感所需的三维数据模型,结合OpenGL内容对三维数据模型进行实体渲染,交互实现了数据模型的光照、材质、雾化等功能,通过旋转、透视变换,零件设计者可真实地观测到零件内部结构,从整体上对所设计的零件结构进行直观的认识;实验结果表明所开发的图形真实感程序系统能够高效的实现车削轴类件的渲染...",2016/7/25,2016
CJFD2016,基于改进正2k边形坐标的可视化方法研究,张健;赵立军;,中国人民解放军装备学院;,计算机工程与应用,正2k边形;;可视化;;维度重排;;相关系数;;降维映射,"针对网络安全领域处理海量高维数据时遇到的认知困难,提出一种基于改进的正2k边形坐标的可视化方法,利用可视化效果评价指标和相关系数对维度进行重排,优化了高维数据在降维映射后的显示效果。实验结果表明,该方法保持了易于发现维度分布信息的优点,并解决了散点图数据混乱和呈现信息单一等缺点,能够更加有效地发现聚类信息,为管理员进一步分析和挖掘威胁提供了便利。",2015/4/21 10:24,2016
CJFD2016,基于关联规则挖掘的跨网络知识关联及协同应用,黄晓雯;严明;桑基韬;徐常胜;,中国科学院自动化研究所模式识别国家重点实验室;中国—新加坡数字媒体研究院;,计算机科学,跨网络关联;;关联规则挖掘;;视频推荐,"随着社交媒体的兴起,各种社交媒体服务应运而生,社交媒体多源化现象越来越明显。一种基于关联规则挖掘的方法可以用来分析研究社交媒体多源现象,即通过同一个用户与不同社交媒体上多源数据的行为交互,挖掘社交媒体多源数据知识关联,进而设计跨网络协同的视频推荐应用。本研究框架主要分为3个步骤:(1)基于主题建模的知识发现,对用户和视频进行主题建模,得到其在主题层上的表示;(2)基于关联规则挖掘的跨网络知识关联,以跨网络共同用户作为连接不同网络的桥梁,利用关联规则的方法挖掘不同网络间的知识关联;(3)基于跨网络知识发现的冷启动视频推荐,将用户和视频映射到同一主题空间并进行主题匹配,最终进行视频推荐。实验结果表...",2016/7/15,2016
CJFD2016,商业智能系统在政府部门的应用,陆从青;,江苏省质量技术监督信息中心;,无线互联科技,智能系统;;数据;;政府;;应用,"大数据是继物联网、云计算之后,IT产业又一次颠覆性的技术革命,随着IT行业的长足发展,数据才是真正有价值的资产。政府部门应该积极引入商业智能系统,提高工作效率,更好地为广大民众提供便捷服务。",2016/6/10,2016
CJFD2016,数据资源集成技术专利分析——以八国两组织专利数据为例,朱新超;潘薇;刘会景;,中国科学技术信息研究所;北京万方数据股份有限公司;,情报工程,专利分析;;数据资源;;数据集成,"随着互联网、移动互联网、云计算技术的发展,数据资源的重要性越来越凸显。本文以八国两组织范围内的相关技术专利数据为依据,通过对数据资源集成技术专利信息的数据挖掘和数据分析,从专利申请趋势、重点专利申请人的专利申请趋势及专利技术生命周期等指标,分析数据资源集成技术在八国两组织范围内的发展现状及未来的发展趋势;结合专利申请地域分布、主要专利申请人专利申请区域分布等要素分析八国两组织的专利竞争情况及重点专利区域布局。",2016/4/15,2016
CJFD2016,第三方支付粗糙复杂网络知识发现方法研究,曹黎侠;黄光球;李艳;,西安建筑科技大学管理学院;西安工业大学理学院;,计算机科学与探索,第三方支付;;粗糙复杂网络;;时间序列分析;;知识发现,"第三方支付平台的可持续发展是一个错综复杂的问题,解决问题的关键之一是平台潜在客户的挖掘。建立了第三方支付粗糙复杂网络,通过对该粗糙复杂网络的上下近似度、度分布和度的概率主值的研究,构建了第三方支付粗糙复杂网络知识发现模型,给出了基于粗糙集理论的时间序列分析法的求解方法。第三方支付粗糙复杂网络知识发现方法的研究,为第三方支付平台潜在客户的挖掘提供了定量化可操作的方法。提出了粗糙复杂网络的有关概念,以及第三方支付粗糙复杂网络的度分布,为第三方支付有关问题的研究奠定了理论基础;知识发现方法的研究,适应了动态知识系统更新的需求,因此有着广泛的应用前景。",2016/2/3 11:26,2016
CJFD2016,一种新的链接预测方法在复杂网络中的应用,李奋华;,运城学院计算机科学与技术系;,电脑知识与技术,数据挖掘;;链接预测;;复杂网络;;无标度;;聚类信息,"作为复杂网络分析的一项重要任务,链接预测已经被应用到诸多领域,例如:个性化推荐、决策支持系统和犯罪调查等。常用的链接预测方法主要是基于网络拓扑结构的方法,没有考虑网络的聚类信息因素。实际上,网络的聚类结果包含了对链接预测很重要的信息。在此基础上,一种基于聚类信息和网络特征的链接预测模型被提出,并在人造和真实网络数据集上进行了验证,具有较好的预测效果。",2016/8/9 16:14,2016
CJFD2016,基于云存储技术的数字点餐软件及应用,叶双音;王亚男;龚佃选;时建;史雪芳;,华北理工大学理学院;,中国高新技术企业,餐馆业;;相生相克;;数据结构;;数字点餐软件;;云存储技术,"为了提高餐饮业服务品质,降低食物中毒现象的频率,促进餐饮企业科学合理的营养配膳与健康消费引导,文章提出了基于云存储和大数据挖掘技术将营养学知识加入到点餐软件,应用食物主料间的对比形式提示相生相克信息,创建新型的点餐模式及应用。",2016/8/24 9:22,2016
CJFD2016,中医医案数据库的构建及其应用研究,翁晓兰;申力;贾佳;吕瑛;陈裕;杨晓娟;,浙江中医药大学;上海生物信息技术研究中心;,浙江中医杂志,中医医案;;数据库;;名老中医经验;;数据挖掘;;医案分析,"文章构建了由中医数据库与方剂筛选系统相结合的名老中医临床信息分析平台,利用结构化医案方剂录入模块将临床病例数据化,利用医案方剂分析系统模块进行分析挖掘,形成知识挖掘。应用方面,结合浙江省中医院吴良村教授的门诊病历,开展肺癌疾病关乎中医治疗的医案实例分析。",2016/8/16,2016
CJFD2016,大数据电子政务发展模式研究,夏换;李爽;,贵州财经大学信息学院;贵州省经济系统仿真重点实验室;,信息技术与信息化,大数据;;电子政务;;发展模式;;研究,"本文基于大数据的视角,阐述了大数据与电子政务的相关概念,分析了大数据时代我国电子政务的发展现状:大数据电子政务认识不足、缺乏统一规划、忽视数据的量化、强调信息服务,忽视数据服务。为解决电子政务出现的问题,提出大数据电子政务的发展模式。",2016/7/25,2016
CJFD2016,商务智能实践教学内容设计与方法研究,胡敏;,北京信息科技大学信息管理学院;,教育现代化,商务智能实践;;模块化教学,"本文主要研究信息管理专业商务智能实践教学内容、方法和基本步骤。课程按照知识点难易,可以做两类划分,一是课程总体分为基础内容模块和高级主题模块;二是对较为复杂的章节或算法,或对单个知识点的基础和高级模块的划分。商务智能实践课程需要让学生实现由问题找方法,进而深入理解方法的过程,需要学生对数据准备、数据挖掘、结果分析的三个阶段有深刻的认识。",2016/8/29,2016
CJFD2016,“大数据”时代的计算机处理技术探究,陈荣;,新疆阿勒泰广播电视大学;,湖北函授大学学报,大数据;;计算机;;处理技术,"在当今社会科学技术不断发展的背景下,计算机处理技术也出现了前所未有的进步。随着人们对信息的需求量逐步上升,以计算机处理为根本的""大数据""时代也开始影响人们的生活。本文首先介绍了""大数据""时代和计算机处理技术的基本概念,然后分析了""大数据""时代下主要的计算机处理技术,接着阐述了""大数据""时代下计算机处理技术需要面对的机遇和挑战,最后探究了""大数据""时代下计算机处理技术的发展趋势。",2016/8/28,2016
CJFD2016,大数据时代税务数据应用与发展趋势思考,肖胜球;,深圳市国税局;,信息与电脑(理论版),大数据时代;;“四V”特征;;税务数据,"数据浪潮席卷全球,全球数据量呈爆炸式增长趋势,标志着人们已进入大数据时代。笔者从大数据时代的趋势、基本特征入手,借鉴大数据时代国外政府部门的成功实践,阐述了大数据时代我国税务数据应用的基本情况和存在问题,并对未来税务数据发展趋势与应用做了展望。",2016/6/8,2016
