SrcDatabase-来源库,Title-题名,Author-作者,Organ-单位,Source-文献来源,Keyword-关键词,Summary-摘要,PubTime-发表时间,Year-年
CJFD2016,基于负载均衡和冗余剪枝的并行FP-Growth算法,刘祥哲;刘培玉;任敏;伊静;高钊;,山东师范大学信息科学与工程学院;山东省分布式计算机软件新技术重点实验室;山东财经大学数学与数量经济学院;山东建筑大学计算机科学与技术学院;,数据采集与处理,关联规则;;MapReduce;;冗余剪枝;;FP-Growth算法,"针对现有的并行FP-Growth算法在数据并行分组时存在数据冗余和负载不均的问题,提出了基于负载估算和冗余剪枝的优化算法。首先,在采用高频策略分组时,引入节点任务估算方法,把每个分组中最大模式树的最长路径和支持度作为该分组的估计值,将估计值远大于其他节点的分组进行分割,平均到其他分组中,并且对不同分组中重复的列表元素进行截断,去除冗余数据。实验表明,本文提出的算法能够有效防止并行化的数据倾斜,减少数据冗余,在时间和空间复杂度上要低于以前的并行化FP-Growth算法。",2016/1/15,2016
CJFD2015,基于十字链表的Separate算法研究,陈平;王利钢;,南京信息职业技术学院信息服务学院;,信息化研究,关联规则;;十字链表;;项约束;;频繁项目集,"生成频繁项集是约束关联规则挖掘中最耗时的一步。为提高挖掘的效率,文章提出一种基于十字链表的经典的约束算法(Separate)改进算法(SABCL)。该算法结合Separate算法和十字链表存储的优势,先根据约束条件过滤数据库并产生频繁项目,再利用十字链表存储频繁项目信息,通过遍历十字链表生成满足约束条件的频繁项集,从而避免重复扫描数据库,提高了挖掘效率。在美国蘑菇(mushroom)、象棋(chess)数据集上,对SABCL、Separate算法进行了实验对比,实验结果表明,在相同的条件下,SABCL算法能够快速地生成所有的频繁项集,时间性能优于Separate算法。",2015/10/20,2015
CJFD2016,基于基因本体的语义相似度计算方法研究综述,彭佳杰;王亚东;,哈尔滨工业大学计算机科学与技术学院;,智能计算机与应用,基因本体;;语义相似度;;术语相似度,"基因本体是一个被广泛使用的生物数据资源,主要用于描述基因和基因产物的属性,包括分子功能、生物过程和细胞组件三个方面。基于基因本体的术语相似度及基因功能相似度计算对基因功能分析、比较和预测等生物学研究热门领域具有非常重要的意义。本文综述了基于基因本体的语义相似度算法,主要包括基因本体同一分支中的术语相似度计算法和基因本体跨分支术语相似度算法两大部分内容,并对这些方法的优缺点做了一定的分析总结。",2016/2/28,2016
CJFD2016,基于大数据支持的军事决策系统构建研究,李崇东;,武警警官学院管理科学与工程系;,软件工程,大数据;;军事决策系统;;构建,"本文首先系统回顾了大数据决策由来及发展现状;接着论述了大数据决策分析在军事决策领域的需求,并根据需求构建了由数据获取层、数据处理层及数据应用层三个层面组成的大数据军事决策系统;最后探讨了构建基于大数据支持的军事决策系统所需使用的关键技术,主要有数据提取与存储技术、大数据查询和分析技术、数据表示与数据整合技术。",2016/3/5,2016
CJFD2016,单飞行事件噪声关联规则挖掘及信念网络表示,徐涛;杨婷婷;谢继文;,中国民航大学计算机科学与技术学院;中国民航大学中国民航信息技术科研基地;,中国民航大学学报,单飞行事件噪声;;关联规则;;信念网络;;FP-Growth-Cube算法,"挖掘各种噪声影响因素与机场噪声之间的关联规则,能够为机场经营者制定有效的降噪措施提供科学依据。先将FP-Growth算法与数据立方体相结合,构造FP-Growth-Cube算法挖掘单飞行事件噪声与各噪声影响因素之间的关联规则,然后通过信念网络可视化表示关联规则。此方法不但直观、清晰,而且克服了关联规则不能表达不同规则之间联系的弱点,图形化地综合表示各因素对噪声的影响。最后,实验从降噪措施之一的机型选择角度,与权威噪声预测软件INM对比,验证了该方法的可行性和有效性。",2016/2/15,2016
CJFD2016,基于事件的证券市场状态变化规则挖掘,姜丽;,上海应用技术学院计算机科学与信息工程学院;,科技创新与应用,事件;;证券市场;;数据挖掘;;ID3算法,"文章在前期市场状态研究的基础上,重点研究了三类影响市场状态的事件,建立了事件模型,并采用改进的ID3数据挖掘算法,得到了一组市场状态在事件刺激下的转化规则。最后,文章对得到的规则进行了分析。",2016/3/28,2016
CJFD2016,一种面向海量咨询语句的文法自动学习方法,方文英;童林;朱俊武;,杭州万向职业技术学院教务处;扬州大学信息工程学院;,江苏科技大学学报(自然科学版),文法学习;;2-频繁序列;;可选项;;歧义项,"问题咨询语句的自然语言理解是提高Q&A系统可用性的关键技术之一.由于人工的文法获取方式无法满足大规模文法库创建的实际需要,文中提出并实现了一种带间距限制的2-频繁序列覆盖的文法自动学习方法.首先,获取所有的带间距限制的2-频繁序列,根据其覆盖的广度和连续性评价词模的质量;考虑到文法的扩展性及精确性,通过文法组成结构的对比,设定文法的可选项,并根据已有的标准文法去除文法中的歧义项.与现有的方法相比,文中提出的方法不依赖文法的语法组成或结构,澄清了文法要素之间的语义关联.在海量电信咨询语料库上的实验表明,文法获取的有效率为95.2%.文中将数据挖掘与模式获取融合并应用在一起,得出了带有频繁序列具有...",2016/3/22 9:42,2016
CJFD2016,基于规则置信度调整的知识挖掘及在烟草科技管理中的应用,王塑;张萍;周新;王乙民;,陕西省烟草公司西安市公司;,计算机应用与软件,知识挖掘;;规则置信度;;信息管理,"介绍信息管理领域中的一个热门研究主题——知识挖掘。知识挖掘旨在从结构化、半结构化的数据中挖掘信息。例如从电子文档、不完备的历史数据中搜索稳定的模式或模型,分析挖掘数据间的交互特征和规律,以辅助管理人员制定、调整规范与标准,构建专家库和知识库。提出知识挖掘的一种改进方法,通过动态规则置信度生成算法提高所获得规则的准确性与适应性,并结合烟草企业科技项目智能辅助管理中的实际应用进行了验证,取得了一定的成效。",2016/3/15,2016
CJFD2016,异构信息网上的可达性查询,尹丹;高宏;邹兆年;李建中;,哈尔滨工业大学计算机科学与技术学院;,计算机研究与发展,异构信息网;;查询处理;;可达性;;路径模式;;索引,"随着图数据规模的爆炸式增长,其形式也越来越复杂.异构信息网可建模成包含多种类型的顶点和多种类型的边的图.例如,文献数据库、在线购物网站等.首次研究异构信息网上的可达性查询问题.利用不同类型顶点之间的关系,查询2个顶点满足路径模式的可达性,该问题的时间复杂度是多项式的.然而在大规模的网络上,每次查询遍历一遍网络的时间开销也是不能容忍的.现有的可达性查询问题主要分为2类:k跳可达性查询和带有标签约束的可达性查询.但是这2种问题的算法都不能用于解决异构信息网上的可达性查询问题.因此,为了实现高效的在线查询,提出一种新的索引结构,通过路径模式的分解,预先计算部分路径模式的可达信息.当在线查询到来时,在...",2016/2/15,2016
CJFD2016,基于SAO结构语义分析的新兴技术识别研究,李欣;王静静;杨梓;黄鲁成;,北京工业大学经济与管理学院;,情报杂志,SAO结构;;语义分析;;专利数据;;专利技术;;新兴技术识别,"[目的/意义]如何在新技术不断涌现的技术大海中寻找和识别有颠覆性潜力的新兴技术,对于企业或国家来说是至关重要的战略议题。针对目前在新兴技术识别中存在的不足,即专利引用信息的滞后性和关键词聚类既不能深入反映专利文献表达的主题,也不能很好地揭示技术主题之间的关联关系等问题。[方法/过程]研究提出了基于SAO结构语义分析法的新兴技术识别模型。并首先利用文本挖掘方法抽取专利权利要求项中的Subject–Action-Object(SAO)结构,其次利用改进的语义相似度算法对专利文本进行聚类,然后结合基于时间切片的专利地图和语义分析法识别新兴技术。[结果/结论]用钙钛矿太阳能电池作为实证进行了研究,验证...",2016/3/18,2016
CJFD2016,基于评论者关系的垃圾评论者识别研究,徐小婷;魏晶晶;廖祥文;刘月;陈水利;,福州大学数学与计算机科学学院;福建省网络计算与智能信息处理重点实验室;福建江夏学院;集美大学诚毅学院;,集美大学学报(自然科学版),互评估;;可信度;;多边图模型;;评论关系;;垃圾评论者,"垃圾评论者在很大程度上误导潜在消费者和观点挖掘系统。目前检测垃圾评论者的方法主要是基于评论、评论者和商店之间的关系,忽略了评论者之间的关系。针对上述问题,提出了基于评论者多边图的产品垃圾评论者检测方法。首先,以每个评论者为节点,评论者之间的关系为边,构建评论者之间的关系图模型;其次,根据多边图模型,提出了一种基于PageRank的评论者互评估可信度模型来检测垃圾评论者;最后,采用卓越亚马逊和Resellerrating.com平台上的数据进行验证。结果表明:该模型能够更有效地识别出垃圾评论者,在一定程度上解决了难识别仅发表一条评论的评论者的可信度问题。",2016/3/25,2016
CJFD2016,基于大数据背景下智慧校园的可视化管理信息系统的研究,蒋达央;姚琪;,常州信息职业技术学院;,常州工学院学报,智慧校园;;大数据;;可视化管理;;物联网,"文章结合智慧校园中的物联网和大数据,针对网络化、数字化、人性化的校园环境与教育教学资源,引入可视化管理理念。通过挖掘智慧校园与可视化技术之间的关联特征,探究可视化管理信息系统建设的现实意义与实际应用价值,把校园的日常管理、师生活动、教育教学等校园管理行为提升到一个新的层面,体现可视化管理信息系统对智慧校园的管理与学习生活的重要影响和作用。",2016/2/28,2016
CJFD2016,基于大数据的K-means聚类算法在网络安全检测中的应用,郑志娴;王敏;,福建船政交通职业学院信息工程系;,湖北第二师范学院学报,大数据;;网络安全检测;;K-means聚类算法,"随着云时代的到来,大数据的应用受到了越来越多的关注。大数据的核心在于挖掘数据中蕴藏的价值链,为决策提供可借鉴参考。聚类算法是数据挖掘的一种归类方法,K-means则是基于划分的聚类方法。在网络安全检测中,应用K-means建立网络异常检测模型,可有效提高大数据环境下集中选取数据准确性的能力,控制检测误报率,缩短网络异常数据选取时间。但是,传统的K-means聚类算法在数据类型预处理、初始中心选取和K值确定等方面存在不确定性,导致对入侵检测的效率降低。本文提出一种改进的K-means算法,并通过利用KDDCup99数据集进行仿真实验,证明改进后的K-Means算法的检测准确率与检测效率要优于传统...",2016/2/15,2016
CJFD2016,关联规则算法在互联网教育领域的研究及应用,邓吉君;,湖南师范大学;,信息与电脑(理论版),关联规则算法;;互联网教育;;Apriori算法,"Apriori算法作为一种最有影响的挖掘关联规则的频繁项集的算法,已经被广泛引用到商业、网络安全、医药研究、故障诊断等各个领域。本文主要研究基于Apriori关联规则算法在互联网教育领域的应用及相应的算法改进。",2016/2/8,2016
CJFD2016,改进的基于标签的协同过滤算法,郭彩云;王会进;,暨南大学信息科学技术学院;,计算机工程与应用,协同过滤;;标签;;指数渐进遗忘函数;;时间窗口;;准确率,"针对现存的基于标签的个性化推荐系统在构建用户兴趣模型时未充分挖掘用户真正的兴趣爱好,且未考虑到时间因素对推荐结果的影响,提出一种改进的基于标签的协同过滤算法(ITCF)。该算法将用户评分融入到用户对标签权重的计算中,考虑用户不同兴趣程度的项目对推荐结果的影响,并使用指数渐进遗忘函数和时间窗口相结合的方法来捕捉用户兴趣的变化。在数据集Movielens上的实验证明,改进后的算法在precision、hit-rank以及NDCG三个评价指标上均取得了较好的推荐效果,其推荐的质量和效果均优于传统方案。",2015/12/11 15:18,2016
CJFD2016,基于小差异分类的移动目标越界检测系统设计,何伟娜;黄淼;褚龙现;姜建国;,平顶山学院软件学院;西安电子科技大学计算机学院;,计算机仿真,最小差异度分类;;移动目标;;计算机视觉,"在对移动目标越界检测过程中,移动目标点与边界线的位置受到运动轨迹变化产生干扰。采用传统的检测方法,在干扰下运动方向和交点坐标不能准确的判定,导致检测时间长,效率低的问题。提出采用最小差异度分类的目标越界检测算法,在移动目标点与边界线的位置关系上,利用移动目标起始到结束两点的运动轨迹连续线段的有序性,通过对移动目标的运动方向判定、轨迹线段与边界线的交点坐标判定、待测数据的分类等算法,可以有效解决移动目标的越界检测问题。并通过系统仿真进行了验证。仿真结果表明,系统在判断移动目标是否越界问题上的有效性,特别是在运行时间与效率方面都有了明显提高。",2016/3/15,2016
CJFD2016,高效用项集挖掘算法综述,刘畅畅;,河南大学计算机与信息工程学院;,福建电脑,高效用项集;;效用挖掘;;频繁项集;;数据挖掘,"本文介绍了高效用项集挖掘的基本概念,列举并分析了三个高效用项集挖掘算法,指出了它们的优缺点,最后展望了高效用项集挖掘的未来研究方向。",2016/3/25,2016
CJFD2016,基于信息熵改进的K-means动态聚类算法,杨玉梅;,川北医学院图书馆;,重庆邮电大学学报(自然科学版),K-means算法;;信息熵;;数据挖掘;;动态聚类,"初始聚类中心及聚类过程产生的冗余信息是影响K-means算法聚类性能的主要因素,也是阻碍该算法性能提升的主要问题。因此,提出一个改进的K-means算法。改进算法通过采用信息熵对聚类对象进行赋权来修正聚类对象间的距离函数,并利用初始聚类的赋权函数选出质量较高的初始聚类中心点;然后,为算法的终止条件设定标准阈值来减少算法迭代次数,从而减少学习时间;最后,通过删除由信息动态变化而产生的冗余信息来减少动态聚类过程中的干扰,以使算法达到更准确更高效的聚类效果。实验结果表明,当数据样本数量较多时,相比于传统的K-means算法和其他改进的K-means算法,提出的算法在准确率和执行效率上都有较大提升。",2016/4/15,2016
CJFD2016,Apriori算法在三二分段成绩分析中的应用,苏伟斌;,东莞理工学校;,电子技术与软件工程,Apriori算法;;成绩分析;;数据挖掘,"本文介绍了Apriori算法的基本概念并以本人所在的中职学校计算机专业为例,介绍了使用Apriori算法来挖掘数据之间关联性的方法,找出规律,分析结果,为实际教学工作提供理论支持。",2016/4/19 17:19,2016
CJFD2016,内蒙古电力数据仓库的应用,张瑜;潘红芳;,内蒙古电力(集团)有限责任公司信息通信中心;,电信科学,电力大数据;;数据中心;;数据仓库,"随着电力信息化的发展,电力数据的积累速度越来越快,如何使大数据产生价值、为公司科学发展提供支持的议题被越来越多地提及。内蒙古电力公司从2011年开始建设一体化平台数据中心,当前已经完成了公司各业务口的数据集成工作,为数据利用提供了基础。依据建设的一体化生产经营决策分析系统建设情况,从应用需求、应用技术、数据分析挖掘3个方面介绍了内蒙古电力公司在大数据背景下的数据仓库应用的探索与尝试。总结了建设成果与建设经验,得出做好分析展现应用的关键是需求管理,核心技术是数据挖掘的结论。",2016/4/20,2016
CJFD2016,基于数据平台的智能协同设计系统研究,耿明;,中铁第四勘察设计院集团有限公司;,铁道工程学报,数据平台;;智能;;设计;;总线;;协同;;信息标准,"研究目的:目前协同设计系统主要为基于文本库的传统作业系统,设计数据提取、加工、使用、挖掘困难,影响设计进度和质量。智能数据协同设计平台的关键技术、构建方案需要进行深入研究。研究结论:(1)基于数据平台的协同设计关键技术主要有信息标准建立、设计数据及标准结构化、数据标准建立与维护、多专业标准化协同作业模式、应用软件研发、智能设计与在线设计集成、数据挖掘与抽取、系统展现等;(2)智能协同设计系统可大幅提高设计速度与设计质量,可在资源、行为、交付维度单独或同时提供文本(含音视频)、数据、BIM成果;(3)基于数据平台技术的智能协同设计系统是工程设计现代化的发展方向,也是建设协同系统现代化的基础和前提...",2016/4/15,2016
CJFD2016,关联规则挖掘算法FP-Growth在高职网络技术专业学生成绩分析中的应用,罗拥军;罗云芳;,广西职业技术学院计算机与电子信息工程系;,河池学院学报,关联规则;;FP-Growth算法;;成绩分析,"从大量的成绩数据中进行数据挖掘并从中获得有价值的信息,是一件非常有意义的研究。以计算机网络技术专业学生10年的成绩作为数据源,运用基于关联规则的FP-Growth算法,研究5门课程之间的关联,为制订该专业人才培养方案提供参考和借鉴。",2016/4/15,2016
CJFD2016,基于Struts的Web系统开发及信息挖掘系统实现,李少辉;纪晓辉;樊锐轶;,中国移动通信集团河北有限公司石家庄分公司;中国电子进出口总公司;国网河北省电力公司;,计算机与网络,Web系统开发;;Struts框架;;信息挖掘;;呼叫信令,"研究了基于Struts的Web系统开发技术,采用MVC(模型-视图-控制器)设计模式,并基于Struct框架体系结构实现一套提供在线论文服务的大型Web信息系统。使用集成了Struts框架和Hibernate组件的Myeclipse做为开发工具,利用信息挖掘技术对基于Struts的Web系统功能进行了证实。通过对历史呼叫信令记录的信息挖掘,能够便捷定位问题,提高电信运营商解决问题的效率。实践工作表明,基于Struts框架的设计技术有效提高了系统的开发效率及系统的可维护性和可扩展性。",2016/4/26,2016
CJFD2016,基于MapReduce和矩阵的频繁项集挖掘算法,周国军;龚榆桐;,玉林师范学院数学与信息科学学院;,微电子学与计算机,MapReduce;;Hadoop平台;;矩阵;;频繁项集;;关联规则,"为了能高效地从大数据集中挖掘所有频繁项集,提出了一种基于MapReduce和矩阵的频繁项集挖掘算法.该算法将事务数据库转化为矩阵,按照垂直划分方法将矩阵分解成多个规模相同的子矩阵,根据MapReduce模型将子矩阵分配给计算机集群的节点,各节点并行对子矩阵计算候选项集的支持度.该算法在执行过程中产生的通信量较少,实现了节点计算任务的负载平衡.在Hadoop平台上测试了算法的性能,实验结果表明该算法具有较好的加速比和可扩展性,适合对大数据集挖掘频繁项集.",2016/5/5,2016
CJFD2016,集团公司统一客户关系管理系统的构建,刘恕谦;,中国人民大学;,电脑知识与技术,客户关系管理;;集团公司系统;;信息化建设,"从集体公司层面对客户关系管理系统进行整体设计,提供跨业务板块和条线的解决方案。对系统功能边界进行分析和界定,从而规划出子系统,来保证系统的高维护性和扩展性。并且从实现角度进行建议,包括各子系统的功能和技术实现,以及安全和高可用等方面。",2016/5/11 16:25,2016
CJFD2014,大数据环境下学科化服务的策略,吴立国;,辽宁科技大学图书馆;,图书馆学刊,大数据;;学科化服务;;一站式检索平台;;学科导航,"介绍了大数据的产生以及图书馆具有的大数据特征,阐述了大数据环境下学科化服务的必要性,分析了通过学科化服务参与文献资源建设、以学科化为基础适当调整文献资源布局、充分利用一站式检索平台、建立学科导航、构建特色数据库以及利用现代化信息工具向个性化服务推进等服务策略,以提高图书馆的竞争力和服务水平。",2014/9/30,2014
CJFD2016,复杂网络中基于WCC的并行可扩展社团挖掘算法,亚森·艾则孜;李卫平;郭文强;,新疆警察学院信息安全工程系;铁道警察学院公安技术系;新疆财经大学计算机科学与工程学院;,计算机应用与软件,复杂网络;;社团挖掘;;并行算法;;可扩展性,"WCC(Weighted Community Clustering)通过复杂网络中社团含有的三角数量来评价社团挖掘算法的性能。在原始的WCC算法中,需要在每次迭代中对所有的社团变化计算WCC值,因而计算量非常大。为了减小社团变化带来的WCC计算量,提出一种并行可扩展的社团挖掘算法。对应用WCC进行社团评价的方法进行分析,提出一种包含预处理、初始划分和划分改进三个阶段的并行社团挖掘算法。在划分改进中,由于每次社团变化都需要计算大量的WCC提升,基于社团的统计量提出一种WCC近似计算方法。大量的真实数据集实验表明,提出的社团挖掘算法与相关算法相比较,不仅社团检测的准确性更高,而且具有更好的并行可扩...",2016/6/15,2016
CJFD2016,面向民生科技的智能健康系统发展策略,陶永;孙立宁;刘文勇;王田苗;匡绍龙;,北京航空航天大学航空科学与技术国家实验室(筹);中国航空工程科技发展战略研究院;苏州大学机电工程学院;北京航空航天大学生物与医学工程学院;北京航空航天大学机械工程及自动化学院;,科技导报,智能健康;;健康大数据;;精确诊疗;;生物三维打印;;微创手术;;助老助残,"围绕中国老龄化社会与民生科技发展对智能健康系统的需求迫切,介绍了智能健康系统的内涵与特征,阐述了健康大数据挖掘、个性化植入/介入生物三维打印、个体化精准诊疗、生肌电融合及助老助残等智能健康系统的基础科学问题与关键技术。围绕智能健康系统的应用领域、基础研究领域,介绍了国际研究的创新前沿与进展,国内智能健康系统的研究现状、优势单位与进展情况。",2016/5/13,2016
CJFD2016,关联规则挖掘以改进朴素贝叶斯,俞杰;丁晓剑;崔鹏;,信息系统工程重点实验室;,舰船电子工程,朴素贝叶斯;;条件独立性假设;;项目集,"朴素贝叶斯算法是建立在条件独立性假设上的,但是在实际应用中,类属性条件独立假设并不成立。针对这个问题,结合关联规则方法构造一个改进的朴素贝叶斯分类器。通过挖掘感兴趣的和频繁的项目集,深入研究样本算法中的属性联系。使随后运用朴素贝叶斯方法的各个属性尽量属性独立,达到朴素贝叶斯分类器的要求。实例标签方法改善了朴素贝叶斯的分类性能。",2016/5/20,2016
CJFD2016,基于集成分类的恶意应用检测方法,黄伟;陈昊;郭雅娟;姜海涛;,江苏省电力公司电力科学研究院;,南京理工大学学报,安卓;;分类;;集成学习;;恶意应用检测;;静态分析;;支持向量机;;特征选择,"针对难以准确判断单一的特征和单一的数据挖掘算法对于恶意应用检测精度影响的问题,该文提出了一种基于集成分类的恶意应用检测方法,该方法以安卓平台上的应用为研究对象,采用静态分析方法提取三类特征:权限特征、组件特征和函数调用特征;在此基础上,分别为每一类特征应用多种基分类器建立分类模型,并采用集成学习的思想设计一致性函数产生多种基分类器的决策结果作为某一特征上的分类结果;最后,再次采用集成学习的思想,融合每一类特征的分类结果,产生面向多特征的恶意应用分类结果。针对应用市场的真实应用的检测分析结果表明:面向多特征的集成分类检测方法能提高恶意应用检测精度。",2016/2/28,2016
