SrcDatabase-来源库,Title-题名,Author-作者,Organ-单位,Source-文献来源,Keyword-关键词,Summary-摘要,PubTime-发表时间,Year-年
CJFD2015,城市交通大数据技术及智能应用系统,熊刚;董西松;朱凤华;季统凯;,中国科学院自动化研究所复杂系统管理与控制国家重点实验室;中国科学院云计算中心;青岛智能产业技术研究院;,大数据,城市交通;;大数据;;云计算;;物联网,"城市交通大数据具有种类繁多、异质性、时空尺度跨越大、动态多变、高度随机性、局部性和生命周期较短等特征,如何有效地采集和利用交通大数据,满足高时效性的交通行政监管、交通企业经营管理、交通市民服务等应用需求,是城市交通和智慧城市面临的前所未有的机遇和挑战。重点分析总结了城市交通大数据的若干研究内容及核心技术,提出了城市交通大数据智能应用系统解决方案,列举了几种典型应用,在城市交通和智慧城市领域的大数据研发和应用领域进行了初步探讨。",2015/11/20,2015
CJFD2015,农业大数据的获取与利用,谢润梅;,中国科学技术信息研究所;,安徽农业科学,农业大数据;;数据获取;;数据利用;;智慧农业,"大数据的发展日新月异,已经深入到包括农业在内的各个行业。因此,农业大数据作为农业信息化的发展趋势,是新一代信息技术的集中反映,是一个具有无穷潜力的新兴科技产业发展方向。该研究结合农业大数据的基本特征与产业链构成,介绍了农业大数据的基本概念,基于相关农业信息平台、农业数据库等渠道,阐释了农业大数据的获取方式,并从良种培育、精准种植、农业生态环境监测、天气预测等维度对农业大数据的利用进行探讨,以正确面对农业大数据面临的机遇与挑战,为农业的发展、创新奠定基础。",2015/11/3 16:19,2015
CJFD2015,分级存储数据多维分析技术的研究与应用,项玉良;任开银;张明明;黄高攀;,南京南瑞集团公司;江苏省电力公司;,计算机与现代化,分布式数据;;多维分析;;商业智能,"多维数据分析是数据仓库系统需要具备的一个主要功能,它接受用户的多维数据查询请求,生成多维数据集,为建立数据挖掘模型提供基础数据。本文提出一种分级存储数据的多维分析方法,实现分布式多维数据的报表展现原型系统,解决分布式环境下数据的即时展现应用问题,为分布式数据的统计展现提供了多角度、多层次和直观性的分析手段。",2015/12/15,2015
CJFD2015,基于用户-兴趣-项目三部图的推荐算法,张艳梅;王璐;曹怀虎;毛国君;,中央财经大学信息学院;,模式识别与人工智能,用户兴趣;;个性化推荐;;三部图;;物质扩散;;概率主题模型,"目前大多数个性化推荐算法为了追求较高的推荐精度而在不同程度上受到用户兴趣过拟合问题的影响,因此提出通过挖掘用户隐含的兴趣信息进行推荐的算法.首先利用概率主题模型抽取用户兴趣分布,并建立用户-兴趣-项目加权三部图.然后在用户-兴趣和兴趣-项目的概率加权二部子图上依次利用物质扩散算法配置项目资源值,并根据项目资源值的高低排序产生Top-K推荐.在Movielens数据集上的实验表明,基于用户-兴趣-项目三部图的推荐算法能缓解过拟合问题,同时可提高准确率等方面的性能.",2015/10/15,2015
CJFD2015,决策系统在K-means算法中的应用,朱俚治;,南京航空航天大学信息中心;,计算机与数字工程,聚类;;决策系统;;K-means算法,"如今的聚类算法在数据挖掘和信息安全方面已有相当的应用。事实上在大数据时代之中,为了识别已知的或未知的数据则需要将通过数据聚类的算法来计算和实现。数据聚类算法是一种智能性的算法,其可以使得机器通过自我的学习来识别已知和未知的数据。目前的数据聚类算法,有基于划分的聚类算法、基于层次的聚类算法等各种的聚类算法。但在这些聚类算法中经典的算法仍然是基于距离的聚类算法,如K-means算法。因此论文的作者在查阅了一些关于距离聚类的算法之后,提出了将粗糙集中决策系统在K-means算法中进行首次的应用,这是论文的创新点。",2015/12/20,2015
CJFD2015,无线通信网络节点间通联关系的发现与更新算法,张攀峰;王世练;张炜;张尔扬;,国防科学技术大学电子科学与工程学院;,通信对抗,增量式PCA;;通联关系发现;;关联规则挖掘;;更新算法,"无线通信网络的节点间通联关系发现问题是网络层面通信对抗的一个重要问题。由于很难直接获得无线通信网络中节点间的通联关系,利用各节点的通信行为数据来进行通联关系发现是一个有价值的方向。考虑到各节点间的通信行为的关联,利用数据挖掘中的关联规则挖掘方法可以有效地从通信行为数据库中发现节点间的通联关系,将通联关系的发现问题转为关联规则挖掘问题,但现有的算法都不能高效地解决通信行为数据库变化时的通联关系更新问题。提出了一种针对无线通信网络进行节点间通联关系发现和更新的新算法。算法主要基于增量式PCA算法和矩阵变换,能够有效地从变化的庞大通信行为数据库中进行通联关系发现和更新。仿真实验表明算法在时间复杂度和...",2015/9/15,2015
CJFD2015,大数据中一种基于语义特征阈值的层次聚类方法,罗恩韬;王国军;,中南大学信息科学与工程学院;湖南科技学院电子与信息学院;,电子与信息学报,大数据;;数据抽取;;层次聚类;;聚类分析,"云计算、健康医疗、街景地图服务、推荐系统等新兴服务促使数据的种类和规模以前所未有的速度增长,数据量的激增会导致很多共性问题。例如数据的可表示,可处理和可靠性问题。如何有效处理和分析数据之间的关系,提高数据的划分效率,建立数据的聚类分析模型,已经成为学术界和企业界共同亟待解决的问题。该文提出一种基于语义特征的层次聚类方法,首先根据数据的语义特征进行训练,然后在每个子集上利用训练结果进行层次聚类,最终产生整体数据的密度中心点,提高了数据聚类效率和准确性。此方法采样复杂度低,数据分析准确,易于实现,具有良好的判定性。",2015/12/15,2015
CJFD2015,大数据处理流程及存储模式的改进,孙红;郝泽明;,上海理工大学光电信息与计算机工程学院;上海现代光学系统重点实验室;,电子科技,大数据;;数据存储;;数据分析;;Hadoop;;标签云,"结合大数据的特点,提出以标签云改进方案来快速识别网络热搜词,同时考虑到传统的数据仓库在查询、存储结构化数据方面的优势,在目前学者提出的数据仓库与Hadoop平台结合的基础上,提出了协作模式中与以往不同的数据迁移方式,即使用数据中间件,并通过相同数量记录导入Hadoop的时间比较,得出文中所提的数据迁移方法较Sqoop方法更具优势的结论。",2015/12/15,2015
CJFD2015,构建档案大数据应用平台的探析,陈琦;,泉州市投资贸易促进协调服务中心;,办公自动化,档案大数据;;应用平台;;建设,"档案应用大数据涉及整个档案管理系统在大数据时代发展理念、管理体制、和技术创新等方面的重大变革。通过以云计算技术取代传统的档案管理系统,数据治理和建设全国统一的档案数据模型和行业级档案数据中心,搭建集约化的档案大数据应用平台。通过档案数据的采集、智能处理、数据挖掘与智能检索三个层次,实现档案大数据应用系统开发工作。在档案应用大数据建设过程中,档案管理部门要以科学的态度,坚持实事求是的工作作风,注重档案数据应用的基础工作。制定切实可行的发展规划;提升档案管理部门大数据环境下的工作能力;大力培养档案大数据技术专业型人才。",2015/11/15,2015
CJFD2015,基于大数据技术传统企业O2O模式的应用研究,张仁济;,上海理工大学;,改革与开放,传统企业;;O2O;;大数据,"随着互联网的蓬勃发展以及电商的冲击,传统企业经营受阻,纷纷尝试转型。O2O是一种新的商业模式,通过互联网在线推广带动线下销售,消费者由线上引流至实体店中进行体验享受服务,达到线上线下相结合的效果,但在这过程中也遇到不少挑战与问题。而在当下数据迅速膨胀的大数据时代,各行各业开始利用数据分析作出相关决策,本文将重点阐述大数据技术在传统企业转型O2O商业模式中的应用。",2015/12/15,2015
CJFD2015,以CPS为核心的智能化大数据创值体系,李杰;,美国辛辛那提大学;美国国家科学基金会(NSF);,中国工业评论,智能产品;CPS;分析平台;物联网;面向客户;构建模式;生产系统;工厂管理;网络层;内容管理;,"传统的生产系统要转型成为生产智能产品的智慧工厂,需要不断完善""物联网+智能分析平台+务联网""的大数据创值体系。以CPS为核心的智能化体系,正是根据工业大数据环境中的分析和决策要求所设计的。本文给出了工业4.0环境下的包括5个层次构建模式的CPS技术体系架构,并通过CPS在制造业的应用阐释如何从工业大数据中创造面向客户的价值。",2015/12/5,2015
CJFD2015,K-means聚类分析在就业管理系统中的应用研究,王志伟;王利军;,安徽经济管理干部学院;,电脑知识与技术,就业管理;;聚类分析;;数据,"学生就业管理系统可以采集毕业生的就业调查数据信息,并且可以对数据进行选择和转换以便数据挖掘的顺利完成,利用SPSS软件进行K-means聚类分析,从而得到有价值的信息,为学生管理工作和教学方案的修改制定提供参考。",2015/12/25 9:15,2015
CJFD2016,一种新型的技术形态识别方法——基于SAO语义挖掘方法,郭俊芳;汪雪锋;李乾瑞;朱东华;,北京理工大学管理与经济学院;,科学学研究,形态分析法(MA);;SAO语义挖掘;;技术机会分析(TOA);;形态结构;;染料敏化太阳能电池(DSSCs),"形态分析法作为一种面向未来的系统分析方法,已被广泛运用于技术机会识别和技术预测等领域。但现有形态分析方法中,形态结构构建过程对领域专家有较强的依赖。虽有学者尝试引入定量分析方法,但单纯以词频为依据选择特征词,忽略了词间的影响,存在无法展示技术/部件的目的、构成和语义关系等缺陷,限制了技术预测的效果。因此,本文引入主语-谓语-宾语(SAO)语义挖掘方法,提出一种新型的技术形态识别方法,并以德温特专利数据为基础,描述了专利技术形态识别的过程,验证了该方法的可行性和有效性。该方法弥补了基于关键词方法的不足,增强了定量方法对技术形态识别中的应用,减少了技术形态定义对专家知识的依赖,提高了技术形态识别的...",2016/1/15,2016
CJFD2015,基于聚类权重调度的大数据采样技术,耿德志;,晋中学院信息技术与工程学院;,世界有色金属,大数据;;采样;;数据聚类;;权重调度,"通过大数据优化采样提高对大数据的分析和调度能力。传统方法中对大数据的采样技术采用奈奎斯特采样定律,当大数据的特征信息出现非线性特性时,采样精度不高。提出一种基于聚类权重调度的大数据采样技术,进行大数据的分布式数据结构分析和时间序列模型构建,采用模糊C均值聚类方法进行大数据的聚类权重调度算法设计,以此为基础实现大数据的特征提取和特征采样。仿真实验结果表明,采用该方法进行大数据的信息采样,能有效提高采样精度,在大数据挖掘和特征提取方面具有重要意义。",2015/12/21 15:54,2015
CJFD2016,面向多源城市出行数据的可视化查询模型,汪飞;张繁;吴斐然;顾天瑜;高思远;赵烨;鲍虎军;,浙江大学CAD&CG国家重点实验室;湖南师范大学数学与计算机学院;浙江工业大学计算机科学与技术学院;肯塔基州立大学计算机学院;,计算机辅助设计与图形学学报,多源城市出行数据;;可视化查询;;查询模型;;可视分析,"多源城市出行数据为理解城市现象和享受城市生活带来了机遇.利用统计物理学和数据挖掘技术,人们在多源城市出行数据的研究上取得了很大进展,但是基于可视分析方法的研究甚少.为此,提出了一种可视化查询模型旨在解决应用可视分析方法研究多源城市出行数据时所面临的数据组织和可视表达上的挑战.查询模型从数据抽象,数据组织和管理,查询交互界面以及可视化分析等方面进行探讨,介绍了相关方法和技术.最后实现了查询模型的实例系统并通过典型案例证明了查询模型的有效性.",2016/1/15,2016
CJFD2015,一种改进的短文本层次聚类算法,李天彩;席耀一;王波;张佳明;,信息工程大学;,信息工程大学学报,短文本;;聚类;;词向量;;关键词提取,"互联网上存在着海量蕴含丰富信息的短文本数据,由于短文本存在特征稀疏、用语不规范的特点,使用传统的聚类算法效果较差。提出了一种使用词向量表示特征并结合关键词提取的短文本聚类算法:定义特征权重计算公式,计算类簇中特征的权重,得到类簇的关键词;使用Skip-gram模型训练得到的词向量计算关键词之间的语义相似度进而得到类簇的相似度实现聚类。在4个数据集上进行的实验结果表明文章的方法效果优于传统的聚类算法,宏平均较次优结果分别提高了22.3%、24.9%、2.9%和34.4%。",2015/12/15,2015
CJFD2016,基于局部加权重构的化工过程数据恢复算法,郭金玉;袁堂明;李元;,沈阳化工大学信息工程学院;,计算机应用,数据挖掘;;缺失数据;;数据恢复;;k近邻规则;;局部加权重构;;化工过程,"针对化工过程数据中存在缺失数据的问题,在保持局部数据结构特征的基础上提出了基于局部加权重构的化工过程数据恢复算法。通过定位缺失的数据点并以符号Na N(Not a Number)标记,将缺失的数据集分为完备数据集和不完备数据集。不完备的数据集按照完整性的大小依次找到它们在完备数据集中相应的k个近邻,根据误差平方和最小的原则,求出k个近邻相应的权值,用k个近邻及相应的权值重构出缺失的数据点。将该算法应用在不同缺失率下的两种化工过程数据中并与望最大化主成分分析(EM-PCA)法和平均值(MA)两种传统的数据恢复算法相比较,该算法的恢复数据误差最小,并且计算速度相比EM-PCA算法平均提高了2倍。实...",2016/1/10,2016
CJFD2016,基于位置签到数据的城市分层地标提取,王明;胡庆武;李清泉;秦龙焜;,武汉大学遥感信息工程学院;深圳大学空间信息智能感知与服务重点实验室;武汉大学测绘遥感信息工程国家重点实验室;,计算机学报,位置服务;;位置签到(Check-In);;地标;;POI;;显著度;;分层;;云计算,"为了及时准确地获取用于智慧位置服务的城市层次性空间知识,该文提出了一种依据签到属性显著度的差异从位置签到数据中提取城市分层地标的方法.首先,针对传统基于调查问卷的公众认知度计算方法存在的不足,该文从位置签到数据中的签到次数、签到用户数和用户影响因子3个方面入手讨论POI显著度的影响因素,进而提出了一种基于签到数据的POI显著度计算模型;然后,利用Voronoi图对POI空间作用范围进行分割并结合邻域分析与合并算法逐层迭代,形成了基于签到POI显著度与Voronoi图的分层地标提取算法;最后,以北京市的位置签到数据为例,进行了POI显著度计算与分时分层地标提取,通过与现有实体、网络地图资料的比对...",2014/12/19 0:07,2016
CJFD2015,基于并行GN算法的邮件关系网络社区检测,陈立新;,江西理工大学;,科技广场,邮件关系网络;;安然邮件数据集;;关键人物;;社区检测;;并行GN算法,"电子邮件的应用已经遍及社会的各行各业,而邮件关系网络可以反映人物社会关系,如何利用邮件数据精准挖掘出关系网络中的社区结构并用于识别关键人物面临较多挑战。本文以安然公司(Enron)邮件网络数据集为研究对象,提出一种基于并行GN算法来找出安然公司高管的组织结构及关键人物,最后利用netdraw分析软件绘制关系网络的社区结构图。",2015/11/30,2015
CJFD2015,大数据在酒店管理系统中的应用,杨慧慧;邓薇;陈冲;,东华理工大学软件学院;,科技广场,酒店管理系统;;大数据分析;;Tableau,"酒店管理行业的发展越来越依托于数据的分析,大数据的收集、清洗优化、挖掘及整合研究分析,给酒店的经营管理提供了巨大的帮助。本文采用Tableau作为分析工具,对酒店管理系统中的酒店预订模块、客户入住模块、客户结算模块中产生的数据进行大数据分析,准确的找出酒店经营存在的问题,使酒店管理决策者实现业务的提升。",2015/12/30,2015
CJFD2015,面向高维数据PCA-ReliefF的EP模式分类算法,程玉胜;胡飞;程百球;,安庆师范学院计算机与信息学院;,安庆师范学院学报(自然科学版),分类器;;特征选择;;PCA-ReliefF;;EP模式;;PREP算法,"针对高维数据集,文中提出一种PREP(PCA-Relief F for EP)算法:首先采用PCA和Relief F算法实现特征降维;然后利用EP模式思想,构造精度更高、规模更小的EP模式分类器;最后利用标准数据集对文中的方法进行测试。实验结果表明,在对高维数据进行分类时,该方法构造的分类器在预测精度和运行时间上均有较大幅度的提升。",2016/1/5 13:01,2015
CJFD2016,基于出租车轨迹数据的路径规划方法,林娜;郑亚男;,沈阳航空航天大学计算机学院;,计算机应用与软件,智能交通;;路径规划;;轨迹数据;;贝叶斯分类器;;分层路径规划算法,"传统的路径规划算法很大程度上是依赖于改进的加权最短路径算法,在大规模路网中效率较低而且没有考虑实际交通中的各种因素,得到的是理想情况下的最优路径。针对这种情况,根据出租车的轨迹数据提出一种路径规划方法,主要包括三个部分:首先,利用出租车数据挖掘司机在路径选择上的经验,提取经验轨迹形成经验轨迹集;然后,根据出租车在各经验路段各时段的速度和频次利用贝叶斯分类器对路网进行分层,构建分层路网;最后,使用分层路径规划算法实现层次路径规划。以北京市GPS数据为研究对象,将该方法与经典路径规划算法的结果进行比较。结果表明,该方法得到的路径可以综合考虑各种因素,得到实际行驶中的较快路径。",2016/1/15,2016
CJFD2016,数据仓库技术在医院信息化建设方案实现中的应用价值,李韬;冯佳莉;张屹;于树新;,河北北方学院附属第一医院信息管理处;河北北方学院附属第一医院肾内科;,中国医药导报,数据仓库;;联机事务处理;;信息化建设;;数据挖掘,"目的探讨数据仓库技术在医院信息化建设方案中的应用价值。方法于实施基于数据仓库技术的医院信息化建设前(2013年全年)向河北北方学院附属第一医院(以下简称""我院"")门诊患者发放医院医疗服务满意度调查问卷,选取500份合格问卷作为对照组;实施基于数据仓库技术的医院信息化建设后(2014年全年),向我院门诊患者发放相同问卷,选取500份合格问卷作为研究组;比较两组对门诊服务的综合满意度、等待时间、诊疗时间、医护人员工作绩效情况。结果研究组总满意度显著高于对照组(38.20%比19.00%);研究组等待总时间显著短于对照组[(30.21±8.73)比(62.89±10.75)min];研究组实际诊疗总...",2016/2/5,2016
CJFD2016,基于中医三路脉象诊断机制的脉诊数字化系统研制,史伟;刘卫兰;王伟浩;,洛阳职业技术学院;,电脑编程技巧与维护,中医脉诊;;数字化系统;;三路脉象;;数据挖掘,"中医脉诊数字化系统包括数据采集装置、信号通信装置和数据分析设备等。硬件系统可以实现对寸关尺三路脉象信号的釆集、分析和处理;软件部分将脉象的位、数、形、势和脉图的各项特征参数作自动分析处理。同时结合中医望诊和问诊(以人机对话形式),采用数据挖掘的方法建立起病名与脉象之间、证型与脉象之间的关联性,综合中医八纲辩证的思路,为被测者提供健康状况的指导。",2016/2/18,2016
CJFD2015,C4.5算法在高职学校成绩分析中的应用,卜阳;,江苏省徐州医药高等职业学校;,佳木斯职业学院学报,数据挖掘;;决策树;;成绩分析;;C4.5算法,"本文采用C4.5算法构造决策树的方法,对学生的成绩进行分析并找出影响成绩的主要因素和规则,给教师调整教学环节提供参考,对学生管理工作提出意见,从而指导教育教学工作。",2015/12/15,2015
CJFD2015,云计算环境下的数据挖据算法研究,张一名;,山西林业职业技术学院;,信息化建设,云计算;;数据挖掘;;研究,"基于项目协同过滤推荐算法是云计算环境下的数据挖据算法,用于解决Amazon.com中千万级的用户和产品数据挖掘和推荐。并且在如此海量的数据规模下,将已有的平台迁往云平台己大势所趋。本章将介绍基于项目协同过滤算法的并行化实现和性能分析。",2015/12/15,2015
CJFD2016,基于多标记学习的汽车评论文本多性能识别,张晶;李德玉;王素格;,山西大学计算机与信息技术学院;,计算机工程与科学,多标记学习;;文本处理;;汽车评论;;多方面识别,"针对汽车产品评论文本中出现的多方面性能,提出一种基于多标记学习的汽车评论文本多方面性能识别方法。首先,结合文本挖掘方法,利用多标记文本特征选择方法选取特征,将非结构化的文本转化为结构化的多标记数据集。在此基础上,使用四种多标记分类方法,对待识别的评论文档标注一个或多个方面标记。最后,以八种多标记评价指标评估方面识别的性能。在新浪汽车评论语料上的实验表明,方面识别的子集准确率达到了95%,验证了方法的可行性。",2016/1/15,2016
CJFD2016,计算机数据库入侵检测技术的实际运用分析,周淑君;,吉林大学珠海学院计算机系符号计算与知识工程教育部重点实验室珠海分实验室;,科技传播,入侵检测技术;;计算机数据库;;安全;;运用,"信息时代的到来为各行业领域的发展注入新鲜的活力,然而由于计算机自身软件与硬件设计中存在一定漏洞,加上计算机网络具有开放性特征,使计算机应用中极易出现较多安全问题。以计算机数据库为典型代表,实际运用中出现数据丢失或被破坏的可能性极高,要求引入入侵检测技术,以此为计算机数据库的可靠运行提供保障。本文主要对数据库入侵检测技术内涵与功能、入侵检测技术实际运用中的难点以及提升入侵检测技术运用效果的具体策略进行探析。",2016/1/23,2016
CJFD2016,Spark环境下并行立方体计算方法,萨初日拉;周国亮;时磊;王刘旺;石鑫;朱永利;,华北电力大学控制与计算机工程学院;,计算机应用,Spark;;联机分析处理;;数据立方体;;自底向上构造,"针对传统联机分析处理(OLAP)处理大数据时实时响应能力差的问题,研究基于分布式内存计算框架Spark加速的数据立方体计算方法,设计基于Spark内存集群的自底向上构造(BUC)算法——BUCPark,来提高BUC的并行度和大数据适应能力。在此基础上,为避免内存中迭代的立方体单元膨胀,基于内存重复利用和共享的思想设计改进的BUCPark算法——LBUCPark。实验结果表明:LBUCPark算法性能优于BUC算法和BUCPark算法,能够胜任大数据背景下的快速数据立方体计算任务。",2016/2/10,2016
CJFD2015,互联网+时代的大数据浅谈,李国忠;,江西工业工程职业技术学院;,无线互联科技,大数据;;电子商务;;系统承载;;高并发,"大数据已经渗透到商业、生活、通讯、金融等各个方面。由互联网+衍生出的新型电子商务产业对于大数据的处理机制和算法有着极高的要求,对数据库系统的高并发和承载提出了更高的要求。文章对互联网+时代的大数据进行了分析。",2015/12/10,2015
CJFD2016,学生评教留言的倾向性分析,李效伟;,山东女子学院信息技术学院;,微型机与应用,倾向性分析;;分词;;特征选择;;降维;;支持向量机,"学生评教留言经过逐年累积,已经形成一个巨量的信息资源,如何进行挖掘和分析这些资源已经成为一项紧迫的任务。本文采用频率、信息增益、条件概率比、期望值差异等四种特征选取方法对留言进行分析,采用ICTCLAS分词软件进行分词,利用MATLAB软件进行矩阵奇异值分解和降维,使用支持向量机进行训练和预测数据,从而能够对学生留言的情感倾向性给出很好的预测结果。最后通过实例说明了文中算法的有效性。",2016/2/10,2016
