SrcDatabase-来源库,Title-题名,Author-作者,Organ-单位,Source-文献来源,Keyword-关键词,Summary-摘要,PubTime-发表时间,Year-年
CJFD2016,4G网络环境下数据挖掘技术在通信网络优化中的应用,纪士伟;,中邮建技术有限公司;,无线互联科技,4G网络;;通信网络优化;;数据挖掘技术;;应用,"数据挖掘技术是指在数据系统中不断收集和统计具有价值的数据资料以及数据模型和规则等的技术。在计算机通信网络中应用该种技术能够创造稳定而安全的网络环境。文章对数据挖掘技术的基本特点和性能作了基本介绍,并对数据挖掘技术在通信网络优化中的实际应用进行了探讨。",2016/6/25,2016
CJFD2016,大数据时代下数据挖掘技术的应用,李文艳;,重庆市信息通信咨询设计院有限公司;,数字技术与应用,大数据;;数据挖掘;;挖掘技术,"大数据时代是信息时代的一个重要特征,实际上,在大数据时代的背景下进行数据挖掘技术的探究与应用其实就是通过在巨大的信息群中不断挖掘出具有一定价值意义的信息进行整合,在此基础上对已整合的信息进行进一步的处理,以提高信息数据的价值。本文以此为出发点,就大数据时代下数据挖掘技术的应用进行深入探究。",2016/5/15,2016
CJFD2016,分布式并行化数据流频繁模式挖掘算法,马可;李玲娟;孙杜靖;,南京邮电大学计算机学院;,计算机技术与发展,数据流;;频繁模式;;分布式并行化;;Storm,"为了提高数据流频繁模式挖掘的效率,文中基于经典的数据流频繁模式挖掘算法FP-Stream和分布式并行计算原理,设计了一种分布式并行化数据流频繁模式挖掘算法—DPFP-Stream(Distributed Parallel Algorithm of Mining Frequent Pattern on Data Stream)。该算法将建立频繁模式树的任务分为local和global两部分,并设置了参数""当前时间"";将到达的流数据平均分配到多个不同的local节点,各local节点使用FP-Growth算法产生该单位时间内本节点的候选频繁项集,并按照单位时间将候选频繁项集及其支持度计数打包发送至...",2016/6/21 17:01,2016
CJFD2016,数据挖掘技术在软件系统中的应用研究,刘维松;,,科技展望,数据挖掘技术;;软件系统;;应用研究,"随着信息技术的不断发展,当今时代软件系统的规模和复杂飞速攀升,给软件系统的开发、管理以及后期修复完善工作带来了巨大的挑战,仅仅依靠软件工作人员原有的直觉经验型工作模式已经不能应对庞大的软件系统所带来的挑战。而数据挖掘技术能够通过数据准备、数据挖掘以及数据处理三个过程在海量的数据中潜藏的有趣数据,从而极大的提升了软件系统的开发效率,加强了对软件系统的控制和管理,从很大程度上缓解了目前软件系统开发管理的困境。",2016/8/30,2016
CJFD2016,数据挖掘技术在移动通信终端营销领域的应用,李文权;,中国联合网络通信有限公司长春市分公司;,科技展望,数据挖掘;;移动通信;;终端营销,"将潜在有用的、隐含在很多有噪声、随机、模糊、不全面的真实数据中的有用知识和信息提取出来,就是数据挖掘的过程,在移动通信终端营销中使用数据挖掘,可为客户提供更合适的服务,并提升管理水平。本文初步探析了在移动终端营销中应用数据挖掘技术的方式。",2016/8/30,2016
CJFD2016,烟草物流研究现状与行业数据挖掘技术解读,张涛;,红云红河集团昆明卷烟厂;,物流工程与管理,烟草行业;;物流;;数据挖掘技术,"提高烟草物流运作效率,降低烟草流通成本是现阶段烟草行业在激烈的市场竞争中加强自身核心竞争力的重要举措。文中从介绍烟草行业的物流规划出发,分析了我国烟草行业物流运行的现状,并阐述了行业数据挖掘技术在烟草物流配送中的应用。",2016/7/15,2016
CJFD2016,数据挖掘技术在药品零售经营决策支持中的应用,林淑芳;,广东省东莞市塘厦医院药剂科;,海峡药学,药品零售;;数据挖掘技术;;经营决策支持;;应用价值,"目的探究在医院药房药品零售经营决策支持中应用数据挖掘技术的效果及价值。方法从我院2013年01月起,在我院药房零售经营工作中建立微软SQL Server 2010数据工作库,并且运用关联规则法对我院药品日常销售产生的数据作数据挖掘和相关分析。结果顾客购入抗眩晕及维生素药物后,再购入理血药物的可能性大;同时购入解毒消炎药及清热解毒类药物饮片后,再购入五官科用药的几率大;购入心脑血管药物、消化系统药物的顾客主要为中老年患者,再购入理血药物的可能性大;夏秋季节清热解毒类中药饮片的销售额较高,顾客在购入咽喉含片时,有较大的可能性购入清热解毒类中药饮片;购入补益药、祛风湿药物之后,再购入骨伤科用药的几率...",2016/8/15,2016
CJFD2016,数据挖掘在计算机网络病毒防御中的应用,苟元琴;,三门峡职业技术学院信息传媒学院;,湖北函授大学学报,计算机网络病毒;;数据挖掘技术;;防御;;DMAV系统,"在现阶段的互联网信息时代,网络病毒的不断滋生、变化为计算机系统带来了极大的安全困扰和伤害,尤其是许多网络病毒还采用了伪装、变形等技术来侵入计算机,进而造成更大的杀伤,使得计算机反病毒体系常常处于力不从心的状态。为了建立基于计算机网络病毒防范的可靠防御体系,本文希望面向防御目标实施数据挖掘相关技术,并基于该技术搭建DMAV体系结构,实现对病毒的主动检测和主动防御。",2016/7/28,2016
CJFD2016,基于数据挖掘的隐私保护数据发布模型研究,王蕊;,辽宁建筑职业学院;,技术与市场,数据挖掘;;隐私数据;;数据预处理;;决策树,"在满足一定适用条件和范围的前提下,提出了一种基于数据挖掘的隐私保护数据发布模型,给出了模型结构图,并详细介绍了模型的工作流程及数据预处理模块、决策树模块、属性分析模块的功能及部分实现细节。",2016/8/15,2016
CJFD2016,数据挖掘技术在电厂经济性分析系统中的应用,李玥;,平顶山姚孟发电有限公司;,无线互联科技,大数据;;支持向量机;;数据挖掘;;销售模式,"随着互联网技术的迅速发展,各行业尤其是销售行业得到了快速的发展,同时也产生了海量的相关数据资源。作为销售行业中的一部分,传统的人工分析模式已经无法为电厂直供电、供热和电力营销提供必要的数据分析。需要利用大数据挖掘与分析技术,从海量的电力营销数据中发掘潜在的、有价值的信息,快速有效地分析数据与信息,从而将各个信息孤岛相互汇集成为决策辅助信息系统,更好地保证电厂生产的安全运行、销售利润和市场竞争力。",2016/7/10,2016
CJFD2016,数据挖掘在洗钱交易中的识别研究,郝建军;翟岁兵;甘霖;,陕西服装工程学院信息工程学院;,中国新通信,数据挖掘;;洗钱交易;;识别,"随着经济建设不断加快,洗钱交易成为世界性的犯罪行为。但是从现状来看,如何识别洗钱交易难度非常大,选择科学合理的识别方法非常关键,更是研究反洗钱的重要课题。本文阐述了交易信息的层次分析和数据结构,通过真实交易验证数据挖掘方法的有效性和可行性。",2016/7/20,2016
CJFD2016,试析数据挖掘技术在软件工程中的应用,王希军;,许昌职业技术学院;,电子技术与软件工程,数据挖掘技术;;软件工程;;应用,"我们如今的生活会遇到大量的信息,一方面人们随时随地可以查阅相关信息但是另一方面不利于人们来进行分门别类和快速的获得主要信息,数据挖掘技术的使用使人们能够段时间内完成信息的处理。本文首先介绍了数据挖掘技术的含义和包括的方法,然后阐释了数据挖掘技术的应用情况并对它面临的问题进行了分析。",2016/7/28 17:17,2016
CJFD2016,面向思维主题发现的概念对分类研究,胡耀宇;,北京科技大学东凌经济管理学院;,中国管理信息化,数据挖掘;;思维主题发现;;分类;;概念对,"数据挖掘又称数据库中的知识发现(Knowledge Discover in Database,KDD),是目前人工智能和数据库领域研究的热点问题,所谓数据挖掘是指从数据库的大量数据中揭示出隐含的,先前未知的并有潜在价值的信息的非平凡过程。当前数据挖掘所面临的困境之一在于任务的确定和挖掘对象信息的表征仍由数据分析人员主观完成。思维主题发现作为一种全新的数据挖掘问题提取方法能够推动数据挖掘技术应用的进一步发展。本文提出的概念对分类研究则有利于大大提高思维主题发现的效率。",2016/9/1,2016
CJFD2016,已知网络入侵模式的低匹配度数据信息集挖掘平台设计,刘兴明;王三虎;张跃进;,吕梁学院计算机科学与技术系;华东交通大学信息工程学院;,现代电子技术,网络入侵模式;;低匹配度;;数据信息集;;挖掘平台,"在已知网络入侵模式下对低匹配度数据信息集进行挖掘时,缺少对低匹配度数据信息集的处理和分类选取过程,存在挖掘不准确,效率低的问题。设计并实现了一种已知网络入侵模式下对低匹配度数据信息集挖掘平台,介绍了平台的总体硬件结构,利用数据采样预处理模块实现从源数据到挖掘数据的映射,完成离散化、数据过滤等处理过程。依据KC89C72 DIP40FILE分类器进行低匹配度数据信息集的分类,储存到SSRAM中,并以此为基础,通过数据挖掘模块对储存的低匹配度数据信息集进行确认与挖掘。软件设计过程中,对已知网络入侵模式的低匹配度数据信息集挖掘平台进行了详细的分析,并给出低匹配度数据信息集挖掘的实现过程以及程序代码。...",2016/9/15,2016
CJFD2016,浅谈数据挖掘算法在财务信息管理系统的应用,袁超;付涛;,上海金鼎软件有限公司;,数字技术与应用,算法;;财务信息管理;;数据挖掘;;拓扑排序,"企业改制提高了财务信息管理系统的性能。算法在财务系统中的应用,能提高财务管理程序的效率、实时性和集成度。EPR技术的应用,使财务管理成为经营、工作和项目的中心。数据挖掘算法能实现财务数据分析,为企业战略决策提供信息,实现建立内部优势业务,通过市场分析确定产品的生产任务,并且实时调整,提高市场竞争力和工作水准。",2016/8/15,2016
,,,,,,,,
