SrcDatabase-来源库,Title-题名,Author-作者,Organ-单位,Source-文献来源,Keyword-关键词,Summary-摘要,PubTime-发表时间,Year-年
CJFDTEMP,基于深度信念网络的个性化信息推荐,王兆凯;李亚星;冯旭鹏;刘利军;黄青松;刘晓梅;,昆明理工大学信息工程与自动化学院;昆明理工大学教育技术与网络中心;云南省计算机技术应用重点实验室;昆明佳谦科技有限公司;,计算机工程,信息推荐;;深度学习;;深度信念网络;;潜在狄利克雷分配模型;;模糊聚类,"为在信息推荐过程中挖掘出更多的信息关系,提出一种基于深度信念网络的信息推荐方法。利用模糊聚类进行预处理以达到跨类推荐的目的,根据用户浏览记录通过网络计算高分信息,并结合用户兴趣,使用潜在狄里克雷分配模型对高分信息进行权值调整,从而提高推荐准确率。在整个推荐过程中网络会根据用户行为对推荐信息权值进行相应调整。实验结果表明,该方法的推荐成功率比BP神经网络提高5.7%。",2016/10/15,2016
CJFDTEMP,面向自然语言处理的深度学习研究,奚雪峰;周国栋;,苏州大学计算机科学与技术学院;苏州科技学院电子与信息工程学院;苏州市移动网络技术与应用重点实验室;,自动化学报,自然语言处理;;深度学习;;表示学习;;特征学习;;神经网络,"近年来,深度学习在图像和语音处理领域已经取得显著进展,但是在同属人类认知范畴的自然语言处理任务中,研究还未取得重大突破.本文首先从深度学习的应用动机、首要任务及基本框架等角度介绍了深度学习的基本概念;其次,围绕数据表示和学习模型两方面,重点分析讨论了当前面向自然语言处理的深度学习研究进展及其应用策略;并进一步介绍了已有的深度学习平台和工具;最后,对深度学习在自然语言处理领域的发展趋势和有待深入研究的难点进行了展望.",2016/10/15,2016
CJFDTEMP,中文病理文本的结构化处理方法研究,陈德华;冯洁莹;乐嘉锦;潘乔;,东华大学计算机科学与技术学院;,计算机科学,中文病理文本;;结构化;;短句聚类;;模板提取,"病理文本作为一类重要的非结构化临床文档,对临床诊断至关重要。针对具体的中文病理文本数据,提出一种简单有效结构化处理方法。首先对中文病理历史文本数据进行预处理,包括数据清洗、短句切分及主干提取等步骤,从中提取出各个样本所对应的文本信息;然后通过短句聚类和统计参数筛选实现样本描述模板的提取;最后利用模板对病理文本进行即时结构化处理,得到最终的结构化处理结果。实验证明,该方法对同类文本可以达到很好的结构化效果;同时提取的模板会被定期优化以适应最新的数据结构化需求。",2016/10/15,2016
CJFDTEMP,一种新的在线流数据异常检测方法,丁智国;莫毓昌;杨凡;,浙江师范大学数理与信息工程学院;,计算机科学,流数据;;异常检测;;隔离森林;;在线集成学习,"流数据的海量、无限、分布动态变化且不均衡等特征使得对流数据的在线异常检测成为当前一个研究热点。分析了异常数据的少而不同且更容易通过随机空间的分割而孤立出来的特征,基于在线集成学习理论,提出了一种基于隔离森林的在线流数据异常检测算法。在4个UCI标准数据集上的实验结果表明提出的方法有效。",2016/10/15,2016
CJFDTEMP,基于多标签传播的社交网络用户影响力评估,许为;林柏钢;林思娟;杨旸;,福州大学数学与计算机科学学院;网络系统信息安全福建省高校重点实验室;,计算机科学,用户影响力;;多标签传播;;影响力传播;;社交网络;;效果评判,"为了识别出社交网络中的关键人物,需要对用户影响力进行评估。由于影响力是借助信息在网络中的扩散而逐步形成的,因此需首先对影响力传播过程进行建模;然后以该模型为基础,用标签表示影响力的所有者,以隶属度表示用户被影响的程度,利用多标签传播来模拟影响力传播的过程,实现了一种新的用户影响力评估算法MLPIA(Multi-label Propagation User Influence Asessment Algorithm);最后,在真实数据集上测验排名靠前的用户的影响力覆盖范围和紧密中心性,结果证明了该算法的合理性和有效性。",2016/10/15,2016
CJFDTEMP,基于Spark的大数据热图可视化方法,张繁;袁兆康;肖凡平;尤堃;王章野;,浙江工业大学计算机科学与技术学院;浙江大学CAD&CG国家重点实验室;,计算机辅助设计与图形学学报,热图;;并行计算;;大数据;;细节层次,"针对普通客户端浏览和分析大数据困难的问题,结合Spark和LOD技术,以热图为例提出一种面向大数据可视化技术框架.首先利用Spark平台分层并以瓦片为单位并行计算,然后将结果分布式存储在HDFS上,最后通过web服务器应用Ajax技术结合地理信息提供各种时空分析服务.文中重点解决了数据点位置和地图之间的映射,以及由于并行计算导致的热图瓦片之间边缘偏差这2个问题.实验结果表明,该方法将数据交互操作与数据绘制和计算任务分离,为浏览器端大数据可视化提供了一个新的思路.",2016/11/15,2016
CJFDTEMP,网络安全之道可道;非常道——访国家信息技术安全研究中心总工程师李京春,唐莉;,,信息安全与通信保密,安全研究中心;李京春;网络安全;科技部信息;信息安全专家;道可道;工业控制系统;信息安全产业;信息技术;信息化专家;,"李京春,男,教授级高级工程师。现任国家信息技术安全研究中心副主任兼总工程师,北京科技大学特聘博士生导师。中央网信办党政云审查专家组副组长,国家科技部信息安全专家组成员、公安部信息安全等级保护建设指导委员会委员、国家科技部863信息安全专家组成员、国家",2016/10/10,2016
CJFDTEMP,基于混合遗传算法的高维离群数据检测,施冬冬;方星星;,安徽大学江淮学院;解放军陆军军官学院;,赤峰学院学报(自然科学版),离群点;;遗传算法;;模拟退火算法,"离群点研究在实际应用中有着重要的意义,随着数据规模的不断扩大,传统的离群点检测方法已经不适用于高维空间数据,本文在遗传算法的基础上结合模拟退火算法,一方面利用遗传算法对高维数据处理有很好的全局搜索能力,一方面利用模拟退火算法的局部搜索能力,最后经实验证明,本文提出的新算法能有效的提高高维空间离群点检测的效率.",2016/10/25,2016
CJFDTEMP,大数据技术:从数的解蔽到数据的遮蔽之现象学考察,陈艳;李君亮;,广西民族师范学院数学与计算机科学学院;,河北师范大学学报(哲学社会科学版),数;;数据;;大数据技术;;遮蔽;;解蔽,"大数据技术沿着""数→数据→数学化→大数据技术""这一逻辑脉络演化而来。数的发现将世界带入人的眼前,从而开启了微数据对世界的解蔽。近代自然科学的发展呈现的小数据将世界数学化,从而造成了世界的遮蔽。大数据时代,世界以数的复杂性方式显现,使得世界面临被深层遮蔽的危险,更使世界获得全面解蔽的可能。",2016/9/5,2016
CJFDTEMP,基于项目近邻的约束概率矩阵分解算法,张天杰;曹苏燕;闫世洋;,南京邮电大学计算机学院;,计算机技术与发展,推荐系统;;协同过滤;;约束概率矩阵分解;;项目近邻,"在个性化推荐领域,协同过滤是目前最为成功应用最为广泛的推荐技术之一。约束概率矩阵分解算法便是一种基于模型的协同过滤算法,它能有效地面对推荐系统中遇到的海量数据问题,保证推荐的实时性。然而,传统的约束概率矩阵分解算法并没有考虑用户或者项目之间的关系,使得算法的推荐质量受到影响。为进一步提高算法推荐的质量,文中在约束概率矩阵分解算法模型的基础上引入项目近邻关系,通过结合从项目简介中提取的固有特征和用户评定的标签特征两方面信息来确定项目的最近邻居集合,并将该邻居集合融合到基于约束的概率矩阵分解模型中产生推荐。通过在真实的数据集上的验证结果表明,该算法能够更有效地预测用户对项目的评分,提高算法的推荐精...",2016/9/19 8:42,2016
CJFDTEMP,基于用户回复内容观点支持度的评论有用性计算,李学明;张朝阳;佘维军;,重庆大学计算机学院;,计算机应用,评论有用性;;观点支持度;;情感分析;;观点摘要;;用户回复,"针对有监督评论有用性预测方法中的训练数据集难以构造,以及无监督方法缺乏对情感信息支撑的问题,提出基于语义和情感信息构建一种无监督模型,用于对评论有用性进行预测,同时考虑了评论和评论下回复内容对观点的支持度用来计算观点的有用性得分,进而得到评论的有用性。同时,提出结合句法分析和改进潜在狄利克雷分配(LDA)模型的评论摘要方法用于评论有用性预测模型中的观点提取,基于句法分析结果构建must-link和cannot-link两种约束条件指导主题模型学习,在保证召回率的同时提高模型准确率。该方法在实验数据集上能取得70%左右的F1值和90%左右的排序准确率,且实例应用也表明该方法对结果具有较好的解释性...",2016/10/10,2016
CJFDTEMP,课程考核方式的研究与探讨——以在线考试为例,谭红春;金力;汪庆;,安徽中医药大学医药信息工程学院;,长沙大学学报,在线考试;;系统设计;;题库建设,"互联网技术的日益发展推进了教育领域信息化的变革.目前,仅采用纸质考试,已经不能满足课程考核的需求,在线考试成为了主要的考核形式之一.通过对在线考试的各模块进行分析,包括用户登录设计、题库建设、组卷算法和智能评分等模块,对课程考试的改革进行了探讨.在线考试的使用,提高了阅卷的效率,保证了试卷的质量和考试公平.",2016/9/15,2016
CJFDTEMP,癌症相关基因选择性剪接进化数据库的构建,徐敏杰;窦同海;徐佳熹;江建平;刘匆;付茂宾;高原;陈诚文;张亮;周雁;,复旦大学生命科学学院遗传工程国家重点实验室;国家人类基因组南方研究中心上海市疾病与健康基因组学重点实验室;,复旦学报(自然科学版),癌症;;选择性剪接;;数据库;;外显子,"选择性剪接是真核生物基因调控的基本调节机制之一,与各种类型的生理和病理活动相关.癌症相关基因的不正常剪接可能与多种癌症的发生发展有关.作为选择性剪接进化的主体,选择性剪接外显子展示了其在不同物种中多样的进化功能.本文系统整理了2 989个癌症相关基因的各项功能,通过比较基因组学的分析方法总结了癌症相关基因的选择性剪接外显子的功能和进化关系,建立了癌症相关基因选择性剪接进化数据库(ASeeDB数据库).ASeeDB包含癌症相关基因外显子区域的进化保守性、结构域预测、Ka/Ks值、以及基因、转录本、外显子区域3个层次的表达量统计等信息,结合这些信息用户可以方便的检索有研究意义的基因或者外显子.外显...",2016/10/15,2016
CJFDTEMP,大数据技术在高职教育中的应用问题,许翊;,镇江高等专科学校丹阳师范学院;,信息与电脑(理论版),大数据技术;;高职教育;;教学改革,"结合当前高职教育中的信息化问题,在探讨高职教育中大数据的时代价值的基础上,从多个方面论述了大数据在高职教育中的应用问题,希望对于今后的高职教育改革有一定帮助。",2016/7/8,2016
CJFDTEMP,TaintDroid数据流监控系统缺陷及优化策略研究,孙梦阳;,上海交通大学;,网络安全技术与应用,数据流;;监控系统;;优化策略,"本文首先综述安卓系统安全检测技术发展现状,在详细分析了基于安卓恶意应用检测的TaintDroid数据流监控系统缺陷的基础上,给出了一种基于扩展TaintDroid的检测范围来实现用户隐私保护的策略。",2016/10/15,2016
CJFDTEMP,大尺寸形貌测量的三维点云拼接技术的研究,张健;,广西讯驰信息科技有限公司;,信息与电脑(理论版),大尺寸形貌测量;;三维点云拼接技术;;数据处理,"三维点云拼接技术是在计算机技术的基础上,综合应用网络数据分析技术、三维空间模拟技术,对检测物体进行部分检验,然后将不同部分的数据分析结构模拟图,进行三维空间图形综合性处理。三维点云拼接技术在大尺寸形貌测量中的应用将大尺寸的地貌切分成不同层次的小部分,进一步提升了形貌测量数据的准确程度,推进我国地理检测技术的进一步发展。",2016/7/8,2016
CJFDTEMP,基于社会化标签的图书推荐系统模型研究,付凯丽;,天津师范大学图书馆;,情报探索,社会化标签;;图书推荐系统;;LDA;;协同过滤,"[目的/意义]从社会化标签视角探讨图书推荐系统模型。[过程/方法]分析3种主流的标签推荐模型(基于主题、网络和张量的模型)和3种标签推荐算法(基于内容、协同过滤和混合推荐算法)的优缺点,构建基于标签的图书推荐系统模型。[结果/结论]该模型由数据采集模块、数据预处理模块和协同过滤推荐模块组成,可以在一定程度上解决推荐系统中的标签语义模糊、用户兴趣多变、可扩展性差等问题,以提高图书推荐效率和准确度。",2016/10/15,2016
,,,,,,,,
