SrcDatabase-来源库,Title-题名,Author-作者,Organ-单位,Source-文献来源,Keyword-关键词,Summary-摘要,PubTime-发表时间,Year-年
CJFDTEMP,稀疏集SVN惩罚校正方法及其种质评价应用研究,谭文学;赵春江;吴华瑞;,北京工业大学计算机学院;湖南文理学院计算机学院;国家农业信息化技术研究中心;,高技术通讯,惩罚校正;;支持向量网络;;错误训练;;稀疏样本;;逆向训练,"针对支持向量学习网络(sVN)学习稀疏样本数据集时,稀疏目标和非稀疏目标的分类器错误率严重失衡而实用性大大降低的问题,在拉格朗日乘数渐近分析基础上,引入惩罚校正因子、逆向训练样本和错误训练率等概念,提出了惩罚校正支持向量网络学习算法和校正方法,并将该方法应用于以CT图像特征数据集为基础的小麦籽种品质定级。等值分析说明该学习算法能有效地等级化籽种特征数据,准确率达95%;和其他同源方法的对比试验显示:针对稀疏样本集,该算法在获得可观综合预测准确性的同时,能显著改善稀疏样本集各目标分类器的预测错误率的极性分布,并展现良好的学习性能。",2014/3/15,2014
CJFDTEMP,面向社交网络的访问控制模型和策略研究进展,陈天柱;郭云川;牛犇;李凤华;,中国科学院信息工程研究所信息安全国家重点实验室;,网络与信息安全学报,社交网络;;访问控制模型;;访问控制策略;;信息传播,"作为信息保护有效手段之一的访问控制技术,可以保障信息仅能被合法用户访问,防止信息的泄露,势必成为在线社交网络中信息保护方法的重要组成部分。通过分析在线社交网络的特点,从访问控制模型与访问控制策略2个角度出发,对目前在线社交网络中的访问控制研究进行深入探讨,并对相关研究进行整理与分析。",2016/8/15,2016
CJFDTEMP,物联网技术在高校设备管理中应用,曲德强;缪渝斌;张欢;,上海理工大学资产后勤处;,实验室研究与探索,物联网;;设备管理;;利用率;;重复购置;;实验室,"仪器设备特别是大型精密贵重仪器、设备是实验室发展建设的核心,对其管理的好坏直接关系到高校教学、科研效果的成败。在高校教学、科研经费有限的情况下,做好仪器设备管理工作,对优化高校资源配置,保障资产安全,提高使用效益具有重要意义。目前,高校仪器设备管理工作存在着重复购置、利用率低、优质大型仪器设备共享不足等问题。为此,将物联网技术应用到高校设备管理中。通过物联网技术对设备的运行数据进行采集,将采集到的数据进行量化,然后对其分析处理,判断出设备的使用情况,从而更加科学、合理的配置实验室设备,减少重复购置、利用率低等问题,使有限的教学、科研经费发挥出最大的效益。",2016/9/15,2016
CJFDTEMP,基于CSS模板的职位信息并行抽取系统设计,薛安荣;王丹;黄祖卫;,江苏大学计算机科学与通信工程学院;,电子科技,信息抽取;;MapReduce;;CSS模板;;MD5算法;;分布式数据库HBase,"针对现有职位信息抽取方法由于缺乏自适应性和并行性,存在冗余度高和抽取效率低的问题,提出了基于CSS模板的方式并行职位信息抽取方法。该方法根据职位信息页面特点使用CSS路径抽取方法,并制定抽取模板解决抽取的准确性和自适应性,使用了MapReduce编程模型实现职位信息的并行化抽取。使用MD5算法计算已抽取得到的职位信息的MD5值,结合MapReduce并行计算编程模型的特性实现职位信息去重,最终将去重后的职位信息存储在分布式数据库HBase。实验测试结果表明,并行计算与传统的非并行编程模型相比在处理的时间效率和采集的职位信息量上都有明显的提高。",2016/10/15,2016
CJFDTEMP,孩子兄弟树查找双亲结点的算法,袁关伟;,69027部队;,计算机系统应用,孩子兄弟树;;查找;;双亲结点,"为完善孩子兄弟树抽象数据类型中的基本操作,进而更好地服务于教学科研和日常应用,解决了在孩子兄弟树中查找双亲结点这一重要的、复杂的和缺少深度研究的操作.通过数学方法分析得知,该算法的时间复杂度和空间复杂度均为O(n).同时,通过对该算法的应用潜力进行挖掘,发现其在地名查询系统中具有很好应用前景.",2016/10/15,2016
CJFDTEMP,基于文本向量化方法构建IT运维服务台事中处置参考模型,陈晓伟;曹逸峰;尚鸿斌;付谦;包妍苹;沈璟;,中国农业银行股份有限公司数据中心;,计算机系统应用,IT运维;;服务平台;;事件文本;;向量化;;处置参考,"针对传统IT运维服务平台事件全文检索准确度不高及大量历史事件单再利用率低的特点,提出一种基于事件文本向量化处理方法的事中处置参考模型.通过建立生产运维特征词库,将事件工单文本表示成特征向量,并选择合适的算法对不同事件文本特征向量进行相似度计算,最终通过匹配找到平台历史事件或者知识库中与现有事件相似度高的事件或知识,供故障处置人员参考.将此方法应用到企业级服务台事件处置流程中,能帮助运维人员快速准确地找到类似的历史事件或者相关的知识,形成事中处置参考,加快事件处置效率,同时也进一步提高了运维工具的智能化水平.",2016/10/15,2016
CJFDTEMP,大数据时代信息与计算科学专业课程体系优化改革与实践,刘淳安;,宝鸡文理学院数学与信息科学学院;,高教学刊,大数据;;信息与计算科学;;优化改革;;实践教学,"在信息化向大数据时代转型的过程中,在以压缩理论教学课时为总体要求下,为加强学生的课程教学,提高学生的数学应用和创新创业能力,对信息与计算科学专业课程结构进行优化升级,使课程体系整体形成一个相互衔接,相互统一的创新创业型课程群。并对课堂教学模式、课外实践教学、考核方式、方法进行了改革与实践。",2016/11/10,2016
CJFDTEMP,基于大数据的智能管道技术研究,廖军;,中国联通网络技术研究院;,邮电设计技术,移动通信;;智能管道;;大数据;;用户感知,"根据运营商面临的实际问题以及3GPP标准对智能管道定义的缺陷,提出了一种基于大数据的网络智能管道体系架构,形成了分层的逻辑结构,并对信令和用户面数据的采集内容、处理要求和应用进行了探索,研究了数据采集的具体信令范围,采集接口,采集点,根据运营商设备能力的实际情况,分析了需要对采集的数据进行的关联处理和格式要求,以及多数据源关联的原因、方法及其价值。最后将智能管道大数据应用于用户体验评估,并对常见的移动用户体验问题提出了基于智能管道的分析方法。",2016/9/20,2016
CJFDTEMP,基于本体推理的故障信息关联及诊断应用研究,任鹏;宋仁旺;,太原科技大学电子信息工程学院;,燕山大学学报,故障诊断;;本体推理;;关联链接;;C-F算法,"针对故障诊断专家系统本体知识库中的领域知识,以工程机械为实践范围,以混凝土泵车液压系统故障为探究对象,开展了使用本体推理技术发现故障知识间关联链接的研究以及引进并根据工程机械故障诊断的特点改进C-F模型的尝试,相应地设计了本体推理的结构层次、借助C#等语言编制查询界面以及制定了对模糊条件加入权重和匹配算法的新推理规则。通过分别进行实验测试,可看出利用本体推理的技术能够更有效地发现故障知识间的关联链接;同时,改进的C-F推理规则可以有效应对多重组合证据,二者均对优化推理过程、提高推理结果与故障实际的相符程度提供了帮助,具有一定的实际应用价值。",2016/7/31,2016
CJFDTEMP,结合正反相似度的协同过滤推荐算法,周泓宇;梁刚;冯程;刘江冬;,四川大学计算机学院;,计算机工程,推荐系统;;协同过滤;;数据稀疏;;正反相似度;;惩罚因子,"针对协同过滤推荐系统中普遍存在的评分数据稀疏问题,提出一种基于正反相似度的协同过滤推荐算法。通过改进杰卡德相似度模型,给出一种计算用户正反相似度的方法,进而筛选出正反相似用户群,并根据正反相似用户群的已知评分进行综合预测。实验结果证明,与基于相似用户群的协同过滤推荐算法相比,该算法可以有效缓解协同过滤推荐中的数据稀疏问题,并且提高了推荐系统的预测准确率。",2016/10/15,2016
CJFDTEMP,新疆动物卫生监督实验室信息管理系统的建立与应用,李琛;林汉亮;林福滨;彭晓玲;王高明;,新疆维吾尔自治区动物卫生监督所;北京三维天地科技有限公司;,中国动物检疫,LIMS;;兽医实验室;;动物疫病控制;;检测数据库;;建立与应用,"为提高实验室的工作效率,新疆维吾尔自治区动物卫生监督所开发了实验室信息管理系统(LIMS),并于2015年12月上线运行。LIMS运行于新疆动物卫生监督所内部网络,其授权客户登陆部分发布在外网。该系统采用完全B/S架构,使用信息管理技术建立了动物疫病监测和流行病学调查数据库,可以对数据进行统计利用,具有系统集成、离线地图、统计查询、结果导入等技术特点,实现了对实验的全过程监控,保证了检测数据的完整性、真实性和客观性,提高了工作效率和管理水平。同时利用数据统计功能,实现了疫情预警预报。今后,该系统还需在移动采样、功能拓展、信息拓展、大数据平台应用和疫情预警方面进一步优化。",2016/10/20,2016
CJFDTEMP,基于有向网络的在线评论情感倾向性分类,张向阳;那日萨;孙娜;,大连理工大学系统工程研究所;集宁师范学院数学系;,情报科学,在线评论;;有向网络;;情感分类;;相似度;;情感词典,"根据消费者在线评论,构建有向网络,从评论网络的拓扑性质出发建立在线评论情感倾向性分类模型。该模型首先以词语共现理论为基础构建评论的有向网络,然后挖掘网络中具有情感信息的子网络,将子网络中由程度词和否定词导致的情感偏移引入到韦伯-费希纳定律中,提出了一种新的在线评论情感相似性计算方法DNSA(Directed network and syntactic analysis),利用该方法计算测试评论和训练中评论的相似度,选取相似度最大的K条评论的多数类作为该评论的类别。最后对酒店评论和手机评论进行实验,结果表明该模型可以有效的对评论作情感倾向性分类。",2016/11/5,2016
CJFDTEMP,基于用户主题精确感知大数据群体计算任务分配算法,王青;谭良;,四川师范大学计算机科学学院;中国科学院计算技术研究所;,计算机应用,群体计算;;主题匹配;;大数据;;逻辑回归;;人机协作,"针对大数据任务中海量数据分析需求、复杂认知推理挑战和传统计算中随机分配任务算法的低效性以及互联网用户的虚拟性、不确定性等问题,提出了一种基于用户主题精准感知的迭代式任务分配算法。首先,通过基于自适应模糊聚类与主题提取模型相结合的方法提取已发布群体任务的主题,然后构建特定任务模型和用户模型计算各关联度,再利用已提交高质量答案的历史任务迭代地检测新用户的真实主题并计算初始准确率;其次,通过逻辑回归(LR)方法预测用户能参与到某类任务的可能性并得到参与用户候选序列,在充分了解用户真实主题和对应主题上的准确率以及用户诚信度的情况下进行精准分配。通过与随机算法在模拟实验中对准确率进行比较,实验结果表明所...",2016/10/10,2016
CJFDTEMP,基于表示学习的中文分词,刘春丽;李晓戈;刘睿;范贤;杜丽萍;,西安邮电大学计算机学院;,计算机应用,表示学习;;词向量;;聚类;;条件随机场;;中文分词,"为提高中文分词的准确率和未登录词(OOV)识别率,提出了一种基于字表示学习方法的中文分词系统。首先使用Skip-gram模型将文本中的词映射为高维向量空间中的向量;其次用K-means聚类算法将词向量聚类,并将聚类结果作为条件随机场(CRF)模型的特征进行训练;最后基于该语言模型进行分词和未登录词识别。对词向量的维数、聚类数及不同聚类算法对分词的影响进行了分析。基于第四届自然语言处理与中文计算会议(NLPCC2015)提供的微博评测语料进行测试,实验结果表明,在未利用外部知识的条件下,分词的F值和OOV识别率分别达到95.67%和94.78%,证明了将字的聚类特征加入到条件随机场模型中能有效提...",2016/10/10,2016
CJFDTEMP,基于多源异构数据的市政管理知识库构建,佟明川;陈明锐;许斌;钟东来;张淑征;,海南大学信息科学技术学院;清华大学信息科学技术学院;,海南大学学报(自然科学版),智慧城市;;市政管理;;多源异构数据;;自动化知识抽取;;领域知识库构建,"为了满足市政管理领域对数据权威性和体系完备性的高要求,实现市政管理领域知识库的自动化构建,笔者提出了一种基于多源异构数据的市政管理知识库构建模型.采用自顶向下的构建模式,完成对结构化关系型数据、半结构化文本数据和互联网数据在内的多源异构数据自动化知识抽取,最后设计了一个轻量级示例系统,并对该方法的执行效果进行了评估.实验结果表明,本方法在市政管理领域的知识库构建上优势明显,能够实现对多种市政管理资源的自动化知识抽取,所生成的概念体系完整清晰,知识描述恰当准确.",2016/5/30 11:54,2016
CJFDTEMP,大数据安全与隐私保护研究进展,曹珍富;董晓蕾;周俊;沈佳辰;宁建廷;巩俊卿;,华东师范大学计算机科学与软件工程学院密码与网络安全系;上海交通大学计算机科学与工程系;,计算机研究与发展,大数据安全;;隐私保护;;密文计算;;密文访问控制;;密文数据聚合,"当前,用户数据的安全与隐私保护无疑成为大数据环境中最为重要的问题之一,而其最彻底的解决方式是通过加密所有数据来完成.因此,新的加密技术和在密文域上探索高效的大数据处理新模式是国内外当前的研究热点.在贯穿于整个数据生命周期中,密文域上的计算、访问控制和数据聚合(分别称为密文计算、密文访问控制和密文数据聚合)等问题已成为该领域的核心问题.主要针对密文计算、密文访问控制和密文数据聚合等当前国内外研究的现状进行综述,指出其存在的问题与不足.在此基础上,重点介绍了文章作者团队在大数据安全与隐私保护方面的最新研究成果.在密文计算方面,提出了通过减少公钥加密使用次数来设计高效的隐私保护外包计算的新方法,并设...",2016/9/27 14:43,2016
CJFDTEMP,Maldetect:基于Dalvik指令抽象的Android恶意代码检测系统,陈铁明;杨益敏;陈波;,浙江工业大学计算机科学与技术学院;,计算机研究与发展,恶意代码;;安卓;;Dalvik指令;;N-Gram;;机器学习,"提出了一个Android恶意代码的静态检测系统Maldetect,首先采用逆向工程将DEX文件转化为Dalvik指令并对其进行简化抽象,再将抽象后的指令序列进行N-Gram编码作为样本训练,最后利用机器学习算法创建分类检测模型,并通过对分类算法与N-Gram序列的组合分析,提出了基于3-Gram和随机森林的优选检测方法.通过4 000个Android恶意应用样本与专业反毒软件进行的检测对比实验,表明Maldetect可更有效地进行Android恶意代码检测与分类,且获得较高的检测率.",2016/10/15,2016
CJFDTEMP,国内新闻出版产业大数据应用困境分析,王欣欣;,长春科技学院;,网络安全技术与应用,新闻出版产业;;大数据应用;;困境,"新闻出版产业大数据化既是推动自身创新发展的需要,也是满足社会消费需求的需要。为更好地促进新闻出版产业大数据发展,本文进行了大数据应用困境分析,研究认为当前国内新闻出版产业大数据存在认知不足、开发资源匮乏、人力与技术支撑薄弱、市场竞争、企业生存等方面的困境。",2016/10/15,2016
CJFDTEMP,有限先验情景下的隐写分析技术研究,郭艳卿;王久君;许志浩;,大连理工大学信息与通信工程学院;,信息安全研究,隐写分析技术;;隐写分析框架;;有限先验知识;;特征基;;表示系数,"作为隐写技术的对抗手段,隐写分析主要致力于检测、阻止甚至破坏互联网上可能存在的基于隐写的隐蔽通信行为.实用隐写分析技术的研究,对打击恐怖组织及不法分子对隐写技术的滥用、维护国家安全和社会稳定具有重要的意义.首先阐述了隐写分析技术的研究意义及研究现状,然后,从需求极为迫切的图像隐写分析切入,针对有限先验信息的情境,提出新的隐写分析研究框架.以海量多样代表性样本数据为研究对象,重点研究具有超完备性的隐写分析特征基构造方法,利用超完备特征基对测试样本进行表示,根据表示系数对隐写方法进行预测,为研制准确性更高、实用性更强的隐写分析方法提供理论和技术支撑.",2016/10/5,2016
CJFDTEMP,基于K-核塌缩序列的社会化资源推荐中核心用户发现研究,武慧娟;Jia Tina Du;孙鸿飞;Jannatul Fardous;,东北电力大学经济管理学院;南澳大利亚大学信息技术与数学科学学院;,现代图书情报技术,核心用户;;社会化资源推荐;;社会化网络分析;;K-核塌缩序列,"【目的】通过对社交网站平台用户行为的分析,发现社会化小众群体中的核心用户,为社会化资源推荐服务提供参考。【方法】收集豆瓣读书用户的1 208个标签,对排名前100位的标签建立标签共现矩阵,分析用户的K-核网络结构,研究用户的K-核塌缩序列的波动情况。【结果】与度数中心度、最小K-核深度值等方法相比,基于K-核塌缩序列方法发现了新的社会化小众群体中的核心用户。【局限】样本数据规模较小且局限于某领域,排序问题不能得到很好的解决,需要进一步改进K-核分析方法。【结论】本研究有利于社交网站平台的管理者制定或改进新的资源推荐策略,从而促进社交网站平台更好地发展。",2016/9/25,2016
,,,,,,,,
