SrcDatabase-来源库,Title-题名,Author-作者,Organ-单位,Source-文献来源,Keyword-关键词,Summary-摘要,PubTime-发表时间,Year-年
CJFDTEMP,高速公路道路综合信息管理系统的设计与实现,郭建平;,福建省高速公路信息中心;,福建交通科技,高速公路;;道路综合管理;;信息系统;;建设,"本文以福建高速公路日常业务为基础,按照规范化建设、一体化管理的要求,给出高速公路道路综合管理信息系统的设计方案,并统筹安排系统建设,同时在使用中注重技术应用的实效性和可靠性,使之满足高速公路日常管理的需求。",2013/8/20,2013
CJFDTEMP,面向GPU的循环合并,杨扬;崔慧敏;冯晓兵;,中国科学院计算技术研究所计算机体系结构国家重点实验室;中国科学院研究生院;,高技术通讯,通用图形处理单元(GPU);;循环合并;;并行;;CUDA;;循环间数据重用,"针对现有的将C或Fortran程序映射到通用图形处理单元(GPU)的自动转换工具主要关注将单个循环生成一个独立的GPU内核,从而阻碍了对循环间数据重用的利用的问题,提出一种新的面向GPU的循环合并的代码变换方法,该方法通过循环分块(strip mining)和冗余计算等手段达到消除迭代间数据依赖的目的,并可充分利用GPU片上的共享内存进行线程间数据交换,从而将此类程序高效地映射到GPU上。通过典型程序在GPU上的实验表明,该新方法由于能够减少对全局内存的访问,带来了最多高达1.96倍的加速比。",2013/3/15,2013
CJFDTEMP,计算机数据库入侵检测技术的运用,侯玉香;,江西先锋软件职业技术学院;,信息系统工程,计算机数据库;;入侵检测技术;;检测效率;;系统自保能力,"为保证数据库安全,合理应用入侵检测技术是十分必要的。但目前入侵检测技术应用存在不足,主要体现在经常出现误报、检测效率较低、系统自保能力不强和扩展性能较差等方面。为弥补这些缺陷,应该采取改进和完善对策,完善系统设计、改进检测方法、提高自保能力,并合理应用检测技术,确保系统安全。",2016/9/20,2016
CJFDTEMP,基于Symfony2的助教管理系统,陈贻东;叶艳;郑文曦;吴敏;,中国科学技术大学现代教育技术实验室;中国科学技术大学软件学院;,计算机系统应用,助教;;管理系统;;工作汇报;;Symfony,"针对学校对助教管理工作信息化、流程化的需求,设计开发了基于Symfony2的助教管理系统.本文首先介绍所在学校助教管理工作的现状和改进方向,然后对基于Symfony2的助教管理系统的功能做了概述,最后着重论述了系统中数据库、提醒和工作考核模块的设计和实现.目前系统已经在学校稳定运行了两个学期,为学校提供了可靠的助教工作考核过程,节约了成本.",2016/10/15,2016
CJFDTEMP,浅论大数据,艾斯卡尔·巴拉提;,中共新疆维吾尔自治区委员会党校信息网络中心;,中国新通信,大数据;;优势,本文简要叙述了大数据的概念及我们生活中所涉及的一些方面。大数据认为是新的竞争优势。,2016/10/5,2016
CJFDTEMP,某生产系统基于Witness的仿真与优化,李琴;刘海东;,攀枝花学院机械工程学院;,现代制造工程,工艺流程;;作业时间;;Witness软件;;仿真,"以某钢制门的制造生产为研究对象,应用Witness软件进行建模仿真研究。首先,对产品生产过程进行实地调研和数据测量,并对当前生产过程进行建模和仿真分析,找出生产系统中设备利用率不均衡的问题。然后,针对问题并结合企业实际,提出了改进机加工工艺流程和调整工人作业时间的新方案,并对新方案进行了再次建模仿真,验证了方案的正确性和可行性。通过改进,不但能提高生产加工效率,减少操作人员,还能降低企业大量的生产成本。",2016/9/18,2016
CJFDTEMP,基于微博的时空事件识别研究,郑喆君;金蓓弘;崔艳玲;,中国科学院软件研究所;中国科学院大学;,计算机科学,微博;;时空事件;;主题模型,"微博是一种社交网络服务,它主要基于用户的关注关系进行信息分享和传播,具有时效性强、传播迅速等特点。将微博看成是反映城市动态的一类感知器,从识别微博的主题入手,检测微博中反映的时空事件。为此,首先提出了一种用于分析微博主题的主题模型ST-LDA,并应用该模型将具有语义相似性、时空聚集性的微博归属于同一主题下;然后给出了从主题中检测时空事件的方法。基于真实的新浪微博数据进行实验,结果表明此方法比基于LDA的方法、基于TimeLDA的方法在事件识别上有更高的查全率和查准率。",2016/10/15,2016
CJFDTEMP,数字校园基础平台的研究与设计,户占良;郭玉滨;,菏泽学院现代教育技术中心;菏泽学院计算机与信息工程系;,智能计算机与应用,数字校园基础平台;;SOA;;Web Service;;Portlet;;基础平台设计,"本文首先介绍了数字校园建设情况、数字校园基础平台的概念及建设原则。然后讨论了数字校园基础平台建设的关键技术,例如SOA、Web Service、Portlet等。最后论述了统一信息门户平台、统一身份认证平台、统一数据管理平台的设计。",2016/10/28,2016
CJFDTEMP,基于视觉的目标检测与跟踪综述,尹宏鹏;陈波;柴毅;刘兆栋;,信息物理社会可信服务计算教育部重点实验室(重庆大学);重庆大学自动化学院;,自动化学报,计算机视觉;;目标检测;;目标跟踪;;背景建模;;表观建模,"基于视觉的目标检测与跟踪是图像处理、计算机视觉、模式识别等众多学科的交叉研究课题,在视频监控、虚拟现实、人机交互、自主导航等领域,具有重要的理论研究意义和实际应用价值.本文对目标检测与跟踪的发展历史、研究现状以及典型方法给出了较为全面的梳理和总结.首先,根据所处理的数据对象的不同,将目标检测分为基于背景建模和基于前景建模的方法,并分别对背景建模与特征表达方法进行了归纳总结.其次,根据跟踪过程有无目标检测的参与,将跟踪方法分为生成式与判别式,对基于统计的表观建模方法进行了归纳总结.然后,对典型算法的优缺点进行了梳理与分析,并给出了其在标准数据集上的性能对比.最后,总结了该领域待解决的难点问题,对...",2016/6/21 14:56,2016
CJFDTEMP,一种基于模糊聚类的医学图像快速分割算法,张举森;陈菲;,西南科技大学计算机科学与技术学院医学影像技术实验室;,西南科技大学学报,模糊聚类;;医学图像分割;;直方图;;峰值检测;;卷积,"对基于模糊聚类的医学图像分割算法进行研究,提出了一种快速有效的分割算法。该算法先将图像的直方图与高斯模板卷积,并进行峰值检测,得到c个峰值的横坐标,以此为基础进行区间划分,在各区间范围内初始化并且更新聚类中心,然后对原图像进行均值滤波,最后根据像素值所属区间完成分割。实验证明,在保证分割质量的前提下,可将运行时间减少4%以上,优于目前的图像快速分割算法。",2016/9/15,2016
CJFDTEMP,一种基于WebMagic和Mahout的信息搜集与推荐系统,武婷婷;,南京邮电大学理学院;,软件导刊,爬虫框架;;余弦定理;;推荐引擎;;WebMagic;;Mahout,"提出一种基于Java爬虫框架WebMagic和Mahout推荐引擎的信息搜集与推荐系统。首先利用WebMagic框架从多个信息源获取需要的数据,然后使用Jieba分词工具和余弦定理进行文本相似度判定,从而对数据进行处理,最后使用Mahout推荐引擎为用户推荐可能感兴趣的信息。",2016/10/27 10:34,2016
CJFDTEMP,基于词典特征优化和依存关系的中文时间表达式识别,高源;席耀一;李弼程;李苏奕;,信息工程大学;解放军电视宣传中心;,信息工程大学学报,时间表达式;;时间表达式识别;;时间词典;;条件随机场;;依存句法分析,"提出一种基于词典特征优化和依存关系的时间表达式识别方法。首先针对中文文本时间表达式边界定位不准确及长距离依赖的问题,优化了传统时间词典特征,将时间词典分为时间词词典和时间单位词典;其次针对传统基于机器学习的时间表达式识别方法忽视时间表达式本身结构特点的问题,在优化后的词典特征的基础上提取依存特征,挖掘时间表达式的结构信息;最后综合时间表达式的基本特征、词典特征和依存特征,在条件随机场模型上完成时间表达式识别。在中文语料上进行实验,时间表达式识别达到较好效果。",2016/8/15,2016
CJFDTEMP,大数据时代个人信息定义的再审视,范为;,中国信息通信研究院;,信息安全与通信保密,个人信息定义;;场景;;风险评估;;匿名化;;关联;;合理性,"大数据时代,界定个人信息应更侧重信息在特定场景中与个人的""关联性"",以及信息处理是否可能对个人造成影响。个人信息及匿名信息的界定是动态的,应基于具体场景进行风险评估。此外,个人信息定义作为法律适用的""门槛""性作用逐渐淡化,应重点从信息处理行为引发的隐私风险出发,根据风险程度确定法律的适用及相应保障义务,界定""合理使用""的范围,提升隐私保护实效,同时促进数据开发,释放数据活力。",2016/10/10,2016
CJFDTEMP,以读者为中心的基础数据库建设,龚新刚;沈丽娟;胡之茜;,63650部队科技信息中心;,图书情报工作,个性化;;数据库;;数据清洗;;用户画像,"分析以读者为中心基础数据库的构建原因,讲述利用读者个人信息的搜集思路即如何收集信息、构建数据库、整合清理信息,以及数据库构建的原理和方法。",2016/6/15,2016
CJFDTEMP,区域心电监护物联网云计算平台关键技术研究,杨枢;邱昱炎;石波;,蚌埠医学院卫生管理系;合肥工业大学计算机与信息学院;蚌埠医学院医学影像学系;,中国医疗器械杂志,心电监护;;物联网;;云计算,"该文探讨构建一个区域心电监护物联网的方法,重点是基于云计算平台的心电监护中心的实现。文章分析了心律失常类型自动识别功能的实现原理,并对云计算平台的总体架构、关键技术进行了研究,包括服务器负载均衡技术、海量小文件可靠存储与快速检索功能的实现方式等。",2016/9/30,2016
CJFDTEMP,基于Oracle流复制技术的高性能数据同步接口实现,黄杰生;韩早强;罗鹏;,广州奥格智能科技有限公司;,信息与电脑(理论版),流复制;;数据同步;;容灾备份;;高可用性,"流复制是Oracle推出的多粒度数据复制技术,可用于数据同步与容灾备份,同时又能保证业务系统的高可用性。笔者介绍了流复制技术工作原理,并给出如何利用流复制技术进行跨平台的高性能数据同步接口开发的应用实例。",2016/7/8,2016
CJFDTEMP,基于用户模型的广告推荐系统,朱道杰;朱艳辉;,湖南工业大学计算机与通信学院;,信息与电脑(理论版),用户模型;;广告推荐系统;;上下文感知;;用户偏好,"根据用户网页浏览上下文环境获取用户偏好,则能够完成用户潜在需求的挖掘,从而使广告推荐的准确性得到提高。基于此,设计了一种基于用户偏好模型的广告推荐系统。经过验证,该系统的广告推荐准确率可以达到95%,在广告推荐中具有一定有效性。",2016/7/8,2016
CJFDTEMP,信息安全审计系统的架构设计,林迅;,福富软件;,网络安全技术与应用,行为审计;;特征码识别;;管理中心,"信息安全审计系统采用分布式部署方式,分为网络审计设备和审计管理中心两大部分,通过基于业务运维行为、上网行为和网络应用行为的审计,实现基于用户网络行为的全面多维度审计,本文通过介绍信息安全审计系统的体系架构、通过分析数据流图设计来阐述该系统的设计原理。",2016/10/15,2016
,,,,,,,,
