SrcDatabase-来源库,Title-题名,Author-作者,Organ-单位,Source-文献来源,Keyword-关键词,Summary-摘要,PubTime-发表时间,Year-年
CJFDTEMP,应用型本科高校物联网技术课程改革方法研究,孙泽宇;,洛阳理工学院计算机与信息工程学院;,山东农业工程学院学报,物联网;;课程改革;;理论教学;;实践教学,"物联网技术作为物联网专业的核心课程和骨干课程,在物联网工程专业整个教学过程中启到了至关重要的作用。物联网技术课程改革主要体现在课程设置和课程重点与难点的讲解分析以及教学实践等环节。将学生的理论知识与实践认知相结合,提高了学生们的创新能力、思维能力和动手能力,提升了教师教学能力和科研能力,对物联网专业整体教学水平产生较大的推动作用。",2016/9/15,2016
CJFDTEMP,基于云计算技术的图书馆智能采编系统研究,余黎;,重庆工商职业学院图书馆;,西安文理学院学报(自然科学版),云计算;;图书馆;;智能图书采编;;系统设计,"为了提高图书馆采编的效率和服务能力,设计了基于云计算技术的图书馆智能图书采编系统;并重点研究了云计算环境下图书馆智能图书采编系统的实现;详细探讨了云计算环境下图书馆智能图书采编的创新:建立复合型采编队伍、创建采编数据平台和优化采编工作等.",2016/9/15,2016
CJFDTEMP,基于相似用户情感分析的推荐算法研究,余燕萍;,江西财经大学软件与通信工程学院;,科技广场,聚类;;用户评论;;推荐算法,"互联网发展迅速,电商扮演了重要角色,大多数的电商仅仅根据用户评分进行推荐,日益庞大的用户评论数据并没有很好的运用到商品推荐当中。本文利用大数据的聚类技术结合情感分析算法,通过相似用户对物品的需求相似,结合用户对商品评价的情感分析,对评价的情感倾向的分析作出一些评判,给出了一个较好的推荐算法,使得推荐系统可以为用户进行更好的推荐,代替了传统根据评分推荐系统,对未来推荐系统的发展方向有正面意义。",2016/8/30,2016
CJFDTEMP,Redis消息推送机制应用技术研究,王嫣如;,江西财经大学软件与通信工程学院;,科技广场,Redis消息推送;;发布/订阅机制;;移动医疗,"Redis是一个开源的、高性能的键值对数据库。对于不同条件下的存储需要,Redis可以有相应的键值数据类型来匹配,Redis也是当前应用非常广泛的一个开发工具。移动医疗作为一个新兴产业,旨在用更科学、更有效的方式改善当前的医疗环境。本文简要介绍了Redis的发布/订阅机制,并以医院门诊输液为例,简述Redis消息推送机制的应用。",2016/8/30,2016
CJFDTEMP,政府部门间信息资源共享软件平台的建设,谢宏霖;王若成;,山东英才学院信息工程学院;,山东农业工程学院学报,政府部门间信息资源;;信息共享体系;;目录管理系统;;流程管理系统,"本文以常德市人民政府电子政务管理办公室的信息资源共享交换及软件平台建设方案中的信息资源共享平台建设为例,对信息资源共享平台总体架构、数据资源门户设计、目录管理系统、共享体系管理四个模块进行了详细的叙述。",2016/9/15,2016
CJFDTEMP,从西方国家保护消费者权益政策看用户信息消费的安全管理,陆浩东;,贺州学院图书馆;,新世纪图书馆,信息消费;;消费者权益;;知识服务;;信息用户,"第二次世界大战之后,西方国家实施了保护消费者权益的政策,有效地扼制了生产过剩的危机。借鉴西方国家消费调控,实现社会平衡的政策手段,论文分析信息消费中危害用户信息的原因,提出加强知识产权法教育和消费教育,重视用户个人信息管理,规范信息消费市场,强化社会监管,以及构建安全的信息消费环境,是实现用户信息消费安全管理的有效措施。",2016/9/20,2016
CJFDTEMP,Android安全技术分析,张琳;,北京大学;,电子技术与软件工程,安全;;Android;;权限;;漏洞,"Android是一种深受人们的厚爱的开放源代码的操作系统,它基于Linux,以其强大的功能,廉价和开源的特征,在带来便利实用等的同时,也带来了安全隐患。本文将结合源码分析Android的安全技术,希望能够对Android操作系统研究有所帮助。",2016/9/23 13:38,2016
CJFDTEMP,移动端代替算法的并行优化,高明;程相国;咸鹤群;王硕;陈亚萌;,青岛大学计算机科学技术学院;,青岛大学学报(自然科学版),对称密码;;并行算法;;Android系统;;图形处理器,"研究DES的S盒代替算法,针对Android平台,利用并行思想,结合Android基于共享内存的并行框架提出并行查表代替算法,并对代替算法进行优化。在Renderscript框架下合理利用移动端GPU,能有效地提高代替算法速度。实验结果验证了该算法的优势,相对于移动端串行代替算法,该优化方案在密文长度高于6KB时,具有优势。密文长度超过300KB,相对于传统串行算法的加速比为10。",2016/8/15,2016
CJFDTEMP,结合ReliefF和改进的马尔科夫毯过滤的两阶段特征选择方法,姜文蓄;郭振波;王开西;,青岛大学数据科学与软件工程学院;,青岛大学学报(自然科学版),特征选择;;ReliefF;;马尔科夫毯过滤;;两阶段特征选择;;分类,"针对马尔科夫毯过滤(Markov Blanket Filter,MBF)方法中使用的线性相关系数存在只能度量变量间的线性相关性,而无法度量变量间非线性相关的问题,提出两阶段Filter特征选择方法 MBFSU-ReliefF。该方法对马尔科夫毯过滤方法作了改进,可利用对称不确定性以度量变量间的线性和非线性相关性。实验使用UCI和ASU上的4个数据集分析比较MBFSU-ReliefF、ReliefF、马尔科夫毯过滤和其他多种Filter方法,使用朴素贝叶斯和SVM两种分类器对特征选择方法选取的特征优劣进行评价,实验结果表明,MBFSU-ReliefF方法较其他方法具有较高的分类准确率。",2016/8/15,2016
CJFDTEMP,基于混合注册方式的海洋环境增强现实系统,邹国良;屠正飞;郑宗生;,上海海洋大学信息学院;,计算机应用与软件,增强现实;;混合注册;;数值预报;;海洋环境;;Vuforia,"针对单一传感器无法解决海洋环境增强现实系统中跟踪注册的问题,提出融合智能手机AGPS、电子罗盘和加速度传感器测定视线方向的多传感器注册与基于海天线特征标识的视觉跟踪注册的混合注册方法,并通过扩展卡尔曼滤波器实现多传感器有效融合以提高三维注册精度。以真实海洋环境及海洋数值预报为例,提出适应海洋动态环境的增强现实框架,利用Vuforia AR实现了原型系统,并对混合注册方法进行了验证。结果表明,该技术框架及注册方法有较强的可用性和实用性,在海洋动态环境的增强现实中具有广泛应用前景。",2016/10/15,2016
CJFDTEMP,已知社交和文本的Top-k位置查询,陈子军;崔清娟;刘文远;,燕山大学信息科学与工程学院;河北省计算机虚拟技术与系统集成重点实验室;,小型微型计算机系统,社交关系;;空间关键字查询;;SNIR-Tree,"空间关键字查询处理是数据库领域近年来的研究热点,为进一步提高用户的满意度,将用户的社交信息应用于空间关键字查询中.提出已知社交和文本的Top-k位置查询,给定用户社交关系、位置和多个关键字,为用户返回k个用户可能感兴趣的对象,这k个对象的选择依赖于三个方面:空间邻近、文本相似度和社交相似度.用rank函数作为衡量的标准,返回k个得分最高的对象.在查询算法中,提出了三种裁剪策略,包括距离、文本和社交的裁剪,提高了查询速度,并通过实验验证了本文所提方法的有效性.",2016/10/15,2016
CJFDTEMP,浅议数据采集及集中监控系统设计与应用,吕亚洲;,舟山市定海区公共资源交易中心;,电脑迷,数据采集;;监控系统;;有效设计;;技术运用,"在数据采集与集中监控系统设计中,技术人员应该需要从数据库管理系统的优化入手,实现管理系统主要软件模块的功能整体性开发。在数据监控系统设计中,技术人员应该强化对于新建库的资料整理操作,对数据采集中冗余部分进行剔除,不仅要实现运行库的正常数据更新还要确保系统故障率整体降低。本文根据数据管理系统的内容设置展开讨论,提出几点有利于系统主要软件模块开发方法创新的可行性措施。",2016/3/15,2016
CJFDTEMP,学生成长过程评价系统的研究与实现,陈云龙;,南京市北京东路小学;,中国教育信息化,成长过程评价;;评价系统;;评价策略,"学生成长过程评价是顺应新课程改革需要的教育评价方式之一,新课程改革要求建立符合素质教育理念的发展性的评价体系,以发挥评价不断促进学生全面发展的教育功能。本研究缘于教育实践过程,传统的评价仅仅停留在表面,既不能有效发挥评价的激励性和多元性,也不能从评价中反映出学生成长的过程和状态,同时不利于评价资料的长久保存。基于网络的学生成长过程评价系统体现出了较为显著的优势:可以运用智能手机和电脑终端,突破时空局限实时记录评价内容,体现了评价的过程性和连续性;教师、家长和学生都能参与到评价之中,实现了评价的多元性和科学性;对评价数据能进行全面自动的分析汇总,体现了评价的高效性和直观性;学生在校阶段的成长数据...",2016/10/5,2016
CJFDTEMP,浅谈衡器物联网的智能应用,王威;,上海耀华称重系统有限公司;,衡器,衡器;;物联网;;防作弊;;称重健康预警;;无人值守称重;;智能称重,"本文结合实例介绍了衡器物联网的构架和应用,探讨了如何分析和利用称重设备感知的各种基础数据,以满足衡器用户远程数据处理、称重防作弊、保障称重准确性、智能称重等需求。",2016/8/15,2016
CJFDTEMP,网络舆情信息提取技术研究与实现,刘华春;王星捷;,成都理工大学工程技术学院;,计算机技术与发展,舆情信息;;Web信息提取;;话题线索;;DOC树,"网络舆情信息提取是舆情分析系统中最为关键的部分,是实现舆情分析、舆情统计的数据基础。为此,设计和实现了一个基于话题线索的舆情信息提取方案。该方案将舆情页面以话题为线索进行逻辑划分;采用基于DOM树的广度优先搜索方法,设计了舆情信息提取算法;通过设置最低重复话题阈值θ,用户定制提取格式,信息去重去噪措施,实现了舆情信息的有效提取。通过对多个论坛舆情信息的提取实验,结果表明,所设计的方案有很好的提取性能,召回率、正确率、F指数都较高,能够很好地提取出论坛、评论等舆情信息。",2016/8/23 13:59,2016
CJFDTEMP,基于领域驱动的测试用例设计开发方法研究,胡继东;鞠炜刚;,中兴通讯南京研究所;,计算机技术与发展,测试用例;;领域驱动;;实例化需求;;领域建模;;面向对象;;重构,"随着软件产品的交付周期越来越短,敏捷研发模式的应用范围更加广泛。为解决敏捷团队中测试用例设计、开发不能满足产品持续快速交付的问题,采用领域驱动方法,从需求特性出发,采用实例化需求的方法设计测试用例,然后对被测领域进行建模,通过领域关键字结构模型分析用领域语言描述测试用例,对领域对象模型进行分析,采用面向对象设计、开发,通过不断演进和重构,迭代地完成测试用例的开发。一方面使得测试用例的组织、设计、开发更加有效,提高了测试用例的开发和维护效率,测试用例更加易于理解、清晰简洁,能够通过重构快速应对变化;另一方面可以采用ATTD的方法来驱动产品的开发。该方法在通信系统测试中得到了应用推广,取得了很好的...",2016/8/23 13:59,2016
CJFDTEMP,大数据对企业管理决策的影响分析,袁君;,广东白云学院;,科技经济导刊,大数据;;企业管理;;决策,"随着企业信息化经济的快速发展,大数据在企业管理决策中发挥了至关重要的作用。本文主要从大数据的内涵与特点入手,对大数据对企业管理决策的影响进行分析,提出了预判式的决策过程,以促进企业管理水平的进一步提高。",2016/9/5,2016
CJFDTEMP,基于图像特征提取的脱机手写数字识别方法,周胜明;张玉叶;王春歆;,海军航空工程学院青岛校区;北海舰队;,光学与光电技术,脱机手写数字识别;;主分量分析;;结构特征;;统计特征,"脱机手写数字识别其本质是数字的图像特征匹配问题,所以需要进行手写数字的特征提取,为了准确识别,往往使用较高的特征维数,这就导致识别效率较低。为了提高识别效率,同时为了保持较高的识别率,提出了一种基于图像特征提取的脱机手写数字识别方法。首先利用主分量分析法抽取数字字符图像的统计特征,来降低数字的特征维数,通过对主分量重建模型的误差分析进行数字识别;然后,结合手写数字的笔画结构不稳定的特点,设计并提取数字的宽高比结构特征,进一步比对识别;最后,利用自制训练样本及测试样本库进行仿真实验,数字识别率为96%,识别准确率较高。",2016/10/10,2016
CJFDTEMP,云计算中数据隐私保护的问题研究及建议,许海东;,中国石油天然气勘探开发公司;,电脑与电信,云计算;;敏感数据;;信息安全,"云计算的出现为人们工作和生活都带来了极大的便利,它借助互联网实现了计算资源的共享,但是同时也存在诸多问题。其中信息经常会涉及到敏感数据或者是用户的个人隐私,一旦泄露就会对企业或个人造成一定的不利影响,所以保护信息的安全显得尤为重要。本文对目前关于云数据隐私保护方面存在的问题进行了分析,并提出了有针对性的建议和相应的数据安全保护措施。",2016/8/10,2016
CJFDTEMP,大数据时代的索道信息化建设,邱灿义;,泰山索道运营中心;,山东工业技术,大数据时代;;索道;;信息建设,"以综合管理平台为中心,构建各应用模块为分支的信息化管理系统,同时建设无线WIFI网络作为补充,在保障设备安全运行,提升运营服务质量,落实标准化管理等方面发挥了重要作用,使泰山索道信息化建设在本行业处于领先地位,得到了中国索道协会、索检中心的认可和高度评价。本文详细介绍了综合管理系统各模块的功能,在安全运维方面发挥的作用,并在最后对信息化建设的发展目标作了进一步规划。",2016/9/15,2016
CJFDTEMP,数字电视节目推荐系统结构及推荐算法研究,殷复莲;柴剑平;高雅;,中国传媒大学信息工程学院;,高技术通讯,数字电视;;节目推荐系统;;节目类型分析;;收视行为分析,"针对数字电视信息过载问题进行了数字电视节目推荐系统的结构和推荐算法研究。构造了包含信息摄取单元、系统分析单元和推荐信息发送单元的数字电视节目推荐系统结构。提出了节目类型分析法,采用节目类型阈值和节目类型聚类两种形式,分别实现了根据经验值的人工分级和任意簇数的自动聚类,达到了有效寻找观众收视兴趣与所观看节目之间的联系的效果。提出了收视行为分析法,采用收视个体行为分析和收视群体行为分析两种形式,通过观众收视数据推测观众收视兴趣,实现了给观众个体或群体推荐感兴趣的电视节目的目的。",2014/7/15,2014
CJFDTEMP,基于多参数距离融合聚类原理建立中药标准指纹图谱的研究,崔建新;崔建凤;洪文学;高海波;,燕山大学电气工程学院;河北省测试计量技术及仪器重点实验室;秦皇岛职业技术学院旅游系;中国中医科学院针灸研究所;,高技术通讯,中药指纹图谱;;聚类分析;;信息融合;;可视化,"分析了中药标准指纹图谱的传统构建方法,针对传统方法建立的中药标准指纹图谱在中药质量鉴别及评价上的局限性,进行了标准指纹图谱建立方法研究,提出了基于多参数距离融合聚类原理建立中药标准指纹图谱的方法。该方法通过计算中药多维多息图谱数据的各维特征聚类规则并融合在一起获得中药标准指纹图谱,实现了多种图谱信息的融合。采用黄芩数据进行了实验,实验结果显示依据聚类原理构建的中药标准指纹图谱更利于中药的分类。该方法是一种可行的中药标准指纹图谱构建方法。",2014/1/15,2014
CJFDTEMP,企业客户管理系统设计研究,李晓旭;王元圆;,安阳学院航空工程学院;,无线互联科技,企业客户管理;;系统设计;;客户关怀,"随着信息技术的发展,计算机已经开始越来越多地代替人来从事繁复、琐碎的工作,信息管理系统的广泛应用就是有力的证明,企业客户管理系统就是典型的信息管理系统。文章旨在通过对客户管理系统的设计原则、客户管理的阐述、客户的维系及对开发过程系统全面的分析,对企业在市场中吸引更多的客户产生积极的效益。",2016/9/25,2016
CJFDTEMP,导读,,,大数据,数据处理技术;传统研究方法;研究和发展;信息传输;数据传输;数据管理系统;布局算法;数据分析方法;社交媒体;目标识别技术;,"海量、异构和混杂大数据的广泛存在与爆炸式增长给信息传输、存储、计算以及面向各种应用的数据处理技术提出了前所未有的挑战。如何突破传统研究方法的思维定式,研究和发展革命性的、可满足时代需求的大数据传输、存储、计算和处理的新方法和新技术是当前全球研究热点。2014年前后,国家自然",2016/9/20,2016
CJFDTEMP,Web搜索引擎的一种检索结构优化方法,钱立兵;季振洲;,哈尔滨工业大学计算机科学与技术学院;,高技术通讯,Web搜索引擎;;分布式搜索;;检索结构;;吞吐量;;分类索引,"为了提升Web引擎的检索服务性能和扩展性,提出了一种索引划分方法,依据该方法改进了检索结构,避免了冗余查询,并加速了内部并行化查询过程。按照文档主题和相似URL对索引文档分类,而索引节点内则按照词项划分,实现了索引节点查询间和查询内的并行。根据索引分类的结构,改进了系统内部查询逻辑,设计了Aggregator(简称Agg)进程队列,实现了异步处理高并发查询。实验结果表明,优化的Web引擎结构总体上能够降低查询开销,提高系统吞吐量,相对于传统Web搜索模型,其查询速度和吞吐量分别提高了20%和25%。",2014/6/15,2014
CJFDTEMP,黑白条空成就移动方圆——商品条码直接服务消费者,杜寒;,中国物品编码中心;,中国自动识别技术,商品条码;服务消费者;移动技术;编码规则;研究机构;食品营养标签;条码识别;预包装食品;应用服务;应用软件;,"国际物品编码协会(GS1)和各国(地区)编码组织等相关研究机构正在考虑如何进一步发挥商品条码的作用,把传统面向B2B领域的商品条码向消费者(C端)进行延伸,通过丰富直接惠及消费者的B2C商品条码应用,最终达成B2B2C完整的物品编码解决方案。随着近年移动技术的发展和配套应用的不断丰富,企业和消费者对利用手机为媒介,实现高效的商务工作和便利的生活产生十分迫切的需求。从上世纪70年代为商品进行统一标识以来,商品条码已经发展形成了一整套完善的编码标准和解决方案,",2014/8/18,2014
CJFDTEMP,商品信息标准化助推消费品行业升级——记2014年第十二届中国ECR大会,郑昱;殷秀凯;,,中国自动识别技术,消费品行业;ECR;信息标准化;联合签署;供应链;中国物品;百家;标准化管理;标准化机构;行业热点;,"在大数据时代,海量数据充斥商品流通的各个环节,如果数据不准确,数据交互格式不统一,商品信息各行其道,将增加数据处理的成本,降低数据的关联性和准确性,大数据的作用将大打折扣。商品信息标准化对于消费品行业的转型升级尤为重要。6月10~12日,在广州召开的第十二届中国ECR大会上,近百家零供企业联合签署了商品信息标准化倡议书。",2014/6/18,2014
CJFDTEMP,物联网技术在精细化城市管理中的应用——以北京市西城区城市运行物联网监测平台为例,杜明义;刘扬;靖常峰;,北京建筑大学测绘与城市空间信息学院;,北京建筑大学学报,物联网;;精细化城市管理;;监测平台;;西城区;;北京市,"随着城市化进程的加快,城市运行管理中表现出的问题越来越凸显.如何有效利用物联网等高新科技手段,以全新的管理理念和管理模式提升城市精细化管理水平,成为城市管理者面临的重大课题.以北京市西城区城市运行物联网监测平台为例,探讨了城市管理部门如何利用物联网技术针对区位特点以及自身业务,解决城市运行管理中的实际问题,以有效提升城市运行管理的效率和精细化管理水平.重点论述了北京西城区城市运行物联网监测平台总体架构、信息通讯传输、统一界面以及西城区物联网具体应用实例,说明了物联网技术在城市管理中的积极作用,希望对今后的城市运行管理工作起到借鉴意义.",2016/9/30,2016
CJFDTEMP,利用闪烁直观观察生物大分子三维结构片段,王攀;何光源;杨广笑;,华中科技大学生命科学与技术学院;华中科技大学教育部分子生物物理重点实验室;华中科技大学科技部基因工程国际合作基地;中南民族大学电子信息工程学院;,华中科技大学学报(自然科学版),生物大分子;;三维可视化;;分子片段;;闪烁;;Web;;Jmol,"为了克服Rasmol和Jmol等传统工具在局部片段观察方面的缺陷,开发了基于Web利用闪烁直观观察生物大分子三维结构片段的可视化系统.该系统基于Jmol,利用HTML,Javascript,PHP和MySQL等Web相关技术,拓展了闪烁片段设置与观察相关功能.拓展功能主要包括:几乎所有的操作通过用户熟悉、使用方便的网页控件而不是传统工具主要采用的文本命令或顶层(或弹出)菜单来完成;同时显示分子序列文本以及单体编号信息,以便对局部片段定位;通过外观状态在隐藏与显示之间来回循环地切换实现片断闪烁效果;与Word或Phoposhop类似,历史操作状态可以通过列表进行撤销或重做,当前状态可以保存到服务...",2016/10/23,2016
CJFDTEMP,大数据时代学校档案信息资源服务于高等教育的研究,李群;张莉;,吉林农业大学档案馆;,科技资讯,大数据;;学校档案;;信息资源;;高等教育,"大数据时代的到来,给各行各业带来了严峻的思考,档案信息作为支撑和引领未来事物发展的重要资源,已经着手构建大数据时代""网络数字资源""管理平台。该文首先对大数据时代国内外研究现状进行分析,进一步阐明了大数据时代学校档案信息资源服务于高等教育研究的目的、意义及研究的主要内容。旨在阐明高校档案信息如何形成以满足用户需求的服务体系和管理模式。",2016/9/29 11:01,2016
CJFDTEMP,基于RFID和ZigBee的景区游客管理系统研究与设计,曹纪磊;,河南省交通高级技工学校;,电子科学技术,RFID;;ZigBee;;景区管理,"近年来,随着人们生活水平的提高,很多时候旅游出现井喷现象,特别是国家法定的节假日,许多景区更是人满为患,其主要原因是游客在进行游览时盲目选择,热点景区扎堆现象比较严重,但是作为游客和景区管理者对这种情况不能做出正确的选择和调整。如果能够实时地将这些信息反馈给广大游客和景区管理人员,必将缓解景区压力。本文针对景区游客的管理采用物联网技术,即采用RFID和ZigBee技术实现景区游客的智能管理。通过用相关的技术和设备实现对游客信息的采集和处理,实时地将所整合的信息反馈共享,使景区的实时状况得到全面的监控。",2016/9/10,2016
CJFDTEMP,智慧城市,胡鑫;,中国石油长庆油田分公司;,电信技术,公共服务建设;应用系统建设;智能化水平;综合管理系统;智能监控系统;信息收集系统;公共服务系统;信息化平台;新型政府;事前预警;,"1智慧城市系统智慧城市是个抽象性的概念,包含了社会的各个领域。总体来说,智慧城市主要由以下几个部分构成。(1)智慧公共服务建设智慧公共服务和城市管理系统,通过加强就业、医疗、文化、安居等专业性应用系统建设,通过提升城市建设和管理的规范化、精准化和智能化水平,有效促进城市公共资源在全市范围共享。积极推动城市人流、物流、信息流、资金流的协调高效运行,在提升城市运行效率和公共服务水",2016/9/25,2016
