SrcDatabase-来源库,Title-题名,Author-作者,Organ-单位,Source-文献来源,Keyword-关键词,Summary-摘要,PubTime-发表时间,Year-年
CJFD2016,分段聚合近似和数值导数的动态时间弯曲方法,李海林;梁叶;,华侨大学信息管理系;,智能系统学报,动态时间弯曲;;时间序列;;分段聚合近似;;数值导数;;相似性度量;;分类;;数据降维;;特征表示,"针对动态弯曲方法对时间序列数据相似性度量的质量和效率的局限性,本文提出一种基于分段聚合近似和数值导数的动态时间弯曲方法。该方法通过分段聚合近似将时间序列数据进行有效地降维,再结合数值导数对降维后的特征序列构建新特征序列,并且设计符合该特征序列相似性度量方法。实验结果分析表明,与传统动态弯曲方法相比,新方法具有较好的度量质量,能在时间序列数据挖掘中得到较好的分类效果,且在低维空间具有较高的分类效率,具有一定的优越性。",2016/3/15 12:39,2016
CJFD2016,基于模糊决策树的作业人员操作效率评估方法研究,宋云雪;靳菲;,中国民航大学航空工程学院;,机械研究与应用,模糊决策树;;数据挖掘;;人员效率,"社会的发展要求企业更合理、高效的利用人力资源,数据挖掘技术可以从大量的历史数据中发现内在的规律和联系,为企业的人员安排提供决策依据。将决策树和模糊集合相结合,引入聚类中心和模糊隶属函数的概念用于人员效率数据挖掘中,并采用Min-Ambiguity算法提取出评估人员效率的基本规则,解决了数据模糊性和不确定性的问题,生成的知识表示方式自然、易于理解、并且具有更强的分类能力及稳健性。",2016/4/26,2016
CJFD2016,医疗大数据环境下的健康信息分析方法,任慧朋;,解放军第98医院;南京政治学院上海校区军事信息管理系;,中国医疗设备,医疗大数据;;健康信息;;分析方法,"本文主要分析了医疗大数据的特点,介绍了当前国内健康信息的需求现状,以医学检验数据(LIS)为研究实例,列举了数据加工、数据挖掘、智能分析等关键性技术,介绍了动态情报分析和病情预测报警等实现原理,展示了利用医疗大数据为患者健康提供信息服务的应用案例。",2016/5/25,2016
CJFD2016,基于选择标准的Apriori算法改进,马良斋;姜滨;摆慧娟;,兰州交通大学电子与信息工程学院;甘肃银行;,河西学院学报,数据挖掘;;关联规则;;数据库压缩;;Apriori算法;;ARM,"关联规则挖掘通过发现密切相关项集的方法已经在商业决策中被广泛使用.现针对关联规则挖掘的经典算法Apriori需要重复多次扫描整个数据库导致在空间和时间方面有很大负载的问题,提出了根据研究者所感兴趣的项集作为关联规则的结果,采用对数据库进行类标签压缩来减少迭代次数.通过实验显示该方法可以有效提高Apriori算法的效率.",2016/4/25,2016
CJFD2016,机器学习法在计量系统告警信息中的研究与应用,韦瑞录;覃能杰;,广西机电职业技术学院电气工程系;广西博联信息通信技术有限责任公司;,价值工程,机器学习;;计量系统;;告警信息;;数据挖掘,"随着计算机技术、网络技术和数据库技术的快速进步和发展,电力运行网络已经引入了先进的自动化管理技术,开发了许多的分布式管理系统,电力系统运行积累了海量的数据。尤其是计量告警系统规模巨大,告警信息种类繁多,人工识别已经无法满足现代电网实时监控需求,需要采用机器学习、数据挖掘技术,从海量告警信息中挖掘潜在的模式,对告警信息进行自动化分类管理,以提高报警信息分析的准确度,提高电网监控管理成效,为电网计量系统正常运行提供支撑。",2016/4/18,2016
CJFD2016,基于信息分析的养老社区智能管理系统研究,张航;亓孝博;韦伟;曹天人;刘瑜;,安徽大学;,无线互联科技,ZigBee技术;;Kinect视频监控;;分布式数据挖掘,"基于信息分析的养老社区智能管理系统主要由养老社区室内Kinect视频监控、Zig Bee传感器节点和养老社区终端云服务器构成,文章通过分布式数据挖掘技术对室内环境和老年人起居生活信息进行处理和分析,并及时进行反馈,保证老年人的身体健康。本系统可行性强,在未来具有良好的发展前景。",2016/4/25,2016
CJFD2016,大数据技术及在电信运营商IT支撑系统的应用研究,廖锋;成静静;,中国移动通信集团广东有限公司;广东省电信规划设计院有限公司;,数据通信,大数据;;移动通信;;数据挖掘;;数据分析;;大数据价值链,"互联网的快速发展,计算机处理能力的日益强大,云计算和数据中心的兴起,促使大数据时代快速到来。传统的移动通信业务正面临着被管道化的威胁,如何充分利用大数据技术,挖掘其中蕴藏的巨大价值,是移动通信行业在大数据时代增强自身竞争力、应对传统业务不断被蚕食所必须面对的问题。本文在梳理大数据的主要技术基础上,分析其在电信运营商IT支撑系统中的应用和价值,为进一步的应用打下基础。",2016/4/28,2016
CJFD2016,增量式的多源序列模式挖掘隐私保护算法,张莹;钟诚;李秋霞;,广西大学计算机与电子信息学院;,合肥工业大学学报(自然科学版),多数据库挖掘;;隐私保护;;增量式算法;;敏感模式,"为解决多数据源挖掘隐私保护问题,文章采取按相似度分类多源数据库及其增量数据库,利用原始数据库挖掘结果和增量数据库分析结果进行敏感序列模式匹配,以有效减少数据库扫描次数的方法,设计实现隐私保护的增量式的高投票率序列模式挖掘算法。实验结果表明,给出的算法既能够准确挖掘出多数据源中全局高投票率模式,又能有效地隐藏保护敏感模式,且显著缩短了挖掘时间。",2016/4/28,2016
CJFD2016,大数据理论实践在公共关系事件研究中的运用——以“二胎”政策全面开放为例,尹红;,海南大学政治与公共管理学院;,价值工程,大数据;;公共关系;;二胎政策,"文章以大数据实践为理论支撑,通过对国家实施全面开放""二胎""政策的大数据挖掘、数据理论分析、数据的预测和管理,为公共关系决策者提供可靠参考,也进一步丰富公共关系理论的研究。",2016/6/28,2016
CJFD2016,关联规则的基本研究,牛猛;,皖南医学院教务处;,河北工程大学学报(社会科学版),关联规则;;定义;;性质;;步骤;;分类;;方法,关联规则是数据挖掘的一个重要的研究领域。简要介绍了关联规则的产生与概述;详细介绍了关联规则的相关定义、性质、步骤与分类情况;阐述了关联规则的多种挖掘方法。,2016/6/25,2016
CJFD2016,一种改进拓扑势的意见领袖挖掘算法,毛天铭;关鹏;皮德常;,南京航空航天大学计算机科学与技术学院;北京航天飞行控制中心;,计算机科学,社会网络;;意见领袖;;权重修正;;拓扑势,"意见领袖发现在舆情监测、市场推广、信息传播等领域具有重要的理论指导意义和实际应用价值。针对传统意见领袖挖掘算法片面考虑目标单一属性、缺乏话题相关性、评估缺乏客观性等问题,提出了一种基于改进拓扑势的意见领袖挖掘ITP算法。该算法结合具体节点的客观属性和网络结构,采用数据偏差对主观权重进行修正,可客观地对目标节点进行评估,挖掘意见领袖。对真实微博数据集进行实验,结果表明与传统的3种方法相比,所提出的算法能挖掘不同背景下的意见领袖,具有较高的相关性和准确度。",2016/6/15,2016
CJFD2016,基于MapReduce的DHP算法并行化研究,周国军;吴庆军;,玉林师范学院数学与信息科学学院;,计算机应用与软件,MapReduce;;Hadoop;;DHP算法;;关联规则,"针对DHP(direct hashing and pruning)算法对大数据挖掘关联规则存在执行时间过长、效率不高的问题,对DHP算法的并行化策略进行了研究。根据云计算平台Hadoop的MapReduce并行编程模型,设计了一种并行DHP算法,给出了算法的总体流程和Map函数、Reduce函数的算法描述。与DHP算法相比,并行算法利用了Hadoop集群强大的计算能力,提高了从大数据集中挖掘关联规则的效率。通过实例分析了并行DHP算法的执行过程,在多个数据集上进行了实验。实验结果表明:并行DHP算法对大数据具有较好的加速比和可扩展性。",2016/6/15,2016
CJFD2016,云环境下基于MapReduce的用户聚类研究与实现,樊同科;,西安外事学院现代教育技术中心;,电子设计工程,Hadoop;;MapReduce;;聚类算法;;Mahout,"基于大数据背景下海量数据人们无法理解,聚类效率低下等问题,采用MapReduce编程模型将Canopy聚类算法和K-means聚类算法在云环境中相结合,使之能够充分利用Hadoop集群的计算和存储能力。以淘宝网上海量的购买用户聚类作为应用背景,通过使用Hadoop平台的数据挖掘组件Mahout对用户聚类进行了实例研究,并给出了使用Mahout进行挖掘的一般步骤。结果表明,基于MapReduce的聚类算法在大规模数据集上具有较好的聚类质量和运行速度。",2016/5/25,2016
CJFD2016,基于知识库的客户网购意向预测系统,马月坤;刘鹏飞;,华北理工大学信息工程学院计算机系;,计算机工程与应用,知识库;;网购意向预测;;Map Reduce;;知识更新;;图检索,"电子商务网站所产生的海量客户网购行为数据中蕴含着丰富的反映客户网购行为规律的知识。这些知识是进行客户网购意向预测以及在此基础上进一步进行商品推荐的重要依据。基于Hadoop框架构建了""客户购买意向预测系统"",实现了利用隐含在交易数据中的知识对正在浏览中的电商客户的购买意向预测。在基于知识图谱技术构建网购客户购买行为知识库的基础上,利用FP-Growth算法和数据统计方法实现了以增量方式从购买者的交易数据中获取反映用户购买规律的知识,并将取得的知识融合到知识库中。系统能够利用存储于知识库中的知识在客户进行网上购物的过程中对其购买意向进行分析和预测,从而达到提高电子商务平台的运营效率,改善客户购物...",2016/3/25 21:04,2016
CJFD2016,基于关联规则混合算法并行化的隐私保护方法研究,王卓伟;,湖北大学计算机与信息工程学院;,物联网技术,隐私保护;;关联规则;;并行化;;数据挖掘,"随着大数据时代的发展,移动通信技术与定位技术、互联网技术等在工作生活中的应用越来越多,享受科技带来便利的同时,隐私安全问题也不容忽视。文中提出了将关联规则中基于划分的技术、随机扰动与重构技术结合起来,从而实现隐私保护的目的。该方法可以确保在原始数据安全的情况下进行其他数据的挖掘操作,而该算法并行化后,其算法执行的时间复杂度也会大大降低。",2016/7/20,2016
CJFD2016,大数据技术在信息管理中的应用研究——以高校就业工作为例,尚光龙;张泽锋;,信阳职业技术学院数学与计算机科学学院;,河北北方学院学报(自然科学版),大数据;;就业;;信息管理,"目的探究大数据技术在信息管理工作中的作用和价值。方法从大数据的概念入手,介绍大数据的相关定义,综合学术界的主流观点,介绍大数据的4个主要特征,指出大数据技术在信息时代的必然发展背景;以高校就业工作为例,结合微信平台等新媒体技术在就业管理工作中的应用,阐述了就业管理工作中大数据的特点和面临的管理难题。结果强调在信息时代,特别是随着智能终端的普及,网络数据流量大规模增大,信息管理工作难度加大,亟待采用大数据技术来进行有效管理。重点论述了在高校就业信息管理工作中所采用的大数据技术,包括数据挖掘技术、遗传算法、神经网络以及其他工具等。指出了大数据面临的挑战,包括计算机存储架构的优化、传统算法和工具面临...",2016/5/28,2016
CJFD2016,基于关联规则挖掘的高校学生选课分析,李芳芳;唐九阳;廖胜辉;刘熙尧;赵荣昌;,中南大学信息科学与工程学院;国防科学技术大学信息系统工程重点实验室;,黑龙江科技信息,数据挖掘;;关联规则;;高校选课,"将关联规则挖掘方法应用于高校选课数据,分析选课数据之间隐藏的关联关系,提取有价值、有规律的信息。",2016/8/5,2016
CJFD2016,基于大数据的食品药品检测数据管理系统构建设想,卢日刚;陈薇;苏浩;,广西壮族自治区食品药品检验所;广西科技信息网络中心;,中国药事,食品药品检测数据;;数据分析;;数据挖掘;;大数据,"目的:探讨大数据时代食品药品检验/检测机构数据资源获取和分析利用的构建设想。方法:阐述了大数据技术的概念和特点,结合我国食品药品检验机构数据资源的获取、分析、利用现状,提出了大数据时代食品药品检测机构面临的难点和挑战。结果与结论:食品药品监管部门需以创新理念指导顶层设计,以总体架构方法加强整合;加快信息化标准规范建设,促进监管检测信息共享;以数据分析应用为重心,为决策层提供数据支撑,形成善用""大数据""成就药品智慧监管的新局面。",2016/7/20,2016
CJFD2016,校园超市数据关联规则与统计分析,黄晓艳;蔡丽清;张钰莎;,广东外语外贸大学南国商学院;,现代计算机(专业版),数据挖掘;;关联规则;;统计分析,"随着社会的发展,校园超市已经成为学生日常生活必不可少的一部分。然而对校园超市进行数据挖据,既可以为商家提供有效地销售手段使利润增加,又可以满足学生的购物需求,达到双赢的局面。",2016/7/25,2016
CJFD2016,SQL Server数据库入侵检测系统的研究,郭可;,秦皇岛职业技术学院;,电脑知识与技术,入侵检测技术;;数据库安全;;SQL server;;数据挖掘,"随着网络技术的迅速发展,互联网在人们的生活中已经普及,网络攻击也成为网络发展中需要解决的一个重要的课题。传统的防火墙技术已经不能满足互联网安全的需要,数据库的入侵检测技术在提高网络的安全性方面可以提供有效的保障。该文对入侵检测系统和数据库入侵检测技术进行了简单的分析,提出了SQL server数据库入侵检测系统设计方法。",2016/8/19 9:59,2016
CJFD2016,一种顾及模糊属性的空间关联规则挖掘方法,许栋浩;李宏伟;张铁映;樊超;朱燕;,信息工程大学;,测绘科学技术学报,模糊集;;隶属函数;;频繁项;;离散化;;空间关联规则,"针对传统空间关联规则挖掘对数据硬化分导致的""尖锐边界""问题,提出了一种顾及模糊属性的空间关联规则挖掘方法。该方法引入模糊集理论,将模糊空间属性通过隶属函数转化为隶属度表示的模糊数值,从而将其划分为模糊集合。然后使用改进的模糊关联规则挖掘算法扫描数据库,根据相应的支持度得到频繁项集,最终提取出关联规则。实验结果表明,该方法能够对带有模糊属性的空间数据进行关联规则挖掘,且在一定程度上提高了挖掘结果的兴趣度。",2016/9/29 10:51,2016
,,,,,,,,
