SrcDatabase-来源库,Title-题名,Author-作者,Organ-单位,Source-文献来源,Keyword-关键词,Summary-摘要,PubTime-发表时间,Year-年
CJFD2015,比较视域下大数据技术的社会功能探析,苏玉娟;,中共山西省委党校;,安徽行政学院学报,大数据技术;;小数据技术;;知识生产;;预测能力;;管理能力,"小数据技术与大数据技术的社会功能从存储、挖掘、可视化、管理等几个方面来看均有所不同。为了更好地发挥好大数据技术的功能,我们要充分认识到大数据技术是对传统数据技术的补充和发展,同时要提高社会对大数据技术功能的认知度,辩证地看待大数据技术的功能,加大对大数据技术人才的培养。",2015/10/25,2015
CJFD2015,C4.5决策树算法在素质教育学分成绩分析与评价中的应用,李宣冬;,重庆商务职业学院;,中小企业管理与科技(下旬刊),素质教育;;学分制系统;;决策树算法;;数据挖掘,"为了探究素质教育的管理模式并将其运用到高职院校的素质教育工作中,本文引入了数据挖掘技术,将素质教育学分化和数据化,从而实现对素质教育学分的分析与评价,为学生的素质教育提供更宽阔的发展空间和制度保障,使素质教育成为高职院校教育教学工作的有机组成部分。",2015/11/25,2015
CJFD2015,大数据分析常用软件工具综述,李笑岩;,辽阳职业技术学院信息工程系;,数字技术与应用,大数据;;数据挖掘;;软件工具,"数据,已经渗透到当今每一个行业和业务职能领域,成为重要的生产因素。人们对于海量数据的挖掘和运用,预示着新一波生产率增长和消费者盈余浪潮的到来。在大数据时代已经到来的时候,要用大数据思维和工具去发掘大数据的潜在价值。面对高数据量、高维度与异构化的特点,以及分析方法思路的转变,传统统计工具已经难以应对。众多新的软件分析工具作为深入大数据洞察研究的重要助力,已成为数据科学家必须掌握的知识技能。",2015/11/15,2015
CJFD2015,面向国防安全的网络大数据分析与应用系统,许洪波;陈波;,中国科学院计算技术研究所;,大数据,大数据;;国防安全;;大数据分析;;多源异构数据融合,"在调研国内外大数据分析与应用研究现状的基础上,针对国防安全领域现有业务体系中存在的数据碎片化、不规范、难共享等突出问题,提出面向国防安全的网络大数据分析与应用方案,将国防安全现实需求与大数据技术有机结合,既能够发挥大数据技术在多源异构数据融合、深层次安全信息挖掘、打破信息孤岛实现广泛共享等方面的优势,又能够适应现有的业务体系,快速产生实际效果。最后,对面向国防安全的网络大数据挖掘和分析相关技术进行了系统性介绍。",2015/11/20,2015
CJFD2015,移动终端位置信息聚类技术在公共安全领域的应用,李伟;陈忠红;,安徽省公安厅信息中心;,电脑知识与技术,移动终端;;位置信息;;聚类技术;;公共安全,"移动通信、互联网及空间定位技术的成熟极大地促进了LBS(Location Based Services)的发展,也产生了越来越多的位置大数据。合理地使用时空数据挖掘技术可有效进行知识发现及价值提取,在追踪目标用户,维护公共安全等方面具有重要意义。本文以移动终端位置信息为研究对象,从推断目标用户敏感信息的角度出发,研究了基于时空数据挖掘的空间位置聚类方法,并总结了当前各类技术的不足,并指出了今后发展方向。",2015/12/24 13:52,2015
CJFD2015,基于FP-Tree的多层关联规则挖掘算法的设计和实现,袁冬菊;,西南科技大学信息工程学院;,科技展望,关联规则;;频繁项集;;算法设计;;数据挖掘,"关联规则是当前数据挖掘研究的一个重要领域,获取具有更高价值的规则是该领域的一个研究重点。关联规则挖掘分为两个阶段:发现频繁项集和由频繁项集生成关联规则。本文介绍基于FP-tree的多层关联规则挖掘设计算法,并用Eclipse实现,程序运行能满足要求。",2015/11/10,2015
CJFD2015,地理学碰上“大数据”:热反应与冷思考,吴志峰;柴彦威;党安荣;龚建华;高松;乐阳;李栋;柳林;刘行健;刘瑜;龙瀛;陆锋;秦承志;王慧;王鹏;王伟;甄峰;,广州大学地理科学学院;北京大学城市与环境学院;清华大学建筑学院;中国科学院遥感与数字地球研究所;美国加州大学圣塔芭芭拉分校;深圳大学土木工程学院;中国城市规划设计研究院;中山大学地理科学与规划学院;香港大学城市规划与设计系;北京大学地球与空间科学学院;北京市城市规划设计研究院;中国科学院地理科学与资源研究所;厦门大学建筑与土木工程学院;北京清华同衡规划设计研究院有限公司;中央财经大学政府管理学院;南京大学建筑与城市规划学院;,地理研究,地理学;;大数据;;机遇与挑战;;笔谈;;反思,"互联网时代的""大数据""热潮迅猛波及到经济社会的各个领域,地理学是大数据研究与应用的天然试验场。聚焦地理学与大数据的碰撞,回顾大数据在地理学研究中的应用探索,重点讨论大数据给地理学研究与发展带来的机遇与挑战。讨论认为:大数据已经对地理学研究产生了一定的影响。其中,人文地理学领域的反应最为热烈,基于大数据的研究案例纷纷呈现;地理信息科学在互联网大数据时代将会更加迅猛发展,自然地理学领域正在寻找和等待爆发点。目前,大数据还不能改变地理学的核心命题与基本范式,在坚持地理学核心思想的同时,应该对地理学领域有关大数据理论的探讨与应用尝试持有一种开放包容的态度。",2015/12/21 17:01,2015
CJFD2015,基于大数据的天气状况研究,危蓉;徐伟;,湖北警官学院信息技术系;,信息通信,PM2.5;;细颗粒物污染;;数据挖掘;;WEKA,"细微颗粒2.5是指大气中直径小于或等于2.5um的颗粒物的每立方米含量。而这些细颗粒物也称为可入肺颗粒物。它们粒径小,富含大量的有毒、有害物质,且在大气中的停留时间长、输送距离远,被称为大气污染的元凶,并且对人体健康有很大危害。文章通过使用数据挖掘方法对某区域某段时间的天气情况和细颗粒物污染状况进行了分析,研究了细颗粒物污染程度与天气状况的关系,得出PM2.5与能见度、风速、露点和湿度负相关。",2015/12/15,2015
CJFD2015,K-means算法的分析及改进,陈敏;余晓平;左文英;,石河子大学信息科学与技术学院;上海石化工业学校;,佳木斯大学学报(自然科学版),K-means算法;;聚类;;数据挖掘,"研讨了数据挖掘中K-means聚类算法,在继承经典K-means算法的优点和基于最大最小距离的方法基础上实现了算法的改进,改进后的算法可根据欧氏距离度量的方法自动确定聚类中心个数K值,并能够识别数据对象中存在的孤立点和噪声,经过实验证明改进后的算法在执行效率、稳定性和K值确定方面都优于K-means算法.",2015/11/15,2015
CJFD2016,基于大数据的小麦蚜虫发生程度决策树预测分类模型,张晴晴;刘勇;牟少敏;温孚江;,山东农业大学农业大数据研究中心;,大数据,小麦蚜虫;;农业大数据;;决策树;;分类模型,"小麦蚜虫是危害小麦的主要害虫。其发生程度预测特别是短期预测一直是植物保护领域难以解决的科学问题。传统预测方法通常仅采用温湿度,预测结果与实际发生匹配度不高。基于大数据的理念和数据挖掘技术,通过对2003-2013年小麦蚜虫发生程度与瓢虫、寄生蜂、日最高气压、日照时数等18种变量关系的决策树分析,构建了分类模型。经分析发现,日照时数与小麦蚜虫的发生程度关联度最高,其次是天敌瓢虫。该模型置信度为91.49%,且运行稳健。",2016/1/20,2016
CJFD2015,大数据时代的灾难信息管理,黄越;李涛;,南京邮电大学计算机学院;,南京邮电大学学报(自然科学版),大数据;;灾难信息管理;;数据挖掘;;信息挖掘,"灾难信息管理旨在利用信息技术有效地应对和避免自然灾害等紧急事件给社会和民众带来的财产损失和生命威胁。在大数据环境下(数据量大,形式复杂,实时性强),灾难信息系统的发展在国际社会尤其是欧美发达国家得到了极大的重视和推动,但国内目前在相关领域的研究相对较少。首先从数据角度分析灾难信息管理中海量复杂数据的特殊性以及这些数据在处理过程中的难点;接着从灾难管理中信息交流的需求和大数据的作用入手,系统总结了灾难信息管理的关键要素。针对数据及信息交流存在的问题,提出基于大数据技术的灾难信息管理系统,并通过具体的实例进行了详细的分析。最后,讨论了大数据时代的灾难信息管理的潜在研究方向和思路。",2015/12/30 10:07,2015
CJFD2015,探究基于云计算的Web结构挖掘算法,薛娟;,扬州工业职业技术学院电气学院;,电脑知识与技术,云计算;;Web;;结构挖掘算法,"云计算是基于互联网的一种超级计算模式,能够为将Web中的所有数据信息集中在一起,为其提供各种服务。数据挖掘是获取Web网页中的有用的信息,随着互联网的快速发展,Web网页中的数据信息量显著增加,传统挖掘算法已经无法满足用户的实际需求,基于云计算的Web结构挖掘算法,能够打破传统挖掘算法的桎梏,对于Web网页信息和知识的发现提供了很大的便利。文章分析了云计算的特点以及服务模式,探析了一种基于云计算的Web结构挖掘算法,即基于Map Reduce的Page Rank算法,以供参考。",2015/12/22 14:53,2015
CJFD2016,智慧城市中信息安全架构研究与设计,郑江波;张建华;,内蒙古呼伦贝尔市公安局;北京互信达科技有限公司;,信息网络安全,智慧城市;;信息安全;;顶层设计;;智能信息安全引擎;;智慧应用,"文章以智慧城市建设中的信息安全系统架构为核心,深入研究顶层设计阶段信息安全系统架构的核心内容,提出智慧城市信息安全和多个智慧应用""和而不同""的设计原则。文章基于智能信息安全引擎和智慧应用适配器,通过信息安全总线,分层构建了独立于智慧应用的基于PKI/CA的智能信息安全架构,支持对不同智慧应用即插即用的自动匹配,综合设计了智慧城市信息安全策略、安全风险评估、安全审计机制、信息安全监测体系。文章最后从信息安全技术、信息融合技术、大数据挖掘技术和安全评估技术上分别探讨了基础设施平台、安全支撑平台和服务平台的实现。智慧城市建设投入多、周期长、影响大,加强对智慧城市信息安全架构的研究和设计实现的探索,对...",2016/1/10,2016
CJFD2015,Medas:一个基于Medline的生物医学文献分析系统,佘玉轩;熊赟;,复旦大学计算机科学技术学院;上海市数据科学重点实验室(复旦大学);,计算机研究与发展,Medline;;文本挖掘;;数据挖掘;;爆发期分析;;主题模型,"Medline是当前国际上最权威的生物医学文献数据库.人们不仅可以从这些文献得到大量的诊疗信息,而且可以从不同年代发表的文献主题之间的差异挖掘出生物医疗研究不同时间的关注点.基于此,开发了基于Medline的生物医学文献分析系统(biomedical literature analysis system based on Medline,Medas),系统设计实现了一系列的文献挖掘算法,提供了生物医疗领域的演变分析、疾病诊疗方案查询、生物医疗领域研究主题变迁分析等功能.这些功能可以为医护人员提供诊疗护理建议,可以帮助医疗研究人员了解生物医疗领域的研究趋势以及不同疾病、诊疗方案在不同时期的关注度...",2015/10/15,2015
CJFD2015,基于Web数据库的数据库挖掘技术研究,安波;,山西林业职业技术学院;,电子技术与软件工程,Web数据库;;数据挖掘技术;;网络时代,"随着科技的发展,以及网络技术的不断更新换代,人们生活中对信息的需求量越来越大,对信息获取手段的要求也越来越高。为了更好地满足人们对大数据的需求,数据库挖掘技术有了飞速发展,而其中基于Web技术的数据库因其信息资源丰富,得到了数据库研究人员的青睐。基于此,本文主要对基于Web数据库的数据库挖掘技术进行了分析,并对这一技术的原理、应用方面进行了阐述,以期能够不断促进数据库挖掘技术的发展。",2016/1/13 9:27,2015
CJFD2015,基于商业智能的智慧法院系统设计与实现,李栋;付娟娟;,青岛东软载波科技股份有限公司软件部;青岛市妇女儿童医院医保办;,电子世界,智慧法院;;商业智能;;数据挖掘;;决策支持,"目的:建立""智慧法院""产品解决方案;方法:利用商业智能工具,对现有法院案件信息进行挖掘、分析、处理,将数据转换为辅助决策的知识;结果:""智慧法院""产品实现了由数据到信息并最终转换为知识的系统升级;结论:""智慧法院""产品给用户带来完全不同的信息推送,为管理者提供决策支持。",2015/8/8,2015
CJFD2016,基于FP-Tree模型的频繁轨迹模式挖掘方法,牛新征;牛嘉郡;苏大壮;佘堃;,电子科技大学计算机科学与工程学院;电子科技大学信息与软件学院;,电子科技大学学报,FP-tree;;频繁轨迹模式;;模式挖掘;;时空属性,"通过对经典频繁模式数据结构FP-tree的扩展与改进,提出了一种适用于处理轨迹数据的灵活高效的FP-tree轨迹挖掘方法(NFTM)。首先运用二维筛选和GPS格式过滤的方法对轨迹进行预处理,然后将有效数据经一次扫描后,生成按照真实轨迹顺序排列且具备时空属性的改进型FP-tree,使用动态数组存储模式挖掘过程中得到的候选集,根据用户的输入针对性输出相应时间和频率范围的频繁轨迹。最后通过与GSP算法、Prefixspan算法的对比测试表明,该算法具有更短执行时间和更优性能。",2016/1/30,2016
CJFD2016,基于融合上下文的移动用户行为过程挖掘与预测,王佳秋;于浩;王忠杰;,哈尔滨工业大学计算机科学与技术学院;,计算机集成制造系统,上下文;;上下文融合过程模型;;行为过程挖掘;;行为过程预测,"针对移动环境中单个用户个性化行为过程的挖掘和预测问题,考虑不同类型上下文对行为过程的影响,研究将行为过程中不同类型的上下文融合成统一的整体(情景),提出上下文融合过程模型。进而将上下文融合过程模型融入移动用户的行为过程中,提出一种基于融合上下文的行为过程模型。在此基础上提出一种挖掘算法ASCF-Mine,利用行为过程中存在的情景周期和时间属性来挖掘频繁的行为过程。结合频繁的行为过程,提出一种基于协同过滤的预测方法来自主构建满足用户个性化需求的行为过程。通过具体的实验分析,验证了所提方法的有效性。",2016/2/15,2016
CJFD2016,MNWAP-mine:一种改进的频繁模式挖掘算法,蒋倩倩;王逊;黄树成;,江苏科技大学计算机科学与工程学院;,江苏科技大学学报(自然科学版),Web频繁序列模式挖掘;;WAP-mine算法;;MNWAP-mine算法;;WAP-tree,"Web访问序列模式挖掘可以发现用户与网站交互的频繁模式,进而预测未来的访问模式.针对传统WAP-mine算法的不足,文中提出一种新的MNWAP-mine算法.首先,对WAP-tree的数据结构进行改进,采用一种基于Hash表的辅助存储结构辅助序列的查找,使该算法节省了序列的查找时间;其次,针对WAP-mine算法在构造WAP-tree时需两次数据库完整扫描的缺点,利用第1次扫描的结果,获得只包含频繁项集的序列,在第2遍扫描数据库时仅仅扫描包含频繁项集的序列,节省了扫描时间;最后,由于WAP-mine算法会产生大量子树,而新算法采用合并频繁子节点的方法,因此,提高了挖掘频繁模式的效率.实验结果表...",2016/3/22 9:42,2016
CJFD2016,监测人禽流感疫情及其发展趋势数据库的建立,李翠霞;郑利荣;贺莲;傅传喜;,广东省医学学术交流中心广东省医学情报研究所;广州市疾病预防控制中心;,热带医学杂志,人禽流感;;数据库;;数据挖掘,"构建可查询人禽流感疫情、分析人禽流感最新研究进展和趋势的数据库,以利于传染科医生、疾控防疫人员及相关决策者及时、准确的掌握人禽流感疫情相关信息及该领域的最新研究动态和趋势。利用成熟Microsoft Net2.0与AJAX技术,通过互联网和专业医学数据库收集禽流感相关的新闻和文献资料,将相关资料编辑成科学""规范的数据清单格式""后录入数据库。并进一步对相关文献进行数据挖掘,探讨该领域的研究热点和趋势。",2016/2/28,2016
CJFD2016,基于频繁序列挖掘的预取算法研究与实现,王芳;王培群;朱春节;,武汉光电国家实验室(华中科技大学);华中科技大学计算机科学与技术学院;,计算机研究与发展,频繁序列挖掘;;预取算法;;字典树;;多步匹配;;子树分割,"预取作为一种提升存储系统性能的有效手段被广泛使用,然而传统的预取算法大多基于顺序性访问特征的探测,这使得它们在非顺序数据访问环境下很难奏效,甚至可能因为预取准确率较低而对存储系统的性能带来负面影响.而基于频繁序列挖掘的预取算法则能够通过分析数据的访问行为找出潜在规律,从而能在非顺序访问模式下也取得一定的性能提升.同时,为了应对某些缓存受限的应用场景,如嵌入式系统,预取算法通过提高分析的准确率减少预取可能对缓存带来的不利影响.新提出的预取算法基于频繁序列挖掘技术,并使用字典树组织预取规则,通过多步匹配和子树分割技术精细地控制规则的使用,提升预取的准确率,从而使得预取算法能够有效提升存储系统的性能...",2016/2/15,2016
CJFD2016,基于支持度和增比率的改进关联分类算法,王卫平;周忠眉;郑艺峰;,闽南师范大学计算机学院;,计算机工程与科学,数据挖掘;;关联分类;;频繁项集;;规则强度;;分类准确率,"关联分类是一项重要的分类技术,目前普遍采用基于支持度和置信度的关联分类模式。但是,用支持度度量项集的分类能力过于简单,且置信度不能度量项集与类的相关性,所以利用支持度和置信度容易产生质量不好的规则。提出改进的关联分类算法—ACSER。ACSER不仅考虑项集到本类的支持度,也考虑项集到补类的支持度。首先,提取频繁增比模式作为分类候选规则集;其次,利用置信度和增比率度量规则的强度,按照其强度进行排序和剪枝;最后,选择k条最优的规则进行预测。在16个UCI数据集上的实验结果表明,改进的分类算法ACSER与传统的分类算法相比有更高的分类准确率。",2016/2/15,2016
CJFD2016,浅谈大数据时代的隐私保护策略,何乾声;黄翀;邓伏虎;,广西壮族自治区工业和信息化委员会电子信息与软件处;电子科技大学信息与软件工程学院;,中国科技信息,隐私保护;非结构化;国家安全;蓝色海洋;信息产业;隐私信息;处理中心;信息安全;身份认证技术;网络攻击;,"随着非结构化数据采集技术的发展,大数据的产生速度正在以超乎人们的想象。随着所蕴涵价值不断被发现,大数据成为IT信息产业中最具潜力的蓝色海洋,全球已经进入大数据时代。就如同数据挖掘和隐私保护这两个孪生兄弟一样,大数据给我们的生活带来了很多便利的同时却也同样带来了很多烦恼。在全球都大力发展数据中心、处理中心等大数据产业之时,对隐私信息的保护具有更加重要的意义。本文通过分析大数据在个人隐私、企业隐私、国家安全等三个方面带来的问题,从技术、法律法规、行业以及国家安全等方面提出大数据时代的隐私保护策略。",2016/4/1,2016
CJFD2016,面向科技型小微企业技术路线图规划的技术挖掘工程研究,李牧南;黄芬;,华南理工大学工商管理学院;,科研管理,科技型小微企业;;技术挖掘;;企业技术路线图;;技术挖掘工程,"针对科技型小微企业在技术路线图规划与制定方面存在的能力和资源局限,本文基于技术挖掘(Tech Mining,TM)的基础理论和方法,结合工程管理的思想,构建了一个面向小微科技企业技术路线图规划的技术挖掘工程模型。通过引入工程化的概念,以及技术挖掘活动的流程标准化管理思想,尝试构建一个可以容纳和集聚多学科、多专业技术和管理人员分工协作的平台。技术挖掘工程模型的提出,对于科技型中小企业,尤其是一些缺乏专业化技术路线图规划能力的小微企业,在提升企业的技术管理能力,科学评价企业技术和研发绩效,以及企业技术路线图的制定等领域,或许具有一定的积极作用和实践意义。",2016/4/20,2016
CJFD2016,物联网环境下;智能医养融合电子平台设计,杜陵江;韩宇;苏勇林;刘毅;,四川大学医学管理处;四川大学公共卫生学院;,生物技术世界,医养融合;;物联网;;MapReduce;;云计算,"为缓解""医养融合""发展模式中养老者电子健康档案、电子病历实时传输和不同服务主体间信息共享的难题,本文提出智能医养融合电子平台模型。系统利用使用物联网技术的智能医疗设备采集养老者的生理信息数据,使用Map Reduce挖掘数据,快速有效的完成养老者生理数据的分析和整理。",2016/4/15,2016
CJFD2016,基于Spark的PFP-Growth并行算法优化实现,方向;张功萱;,南京理工大学计算机科学与技术学院;,现代电子技术,并行化;;Spark;;关联挖掘;;PFP-Growth,"随着数据量的增大,FP-Growth算法压缩数据思想的优势就体现出来,基于MapReduce框架的PFP-Growth算法实现该算法在Hadoop平台上的并行化,但是MapReduce框架每次对作业进行操作都要将中间结果输出存储到磁盘,影响算法的效率。为了提高关联挖掘的效率,基于Spark平台,运用均衡分组的思想对该算法进行改进,同时在对具有很长前缀情况进行共享前缀的拆分,通过4个步骤使IPFP-Growth算法在Spark上实现。实验结果表明在Spark平台上优化过后的算法在性能上要优于PFP-Growth算法。",2016/4/15,2016
CJFD2016,基于特征学习的广告点击率预估技术研究,张志强;周永;谢晓芹;潘海为;,哈尔滨工程大学计算机科学与技术学院;,计算机学报,搜索广告;;点击率;;张量分解;;深度学习;;社交网络;;社会媒体;;计算广告学,"搜索广告中的点击率预估问题在信息检索和机器学习等领域一直是研究的热点.目前通过设计特征提取方案获得特征和针对用户点击行为建模等方法,并没有充分考虑广告数据具有的高维稀疏性、特征之间存在高度非线性关联的特点,致使信息利用不充分.为了降低数据稀疏性和充分挖掘广告数据中隐藏的规律,该文提出了面向广告数据的稀疏特征学习方法.该方法基于张量分解实现特征降维,并充分利用深度学习技术刻画数据中的非线性关联,以解决高维稀疏广告数据的特征学习问题,实验结果验证了文中提出的方法能够有效地提升广告点击率的预估精度,达到了预期效果.",2015/10/9 19:01,2016
CJFD2016,基于数字化校园的高校学生管理系统的研究与设计,邹凌君;许晨;陶亮;,金陵科技学院信息化建设与管理中心;,信息技术与信息化,数字化校园;;数据挖掘;;学生管理系统,"高校扩招使得学生人数不断增加,为了提高学生管理工作的质量和效率,在数字化校园建设的背景下,研究和设计了高校学生信息管理系统。系统可以提高学生工作管理的效率和质量,提升了数字化校园建设的内涵。",2016/3/25,2016
CJFD2016,文本观点挖掘和情感分析的研究,涂慧明;,东华理工大学;,电脑知识与技术,观点抽取;;观点挖掘;;情感分析;;文本挖掘,"观点挖掘和情感分析是分析用户观点,反馈,情感,评估,态度和个人情感的一个研究领域。这是自然语言处理中最活跃的一个研究领域,在数据挖掘,Web挖掘和文本挖掘领域中同样也被广泛研究。随着社交媒体、Web2.0技术(如新闻、论坛、博客、微博和社交网络)的发展,情感分析的重要性相应增长。首次在人类历史上,我们有了大量的数字形式的观点意见需要进行分析。在本文中,我们对文本观点挖掘、情感分析以及相关技术进行了研究。",2016/4/12 13:13,2016
