SrcDatabase-来源库,Title-题名,Author-作者,Organ-单位,Source-文献来源,Keyword-关键词,Summary-摘要,PubTime-发表时间,Year-年
CJFD2015,一种解决稀疏数据和冷启动问题的组合推荐方法,郭晓波;赵书良;牛东攀;王长宾;逄焕利;,河北师范大学数学与信息科学学院;长春工业大学人文信息学院;长春工业大学计算机科学与工程学院;,中国科学技术大学学报,关联推荐;;组合相似度;;协同过滤;;冷启动;;稀疏数据,"针对传统推荐算法所面临的冷启动与稀疏数据问题以及现有ARM(association rule mining)算法大多用于购物篮顾客行为分析,并不适用于特定用户推荐业务且效率较低等现象,提出一种基于相似度的关联推荐模式,实现一种新的结合关联规则推荐与协同过滤推荐方法.采用基于指定后件项的关联规则推荐,直接对目标用户和目标项目进行关联规则挖掘,并利用兴趣因子对活跃用户(或项目)与非活跃用户(或项目)进行权值均衡,以加权方法推荐最优解(规则).同时,采用相似度测量方法,过滤低相似度的项目,为用户推荐既有高评分又具有较高相似度的项目集合.最后,结合规则推荐与CF(collaborative filte...",2015/10/15,2015
CJFD2015,时空轨迹中隐含的周期性行为模式,刘翔;王斌君;王靖亚;杜锦;,中国人民公安大学网络安全保卫学院;,科学技术与工程,时空轨迹;;行为模式;;二值序列;;周期性,"将人类时空轨迹中隐含的信息进行可视化并转换为语义语言是公安工作的迫切需要。使用聚类算法将空间轨迹数据离散化,设计等间距抽样算法规整时间序列数据,从而将连续域上的时空轨迹数据表示为离散的二值序列,为使用离散傅里叶变换和循环自相关方法查找时空轨迹中隐含的周期性行为模式做好数据准备;并通过调整采样时间跨度以增强稀疏二值序列的周期性特征。实验表明可以有效提取时空轨迹中的周期性行为模式,而具有季节性和随机变化的行为模式也具有重要参考价值。案件的发生是由人的行为导致的,所以对人类时空轨迹的研究成果也可以应用于案件分析。",2015/12/18,2015
CJFD2016,大数据环境下计算机信息处理技术的应用及实践要点分析,李海燕;,兴安盟劳动和社会保障信息网络中心;,科技与创新,大数据;;计算机;;数据存储;;数据挖掘,"首先简要阐述了大数据与计算机信息处理技术,然后在此基础上论述了大数据环境下计算机信息处理技术面临的挑战及其应用实践,希望能对数据信息加工处理效率的提升有所帮助。",2016/1/5,2016
CJFD2015,城市交通大数据技术及智能应用系统,熊刚;董西松;朱凤华;季统凯;,中国科学院自动化研究所复杂系统管理与控制国家重点实验室;中国科学院云计算中心;青岛智能产业技术研究院;,大数据,城市交通;;大数据;;云计算;;物联网,"城市交通大数据具有种类繁多、异质性、时空尺度跨越大、动态多变、高度随机性、局部性和生命周期较短等特征,如何有效地采集和利用交通大数据,满足高时效性的交通行政监管、交通企业经营管理、交通市民服务等应用需求,是城市交通和智慧城市面临的前所未有的机遇和挑战。重点分析总结了城市交通大数据的若干研究内容及核心技术,提出了城市交通大数据智能应用系统解决方案,列举了几种典型应用,在城市交通和智慧城市领域的大数据研发和应用领域进行了初步探讨。",2015/11/20,2015
CJFD2015,决策系统在K-means算法中的应用,朱俚治;,南京航空航天大学信息中心;,计算机与数字工程,聚类;;决策系统;;K-means算法,"如今的聚类算法在数据挖掘和信息安全方面已有相当的应用。事实上在大数据时代之中,为了识别已知的或未知的数据则需要将通过数据聚类的算法来计算和实现。数据聚类算法是一种智能性的算法,其可以使得机器通过自我的学习来识别已知和未知的数据。目前的数据聚类算法,有基于划分的聚类算法、基于层次的聚类算法等各种的聚类算法。但在这些聚类算法中经典的算法仍然是基于距离的聚类算法,如K-means算法。因此论文的作者在查阅了一些关于距离聚类的算法之后,提出了将粗糙集中决策系统在K-means算法中进行首次的应用,这是论文的创新点。",2015/12/20,2015
CJFD2015,无线通信网络节点间通联关系的发现与更新算法,张攀峰;王世练;张炜;张尔扬;,国防科学技术大学电子科学与工程学院;,通信对抗,增量式PCA;;通联关系发现;;关联规则挖掘;;更新算法,"无线通信网络的节点间通联关系发现问题是网络层面通信对抗的一个重要问题。由于很难直接获得无线通信网络中节点间的通联关系,利用各节点的通信行为数据来进行通联关系发现是一个有价值的方向。考虑到各节点间的通信行为的关联,利用数据挖掘中的关联规则挖掘方法可以有效地从通信行为数据库中发现节点间的通联关系,将通联关系的发现问题转为关联规则挖掘问题,但现有的算法都不能高效地解决通信行为数据库变化时的通联关系更新问题。提出了一种针对无线通信网络进行节点间通联关系发现和更新的新算法。算法主要基于增量式PCA算法和矩阵变换,能够有效地从变化的庞大通信行为数据库中进行通联关系发现和更新。仿真实验表明算法在时间复杂度和...",2015/9/15,2015
CJFD2015,大数据时代企业管理新变革,张坚强;王冰;,辽宁科技大学工商管理学院;,经营管理者,大数据;;企业;;管理;;变革,"目前,大数据正以各种方式和路径影响着企业的商业生态圈,它已经成为企业管理变革和商业模式创新的基本时代背景。大数据时代下,传统的企业管理模式已不适应激烈的市场竞争环境,现代企业必须以此为契机,深度挖掘潜藏在大数据下的巨大商机,为企业的可持续发展创造广阔的空间。本文通过概述大数据的内涵,分析大数据带给企业的诸多问题,进而探讨企业在大数据浪潮的冲击下如何推进管理模式的新变革,获取更大的经济效益。",2015/11/25,2015
CJFD2015,大数据处理流程及存储模式的改进,孙红;郝泽明;,上海理工大学光电信息与计算机工程学院;上海现代光学系统重点实验室;,电子科技,大数据;;数据存储;;数据分析;;Hadoop;;标签云,"结合大数据的特点,提出以标签云改进方案来快速识别网络热搜词,同时考虑到传统的数据仓库在查询、存储结构化数据方面的优势,在目前学者提出的数据仓库与Hadoop平台结合的基础上,提出了协作模式中与以往不同的数据迁移方式,即使用数据中间件,并通过相同数量记录导入Hadoop的时间比较,得出文中所提的数据迁移方法较Sqoop方法更具优势的结论。",2015/12/15,2015
CJFD2015,构建档案大数据应用平台的探析,陈琦;,泉州市投资贸易促进协调服务中心;,办公自动化,档案大数据;;应用平台;;建设,"档案应用大数据涉及整个档案管理系统在大数据时代发展理念、管理体制、和技术创新等方面的重大变革。通过以云计算技术取代传统的档案管理系统,数据治理和建设全国统一的档案数据模型和行业级档案数据中心,搭建集约化的档案大数据应用平台。通过档案数据的采集、智能处理、数据挖掘与智能检索三个层次,实现档案大数据应用系统开发工作。在档案应用大数据建设过程中,档案管理部门要以科学的态度,坚持实事求是的工作作风,注重档案数据应用的基础工作。制定切实可行的发展规划;提升档案管理部门大数据环境下的工作能力;大力培养档案大数据技术专业型人才。",2015/11/15,2015
CJFD2015,K-means聚类分析在就业管理系统中的应用研究,王志伟;王利军;,安徽经济管理干部学院;,电脑知识与技术,就业管理;;聚类分析;;数据,"学生就业管理系统可以采集毕业生的就业调查数据信息,并且可以对数据进行选择和转换以便数据挖掘的顺利完成,利用SPSS软件进行K-means聚类分析,从而得到有价值的信息,为学生管理工作和教学方案的修改制定提供参考。",2015/12/25 9:15,2015
CJFD2016,一种新型的技术形态识别方法——基于SAO语义挖掘方法,郭俊芳;汪雪锋;李乾瑞;朱东华;,北京理工大学管理与经济学院;,科学学研究,形态分析法(MA);;SAO语义挖掘;;技术机会分析(TOA);;形态结构;;染料敏化太阳能电池(DSSCs),"形态分析法作为一种面向未来的系统分析方法,已被广泛运用于技术机会识别和技术预测等领域。但现有形态分析方法中,形态结构构建过程对领域专家有较强的依赖。虽有学者尝试引入定量分析方法,但单纯以词频为依据选择特征词,忽略了词间的影响,存在无法展示技术/部件的目的、构成和语义关系等缺陷,限制了技术预测的效果。因此,本文引入主语-谓语-宾语(SAO)语义挖掘方法,提出一种新型的技术形态识别方法,并以德温特专利数据为基础,描述了专利技术形态识别的过程,验证了该方法的可行性和有效性。该方法弥补了基于关键词方法的不足,增强了定量方法对技术形态识别中的应用,减少了技术形态定义对专家知识的依赖,提高了技术形态识别的...",2016/1/15,2016
CJFD2015,基于聚类权重调度的大数据采样技术,耿德志;,晋中学院信息技术与工程学院;,世界有色金属,大数据;;采样;;数据聚类;;权重调度,"通过大数据优化采样提高对大数据的分析和调度能力。传统方法中对大数据的采样技术采用奈奎斯特采样定律,当大数据的特征信息出现非线性特性时,采样精度不高。提出一种基于聚类权重调度的大数据采样技术,进行大数据的分布式数据结构分析和时间序列模型构建,采用模糊C均值聚类方法进行大数据的聚类权重调度算法设计,以此为基础实现大数据的特征提取和特征采样。仿真实验结果表明,采用该方法进行大数据的信息采样,能有效提高采样精度,在大数据挖掘和特征提取方面具有重要意义。",2015/12/21 15:54,2015
CJFD2015,基于经验模态分解的大数据波束形成方法,曲鸣飞;辛义;,北京电子科技职业学院自动化工程学院;,世界有色金属,大数据;;经验模态分解;;波束形成,"通过对大数据进行波束形成处理,提高大数据的挖掘和聚类能力,传统方法采用模糊C均值聚类进行大数据波束形成,抗干扰性能不强,提出一种基于经验模态分解的大数据波束形成方法。首先分析的大数据的数据结构和时间序列处理模型,然后通过经验模态分解实现对大数据序列的特征提取和波束形成。仿真结果表明,采用该方法进行大数据波束形成处理,提高了大数据挖掘和聚类性能,收敛性和抗干扰性较好。",2015/12/21 15:54,2015
CJFD2016,面向多源城市出行数据的可视化查询模型,汪飞;张繁;吴斐然;顾天瑜;高思远;赵烨;鲍虎军;,浙江大学CAD&CG国家重点实验室;湖南师范大学数学与计算机学院;浙江工业大学计算机科学与技术学院;肯塔基州立大学计算机学院;,计算机辅助设计与图形学学报,多源城市出行数据;;可视化查询;;查询模型;;可视分析,"多源城市出行数据为理解城市现象和享受城市生活带来了机遇.利用统计物理学和数据挖掘技术,人们在多源城市出行数据的研究上取得了很大进展,但是基于可视分析方法的研究甚少.为此,提出了一种可视化查询模型旨在解决应用可视分析方法研究多源城市出行数据时所面临的数据组织和可视表达上的挑战.查询模型从数据抽象,数据组织和管理,查询交互界面以及可视化分析等方面进行探讨,介绍了相关方法和技术.最后实现了查询模型的实例系统并通过典型案例证明了查询模型的有效性.",2016/1/15,2016
CJFD2015,大数据的安全现状与应对策略研究,桑运昌;,南京陆军指挥学院作战实验中心;,计算机科学,大数据;;数据安全;;数据挖掘,"大数据蕴藏着有价值的信息,但数据安全面临严峻挑战。在分析大数据基本特征的基础上,提出了当前大数据面临的安全挑战,并从监测机制、防范检测、响应水平和处理能力4个方面阐述了大数据安全的应对策略。",2015/11/15,2015
CJFD2016,大数据环境下的电子数据审计:机遇、挑战与方法,陈伟;SMIELIAUSKAS Wally;,南京审计大学管理科学与工程学院;多伦多大学罗特曼管理学院;,计算机科学,电子数据审计;;数据密集型科学;;大数据;;云计算;;计算机辅助审计技术,"电子数据审计的研究与应用是近年来审计领域的热点问题。大数据时代的到来给电子数据审计带来了机遇与挑战。首先阐述了研究大数据环境下电子数据审计的重要性;然后分析了电子数据审计的内涵及原理;在此基础上,重点研究了大数据环境下电子数据审计面临的机遇与挑战,并结合大数据的特点以及目前已有的大数据分析技术与工具,探讨了大数据环境下开展电子数据审计的方法;最后给出了大数据环境下开展电子数据审计的相关建议。研究结果为今后大数据环境下开展电子数据审计提供了理论基础。",2016/1/15,2016
CJFD2016,基于局部加权重构的化工过程数据恢复算法,郭金玉;袁堂明;李元;,沈阳化工大学信息工程学院;,计算机应用,数据挖掘;;缺失数据;;数据恢复;;k近邻规则;;局部加权重构;;化工过程,"针对化工过程数据中存在缺失数据的问题,在保持局部数据结构特征的基础上提出了基于局部加权重构的化工过程数据恢复算法。通过定位缺失的数据点并以符号Na N(Not a Number)标记,将缺失的数据集分为完备数据集和不完备数据集。不完备的数据集按照完整性的大小依次找到它们在完备数据集中相应的k个近邻,根据误差平方和最小的原则,求出k个近邻相应的权值,用k个近邻及相应的权值重构出缺失的数据点。将该算法应用在不同缺失率下的两种化工过程数据中并与望最大化主成分分析(EM-PCA)法和平均值(MA)两种传统的数据恢复算法相比较,该算法的恢复数据误差最小,并且计算速度相比EM-PCA算法平均提高了2倍。实...",2016/1/10,2016
CJFD2015,基于GSP算法的Web用户访问序列模式挖掘,王子卿;樊楠;,中国人民大学附属中学;中国铁道科学研究院电子计算技术研究所;,电脑知识与技术,Web日志;;序列模式挖掘;;GSP算法,"该文以某电子商务网站的Web访问日志为研究对象,利用SQL Server提供的SSIS服务和T-SQL语句进行数据预处理,得到序列数据库,然后用java语言编程实现GSP算法对其进行序列模式的挖掘测试分析,通过对结果分析可以做出对该网站布局和内容(或产品)调整提供参考,使其更好为其用户提供针对性的服务。",2015/12/24 13:24,2015
CJFD2015,人像识别技术在安全生产中的应用,汪建;方洪鹰;,重庆邮电大学计算机科学与技术学院;重庆交通大学理学院;,电脑知识与技术,人体识别;;码本;;方向梯度直方图;;支持向量机,"精细化管控在建设行业中的作用日益突出,其核心是安全质量监管。本文首次将图像处理技术和数据挖掘技术应用到安全监管中,研讨了将码本运算、HOG运算、SVM运算融为一体进行人体图像挖掘的可能性,提出基于多姿态人体安全帽检测技术,并且通过试验证明该算法的实用性和有效性。",2015/12/22 10:49,2015
CJFD2016,大数据时代B2C电子商务CRM体系的研究,张兰;,江苏商贸职业学院;,福建电脑,B2C电子商务;;CRM体系;;客户行为,"随着电子商务的快速发展,B2C企业正在从""增量""增长向""提质""增长转型,将会把更多的关注点集中于对客户有效管理上。本文阐述了B2C电子商务CRM体系的作用,并通过客户行为的分析,提出了CRM体系研究的方法及基于B2C企业CRM体系模型的构建。",2016/1/25,2016
CJFD2016,基于位置签到数据的城市分层地标提取,王明;胡庆武;李清泉;秦龙焜;,武汉大学遥感信息工程学院;深圳大学空间信息智能感知与服务重点实验室;武汉大学测绘遥感信息工程国家重点实验室;,计算机学报,位置服务;;位置签到(Check-In);;地标;;POI;;显著度;;分层;;云计算,"为了及时准确地获取用于智慧位置服务的城市层次性空间知识,该文提出了一种依据签到属性显著度的差异从位置签到数据中提取城市分层地标的方法.首先,针对传统基于调查问卷的公众认知度计算方法存在的不足,该文从位置签到数据中的签到次数、签到用户数和用户影响因子3个方面入手讨论POI显著度的影响因素,进而提出了一种基于签到数据的POI显著度计算模型;然后,利用Voronoi图对POI空间作用范围进行分割并结合邻域分析与合并算法逐层迭代,形成了基于签到POI显著度与Voronoi图的分层地标提取算法;最后,以北京市的位置签到数据为例,进行了POI显著度计算与分时分层地标提取,通过与现有实体、网络地图资料的比对...",2014/12/19 0:07,2016
CJFD2015,大数据在酒店管理系统中的应用,杨慧慧;邓薇;陈冲;,东华理工大学软件学院;,科技广场,酒店管理系统;;大数据分析;;Tableau,"酒店管理行业的发展越来越依托于数据的分析,大数据的收集、清洗优化、挖掘及整合研究分析,给酒店的经营管理提供了巨大的帮助。本文采用Tableau作为分析工具,对酒店管理系统中的酒店预订模块、客户入住模块、客户结算模块中产生的数据进行大数据分析,准确的找出酒店经营存在的问题,使酒店管理决策者实现业务的提升。",2015/12/30,2015
CJFD2016,一种基于MapReduce的压缩矩阵关联规则挖掘算法,安建瑞;王海鹏;张龙波;金超;怀浩;,山东理工大学计算机科学与技术学院;,重庆理工大学学报(自然科学),压缩矩阵;;关联规则;;MapReduce;;Hadoop,"提出一种基于MapReduce的压缩矩阵关联规则挖掘算法FMA_Mining。该算法将数据库映射为布尔矩阵,在矩阵映射过程中引入Flag标识,对于连续出现的项用Flag标识标明,简化矩阵元素的读取和列向量运算。针对大数据应用中事务和项目规模较大的情况,算法引入了矩阵分割和并行化处理思想。在Hadoop平台采用Web Docs数据集对算法性能进行测试,从理论分析和实验结果两方面证明了FMA_Mining算法的有效性。",2016/2/15,2016
CJFD2016,数据仓库技术在医院信息化建设方案实现中的应用价值,李韬;冯佳莉;张屹;于树新;,河北北方学院附属第一医院信息管理处;河北北方学院附属第一医院肾内科;,中国医药导报,数据仓库;;联机事务处理;;信息化建设;;数据挖掘,"目的探讨数据仓库技术在医院信息化建设方案中的应用价值。方法于实施基于数据仓库技术的医院信息化建设前(2013年全年)向河北北方学院附属第一医院(以下简称""我院"")门诊患者发放医院医疗服务满意度调查问卷,选取500份合格问卷作为对照组;实施基于数据仓库技术的医院信息化建设后(2014年全年),向我院门诊患者发放相同问卷,选取500份合格问卷作为研究组;比较两组对门诊服务的综合满意度、等待时间、诊疗时间、医护人员工作绩效情况。结果研究组总满意度显著高于对照组(38.20%比19.00%);研究组等待总时间显著短于对照组[(30.21±8.73)比(62.89±10.75)min];研究组实际诊疗总...",2016/2/5,2016
CJFD2016,基于中医三路脉象诊断机制的脉诊数字化系统研制,史伟;刘卫兰;王伟浩;,洛阳职业技术学院;,电脑编程技巧与维护,中医脉诊;;数字化系统;;三路脉象;;数据挖掘,"中医脉诊数字化系统包括数据采集装置、信号通信装置和数据分析设备等。硬件系统可以实现对寸关尺三路脉象信号的釆集、分析和处理;软件部分将脉象的位、数、形、势和脉图的各项特征参数作自动分析处理。同时结合中医望诊和问诊(以人机对话形式),采用数据挖掘的方法建立起病名与脉象之间、证型与脉象之间的关联性,综合中医八纲辩证的思路,为被测者提供健康状况的指导。",2016/2/18,2016
CJFD2016,智慧学习空间中学习行为分析及推荐系统研究,赵铮;李振;周东岱;钟绍春;,东北师范大学信息与软件工程学院;教育部数字化学习支撑技术工程研究中心;,现代教育技术,智慧学习空间;;学习行为分析;;学习者相似度计算;;学习路径推荐,"智慧学习空间是智慧学习理念下构建的学习空间新形态,学习分析是智慧学习中不可或缺的组成成分。文章围绕智慧学习过程中面向学习者对于知识内容的""呈现与获取""、""个性化建构与拓展延伸""两大环节以及学习者所处的学习状态,构建了学习行为分析及推荐系统。该系统利用W eb挖掘技术,从学习内容、学习路径和空间使用记录三个方面针对智慧学习过程模型中的学习行为进行数据分类挖掘,通过与优秀学习者路径及路径知识点相关学习行为进行相似性比对,为学习者进行个性化学习推荐路径。",2016/1/15,2016
CJFD2015,C4.5算法在高职学校成绩分析中的应用,卜阳;,江苏省徐州医药高等职业学校;,佳木斯职业学院学报,数据挖掘;;决策树;;成绩分析;;C4.5算法,"本文采用C4.5算法构造决策树的方法,对学生的成绩进行分析并找出影响成绩的主要因素和规则,给教师调整教学环节提供参考,对学生管理工作提出意见,从而指导教育教学工作。",2015/12/15,2015
CJFD2015,云计算环境下的数据挖据算法研究,张一名;,山西林业职业技术学院;,信息化建设,云计算;;数据挖掘;;研究,"基于项目协同过滤推荐算法是云计算环境下的数据挖据算法,用于解决Amazon.com中千万级的用户和产品数据挖掘和推荐。并且在如此海量的数据规模下,将已有的平台迁往云平台己大势所趋。本章将介绍基于项目协同过滤算法的并行化实现和性能分析。",2015/12/15,2015
CJFD2016,基于Apriori算法的对微信热点事件的关联分析与研究,王晨绫;刘伟;郑世珏;,华中师范大学信息管理学院;华中师范大学计算机学院;,计算机与数字工程,Apriori;;微信;;热点事件;;关联分析,"作为移动互联网时代的杀手级应用,腾讯公司的微信作为新一代通讯软件在互联网用户中迅速发展。基于移动终端,跨网络、跨终端的特点使微信的传播机制与规律都呈现出新的特点,提升了沟通的效率。微信的大规模使用,使微信聚集了大量的用户传播的社会事件。论文使用Apriori算法对萃取出来的微信热点事件进行关联分析,分析当前社会热点事件的相关性,发现与其相对应的安全性关联规则,跟踪并有效记录该热点事件,形成热点萃取的分析结果。",2016/1/20,2016
CJFD2016,基于类序列规则的中文微博情感分类,郑诚;沈磊;代宁;,安徽大学计算机科学与技术学院;计算智能和信号处理教育部重点实验室;,计算机工程,情感分类;;微博文本;;类序列规则;;情感词典;;机器学习;;文本特征,"研究中文微博文本的情感分类问题,介绍一种基于类序列规则的微博情感分类方法。通过情感词典和机器学习的方法获得微博文本中每个句子的2个潜在的情感标签,将每条微博文本看作是一个数据序列,从数据集中挖掘出类序列规则,从挖掘出的规则中提取出的有效特征并结合文本其他特征来训练分类器。在COAE会议提供的微博数据集上的实验结果表明该方法的有效性。",2016/2/15,2016
CJFD2016,基于多标记学习的汽车评论文本多性能识别,张晶;李德玉;王素格;,山西大学计算机与信息技术学院;,计算机工程与科学,多标记学习;;文本处理;;汽车评论;;多方面识别,"针对汽车产品评论文本中出现的多方面性能,提出一种基于多标记学习的汽车评论文本多方面性能识别方法。首先,结合文本挖掘方法,利用多标记文本特征选择方法选取特征,将非结构化的文本转化为结构化的多标记数据集。在此基础上,使用四种多标记分类方法,对待识别的评论文档标注一个或多个方面标记。最后,以八种多标记评价指标评估方面识别的性能。在新浪汽车评论语料上的实验表明,方面识别的子集准确率达到了95%,验证了方法的可行性。",2016/1/15,2016
