SrcDatabase-来源库,Title-题名,Author-作者,Organ-单位,Source-文献来源,Keyword-关键词,Summary-摘要,PubTime-发表时间,Year-年
CJFD2016,大数据时代下的信息系统建设分析,王磊;,中国五矿股份有限公司;,通讯世界,大数据;;信息系统;;系统建设,"现阶段物联网、云计算等网络业务发展迅速,已经被广泛的应用到各个领域,对提高生活工作质量具有重要意义。随着信息数据总量的增长,现在已经进入到大数据时代,对信息系统数据量和数据结构产生巨大影响,为应对数据存储、数据挖掘等挑战,需要重点做好信息系统建设的研究。本文对大数据时代下信息系统建设方法进行了简要分析。",2016/8/12,2016
CJFD2016,大数据分析在油气行业的应用研究,张春生;郭长杰;尹兆涛;,中国石油规划总院;,微型电脑应用,大数据分析;;油气;;大数据建模;;物联网;;云,"为解决油气行业各业务领域应用大数据技术挖掘沉睡数据中的隐性规则、商业机会从而优化生产、辅助决策的需求,分析了国内外油气公司大数据分析的应用场景及基础设施建设现状,在现有供应商解决方案的基础上,结合我国油气行业应用大数据分析的需求设计了统一的油气大数据分析平台,并从大数据管理、人才组织及自主研发等角度提出油气公司部署大数据分析的相关建议。",2016/7/20,2016
CJFD2016,基于粗糙集的关联规则挖掘方法的研究与应用,吴陈;李丹丹;,江苏科技大学计算机科学与工程学院;,电子测量技术,关联规则;;粗糙集;;Apriori算法,"基于粗糙集理论知识,对关联规则挖掘算法作出一定的改进。该算法的主要思想是把集合的近似质量作为迭代准则,初始约简集是所有的条件属性集合,在保证近似质量不变的前提下通过逐步缩减的方式来求取约简集,保证了所求的约简不会减弱对问题的分类决策能力。约简后得到新的决策表,在此基础上应用基于贪心思想的Apriori算法挖掘关联规则。算法的主要优势是在不影响对问题分类决策能力的前提下,以较小的属性和候选项集数目以及有限的扫描次数生成决策规则。通过应用实例和实验分析验证了算法的有效性。",2016/7/15,2016
CJFD2016,大数据驱动下传统零售业的精准营销——以朝阳大悦城为例,王海峰;卢小倩;,湖南科技大学商学院;,产业与科技论坛,大数据;;传统零售业;;精准营销;;体验式营销,"互联网和大数据时代,传统零售业如何转型升级是目前商业研究的热点。本文从大数据思维、大数据采集、挖掘、分析和应用等方面探讨了大数据与传统零售业精准营销的理论分析框架,然后通过对北京朝阳大悦城的精准营销体系的四个方面进行了分析:精准营销战略、大数据信息管理平台构建、高效的客户管理、高效的品类管理等。传统零售业借助大数据采用体验式营销和020模式实现精准营销是转型的大方向。",2016/9/15,2016
CJFD2016,大数据+市场监管,曾途;,成都数联铭品(BBD)科技有限公司;,中国市场监管研究,科学范式;因果关系;市场监管体系;关联方;人员薪酬;决策方式;招聘对象;政府监管部门;电话查询;监管效能;,"大数据是人类探索未来未知发生事情的一种手段。传统的数据挖掘是通过已知的数据寻找规律,而大数据不像传统的数据分析那样局限于一些因果关系。传统的数据分析一般是先由专家建立数据模型,然后挖掘出一些相应的有特定性的东西。而大数据反其道而行,通过特征抽象,然后找出对象与对象的相关关系,从而去发现未知。大数据来源的数据维度不是单一的,而是由很多不同来源的数据集成在一起,影响着决策流程、商业模式、科学范式和观念形态上发生的根本性变化。大",2016/5/15,2016
CJFD2016,大数据在珠宝企业的应用现状,陈姚朵;,中国地质大学资源学院;,宝石和宝石学杂志,大数据;;珠宝产业;;应用,"大数据在各个行业有着广泛的应用,其核心价值在于运用大数据思维触发新的价值增长。目前,我国珠宝行业对大数据的理解和应用相对滞后,主要体现在珠宝市场营销、企业管理和商业模式创新领域,通过相关数据收集、统计和挖掘,获得有价值信息,为决策提供更科学的依据。本文对大数据在珠宝企业的应用实例进行研究后发现,大数据已经引起珠宝企业的高度重视,其应用不仅能提高珠宝企业的决策和管理效率,还能加速商业模式创新,为跨界发展提供技术支持。运用大数据推动珠宝企业快速发展,进而推动珠宝产业升级已经成为珠宝行业未来发展的必然趋势。",2016/7/15,2016
CJFD2016,基于大数据的路桥汽车用户线上2C运营方案研究,张恒;张磊;程新洲;陈崴嵬;,中国联通网络技术研究院;,邮电设计技术,大数据平台;;汽车运营;;用户画像,"通过分析汽车行业的大数据现状,结合目前路桥汽车用户收费模式,提出基于大数据的汽车用户线上运营方案。该方案包括了大数据平台建设和APP业务运营全链条,通过运营商和汽车本身数据分析,形成完善的汽车用户标签,通过APP向用户提供精准的车主、广告和金融等服务,提升车主服务体验,形成基于大数据的运营服务。最后在高端车主画像和挖掘方面进行了研究,通过大数据分析,形成一套高端车主的挖掘算法,为后期精准运营提供了技术参考。",2016/8/20,2016
CJFD2016,记忆计算:概念、特性及研究进展,郭斌;陈荟慧;李文鹏;於志文;姜佳君;王文辉;,西北工业大学计算机学院;,计算机科学,普适计算;;记忆计算;;情境感知;;数字记忆;;移动及可穿戴设备,"随着信息技术的发展,尤其是移动互联网与物联网的发展,有关个人工作和生活的数据呈指数型增长。这些海量的数据中蕴含着丰富而有价值的个人信息,如何从这些数据中挖掘出有价值的信息成为当前信息领域的重要问题。针对该问题,介绍了普适计算领域新兴起的研究主题——记忆计算。记忆计算旨在通过各种带感知和计算功能的设备,比如智能手机、可穿戴设备等,实时感知和捕获用户线上线下活动的数据,分析并挖掘其内在价值,进而组织和管理有意义的记忆数据,实现基于情境的记忆数据呈现,以辅助个体记忆,支持社群交流与协作。讨论了基于移动情境感知的记忆计算的概念、特性、系统模型以及当前研究的关键技术与挑战,综述了记忆计算在生活日志、记忆...",2016/9/15,2016
CJFD2016,基于改进的关联规则挖掘算法的用户兴趣挖掘,李珊;邵兰洁;孙丽云;,燕京理工学院信息科学与技术学院;,计算机时代,关联规则;;置信度;;数据挖掘;;用户兴趣挖掘,"研究发现,传统的关联规则挖掘算法在用户兴趣挖掘的应用中,摒弃置信度这个度量值。究其原因,在于网站结构中置信度不能准确度量用户兴趣。提出了一个可以替代传统置信度的、在网站环境下能正确反映用户兴趣的确定性的度量值,并结合用户的浏览速率进行用户兴趣挖掘。对比实验结果表明,此方法挖掘用户兴趣的效果明显。",2016/9/15,2016
,,,,,,,,
