SrcDatabase-来源库,Title-题名,Author-作者,Organ-单位,Source-文献来源,Keyword-关键词,Summary-摘要,PubTime-发表时间,Year-年
CJFD2015,基于比较句的网络用户评论情感分析,彭浩;徐健;肖卓;,中山大学资讯管理学院;中山大学图书馆;,现代图书情报技术,比较句抽取;;情感分析;;数据可视化;;自然语言处理,"【目的】为帮助企业识别竞争产品,挖掘有价值的信息,提出基于比较句的情感分析模型。【方法】利用基于比较句数目的热门指数和差距指数筛选热门对比产品,从比较句中抽取特征并根据情感词典计算竞争产品的特征得分。为验证模型的效果,以手机产品为实验对象,以百度搜索引擎为数据来源展开实验。【结果】实验从28对手机产品中筛选出9对热门对比产品,并可视化分析产品的特征差异。相对于以往基于文本的情感分析方法,该模型能够更好地识别竞争产品以及判断竞争产品的用户情感取向。【局限】特征抽取准确性有待进一步提高,比较句识别率存在一定的提升空间。【结论】实验结果与实际情况相符合,模型具有有效性,该方法对企业有较高的利用价值。",2015/12/31 15:05,2015
CJFD2016,基于负载均衡和冗余剪枝的并行FP-Growth算法,刘祥哲;刘培玉;任敏;伊静;高钊;,山东师范大学信息科学与工程学院;山东省分布式计算机软件新技术重点实验室;山东财经大学数学与数量经济学院;山东建筑大学计算机科学与技术学院;,数据采集与处理,关联规则;;MapReduce;;冗余剪枝;;FP-Growth算法,"针对现有的并行FP-Growth算法在数据并行分组时存在数据冗余和负载不均的问题,提出了基于负载估算和冗余剪枝的优化算法。首先,在采用高频策略分组时,引入节点任务估算方法,把每个分组中最大模式树的最长路径和支持度作为该分组的估计值,将估计值远大于其他节点的分组进行分割,平均到其他分组中,并且对不同分组中重复的列表元素进行截断,去除冗余数据。实验表明,本文提出的算法能够有效防止并行化的数据倾斜,减少数据冗余,在时间和空间复杂度上要低于以前的并行化FP-Growth算法。",2016/1/15,2016
CJFD2015,基于十字链表的Separate算法研究,陈平;王利钢;,南京信息职业技术学院信息服务学院;,信息化研究,关联规则;;十字链表;;项约束;;频繁项目集,"生成频繁项集是约束关联规则挖掘中最耗时的一步。为提高挖掘的效率,文章提出一种基于十字链表的经典的约束算法(Separate)改进算法(SABCL)。该算法结合Separate算法和十字链表存储的优势,先根据约束条件过滤数据库并产生频繁项目,再利用十字链表存储频繁项目信息,通过遍历十字链表生成满足约束条件的频繁项集,从而避免重复扫描数据库,提高了挖掘效率。在美国蘑菇(mushroom)、象棋(chess)数据集上,对SABCL、Separate算法进行了实验对比,实验结果表明,在相同的条件下,SABCL算法能够快速地生成所有的频繁项集,时间性能优于Separate算法。",2015/10/20,2015
CJFD2016,K-means聚类个性化推荐算法改进研究,石颖莹;葛万成;汪亮友;林佳燕;,同济大学;上海中科联芯物联网技术有限公司;,信息通信,聚类分析;;数据分析;;推荐系统;;聚类中心初始化;;迭代优化,"聚类算法是数据挖掘中的重要技术,用于发现数据中未知的分类,是电子商务领域实现个性化推荐的重要方法。个性化推荐服务,是一种针对不同特征的用户推出适合于用户的信息及服务。文章介绍了一种K-means的聚类算法,该算法主要应用于数据挖掘领域,也在推荐系统的研究中占有重要的地位。文章还详细的分析了该算法目前存在的不足,针对该算法对初始值有一定要求这一不足,提出了一种通过预处理初始聚类中心的方法,以此来改进该算法,从实验结果可知,该改进算法能够减少迭代次数,提高计算效率。",2016/1/15,2016
CJFD2015,面向多通道QoS需求的虚拟机分簇挖掘仿真,杨丽萍;臧华中;,三江学院计算机科学与工程学院;南京航空航天大学计算机科学与技术学院;,科技通报,多通道;;QoS;;虚拟机分簇,"实行虚拟机最优分配方案的准确挖掘能够提高云计算的服务质量(Qo S)。利用传统算法进行虚拟机最优分配方案挖掘的过程中,由于受到大量冗余数据的影响,造成挖掘效率降低。为此,提出一种基于蚁群算法的面向多通道Qo S需求的虚拟机分簇挖掘方法。根据虚拟机特征的相似度对虚拟机进行分簇,利用蚁群算法进行虚拟机最优分配方案的挖掘,在此过程中,充分考虑了多用户对云计算中虚拟机资源服务质量(Qo S)的要求,避免出现同类型虚拟机被分配到同一物理机上的情况,同时,对蚁群算法中信息素的更新进行了优化。实验结果表明,利用改进算法进行虚拟机最优分配方案挖掘,能够有效提高挖掘效率,并降低系统负载均衡度。",2015/12/31,2015
CJFD2016,大数据的本体假设及其客观本质,黄欣荣;,江西财经大学管理哲学研究中心;,科学技术哲学研究,大数据;;本体论;;数据本质;;数据实在;;透明世界,"随着大数据的兴起,数据的本质发生了巨大的变化。大数据认为,""万物皆数"",世界万物最终都可以还原为数据,数据因此成为世界的本质;万物皆可用数据表达,""量化一切""是大数据的终极目标;数据是信息的普适表征方式和新的实在形式,它是物质世界的映射,具有波普尔世界3的客观实在性。大数据让世界变成了一个数据化的世界,而数据挖掘让我们可以完全认知这个数据世界,由此世界变成了透明世界。",2016/4/5,2016
CJFD2016,单飞行事件噪声关联规则挖掘及信念网络表示,徐涛;杨婷婷;谢继文;,中国民航大学计算机科学与技术学院;中国民航大学中国民航信息技术科研基地;,中国民航大学学报,单飞行事件噪声;;关联规则;;信念网络;;FP-Growth-Cube算法,"挖掘各种噪声影响因素与机场噪声之间的关联规则,能够为机场经营者制定有效的降噪措施提供科学依据。先将FP-Growth算法与数据立方体相结合,构造FP-Growth-Cube算法挖掘单飞行事件噪声与各噪声影响因素之间的关联规则,然后通过信念网络可视化表示关联规则。此方法不但直观、清晰,而且克服了关联规则不能表达不同规则之间联系的弱点,图形化地综合表示各因素对噪声的影响。最后,实验从降噪措施之一的机型选择角度,与权威噪声预测软件INM对比,验证了该方法的可行性和有效性。",2016/2/15,2016
CJFD2016,基于事件的证券市场状态变化规则挖掘,姜丽;,上海应用技术学院计算机科学与信息工程学院;,科技创新与应用,事件;;证券市场;;数据挖掘;;ID3算法,"文章在前期市场状态研究的基础上,重点研究了三类影响市场状态的事件,建立了事件模型,并采用改进的ID3数据挖掘算法,得到了一组市场状态在事件刺激下的转化规则。最后,文章对得到的规则进行了分析。",2016/3/28,2016
CJFD2016,决策区间概念格的粗糙控制规则挖掘模型与应用,孙爱玲;张春英;王立亚;王志江;,华北理工大学理学院;,河北联合大学学报(自然科学版),粗糙控制;;决策区间概念格;;属性离散化;;决策规则挖掘,"融合区间概念格的结构特征和粗糙控制规则的实际需求,将一般区间概念格改造为决策区间概念格,并构建基于决策区间概念格的粗糙控制规则挖掘模型,以实现粗糙控制中挖掘成本和控制效率的整体最优。首先,运用粗糙集理论对粗糙控制数据进行预处理,使其转化成布尔型的形式背景表,并构建符合粗糙控制实际的决策区间概念格;其次,构建了决策区间概念格的控制规则挖掘模型,并对冗余规则进行分析判断,形成最终的粗糙控制决策规则库。分析结果表明:模型在提高规则可靠性的前提下,实现了粗糙控制成本与效率的最优化目标;最后,将模型应用到水库调度的决策规则挖掘中,验证了模型的可行性与高效性。",2016/1/25,2016
CJFD2016,基于规则置信度调整的知识挖掘及在烟草科技管理中的应用,王塑;张萍;周新;王乙民;,陕西省烟草公司西安市公司;,计算机应用与软件,知识挖掘;;规则置信度;;信息管理,"介绍信息管理领域中的一个热门研究主题——知识挖掘。知识挖掘旨在从结构化、半结构化的数据中挖掘信息。例如从电子文档、不完备的历史数据中搜索稳定的模式或模型,分析挖掘数据间的交互特征和规律,以辅助管理人员制定、调整规范与标准,构建专家库和知识库。提出知识挖掘的一种改进方法,通过动态规则置信度生成算法提高所获得规则的准确性与适应性,并结合烟草企业科技项目智能辅助管理中的实际应用进行了验证,取得了一定的成效。",2016/3/15,2016
CJFD2016,交通大数据的特征及价值,张昕;曾鹏;张瑞;张帆;,深圳市易行网交通科技有限公司;宝建投智能科技有限公司;中国科学院深圳先进技术研究院;,软件导刊,交通大数据;;智能交通;;数据挖掘;;交通预测;;数据可视化,"当前,城市交通正面临着安全、堵塞、环境污染三大难题。随着云计算、物联网、移动互联网、大数据等新兴技术的发展,城市交通进入智能化阶段。而智能化实现需要利用各种技术获取有价值的数据资源,提供决策依据。交通大数据为交通决策与服务带来了新的解决思路和方法。",2016/3/22 10:28,2016
CJFD2016,大数据情报化技术应用研究,赵厚理;,中安华盾(北京)信息技术有限公司;,中国新通信,智能化技术;技术应用研究;可视化工具;一体化程度;经济发展;科技发展;网络分析方法;信息安全;技术视角;代码开发;,"引言:大数据核心价值:大数据情报化。高关联度的深度挖掘呈现。纵深横向关联挖掘呈现。随着学科的深入交叉融合及社会发展、经济发展与科技发展一体化程度的增强,大数据情报化研究正从单一领域分析向全领域分析的方向发展。数据精分及呈现结果都在数据计算中凸显情报化特色,满足使用者最精准的需求。各行业越来越依赖利用数字化科学数据以及借助复杂的数据挖掘、集成、分析与可视化工具将其转换为信息和知识的能力。对于大数据情报研究来说,应用智能化技术能自动",2016/3/5,2016
CJFD2016,关于新闻推荐算法的研究,李乐田;吴林;高永存;,中国传媒大学理学院;,中国传媒大学学报(自然科学版),马尔可夫模型;;新闻推荐;;关联规则;;数据挖掘,"随着互联网高速发展,越来越多的网友依赖于手机、PC获取外界讯息。其中较为广泛关注的当属新闻阅读,用户对新闻推荐的要求也越来越高,除了各大网站推出的头条外,不同用户渴望读到的新闻千差万别,那么如何更好的满足用户对新闻的个性需求就成为新闻推荐的一个难题,本文使用1000名用户的新闻阅读记录,挖掘用户的阅读习惯,发现用户阅读下一条新闻只与上一条有关,而与之前的行为无关,故本文使用马尔可夫算法对这一问题进行研究。",2016/2/29,2016
CJFD2016,基于大数据的K-means聚类算法在网络安全检测中的应用,郑志娴;王敏;,福建船政交通职业学院信息工程系;,湖北第二师范学院学报,大数据;;网络安全检测;;K-means聚类算法,"随着云时代的到来,大数据的应用受到了越来越多的关注。大数据的核心在于挖掘数据中蕴藏的价值链,为决策提供可借鉴参考。聚类算法是数据挖掘的一种归类方法,K-means则是基于划分的聚类方法。在网络安全检测中,应用K-means建立网络异常检测模型,可有效提高大数据环境下集中选取数据准确性的能力,控制检测误报率,缩短网络异常数据选取时间。但是,传统的K-means聚类算法在数据类型预处理、初始中心选取和K值确定等方面存在不确定性,导致对入侵检测的效率降低。本文提出一种改进的K-means算法,并通过利用KDDCup99数据集进行仿真实验,证明改进后的K-Means算法的检测准确率与检测效率要优于传统...",2016/2/15,2016
CJFD2016,分布式集群环境下基于并行计算的图聚类信息高效处理方案,张博;,长沙师范学院电子与信息工程系;,自动化技术与应用,人工智能;;数据挖掘;;映射规约;;图聚类;;最小哈希算法,"针对人工智能领域图聚类数据分析与处理能力无法适应于日益复杂的分布式集群环境等问题,提出一种基于并行计算的高效率图聚类信息处理方案。在分布式集群计算环境下对超大规模、超大区域范围图数据信息的稀疏化分析与处理机制上,通过对Minhash算法以Map Reduce架构理论进行改进,使其实现对数据的并行化分析处理,确保能够在日益复杂的分布式集群计算环境下高效处理图聚类数据信息。实验表明,改进方案不仅可行,而且能够对图聚类数据信息进行快速稀疏化处理,具有一定的高效性。",2016/3/25,2016
CJFD2016,商业银行大数据建设探讨,王达山;,中国人民银行成都分行;,中国金融电脑,数据种类;非结构化;社交网络;网络点击;精准营销;挖掘模型;金融产品创新;因果关系;交互数据;多源数据;,"随着社交网络、电子商务和云计算的兴起,音频、视频、图像、网络点击流、互联网交易、日志等多种数据源生成了大规模、多元化、复杂、长期的包括结构化、半结构化和非结构化的分布式数据集,被称为""大数据""。对国内银行业来说,大数据并不是全新概念。银行具备实施大数据战略的基本条件:一是数据量大、种类多,",2016/3/7,2016
CJFD2016,基于甲亢临床指标的多维时间序列关联度分析,王致强;乐嘉锦;陈德华;,东华大学计算机科学与技术学院;,计算机与现代化,高斯混合模型;;多维分析;;关联支持度;;甲亢,"近年来,对临床医疗数据的挖掘分析越来越热,医疗数据中包含很多有价值的信息等待被挖掘。对基于时间序列的临床指标数据流进行关联度分析,从中发现临床指标相互之间变化趋势的相关性,对于开展精准医疗具有非常重要的价值。本文将高斯混合模型运用于临床医疗数据流的关联度分析中,提出关联支持度的方法来衡量指标之间的关联关系的强弱程度。最后通过分析100多位甲亢患者临床指标数据流,计算出各个指标对的关联支持度,得出各指标相互之间关联度的强弱关系。",2016/4/15,2016
CJFD2016,抗大数据分析的隐私保护:研究现状与进展,仝伟;毛云龙;陈庆军;王彬入;张保佳;仲盛;,南京大学计算机科学与技术系;南京大学计算机软件新技术国家重点实验室;,网络与信息安全学报,隐私保护;;大数据;;差分隐私;;地理位置隐私,"隐私保护对于大数据时代的数据分享和利用起到了至关重要的作用。传统的隐私保护方法无法有效地应对在大数据环境中可能存在的数据间的深度关联带来的隐私泄露。因此,需要能够抗大数据分析的隐私保护方法。首先,调研了国内外学者的相关研究工作,并将当前和抗大数据分析的隐私保护相关的工作总结为海量高维异构数据隐私保护、地理位置隐私保护以及高可用性隐私保护发布方案3个方面。其次,着重介绍了南京大学COSEC研究团队在这方面取得的一些研究进展。最后,得到了抗大数据分析的隐私保护的重要性和前瞻性的结论,并介绍了未来可能的研究方向。",2016/4/15,2016
CJFD2016,多源日志的远程存储和分析管理,毕红双;王宝生;张京京;,国防科学技术大学;,信息通信,日志数据;;日志数据的远程备份;;统一日志格式;;数据挖掘,"在现代计算机系统和软件开发过程中日志数据越来越受到业内人士的普遍重视。文章旨在实现对日志数据的远程备份并按照一定的规则挖掘出对后续的日志管理有帮助的记录。首先使用TCP可靠传输协议把日志数据存入到远端服务器上,为了实现对日志数据的较为全面的分析管理,把不同格式的日志数据做统一化处理,并写入到数据库中,实现对日志数据的安全管理。",2016/3/15,2016
CJFD2016,高效用项集挖掘算法综述,刘畅畅;,河南大学计算机与信息工程学院;,福建电脑,高效用项集;;效用挖掘;;频繁项集;;数据挖掘,"本文介绍了高效用项集挖掘的基本概念,列举并分析了三个高效用项集挖掘算法,指出了它们的优缺点,最后展望了高效用项集挖掘的未来研究方向。",2016/3/25,2016
CJFD2016,基于信息熵改进的K-means动态聚类算法,杨玉梅;,川北医学院图书馆;,重庆邮电大学学报(自然科学版),K-means算法;;信息熵;;数据挖掘;;动态聚类,"初始聚类中心及聚类过程产生的冗余信息是影响K-means算法聚类性能的主要因素,也是阻碍该算法性能提升的主要问题。因此,提出一个改进的K-means算法。改进算法通过采用信息熵对聚类对象进行赋权来修正聚类对象间的距离函数,并利用初始聚类的赋权函数选出质量较高的初始聚类中心点;然后,为算法的终止条件设定标准阈值来减少算法迭代次数,从而减少学习时间;最后,通过删除由信息动态变化而产生的冗余信息来减少动态聚类过程中的干扰,以使算法达到更准确更高效的聚类效果。实验结果表明,当数据样本数量较多时,相比于传统的K-means算法和其他改进的K-means算法,提出的算法在准确率和执行效率上都有较大提升。",2016/4/15,2016
CJFD2016,Apriori算法在三二分段成绩分析中的应用,苏伟斌;,东莞理工学校;,电子技术与软件工程,Apriori算法;;成绩分析;;数据挖掘,"本文介绍了Apriori算法的基本概念并以本人所在的中职学校计算机专业为例,介绍了使用Apriori算法来挖掘数据之间关联性的方法,找出规律,分析结果,为实际教学工作提供理论支持。",2016/4/19 17:19,2016
CJFD2016,内蒙古电力数据仓库的应用,张瑜;潘红芳;,内蒙古电力(集团)有限责任公司信息通信中心;,电信科学,电力大数据;;数据中心;;数据仓库,"随着电力信息化的发展,电力数据的积累速度越来越快,如何使大数据产生价值、为公司科学发展提供支持的议题被越来越多地提及。内蒙古电力公司从2011年开始建设一体化平台数据中心,当前已经完成了公司各业务口的数据集成工作,为数据利用提供了基础。依据建设的一体化生产经营决策分析系统建设情况,从应用需求、应用技术、数据分析挖掘3个方面介绍了内蒙古电力公司在大数据背景下的数据仓库应用的探索与尝试。总结了建设成果与建设经验,得出做好分析展现应用的关键是需求管理,核心技术是数据挖掘的结论。",2016/4/20,2016
CJFD2016,基于数据平台的智能协同设计系统研究,耿明;,中铁第四勘察设计院集团有限公司;,铁道工程学报,数据平台;;智能;;设计;;总线;;协同;;信息标准,"研究目的:目前协同设计系统主要为基于文本库的传统作业系统,设计数据提取、加工、使用、挖掘困难,影响设计进度和质量。智能数据协同设计平台的关键技术、构建方案需要进行深入研究。研究结论:(1)基于数据平台的协同设计关键技术主要有信息标准建立、设计数据及标准结构化、数据标准建立与维护、多专业标准化协同作业模式、应用软件研发、智能设计与在线设计集成、数据挖掘与抽取、系统展现等;(2)智能协同设计系统可大幅提高设计速度与设计质量,可在资源、行为、交付维度单独或同时提供文本(含音视频)、数据、BIM成果;(3)基于数据平台技术的智能协同设计系统是工程设计现代化的发展方向,也是建设协同系统现代化的基础和前提...",2016/4/15,2016
CJFD2016,ID3算法在程序设计类课程成绩分析中的应用研究,刘敏娜;,咸阳师范学院信息工程学院;咸阳师范学院图形图像处理研究所;,电子设计工程,ID3算法;;MATLAB;;决策树;;数据挖掘,"基于分析学生成绩主要影响因素的目的,采用了ID3算法完成决策树的生成。算法包括数据采集、数据处理、绘制决策树、决策树剪枝、去噪和模型准确性评估等阶段。模型选取软件工程专业2012级1班的学生的《JAVA程序设计》课程期末考试成绩和学生的基本情况信息等数据作为训练数据。经过反复训练,模型能够根据输入学生的基本信息分析出学生的学习成绩优,良,差的概率。该决策树准确率为90%,能够满足用户需求,决策树模型符合要求。",2016/5/5,2016
CJFD2016,关联规则挖掘算法FP-Growth在高职网络技术专业学生成绩分析中的应用,罗拥军;罗云芳;,广西职业技术学院计算机与电子信息工程系;,河池学院学报,关联规则;;FP-Growth算法;;成绩分析,"从大量的成绩数据中进行数据挖掘并从中获得有价值的信息,是一件非常有意义的研究。以计算机网络技术专业学生10年的成绩作为数据源,运用基于关联规则的FP-Growth算法,研究5门课程之间的关联,为制订该专业人才培养方案提供参考和借鉴。",2016/4/15,2016
CJFD2016,开源机器学习Weka环境下的数据分类算法实现及应用,韩建宁;,西安石油大学计算机学院;,信息系统工程,Weka;;机器学习;;数据发掘;;分类,"针对天气变化的多样性,传统的分析方法已经难以适应及时分析天气变化的趋势。因此,本文以weka数据挖掘平台作为分类模型的数据样本建立工具解决了数据变化太大不易分析,数据多不好分析的问题。利用所收集的两周的天气数据作为小样本进行试验,实验表明,Weka平台可以有效地分析天气数据。",2016/4/20,2016
CJFD2016,差分隐私保护在推荐系统中的应用研究,鲜征征;李启良;,广东金融学院计算机科学与技术系;中山大学数据计算与计算机学院;,计算机应用研究,推荐系统;;个人隐私保护;;差分隐私;;矩阵分解,"推荐系统已经成为Internet商家给用户提供个性化服务的高级商务智能平台之一,然而,用于研究推荐系统的数据信息里往往存在能够被攻击者直接或者间接获取的个人隐私。近年来受到极大关注的差分隐私保护是一种非常严格的、可证明的隐私保护模型。针对目前流行的协同过滤算法之一的矩阵分解进行了研究,提出了采用差分隐私保护技术对原始输入数据进行预处理和扰动处理的新方法。最后通过在真实数据集上进行相关实验验证,结果表明提出的带差分隐私保护的矩阵分解算法达到了预期:既能保护用做推荐研究的原始数据集的隐私,又没有严重影响推荐的准确率。",2015/9/29 10:18,2016
CJFD2016,基于CUDA的并行谱聚类社区挖掘算法,蒋莉芳;苏一丹;覃华;,广西大学计算机与电子信息学院;,山西电子技术,社区挖掘;;CUDA;;并行计算;;谱聚类;;大规模网络,"社会网络和社交媒体数据具有大规模、高维度的特性,社区挖掘算法的计算效率是一个值得研究的问题。针对此问题,本文利用CUDA并行计算架构,提出一种并行的谱聚类社区挖掘算法,首先对高维的社会网络数据集进行降维,再用CUDA的并行计算能力提高谱聚类算法的计算效率。实验表明,本文所提算法能有效地提高社区挖掘算法的计算速度,并行计算效率较常规算法有5~8倍的提高,为社区挖掘计算提出一种新的思路。",2016/4/15,2016
CJFD2016,基于MapReduce和矩阵的频繁项集挖掘算法,周国军;龚榆桐;,玉林师范学院数学与信息科学学院;,微电子学与计算机,MapReduce;;Hadoop平台;;矩阵;;频繁项集;;关联规则,"为了能高效地从大数据集中挖掘所有频繁项集,提出了一种基于MapReduce和矩阵的频繁项集挖掘算法.该算法将事务数据库转化为矩阵,按照垂直划分方法将矩阵分解成多个规模相同的子矩阵,根据MapReduce模型将子矩阵分配给计算机集群的节点,各节点并行对子矩阵计算候选项集的支持度.该算法在执行过程中产生的通信量较少,实现了节点计算任务的负载平衡.在Hadoop平台上测试了算法的性能,实验结果表明该算法具有较好的加速比和可扩展性,适合对大数据集挖掘频繁项集.",2016/5/5,2016
