SrcDatabase-来源库,Title-题名,Author-作者,Organ-单位,Source-文献来源,Keyword-关键词,Summary-摘要,PubTime-发表时间,Year-年
CJFD2016,大数据带来的机遇和挑战,赵永霞;罗建平;,武昌理工学院;武汉凯默电气有限公司;,通讯世界,大数据;;互联网;;数据挖掘,"大数据的发展给我们带来的诸多的好处,人们在教育、生产、生活等方面的认知与发展都在逐渐的改善。现今阶段,无论是手机、电脑、监视器或者其他的电子设备上都有大数据的身影,可以说,大数据正逐步的将生物体与非生物体之间进行了链接,与此同时,例如一些商业的机密、个人的隐私等等也会受到一定的泄露的危险。本文就大数据发展过程中的挑战与机遇进行了详细的阐述。",2016/4/25,2016
CJFD2016,基于关联分析的高等数学试卷分析及其R软件实现,李强丽;李慧;谭立云;,华北科技学院基础部;,现代计算机(专业版),试卷分析;;R软件;;关联规则,"近年来数据挖掘技术得到了迅猛发展,其应用也越来越广泛。可采用R软件,利用Apriori算法对高等数学上、下册试卷成绩的进行关联分析,从而揭示高等数学各主要知识点之间的关系,为学生的学习以及教师的教学提供指导。",2016/6/5,2016
CJFD2016,复杂网络中基于WCC的并行可扩展社团挖掘算法,亚森·艾则孜;李卫平;郭文强;,新疆警察学院信息安全工程系;铁道警察学院公安技术系;新疆财经大学计算机科学与工程学院;,计算机应用与软件,复杂网络;;社团挖掘;;并行算法;;可扩展性,"WCC(Weighted Community Clustering)通过复杂网络中社团含有的三角数量来评价社团挖掘算法的性能。在原始的WCC算法中,需要在每次迭代中对所有的社团变化计算WCC值,因而计算量非常大。为了减小社团变化带来的WCC计算量,提出一种并行可扩展的社团挖掘算法。对应用WCC进行社团评价的方法进行分析,提出一种包含预处理、初始划分和划分改进三个阶段的并行社团挖掘算法。在划分改进中,由于每次社团变化都需要计算大量的WCC提升,基于社团的统计量提出一种WCC近似计算方法。大量的真实数据集实验表明,提出的社团挖掘算法与相关算法相比较,不仅社团检测的准确性更高,而且具有更好的并行可扩...",2016/6/15,2016
CJFD2016,面向民生科技的智能健康系统发展策略,陶永;孙立宁;刘文勇;王田苗;匡绍龙;,北京航空航天大学航空科学与技术国家实验室(筹);中国航空工程科技发展战略研究院;苏州大学机电工程学院;北京航空航天大学生物与医学工程学院;北京航空航天大学机械工程及自动化学院;,科技导报,智能健康;;健康大数据;;精确诊疗;;生物三维打印;;微创手术;;助老助残,"围绕中国老龄化社会与民生科技发展对智能健康系统的需求迫切,介绍了智能健康系统的内涵与特征,阐述了健康大数据挖掘、个性化植入/介入生物三维打印、个体化精准诊疗、生肌电融合及助老助残等智能健康系统的基础科学问题与关键技术。围绕智能健康系统的应用领域、基础研究领域,介绍了国际研究的创新前沿与进展,国内智能健康系统的研究现状、优势单位与进展情况。",2016/5/13,2016
CJFD2016,关联规则挖掘以改进朴素贝叶斯,俞杰;丁晓剑;崔鹏;,信息系统工程重点实验室;,舰船电子工程,朴素贝叶斯;;条件独立性假设;;项目集,"朴素贝叶斯算法是建立在条件独立性假设上的,但是在实际应用中,类属性条件独立假设并不成立。针对这个问题,结合关联规则方法构造一个改进的朴素贝叶斯分类器。通过挖掘感兴趣的和频繁的项目集,深入研究样本算法中的属性联系。使随后运用朴素贝叶斯方法的各个属性尽量属性独立,达到朴素贝叶斯分类器的要求。实例标签方法改善了朴素贝叶斯的分类性能。",2016/5/20,2016
CJFD2016,我国海事大数据应用现状、前景及对策,罗本成;许世博;,交通运输部水运科学研究院;,水运管理,海事信息化;;大数据;;数据服务;;海事监管,"为使海事大数据发挥其应有的作用,促进海事监管和服务模式创新,分析我国海事大数据应用现状和问题,展望海事大数据的应用前景,提出对策和建议:从顶层视角做好海事大数据战略规划,适时出台专项指导意见;找准关键环节和突破口,大力推进海事大数据示范应用;加快搭建统一的海事大数据云服务平台,完善平台运行机制;拓展和延伸海事数据社会价值,推进海事大数据应用创新和突破;充分利用社会资源,推进海事数据资源的深度挖掘和加工再利用;优化海事大数据应用生态环境,构建完善海事大数据生态产业链;大力培育海事大数据应用专业人才队伍。",2016/5/20,2016
CJFD2016,电动汽车领域的大数据处理与分析,潘鸣宇;张禄;孙舟;王伟贤;郑静楠;,国网北京市电力公司;,电气应用,电动汽车;;充换电设施;;大数据,"为推动电动汽车这一新兴行业的发展,需要对其行业特点进行深入研究,通过运用大数据技术对电动汽车产业的运行数据、运营数据进行数据分析处理,揭示电动汽车产业的特性。",2016/5/5,2016
CJFD2016,基于投影的高效用项集挖掘算法,王敬华;罗相洲;吴倩;,华中师范大学计算机学院;,小型微型计算机系统,投影;;高效用;;频繁项集;;模式挖掘,"随着高效用模式挖掘算法在实际应用中的重要性逐步显著,因而其得到了越来越多的关注和研究,但是已知的一些算法存在着多遍数据集扫描以及会产生大量候选项集、时效性不高等问题.这些问题使得高效用模式的挖掘效率大大降低,故本文提出一种新的基于投影的高效用项集挖掘算法HUPMP(high utility pattern mining on projection).采用基于投影的方式将项集的信息存储在数组中,能有效的减少前人基于树结构建树所产生的耗时.同时HUPMP算法将多次数据集扫描减少为只需要进行两次数据集的扫描便可挖掘出所有的高效用模式.另外,针对会产生大量候选项集的问题,提出了一种不同于闭包属性的新性...",2016/6/15,2016
CJFD2016,近场通信技术的安全研究进展与发展趋势,张玉清;王志强;刘奇旭;娄嘉鹏;姚栋;,中国科学院大学国家计算机网络入侵防范中心;西安电子科技大学综合业务网理论及关键技术国家重点实验室;北京电子科技学院;,计算机学报,近场通信技术;;安全威胁;;研究进展;;发展趋势;;网络安全;;信息安全;;网络空间安全,"随着移动互联网和移动支付的发展,NFC技术因其天然的安全特性和便利性,成为运营商、银行、厂商等热捧的对象.由于涉及到移动支付和敏感信息的传输,该技术也受到安全研究人员和攻击者的广泛关注.虽然国内外安全专家和学者对NFC安全问题已进行了一定的研究,但目前还没有详细和全面介绍最新安全研究成果的论文.为解决此问题,该文分析和总结了国内外最新的研究成果,并对NFC安全问题未来的研究方向进行了展望.首先,介绍了NFC技术的基本特性、通信过程、协议栈、工作模式等,分析了该技术面临的安全威胁,包括通信安全、安全漏洞、安全元件、恶意软件、网络钓鱼等内容.然后,通过分析相关研究工作,总结了NFC技术的安全研究现...",2015/11/19 12:32,2016
CJFD2016,基于K-means聚类算法的公交行程速度计算模型,高曼;韩勇;陈戈;张小垒;李洁;,中国海洋大学信息科学与工程学院;,计算机科学,公共交通;;平均行程速度;;K-均值聚类算法;;数据融合;;数据挖掘,"定位与无线装置在公交系统中的广泛应用使得获取实时公交数据成为可能。为挖掘这些数据中蕴含的道路交通状况信息,提出了一种基于K-means聚类算法的数据融合模型,来计算相邻公交站点间的平均行程速度。首先对K-means聚类算法进行改进:(1)聚类数K不是预先设定的固定值,而是不重复样本数的平方根,不同路段不同时段K值不同;(2)初始聚类中心不是随机选取,而是根据K值按一定规则选取。其次利用改进的算法对样本数据进行聚类,然后对各类数据进行加权融合,计算出平均行程速度。最后通过折线图对青岛市4个城区的行程速度进行分析,挖掘交通流的演变规律。研究结果为交通管理、居民出行等提供了强有力的支持。",2016/6/15,2016
CJFD2016,基于Android平台的图书阅读推荐系统,丁勇;朱长水;,南京理工大学泰州科技学院;,计算机科学,图书推荐;;Android;;关联规则;;FP-Growth,"随着移动互联网技术的发展,通过手机进行阅读已经成为人们的一种生活习惯。为了帮助读者在成千上万的""书海""中找到自己喜欢的图书,提出将经典的频繁项集挖掘算法FP-Growth应用到图书推荐系统中。算法根据读者的历史阅读记录,挖掘频繁出现的图书阅读组合,提取满足最小支持度和最小置信度阈值的强关联性规则,并根据关联规则进行图书智能推荐。实例证明该系统能够为读者提供快速、准确的智能推荐服务。",2016/6/15,2016
CJFD2016,软件开发中的活动模式挖掘,吉才盈;代飞;李彤;蒋旭东;,云南大学软件学院;云南省软件工程重点实验室;,计算机科学,过程挖掘;;原子活动;;活动模式;;折叠;;软件过程,"如何获取实际运作的软件过程(而非经验过程)是一个关键问题。软件过程的事件数据呈现记录多、无明确活动与独具过程特性的特点,使得现有的业务过程挖掘方法难以被有效应用。首先获取事件日志的原子活动;然后采用折叠的方法从软件项目开发实例中挖掘活动模式,获取软件过程,对不同时期的软件开发行为进行分析;最后通过一个开源项目的实际案例来验证该方法。",2016/6/15,2016
CJFD2016,点击欺诈群体检测与发现,董亚楠;刘学军;李斌;章玮;,南京工业大学计算机科学与技术学院;中国人民解放军73677部队;,计算机应用研究,点击欺诈;;欺诈群组;;孤立点检测;;贝叶斯分类,"针对目前存在大批网络用户,以群体形式来欺诈点击的问题,提出了一种检测点击欺诈群组的方法。首先使用频繁项集挖掘算法来发现共同点击过大量广告的个体用户,作为疑似欺诈组。然后,在对组内用户点击行为属性分析的基础上,运用孤立点检测方法找到与组内其他用户有显著差异的疑似欺诈用户。最后,运用贝叶斯分类方法对检测到的所有疑似欺诈成员分类,得到真正的欺诈群组和欺诈用户。在真实的数据集上进行的实验,验证了该方法的可行性和有效性。结果表明,该方法为点击欺诈检测问题提供了一条新的思路。",2015/9/29 11:19,2016
CJFD2016,大数据下微博推荐算法,张磊;吾守尔·斯拉木;买买提依明·哈斯木;于清;,新疆大学多语种信息技术实验室;,激光杂志,数据挖掘;;社交网络;;并行计算;;推荐系统,"为了提高微博推荐算法的准确率和解决社交网络平台海量信息的问题。基于LDA(Latent Dirichlet Allocation)三层模型提出C-LDA(Collaborative Latent Dirichlet Allocation)四层模型,该模型不仅考虑被转发者对转发者的影响而且考虑了关注者产生的影响。综合特征词热度、用户负样本反馈以及遗忘曲线等因素改进吉布斯采样算法,使用改进后的吉布斯采样算法近似求解C-LDA模型。然后运用模型中用户与微博的主题概率向量计算相似度,进行Top-K微博推荐。与以往方法相比,该方法适用于具有时效性和互动性的微博应用场景,推荐的效果更加理想。最后基于Had...",2016/6/25,2016
CJFD2016,大数据在企业精益管理中的探索与应用,时小麟;薛训明;陆琨;石蕴玉;汪飞;,安徽中烟工业有限责任公司;,电脑知识与技术,大数据;;数据挖掘;;应用探索,"""大数据""是近年来兴起的热门词汇,并在很短时间内迅速渗透到每个行业,成为重要的生产因素。基于大数据的预测、分析将逐步融入企业管理和决策中。大数据技术和思维将影响企业管理与决策的各个环节,本文通过实例介绍了大数据在卷烟制造企业的应用。",2016/5/26 11:27,2016
CJFD2016,一种基于Hadoop的大规模Internet频繁闭图挖掘算法,张岩庆;陆余良;杨国正;朱凯龙;,电子工程学院网络工程系;,四川大学学报(工程科学版),Hadoop;;动态网络;;大规模Internet;;频繁闭图,"针对当前单机模式下频繁闭图挖掘算法无法处理大规模Internet数据集的问题,通过改进Apriori算法,提出基于Hadoop的迭代式频繁闭图挖掘算法AMR(Apriori based on MapReduce)。首先将动态网络的边集存储在键值表中,并设计了序列化子图编码方案以确保频繁子图的唯一性;然后提出了一种传递子图编码的通信机制,通过整合每个分片的支持度得到全局支持度,从而确保了频繁闭图的准确性;最后通过剪枝得到动态网络的频繁闭图。将AMR算法分别运用于国家级和AS级Internet的动态网络中。结果表明,频繁闭图能够准确表征Internet骨干网络的拓扑结构,说明AMR算法能够快速且有...",2016/7/20,2016
CJFD2016,基于智能交通数据下的否定关联规则实验研究,孙剑斐;叶娅;,河南师范大学新联学院;,电子世界,智能交通;;数据挖掘;;否定关联规则,"目前,交通系统中的数据增长越来越快,特别是公交系统的数据采集和技术分析日益纷杂,伴随着数据的快速增长无疑是告知我们智能交通的大数据时代已经来临。当然,公交数据这类资源和其它资源相比,又有着其特殊性,一种快速且高效的公交数据采集方法,对于城市的公交系统有着其重要的作用,倘若数据这类资源不能得到有效利用,那么给市民出行带来将会是一种沉重的负担。本文主要利用大量公交IC卡刷卡的相关数据进行有效处理与分析,对否定关联规则算法进行深化研究。",2016/7/23,2016
CJFD2016,基于通联数据的人际关系网络构建与挖掘,曲洋;王永剑;彭如香;姜国庆;,公安部第三研究所信息网络安全公安部重点实验室;,信息网络安全,通联日志;;人际网络;;用户串并;;关系预测;;SVM,"网络通讯已然成为了信息时代最具代表性的产物,用户之间的社交关系也变得越来越清晰、越来越重要。文章通过模拟通联数据,利用中文分词、自然语言处理等技术构建反映人际关系的通联好友网络,并设计了一种适用于好友网络人际关系预测的多分类算法。该算法首先利用层次聚类对原始数据进行聚类并结合人工干预,确定最终类的个数,从而有效避免通联分组信息的多义词性造成的类别数过多的问题,然后以通联来往记录等信息为基础设计分类特征,最后利用在小样本下,具有复杂决策边界建模能力的支持向量机(Support Vector Machine,SVM)进行训练,得到适用于人际关系预测的分类模型,并用于未知人际关系的预测。",2016/6/10,2016
CJFD2016,基于关联规则挖掘的跨网络知识关联及协同应用,黄晓雯;严明;桑基韬;徐常胜;,中国科学院自动化研究所模式识别国家重点实验室;中国—新加坡数字媒体研究院;,计算机科学,跨网络关联;;关联规则挖掘;;视频推荐,"随着社交媒体的兴起,各种社交媒体服务应运而生,社交媒体多源化现象越来越明显。一种基于关联规则挖掘的方法可以用来分析研究社交媒体多源现象,即通过同一个用户与不同社交媒体上多源数据的行为交互,挖掘社交媒体多源数据知识关联,进而设计跨网络协同的视频推荐应用。本研究框架主要分为3个步骤:(1)基于主题建模的知识发现,对用户和视频进行主题建模,得到其在主题层上的表示;(2)基于关联规则挖掘的跨网络知识关联,以跨网络共同用户作为连接不同网络的桥梁,利用关联规则的方法挖掘不同网络间的知识关联;(3)基于跨网络知识发现的冷启动视频推荐,将用户和视频映射到同一主题空间并进行主题匹配,最终进行视频推荐。实验结果表...",2016/7/15,2016
CJFD2016,大数据技术在重载铁路运营中的应用研究,孙云;,朔黄铁路发展有限责任公司机辆分公司;,电子技术与软件工程,大数据;;重载铁路;;机务系统;;应用,"随着铁路重载运输技术及装备水平的提高,重载铁路在运营安全、运输效率、基础设备建设、维护等方面面临巨大的挑战。本文通过对大数据技术的分析,提出重载铁路建立数据中心、搭建数据平台等应用大数据技术来提高运营效率和管理决策能力,并以西煤东运第二大通道朔黄铁路机务系统大数据应用为例,在数据收集、分析、挖掘上进行了初步探讨,取得了初步成效。",2016/7/21 9:43,2016
CJFD2016,第三方支付粗糙复杂网络知识发现方法研究,曹黎侠;黄光球;李艳;,西安建筑科技大学管理学院;西安工业大学理学院;,计算机科学与探索,第三方支付;;粗糙复杂网络;;时间序列分析;;知识发现,"第三方支付平台的可持续发展是一个错综复杂的问题,解决问题的关键之一是平台潜在客户的挖掘。建立了第三方支付粗糙复杂网络,通过对该粗糙复杂网络的上下近似度、度分布和度的概率主值的研究,构建了第三方支付粗糙复杂网络知识发现模型,给出了基于粗糙集理论的时间序列分析法的求解方法。第三方支付粗糙复杂网络知识发现方法的研究,为第三方支付平台潜在客户的挖掘提供了定量化可操作的方法。提出了粗糙复杂网络的有关概念,以及第三方支付粗糙复杂网络的度分布,为第三方支付有关问题的研究奠定了理论基础;知识发现方法的研究,适应了动态知识系统更新的需求,因此有着广泛的应用前景。",2016/2/3 11:26,2016
CJFD2016,一种新的链接预测方法在复杂网络中的应用,李奋华;,运城学院计算机科学与技术系;,电脑知识与技术,数据挖掘;;链接预测;;复杂网络;;无标度;;聚类信息,"作为复杂网络分析的一项重要任务,链接预测已经被应用到诸多领域,例如:个性化推荐、决策支持系统和犯罪调查等。常用的链接预测方法主要是基于网络拓扑结构的方法,没有考虑网络的聚类信息因素。实际上,网络的聚类结果包含了对链接预测很重要的信息。在此基础上,一种基于聚类信息和网络特征的链接预测模型被提出,并在人造和真实网络数据集上进行了验证,具有较好的预测效果。",2016/8/9 16:14,2016
CJFD2016,文本挖掘技术在电力工单数据分析中的应用,邹云峰;何维民;赵洪莹;程雅梦;杨红;,江苏省电力公司电力科学研究院;上海希尔企业管理咨询股份有限公司;,现代电子技术,95598工单;;文本挖掘;;文本分类;;自动分类;;用电诉求,"文本挖掘技术为文本分析提供了方法和技术支持,以文本挖掘中的文本分类技术为基础,简要介绍文本预处理、文本分类器模型构建的方法和过程,并以供电服务过程中客户通过供电服务中心反映的热点事件为实例,建立95598工单文本自动分类的模型,通过验证实现95598工单文本快速精准的自动分类,及时准确地挖掘出隐藏的重要信息,并且为分析供电服务对客户的用电诉求的影响提供依据和数据基础。",2016/9/1,2016
CJFD2016,中医医案数据库的构建及其应用研究,翁晓兰;申力;贾佳;吕瑛;陈裕;杨晓娟;,浙江中医药大学;上海生物信息技术研究中心;,浙江中医杂志,中医医案;;数据库;;名老中医经验;;数据挖掘;;医案分析,"文章构建了由中医数据库与方剂筛选系统相结合的名老中医临床信息分析平台,利用结构化医案方剂录入模块将临床病例数据化,利用医案方剂分析系统模块进行分析挖掘,形成知识挖掘。应用方面,结合浙江省中医院吴良村教授的门诊病历,开展肺癌疾病关乎中医治疗的医案实例分析。",2016/8/16,2016
CJFD2016,商务智能实践教学内容设计与方法研究,胡敏;,北京信息科技大学信息管理学院;,教育现代化,商务智能实践;;模块化教学,"本文主要研究信息管理专业商务智能实践教学内容、方法和基本步骤。课程按照知识点难易,可以做两类划分,一是课程总体分为基础内容模块和高级主题模块;二是对较为复杂的章节或算法,或对单个知识点的基础和高级模块的划分。商务智能实践课程需要让学生实现由问题找方法,进而深入理解方法的过程,需要学生对数据准备、数据挖掘、结果分析的三个阶段有深刻的认识。",2016/8/29,2016
CJFD2016,基于Web日志挖掘和相关性度量的电子商务推荐系统,马勇;鲜敏;郑翔;黎远松;,四川工程职业技术学院电气信息工程系;四川理工学院计算机学院;,计算机系统应用,Web日志挖掘;;推荐系统;;相关性度量;;电子商务,"基于Web日志挖掘的个性化推荐技术已在电子商务网站中广泛应用,针对现有推荐系统的准确性不高等问题,提出一种基于Web日志挖掘和相关性度量的个性化推荐系统.首先,提取用户的访问日志,并对其进行预处理,以获得精简的结构化数据.然后,对日志进行分析,提取出特征序列.再后,根据特征的出现频率和页面停留时间,计算出页面与交易文本文档的相关性.最终,利用夹角余弦公式计算出用户与页面的相关性,并以此形成推荐列表.实验结果表明,该方案能够根据用户偏好精确的给出个性化推荐.",2016/8/15,2016
CJFD2016,基于我校微博数据的统计分析及其可视化,任勇;程玉胜;黎康;王一宾;,安庆师范学院计算机与信息学院;,信息系统工程,文本挖掘;;微博;;文字云;;统计分析,"微博在网民中快速增长,已经成为一个重要的公众媒介,它不仅是网民从中获取新闻热点和结交朋友的重要工具,而且成为社会公共舆论的重要平台之一。然而,微博每天产生大量的短文本数据,如何高效的从这些文本数据中进行统计分析,挖掘出有效信息,也是新媒体时代统计工作者的重要课题。本文以安庆师范学院学生会在新浪微博平台上发布的信息为例,利用R语言等工具,进行了相关统计分析,并改进了高频词的文字云显示方式,最后将主题词以更加直观的文字云形式展示出来。",2016/8/20,2016
CJFD2016,商业银行大数据的应用现状与发展研究,信怀义;,东北财经大学金融学院;中国建设银行北京数据中心;,中国金融电脑,数据种类;客户数据;深层挖掘;量化管理;风险防控;决策判断;发展研究;外部欺诈;经济发展;应用技术;,"商业银行经过多年的发展拥有海量的客户数据、交易痕迹数据、经济发展信息数据等。商业银行在战略转型中科学利用好大数据,必将提升核心竞争力、促进量化管理变革、拓展业务发展空间、提升决策判断能力、提高风险防控能力。当前,商业银行需要进一步建立大数据的理念并转变思维观念,加大对大数据的深层挖掘利用,重视大数据的高端人才培养,建立具有特色优势的大数据应用平台,创新大数据应用技术。",2016/8/7,2016
CJFD2016,基于关键词网络的热点关键词及热点项目挖掘,郭静;陈泽亚;王庆;,中国科学技术大学计算机科学与技术学院;中国科学技术大学苏州研究院;,计算机应用与软件,热点关键词;;项目—专家网络;;相关度;;热点项目;;权重,"针对传统使用频数挖掘热点关键词不能保证有效完整地挖掘出数据库中的热点关键词,提出基于项目、专家对应的关键词数据,分析不同项目关键词之间的相关度,从而建立""项目与专家""网络关系。其创新点在于用双层结构来连接专家、网络、关键词,计算关键词的热度值,挖掘出热点关键词及热点项目。实验结果表明,该方法更能准确地挖掘出项目中的热点关键词,避免了单纯频数计算热点关键词带来的片面化问题。",2016/8/15,2016
CJFD2016,基于协议分析与模糊测试的SIP漏洞挖掘研究,李进东;王韬;吴杨;雷东;,军械工程学院信息工程系;,计算机工程,会话初始协议;;协议分析;;漏洞挖掘;;模糊测试;;测试用例,"针对会话初始协议(SIP)可能存在的安全漏洞以及对SIP漏洞挖掘研究工作不足的问题,基于协议分析与模糊测试,提出一种SIP协议漏洞挖掘方案。该方案在分析SIP协议语法、格式和会话流程的基础上,对可能出现漏洞的SIP消息生成对应的畸形数据包作为模糊测试的测试用例,并在会话建立的过程中随机发送畸形数据触发测试目标,在监视到SIP客户端发生异常时记录异常信息,并分析导致异常的错误是否能被利用。实验结果表明,该方案能更全面地挖掘出由协议分析结果和模糊测试发现的SIP漏洞,提高挖掘数量和效率。",2016/8/15,2016
