SrcDatabase-来源库,Title-题名,Author-作者,Organ-单位,Source-文献来源,Keyword-关键词,Summary-摘要,PubTime-发表时间,Year-年
CJFD2015,基于Hadoop云平台的分布式支持向量机,张小琴;胡景;肖炜;,三明学院现代教育技术中心;,山西师范大学学报(自然科学版),Hadoop云平台;;数据挖掘;;支持向量机;;云计算,"支持向量机(Support Vector Machine,SVM)在解决小样本、非线性以及高维模式识别问题中都表现出了良好的性能.然而,在实际问题中随着数据集规模的增大,该算法寻找全局最优支持向量的过程变得十分缓慢,甚至无法在有效的时间和实际环境允许的条件下得到训练模型.本文结合当前流行的分布式解决方案——Hadoop云平台,设计并实现了一种并行化SVM算法.通过在UCI标准数据集上的实验进行分析,结果表明,与传统的单机SVM算法相比,在不显著降低预测精度的前提下,训练时间复杂度得到了比较明显的降低.",2015/12/30,2015
CJFD2015,城市交通大数据技术及智能应用系统,熊刚;董西松;朱凤华;季统凯;,中国科学院自动化研究所复杂系统管理与控制国家重点实验室;中国科学院云计算中心;青岛智能产业技术研究院;,大数据,城市交通;;大数据;;云计算;;物联网,"城市交通大数据具有种类繁多、异质性、时空尺度跨越大、动态多变、高度随机性、局部性和生命周期较短等特征,如何有效地采集和利用交通大数据,满足高时效性的交通行政监管、交通企业经营管理、交通市民服务等应用需求,是城市交通和智慧城市面临的前所未有的机遇和挑战。重点分析总结了城市交通大数据的若干研究内容及核心技术,提出了城市交通大数据智能应用系统解决方案,列举了几种典型应用,在城市交通和智慧城市领域的大数据研发和应用领域进行了初步探讨。",2015/11/20,2015
CJFD2015,基于MOODLE的学习者网络学习行为分析,满宴辰;田鹏;,吉林建筑大学;,通讯世界,MOODLE;;网络学习行为;;数据挖掘,"随着素质教育改革的日益深入,以学生为主体的教学理念得到了学术界的广泛关注,为了提高学生的综合能力,培养学生的创新精神,要积极转变教学方式。在科学技术水平不断提高的背景下,终身学习的教育理念成为了未来教育发展的重要方向,网络教学作为现代教育的重要方法,影响着越来越多的学习者。为了帮助高校教育者更好的利用这一新的学习模式,本文分析了基于MOODLE平台的学习者网络学习行为。",2015/12/25,2015
CJFD2015,基于聚类分析的二分网络社区挖掘,张嫱嫱;黄廷磊;张银明;,桂林电子科技大学计算机科学与工程学院;中国科学院电子学研究所;,计算机应用,二分网络;;资源矩阵;;谱聚类算法;;特征值;;特征向量;;模块度,"针对二分网络中社区挖掘的准确性不高、对额外参数的依赖较大的问题,基于谱聚类算法的思想,从二分网络的拓扑结构展开,提出了一种改进的社区挖掘算法。该算法将二分网络映射到单一网络进行社区挖掘,采用资源分布矩阵替代传统的邻接矩阵,挖掘出同类节点间的隐含信息,有效地保证了原图的信息,改进了谱聚类算法的输入,提高了社区挖掘的准确性;将模块度函数概念应用到聚类分析中,用模块度衡量社区挖掘的质量,有效解决了自动确定聚类数目的问题。在实际网络和人造网络上进行实验,与蚁群优化算法、边集聚系数算法等算法进行对比,实验结果表明,所提算法不但能较准确地获得二分网络的社区数目,且在不需要任何额外参数的情况下,能获得很好的...",2015/12/10,2015
CJFD2015,决策系统在K-means算法中的应用,朱俚治;,南京航空航天大学信息中心;,计算机与数字工程,聚类;;决策系统;;K-means算法,"如今的聚类算法在数据挖掘和信息安全方面已有相当的应用。事实上在大数据时代之中,为了识别已知的或未知的数据则需要将通过数据聚类的算法来计算和实现。数据聚类算法是一种智能性的算法,其可以使得机器通过自我的学习来识别已知和未知的数据。目前的数据聚类算法,有基于划分的聚类算法、基于层次的聚类算法等各种的聚类算法。但在这些聚类算法中经典的算法仍然是基于距离的聚类算法,如K-means算法。因此论文的作者在查阅了一些关于距离聚类的算法之后,提出了将粗糙集中决策系统在K-means算法中进行首次的应用,这是论文的创新点。",2015/12/20,2015
CJFD2015,无线通信网络节点间通联关系的发现与更新算法,张攀峰;王世练;张炜;张尔扬;,国防科学技术大学电子科学与工程学院;,通信对抗,增量式PCA;;通联关系发现;;关联规则挖掘;;更新算法,"无线通信网络的节点间通联关系发现问题是网络层面通信对抗的一个重要问题。由于很难直接获得无线通信网络中节点间的通联关系,利用各节点的通信行为数据来进行通联关系发现是一个有价值的方向。考虑到各节点间的通信行为的关联,利用数据挖掘中的关联规则挖掘方法可以有效地从通信行为数据库中发现节点间的通联关系,将通联关系的发现问题转为关联规则挖掘问题,但现有的算法都不能高效地解决通信行为数据库变化时的通联关系更新问题。提出了一种针对无线通信网络进行节点间通联关系发现和更新的新算法。算法主要基于增量式PCA算法和矩阵变换,能够有效地从变化的庞大通信行为数据库中进行通联关系发现和更新。仿真实验表明算法在时间复杂度和...",2015/9/15,2015
CJFD2015,大数据处理流程及存储模式的改进,孙红;郝泽明;,上海理工大学光电信息与计算机工程学院;上海现代光学系统重点实验室;,电子科技,大数据;;数据存储;;数据分析;;Hadoop;;标签云,"结合大数据的特点,提出以标签云改进方案来快速识别网络热搜词,同时考虑到传统的数据仓库在查询、存储结构化数据方面的优势,在目前学者提出的数据仓库与Hadoop平台结合的基础上,提出了协作模式中与以往不同的数据迁移方式,即使用数据中间件,并通过相同数量记录导入Hadoop的时间比较,得出文中所提的数据迁移方法较Sqoop方法更具优势的结论。",2015/12/15,2015
CJFD2015,构建档案大数据应用平台的探析,陈琦;,泉州市投资贸易促进协调服务中心;,办公自动化,档案大数据;;应用平台;;建设,"档案应用大数据涉及整个档案管理系统在大数据时代发展理念、管理体制、和技术创新等方面的重大变革。通过以云计算技术取代传统的档案管理系统,数据治理和建设全国统一的档案数据模型和行业级档案数据中心,搭建集约化的档案大数据应用平台。通过档案数据的采集、智能处理、数据挖掘与智能检索三个层次,实现档案大数据应用系统开发工作。在档案应用大数据建设过程中,档案管理部门要以科学的态度,坚持实事求是的工作作风,注重档案数据应用的基础工作。制定切实可行的发展规划;提升档案管理部门大数据环境下的工作能力;大力培养档案大数据技术专业型人才。",2015/11/15,2015
CJFD2015,新一代信息安全管理平台的设计思路,徐金伟;,中国人民解放军总参某研究所;,信息安全与技术,信息安全管理;;信息安全管理平台,"论文详细地阐述了新一代信息安全管理平台的设计思路,提出了引入大数据关联分析和历史数据追溯等技术,重点防范""AET【注1】和APT【注2】""攻击的设计要点,可供从事信息安全管理平台研发的专家和技术人员参考。",2015/11/10,2015
CJFD2015,K-means聚类分析在就业管理系统中的应用研究,王志伟;王利军;,安徽经济管理干部学院;,电脑知识与技术,就业管理;;聚类分析;;数据,"学生就业管理系统可以采集毕业生的就业调查数据信息,并且可以对数据进行选择和转换以便数据挖掘的顺利完成,利用SPSS软件进行K-means聚类分析,从而得到有价值的信息,为学生管理工作和教学方案的修改制定提供参考。",2015/12/25 9:15,2015
CJFD2016,一种新型的技术形态识别方法——基于SAO语义挖掘方法,郭俊芳;汪雪锋;李乾瑞;朱东华;,北京理工大学管理与经济学院;,科学学研究,形态分析法(MA);;SAO语义挖掘;;技术机会分析(TOA);;形态结构;;染料敏化太阳能电池(DSSCs),"形态分析法作为一种面向未来的系统分析方法,已被广泛运用于技术机会识别和技术预测等领域。但现有形态分析方法中,形态结构构建过程对领域专家有较强的依赖。虽有学者尝试引入定量分析方法,但单纯以词频为依据选择特征词,忽略了词间的影响,存在无法展示技术/部件的目的、构成和语义关系等缺陷,限制了技术预测的效果。因此,本文引入主语-谓语-宾语(SAO)语义挖掘方法,提出一种新型的技术形态识别方法,并以德温特专利数据为基础,描述了专利技术形态识别的过程,验证了该方法的可行性和有效性。该方法弥补了基于关键词方法的不足,增强了定量方法对技术形态识别中的应用,减少了技术形态定义对专家知识的依赖,提高了技术形态识别的...",2016/1/15,2016
CJFD2015,基于聚类权重调度的大数据采样技术,耿德志;,晋中学院信息技术与工程学院;,世界有色金属,大数据;;采样;;数据聚类;;权重调度,"通过大数据优化采样提高对大数据的分析和调度能力。传统方法中对大数据的采样技术采用奈奎斯特采样定律,当大数据的特征信息出现非线性特性时,采样精度不高。提出一种基于聚类权重调度的大数据采样技术,进行大数据的分布式数据结构分析和时间序列模型构建,采用模糊C均值聚类方法进行大数据的聚类权重调度算法设计,以此为基础实现大数据的特征提取和特征采样。仿真实验结果表明,采用该方法进行大数据的信息采样,能有效提高采样精度,在大数据挖掘和特征提取方面具有重要意义。",2015/12/21 15:54,2015
CJFD2016,面向多源城市出行数据的可视化查询模型,汪飞;张繁;吴斐然;顾天瑜;高思远;赵烨;鲍虎军;,浙江大学CAD&CG国家重点实验室;湖南师范大学数学与计算机学院;浙江工业大学计算机科学与技术学院;肯塔基州立大学计算机学院;,计算机辅助设计与图形学学报,多源城市出行数据;;可视化查询;;查询模型;;可视分析,"多源城市出行数据为理解城市现象和享受城市生活带来了机遇.利用统计物理学和数据挖掘技术,人们在多源城市出行数据的研究上取得了很大进展,但是基于可视分析方法的研究甚少.为此,提出了一种可视化查询模型旨在解决应用可视分析方法研究多源城市出行数据时所面临的数据组织和可视表达上的挑战.查询模型从数据抽象,数据组织和管理,查询交互界面以及可视化分析等方面进行探讨,介绍了相关方法和技术.最后实现了查询模型的实例系统并通过典型案例证明了查询模型的有效性.",2016/1/15,2016
CJFD2015,基于多层挖掘策略的特征选择及在科技文献分类中的应用,钱慎一;朱艳玲;朱颢东;,郑州轻工业学院计算机与通信工程学院;,兰州理工大学学报,科技文献;;特征选择;;K-means;;Apriori,"提出一种应用于科技文献分类的文本特征选择方法.该方法运用了聚类与关联规则的思想,对文本特征进行逐层选择.同时为提高K-means算法的聚类性能,对K-means算法做了相应的改进,通过为算法的终止条件设定标准值来减少算法迭代次数,减少学习时间;通过删除由信息动态变化而产生的冗余信息,来减少动态聚类过程中的干扰.采用KNN分类器进行对比实验,实验结果表明,该特征选择方法在科技文献分类方面有较高的准确率.",2015/12/25 8:47,2015
CJFD2015,海量短文本实时挖掘方法的研究与仿真,朱贺军;马丁;,北京亿赛通网络安全技术有限公司;北京理工大学计算机学院;中国人民公安大学网络安全保卫学院;,计算机仿真,短文本;;挖掘;;粒子群神经网络,"针对短文本字数少,数量庞大,可伸缩性的特点,采用传统算法进行海量短文本挖掘的过程中,由于短文本性能之间特殊关联性使权重和阀值受到干扰,造成挖掘准确率低,效率差。提出基于粒子群神经网络融合算法的海量短文本挖掘方法。将短文本作为具有初始速度和初始位置的粒子,构建用于挖掘海量短文本的神经网络模型,利用粒子群对模型的链接权重和阀值进行寻优,并将搜索到最好位置和速度的粒子作为全局最优解,得到最优的连接权重和阀值,在学习的过程中,加入动量因子对学习速度进行改进,实现了准确的短文本挖掘,并提高了挖掘速度。实验结果表明,利用改进算法能够提高海量短文本挖掘的准确率和效率,效果令人满意。",2015/12/15,2015
CJFD2016,基于局部加权重构的化工过程数据恢复算法,郭金玉;袁堂明;李元;,沈阳化工大学信息工程学院;,计算机应用,数据挖掘;;缺失数据;;数据恢复;;k近邻规则;;局部加权重构;;化工过程,"针对化工过程数据中存在缺失数据的问题,在保持局部数据结构特征的基础上提出了基于局部加权重构的化工过程数据恢复算法。通过定位缺失的数据点并以符号Na N(Not a Number)标记,将缺失的数据集分为完备数据集和不完备数据集。不完备的数据集按照完整性的大小依次找到它们在完备数据集中相应的k个近邻,根据误差平方和最小的原则,求出k个近邻相应的权值,用k个近邻及相应的权值重构出缺失的数据点。将该算法应用在不同缺失率下的两种化工过程数据中并与望最大化主成分分析(EM-PCA)法和平均值(MA)两种传统的数据恢复算法相比较,该算法的恢复数据误差最小,并且计算速度相比EM-PCA算法平均提高了2倍。实...",2016/1/10,2016
CJFD2016,基于聚类算法的金融交易离群点识别,李欣月;张高煜;彭兰舒;袁顺捷;常宇星;刘梦冬;,上海金融学院;,电子技术,可疑金融交易识别;;聚类算法;;离群点;;金融交易监控系统,"随着国家经济的逐渐发展,金融交易活动日渐频繁,交易产生的数据复杂而数量庞大,使得检测洗钱交易的进行变得困难,寻找能以较高准确度在海量数据中检测可疑金融交易算法成为关键。而洗钱金融交易行为相较于正常金融交易而言,发生的概率小且随机性强,处于与正常交易孤立的""离群""状态。针对这一特点,本文将在国内外现在有的关于金融可疑交易数据检测的研究基础上,提出建立在完整金融交易监控系统上的以聚类算法为基础的金融交易离群点检测算法,实现可疑金融行为的识别。",2016/1/25,2016
CJFD2016,基于位置签到数据的城市分层地标提取,王明;胡庆武;李清泉;秦龙焜;,武汉大学遥感信息工程学院;深圳大学空间信息智能感知与服务重点实验室;武汉大学测绘遥感信息工程国家重点实验室;,计算机学报,位置服务;;位置签到(Check-In);;地标;;POI;;显著度;;分层;;云计算,"为了及时准确地获取用于智慧位置服务的城市层次性空间知识,该文提出了一种依据签到属性显著度的差异从位置签到数据中提取城市分层地标的方法.首先,针对传统基于调查问卷的公众认知度计算方法存在的不足,该文从位置签到数据中的签到次数、签到用户数和用户影响因子3个方面入手讨论POI显著度的影响因素,进而提出了一种基于签到数据的POI显著度计算模型;然后,利用Voronoi图对POI空间作用范围进行分割并结合邻域分析与合并算法逐层迭代,形成了基于签到POI显著度与Voronoi图的分层地标提取算法;最后,以北京市的位置签到数据为例,进行了POI显著度计算与分时分层地标提取,通过与现有实体、网络地图资料的比对...",2014/12/19 0:07,2016
CJFD2015,大数据在酒店管理系统中的应用,杨慧慧;邓薇;陈冲;,东华理工大学软件学院;,科技广场,酒店管理系统;;大数据分析;;Tableau,"酒店管理行业的发展越来越依托于数据的分析,大数据的收集、清洗优化、挖掘及整合研究分析,给酒店的经营管理提供了巨大的帮助。本文采用Tableau作为分析工具,对酒店管理系统中的酒店预订模块、客户入住模块、客户结算模块中产生的数据进行大数据分析,准确的找出酒店经营存在的问题,使酒店管理决策者实现业务的提升。",2015/12/30,2015
CJFD2015,基于关联规则探讨《温病条辨》药对的使用规律,杨淑慧;丁吉善;,南阳理工学院;,南阳理工学院学报,温病条辨;;药对;;使用规律;;关联规则,"目的:探讨《温病条辨》药对的使用规律。方法:以《温病条辨》三焦篇189个内服复方为研究对象,采用关联规则数据挖掘方法,设定最小支持度为5%,最小置信度为50%。计算药对的支持度和置信度,找出符合规则的药对。结果:筛选出高频药对22组,其中清热药对4组,养阴药对4组,清热养阴药对4组,祛湿药对7组,补气药对1组,补气温中散寒药对1组,温阳药对1组。符合强关联规则的核心药对6组,分别为黄连-黄芩、连翘-银花、连翘-竹叶、白芍-炙甘草、生地-麦冬、干姜-附子。结论:初步总结了22组高频药对的功效及使用规律,可为温病的治疗提供用药参考。",2015/11/25,2015
CJFD2015,改进的K-means算法在电厂煤质分析中的应用,潘华;高杨杨;郑芳;刘维明;,上海电力学院经济与管理学院;镇江谏壁电厂能源部;,上海电力学院学报,聚类分析;;数据挖掘;;K-means算法;;经济选择,"针对传统K-means算法聚类结果受初始值影响、迭代次数多和易出现局部最优解的弊端,研究改变初始值的选择,并采用三角形三边关系定律减少迭代次数对算法作进一步改善.通过数据对比了传统算法与改进算法,结果表明改进算法有较高的准确率.最后,通过实例为电厂的煤种选择提供了参考.",2015/12/15,2015
CJFD2016,智能电网中高维数据聚类方法研究,于君;范文彬;杜永军;,中国能源建设集团山西省电力勘测设计院;,智能计算机与应用,智能电网;;电网高维数据;;高维数据聚类,"随着电网智能化程度的逐步深入,智能电网高维数据成为了""电网2.0""的重要价值资源。本文论述了智能电网大数据源、大数据流体系,讨论了传统电力数据聚类方法与特征,分析了智能电网高维数据所具有的稀疏性、空空间现象、维度效应、Hubness现象和离群点检测的特征,对智能电网高维数据从维数简化、索引技术、结果表征与评价方面论述了高维数据聚类分析方法和应用实践。",2016/2/28,2016
CJFD2016,数据仓库技术在医院信息化建设方案实现中的应用价值,李韬;冯佳莉;张屹;于树新;,河北北方学院附属第一医院信息管理处;河北北方学院附属第一医院肾内科;,中国医药导报,数据仓库;;联机事务处理;;信息化建设;;数据挖掘,"目的探讨数据仓库技术在医院信息化建设方案中的应用价值。方法于实施基于数据仓库技术的医院信息化建设前(2013年全年)向河北北方学院附属第一医院(以下简称""我院"")门诊患者发放医院医疗服务满意度调查问卷,选取500份合格问卷作为对照组;实施基于数据仓库技术的医院信息化建设后(2014年全年),向我院门诊患者发放相同问卷,选取500份合格问卷作为研究组;比较两组对门诊服务的综合满意度、等待时间、诊疗时间、医护人员工作绩效情况。结果研究组总满意度显著高于对照组(38.20%比19.00%);研究组等待总时间显著短于对照组[(30.21±8.73)比(62.89±10.75)min];研究组实际诊疗总...",2016/2/5,2016
CJFD2016,基于中医三路脉象诊断机制的脉诊数字化系统研制,史伟;刘卫兰;王伟浩;,洛阳职业技术学院;,电脑编程技巧与维护,中医脉诊;;数字化系统;;三路脉象;;数据挖掘,"中医脉诊数字化系统包括数据采集装置、信号通信装置和数据分析设备等。硬件系统可以实现对寸关尺三路脉象信号的釆集、分析和处理;软件部分将脉象的位、数、形、势和脉图的各项特征参数作自动分析处理。同时结合中医望诊和问诊(以人机对话形式),采用数据挖掘的方法建立起病名与脉象之间、证型与脉象之间的关联性,综合中医八纲辩证的思路,为被测者提供健康状况的指导。",2016/2/18,2016
CJFD2015,计算历史学:大数据时代的历史研究,马建强;,湖北大学中国思想文化史研究所;武汉大学社会发展研究院大数据与计算社会科学研究中心;,学术论坛,计算历史学;;大数据时代;;历史研究;;数据库,"随着互联网、计算机技术的发展,大数据时代对历史研究的冲击在所难免,历史学也面临挑战与机遇并存的命运。当前内容庞大、功能多样的数据库与日俱增,历史研究所面对的数据环境越来越健全。面对这样的学术环境,一些学者提出了对历史学发展的思考,一些学者则凭借大数据时代的独特环境,开展了一些新的史学研究实践。大数据时代中的历史研究是一条正在探索的道路,计算历史学可能会成为历史研究发展的一个趋向。",2016/1/20 16:47,2015
CJFD2015,C4.5算法在高职学校成绩分析中的应用,卜阳;,江苏省徐州医药高等职业学校;,佳木斯职业学院学报,数据挖掘;;决策树;;成绩分析;;C4.5算法,"本文采用C4.5算法构造决策树的方法,对学生的成绩进行分析并找出影响成绩的主要因素和规则,给教师调整教学环节提供参考,对学生管理工作提出意见,从而指导教育教学工作。",2015/12/15,2015
CJFD2015,云计算环境下的数据挖据算法研究,张一名;,山西林业职业技术学院;,信息化建设,云计算;;数据挖掘;;研究,"基于项目协同过滤推荐算法是云计算环境下的数据挖据算法,用于解决Amazon.com中千万级的用户和产品数据挖掘和推荐。并且在如此海量的数据规模下,将已有的平台迁往云平台己大势所趋。本章将介绍基于项目协同过滤算法的并行化实现和性能分析。",2015/12/15,2015
CJFD2016,基于多标记学习的汽车评论文本多性能识别,张晶;李德玉;王素格;,山西大学计算机与信息技术学院;,计算机工程与科学,多标记学习;;文本处理;;汽车评论;;多方面识别,"针对汽车产品评论文本中出现的多方面性能,提出一种基于多标记学习的汽车评论文本多方面性能识别方法。首先,结合文本挖掘方法,利用多标记文本特征选择方法选取特征,将非结构化的文本转化为结构化的多标记数据集。在此基础上,使用四种多标记分类方法,对待识别的评论文档标注一个或多个方面标记。最后,以八种多标记评价指标评估方面识别的性能。在新浪汽车评论语料上的实验表明,方面识别的子集准确率达到了95%,验证了方法的可行性。",2016/1/15,2016
CJFD2016,大数据技术在反洗钱工作中的应用前景,汤俊;王妍;车奕蓉;,中南财经政法大学信息与安全工程学院;,海南金融,大数据技术;;反洗钱工作;;了解你的客户;;应用前景,"伴随着大数据时代的不期而至,金融管理机制在大数据技术的冲击下,也在发生着自身层面的工作巨变。作为大数据技术运作范畴中的典型领域和重要组成部分,金融机构及其相应的管理体制,具体溯及到反洗钱工作中,必然要视为义务的主体之一。本文以大数据技术和反洗钱工作为主要研究对象,提出目前对反洗钱工作中客户身份识别和尽职调查认识不全面、反洗钱监管技术不足等问题,通过建立大数据开放与共享的制度保障、构建反洗钱大数据系统、完善大数据风险管理机制等途径实现发展对策,从整体上洞悉大数据技术在反洗钱工作中的应用前景。",2016/2/5,2016
