SrcDatabase-来源库,Title-题名,Author-作者,Organ-单位,Source-文献来源,Keyword-关键词,Summary-摘要,PubTime-发表时间,Year-年
CJFD2015,网络大数据的现状与展望,范媛媛;吴东明;,焦作师范高等专科学校;焦作师专计算机应用技术研究所;,数字技术与应用,大数据;;网络大数据;;硬件设施;;挑战,"大数据通常是指在可承受的时间范围内,无法用常规软件工具,对数据进行捕捉、管理和处理的集合,它需要较强的决策力、洞察发现力和流程优化能力,在新式的处理模式下来处理海量的、高增长率的和复杂多样化的信息资产。网络大数据是在以人、机、物为核心的三元世界,以网络空间为平台,通过数据的交互和融合所产生的,并在互联网中可获得的数据。网络数据以飞速的增长率和海量的数据库给硬件设施的更新升级带来了巨大的挑战。充分利用网络大数据,深入挖掘网络大数据的潜力和价值,不仅能够促进计算机软件与硬件的升级换代,还是对大量的非结构化数据和半结构化数据有效利用。云时代的到来给大数据的及时处理带来了革命性的进步,研究大数据的共性...",2015/12/15,2015
CJFD2016,多源时间序列中具有显著时间间隔的Shapelet对挖掘,李钟麒;段磊;胡斌;邓松;秦攀;,武汉大学软件工程国家重点实验室;四川大学计算机学院;国家电网智能电网研究院;南京邮电大学先进技术研究院;,数据采集与处理,时间序列;;特征提取;;信息增益;;Shapelet,"Shapelet作为时间序列特征,具有较好的可解释性。Shapelet在行为识别、聚类分析及异常检测等方向均得到了广泛应用。但在电力运行监测、医学图像分析以及流媒体监测等领域,时间序列具有多源、同步的特点,仅对单一源上的时间序列提取Shapelet可能丢失序列间相关性。在Shapelet概念基础上,本文提出p-Shapelet作为不同源的Shapelet间关于时间间隔的特征表达,从而实现分析不同源Shapelet间的相关性。具体地,为找出不同类别样本间时间间隔具有最显著差异的Shapelet对,设计并实现了并行化挖掘的算法p-Shapelet miner。算法采用信息增益对不同源间的Shape...",2016/1/15,2016
CJFD2016,基于负载均衡和冗余剪枝的并行FP-Growth算法,刘祥哲;刘培玉;任敏;伊静;高钊;,山东师范大学信息科学与工程学院;山东省分布式计算机软件新技术重点实验室;山东财经大学数学与数量经济学院;山东建筑大学计算机科学与技术学院;,数据采集与处理,关联规则;;MapReduce;;冗余剪枝;;FP-Growth算法,"针对现有的并行FP-Growth算法在数据并行分组时存在数据冗余和负载不均的问题,提出了基于负载估算和冗余剪枝的优化算法。首先,在采用高频策略分组时,引入节点任务估算方法,把每个分组中最大模式树的最长路径和支持度作为该分组的估计值,将估计值远大于其他节点的分组进行分割,平均到其他分组中,并且对不同分组中重复的列表元素进行截断,去除冗余数据。实验表明,本文提出的算法能够有效防止并行化的数据倾斜,减少数据冗余,在时间和空间复杂度上要低于以前的并行化FP-Growth算法。",2016/1/15,2016
CJFD2015,基于十字链表的Separate算法研究,陈平;王利钢;,南京信息职业技术学院信息服务学院;,信息化研究,关联规则;;十字链表;;项约束;;频繁项目集,"生成频繁项集是约束关联规则挖掘中最耗时的一步。为提高挖掘的效率,文章提出一种基于十字链表的经典的约束算法(Separate)改进算法(SABCL)。该算法结合Separate算法和十字链表存储的优势,先根据约束条件过滤数据库并产生频繁项目,再利用十字链表存储频繁项目信息,通过遍历十字链表生成满足约束条件的频繁项集,从而避免重复扫描数据库,提高了挖掘效率。在美国蘑菇(mushroom)、象棋(chess)数据集上,对SABCL、Separate算法进行了实验对比,实验结果表明,在相同的条件下,SABCL算法能够快速地生成所有的频繁项集,时间性能优于Separate算法。",2015/10/20,2015
CJFD2016,基于GIS系统的通信盲点挖掘方法,王娜;,中国移动通信集团河北有限公司;,信息通信,通信盲点;;决策树;;数据挖掘;;自动定位,"针对目前通信系统中存在的大量信号盲区无法自动准确定位问题,根据盲区特性以及盲区客户通话行为特性,利用决策树分析方法建立通信盲点挖掘算法,将识别结果展现在GIS系统中即可自动、快速、准确定位4G网络通信质量问题客户和4G网络通信质量问题区域,把握主动性,极大减少客户投诉量,提升客户满意度。本算法经过网管部门调研勘测及实际使用,证明准确率达到65%以上,使通信盲点自动定位效率得到极大提升。",2016/1/15,2016
CJFD2016,单飞行事件噪声关联规则挖掘及信念网络表示,徐涛;杨婷婷;谢继文;,中国民航大学计算机科学与技术学院;中国民航大学中国民航信息技术科研基地;,中国民航大学学报,单飞行事件噪声;;关联规则;;信念网络;;FP-Growth-Cube算法,"挖掘各种噪声影响因素与机场噪声之间的关联规则,能够为机场经营者制定有效的降噪措施提供科学依据。先将FP-Growth算法与数据立方体相结合,构造FP-Growth-Cube算法挖掘单飞行事件噪声与各噪声影响因素之间的关联规则,然后通过信念网络可视化表示关联规则。此方法不但直观、清晰,而且克服了关联规则不能表达不同规则之间联系的弱点,图形化地综合表示各因素对噪声的影响。最后,实验从降噪措施之一的机型选择角度,与权威噪声预测软件INM对比,验证了该方法的可行性和有效性。",2016/2/15,2016
CJFD2016,基于winForm的教务管理系统的设计和实现,罗宇;李明东;伍开胜;,西华师范大学计算机学院;,科技视界,教务管理系统;;winForm;;智能化,"针对南充市中小学的日常管理及成绩统计的非智能化环境,采用winform开发框架,C/S结构,设计并实现了一套具有针对性的教务管理系统。实现了对教师、学生信息,教师评价,课表排定,学生成绩管理等教务工作的智能化操作。",2016/3/5,2016
CJFD2016,基于事件的证券市场状态变化规则挖掘,姜丽;,上海应用技术学院计算机科学与信息工程学院;,科技创新与应用,事件;;证券市场;;数据挖掘;;ID3算法,"文章在前期市场状态研究的基础上,重点研究了三类影响市场状态的事件,建立了事件模型,并采用改进的ID3数据挖掘算法,得到了一组市场状态在事件刺激下的转化规则。最后,文章对得到的规则进行了分析。",2016/3/28,2016
CJFD2016,基于Web Service技术用于医院信息分析算法库的设计与实现,赵晴峰;,浙江省肿瘤医院信息中心;,计算机系统应用,Web Service;;信息分析;;算法库;;医院信息系统,"分析了当前HIS在信息分析处理领域面临的数据来源复杂多变以及信息分析算法在定制、共享和动态维护等方面存在的主要问题,采用元数据实现对信息分析算法的描述,基于Web Service架构设计了信息分析算法管理模块和信息分析算法库系统.相对于传统模式的信息分析算法,实现了数据和算法的松散耦合和对算法库的动态管理,并进行了实现和验证,研究结果表明,系统能够有效改善HIS中信息分析和数据处理的可维护性和通用性.",2016/3/15,2016
CJFD2016,基于规则置信度调整的知识挖掘及在烟草科技管理中的应用,王塑;张萍;周新;王乙民;,陕西省烟草公司西安市公司;,计算机应用与软件,知识挖掘;;规则置信度;;信息管理,"介绍信息管理领域中的一个热门研究主题——知识挖掘。知识挖掘旨在从结构化、半结构化的数据中挖掘信息。例如从电子文档、不完备的历史数据中搜索稳定的模式或模型,分析挖掘数据间的交互特征和规律,以辅助管理人员制定、调整规范与标准,构建专家库和知识库。提出知识挖掘的一种改进方法,通过动态规则置信度生成算法提高所获得规则的准确性与适应性,并结合烟草企业科技项目智能辅助管理中的实际应用进行了验证,取得了一定的成效。",2016/3/15,2016
CJFD2016,基于通信运营商数据的大数据实时流处理系统,朱奕健;张正卿;,中国联合网络通信有限公司上海市分公司;,中国新通信,大数据;;流处理;;简单事件处理引擎(PME);;Flume;;Kafka,"本文利用流式数据处理框架探索了一种新的基于运营商实时大数据业务系统构建模式。首先,在充分研究了业内实时流式处理技术的发展以及运营商本身实时数据源的特点之后,确定以Flume作为实时采集和分流组件,Kafka作为缓存和多模块通信组件,以Spark Streaming的分布式结构作为数据ETL集群;然后,利用该系统进行了重点区域的人流实时监控的业务,在实施过程中为了提供毫秒级的数据结果流查询能力,采用了Redis组件提供基于内存的Key-Value引擎;最终,通过流式数据处理效率的对比和实时监控的人流效果,我们验证了了这种新的技术架构针对运营商CS域和PS域数据实时处理需求的可行性,结果表明,新的...",2016/2/5,2016
CJFD2016,基于大数据的K-means聚类算法在网络安全检测中的应用,郑志娴;王敏;,福建船政交通职业学院信息工程系;,湖北第二师范学院学报,大数据;;网络安全检测;;K-means聚类算法,"随着云时代的到来,大数据的应用受到了越来越多的关注。大数据的核心在于挖掘数据中蕴藏的价值链,为决策提供可借鉴参考。聚类算法是数据挖掘的一种归类方法,K-means则是基于划分的聚类方法。在网络安全检测中,应用K-means建立网络异常检测模型,可有效提高大数据环境下集中选取数据准确性的能力,控制检测误报率,缩短网络异常数据选取时间。但是,传统的K-means聚类算法在数据类型预处理、初始中心选取和K值确定等方面存在不确定性,导致对入侵检测的效率降低。本文提出一种改进的K-means算法,并通过利用KDDCup99数据集进行仿真实验,证明改进后的K-Means算法的检测准确率与检测效率要优于传统...",2016/2/15,2016
CJFD2016,大数据相关词条(续),,,信息安全研究,数据挖掘技术;数据相关;预报误差;交叉验证;机器学习;共享数据库;联机分析处理;discriminant;分类器;数据仓库;,"基于互联网的挖掘(Web挖掘):是利用数据挖掘技术从Web文档及Web服务中自动发现并提取人们感兴趣的信息.交叉验证(cross-validation):主要用于建模应用中,在给定的建模样本中,拿出大部分样本进行建模,留小部分样本用刚建立的模型进行预报,并求这小部分样本的预报误差,记录它们的平方加和.",2016/4/5,2016
CJFD2016,数据耕耘技术支持下的大规模驾驶行为数据分析仿真技术,王磊;彭敦陆;,上海理工大学光电信息与计算机工程学院;,小型微型计算机系统,数据耕耘;;大数据;;仿真系统;;驾驶行为,"大数据相关问题已成为当今数据科学领域的研究热点,在研究中需要有足够多的数据来验证相关研究成果.由于各种条件限制,研究人员难以得到足够体量的源数据,给研究带来了很大的困难.论文运用数据耕耘技术研究出一种用于大数据系统仿真的方法.该方法首先对被研究对象属性特征进行分析,确定属性之间的依附关系.然后选择合适的数据耕耘方法建立仿真系统,最后对仿真系统进行验证,并以大规模驾驶行为数据分析为例,说明如何利用该技术建立大数据分析及仿真的过程.",2016/4/15,2016
CJFD2016,引入时频聚集交叉项干扰抑制的大数据聚类算法,胡先兵;赵国庆;,国家计算机网络应急技术处理协调中心;北京交通大学电子信息工程学院;,计算机科学,大数据;;聚类;;粒子群;;干扰抑制,"面向大数据集管理的数据聚类方法研究在模式识别、故障诊断和数据挖掘等领域具有重要的研究意义。传统的大数据聚类算法采用混合差分进化的粒子群算法,因数据信息流分量之间的交叉作用而出现的类间交叉项干扰影响了聚类分量的正确判断,聚类效果不好。提出了一种基于时频聚集交叉项干扰抑制的大数据聚类算法。在面向传播学视域下物联网大数据库中生成大数据聚类的信息特征向量,对任意两个分簇矢量进行近邻样本的隶属度训练,在时间滑动窗口模型中进行信息调度,采用高频分量抑制方法实现对时频聚集交叉项的干扰抑制,通过频域卷积相似度融合处理,采用粒子群优化算法进行聚类适应度计算,以实现数据聚类算法改进。仿真结果表明,采用该算法进行大...",2016/4/15,2016
CJFD2016,面向知识扩充的实体关系挖掘,杨帅;宋汝良;,同济大学电子与信息工程学院;上海梦创软件科技有限公司;,电脑知识与技术,知识图谱;;关系挖掘;;知识扩充;;句法依存;;特征抽取,"为了从自由文本中挖掘大量高质量的事实抽象出三元组,并将其与现有的知识库进行知识融合,提出了知识图谱构建中的知识扩充框架。首先对知识图谱的构建过程进行了认知,指出传统的关系挖掘仅仅是利用句法依存树抽取路径上的节点作为关系,对于复杂句子表现较差。在此基础上建立了一种基于关系类型的结合多种特征的知识扩充框架,该方法自动获取高质量知识。效果在开放网页句子中达到F1值88%。",2016/3/1 13:05,2016
CJFD2016,高效用项集挖掘算法综述,刘畅畅;,河南大学计算机与信息工程学院;,福建电脑,高效用项集;;效用挖掘;;频繁项集;;数据挖掘,"本文介绍了高效用项集挖掘的基本概念,列举并分析了三个高效用项集挖掘算法,指出了它们的优缺点,最后展望了高效用项集挖掘的未来研究方向。",2016/3/25,2016
CJFD2016,基于信息熵改进的K-means动态聚类算法,杨玉梅;,川北医学院图书馆;,重庆邮电大学学报(自然科学版),K-means算法;;信息熵;;数据挖掘;;动态聚类,"初始聚类中心及聚类过程产生的冗余信息是影响K-means算法聚类性能的主要因素,也是阻碍该算法性能提升的主要问题。因此,提出一个改进的K-means算法。改进算法通过采用信息熵对聚类对象进行赋权来修正聚类对象间的距离函数,并利用初始聚类的赋权函数选出质量较高的初始聚类中心点;然后,为算法的终止条件设定标准阈值来减少算法迭代次数,从而减少学习时间;最后,通过删除由信息动态变化而产生的冗余信息来减少动态聚类过程中的干扰,以使算法达到更准确更高效的聚类效果。实验结果表明,当数据样本数量较多时,相比于传统的K-means算法和其他改进的K-means算法,提出的算法在准确率和执行效率上都有较大提升。",2016/4/15,2016
CJFD2016,Apriori算法在三二分段成绩分析中的应用,苏伟斌;,东莞理工学校;,电子技术与软件工程,Apriori算法;;成绩分析;;数据挖掘,"本文介绍了Apriori算法的基本概念并以本人所在的中职学校计算机专业为例,介绍了使用Apriori算法来挖掘数据之间关联性的方法,找出规律,分析结果,为实际教学工作提供理论支持。",2016/4/19 17:19,2016
CJFD2016,内蒙古电力数据仓库的应用,张瑜;潘红芳;,内蒙古电力(集团)有限责任公司信息通信中心;,电信科学,电力大数据;;数据中心;;数据仓库,"随着电力信息化的发展,电力数据的积累速度越来越快,如何使大数据产生价值、为公司科学发展提供支持的议题被越来越多地提及。内蒙古电力公司从2011年开始建设一体化平台数据中心,当前已经完成了公司各业务口的数据集成工作,为数据利用提供了基础。依据建设的一体化生产经营决策分析系统建设情况,从应用需求、应用技术、数据分析挖掘3个方面介绍了内蒙古电力公司在大数据背景下的数据仓库应用的探索与尝试。总结了建设成果与建设经验,得出做好分析展现应用的关键是需求管理,核心技术是数据挖掘的结论。",2016/4/20,2016
CJFD2016,基于弱关联挖掘技术的电网故障自动诊断研究,马丽强;王天正;杨冬冬;王志鹏;,国网山西省电力公司电力科学研究院;,现代电子技术,弱关联挖掘;;电网;;故障诊断;;支持度计算,"针对电网故障进行诊断的过程中,故障信息存在不完整或不确定性,甚至存在关键信息丢失的情况,造成故障诊断难以得出正确结论的问题,提出一种基于弱关联挖掘技术的电网故障自动诊断方法。首先进行支持度计算,得到电网故障的表述参数,并将电网故障类别看作是贝叶斯网络的父节点,将挖掘的弱关联规则作为子节点,构建基于弱关联挖掘的贝叶斯网络模型,对各父节点的先验概率及各子节点的条件概率进行计算,完成对电网故障的自动诊断。仿真实验结果表明,采用所提方法对电网故障进行自动诊断,正确性高,容错性好,实用性强,具有很高的诊断精度。",2016/5/15,2016
CJFD2016,基于数据平台的智能协同设计系统研究,耿明;,中铁第四勘察设计院集团有限公司;,铁道工程学报,数据平台;;智能;;设计;;总线;;协同;;信息标准,"研究目的:目前协同设计系统主要为基于文本库的传统作业系统,设计数据提取、加工、使用、挖掘困难,影响设计进度和质量。智能数据协同设计平台的关键技术、构建方案需要进行深入研究。研究结论:(1)基于数据平台的协同设计关键技术主要有信息标准建立、设计数据及标准结构化、数据标准建立与维护、多专业标准化协同作业模式、应用软件研发、智能设计与在线设计集成、数据挖掘与抽取、系统展现等;(2)智能协同设计系统可大幅提高设计速度与设计质量,可在资源、行为、交付维度单独或同时提供文本(含音视频)、数据、BIM成果;(3)基于数据平台技术的智能协同设计系统是工程设计现代化的发展方向,也是建设协同系统现代化的基础和前提...",2016/4/15,2016
CJFD2016,基于大数据的个人健康管理系统设计与实现,陈卓;高忠军;,四川省达州市渠县人民医院;四川省医学数字影像与通讯(DICOM)标准工程实验室;,中国数字医学,大数据;;数据挖掘与分析;;健康评估;;健康管理,"通过分析目前健康管理过程中存在的问题,提出基于大数据应用的个人健康管理系统,能够对个人健康数据方便、快捷、有效地持续监控和智能管理,通过基于大数据应用的个人健康管理系统对个人健康数据进行挖掘分析,实现全人全程全方位的实时互动个人健康管理目标。",2016/5/15,2016
CJFD2016,关联规则挖掘算法FP-Growth在高职网络技术专业学生成绩分析中的应用,罗拥军;罗云芳;,广西职业技术学院计算机与电子信息工程系;,河池学院学报,关联规则;;FP-Growth算法;;成绩分析,"从大量的成绩数据中进行数据挖掘并从中获得有价值的信息,是一件非常有意义的研究。以计算机网络技术专业学生10年的成绩作为数据源,运用基于关联规则的FP-Growth算法,研究5门课程之间的关联,为制订该专业人才培养方案提供参考和借鉴。",2016/4/15,2016
CJFD2016,多元关系的超图可视表达与分析,刘真;周文晖;,杭州电子科技大学计算机学院;,杭州电子科技大学学报(自然科学版),超图;;交闭半格;;海赛图;;关联矩阵,"蓬勃发展的社交网络、物联网、关系型数据库和生物医学等应用领域带来海量数据,其中数据对象之间存在错综复杂的关联.传统信息可视化领域表达二元关系的图已经不能表达这些复杂关联,越来越多研究发现表达多元关系的超图能更好地挖掘信息中隐藏的内在联系和模式.针对多元实体关系,提出两种超图可视化方法:海塞图和关联矩阵.其中超图海塞图方法通过在超图交闭半格上构建层次化海塞图进行可视化;超图矩阵可视化将超图表示成关联矩阵、超边关系矩阵和顶点关系矩阵.通过从Medline在线数据库上挖掘多元关系的肺癌超图数据分析和验证上述方法的有效性.",2016/5/15,2016
CJFD2016,基于全文检索的文本相似度算法应用研究,王格;吴钊;李向;,湖北文理学院数学与计算机科学学院;中国地质大学(武汉)计算机学院;,计算机与数字工程,文本相似度;;余弦VSM;;Simhash,"在大量的文本数据中,针对不能快速有效地提取或查找有用信息及知识这个问题,以文本相似度计算为基础的文本数据挖掘成为数据挖掘研究领域里的一个重要的课题。论文主要研究两种不同的方法 VSM余弦算法和Simhash来实现文本相似度的计算,首先采用传统的VSM余弦算法和Simhash算法,按照余弦公式通过内积最终计算出文本间的相似度大小n(0<n<1),最后为了实现余弦算法并提高系统效率,使用了大量容器如Map、Set和Vector以及内积算法等。实验结果表明,余弦算法VSM由于其局限性不适合进行文本的相似度计算,而Simhash算法则具有高准确度以及可行性。",2016/4/20,2016
CJFD2016,基于MapReduce和矩阵的频繁项集挖掘算法,周国军;龚榆桐;,玉林师范学院数学与信息科学学院;,微电子学与计算机,MapReduce;;Hadoop平台;;矩阵;;频繁项集;;关联规则,"为了能高效地从大数据集中挖掘所有频繁项集,提出了一种基于MapReduce和矩阵的频繁项集挖掘算法.该算法将事务数据库转化为矩阵,按照垂直划分方法将矩阵分解成多个规模相同的子矩阵,根据MapReduce模型将子矩阵分配给计算机集群的节点,各节点并行对子矩阵计算候选项集的支持度.该算法在执行过程中产生的通信量较少,实现了节点计算任务的负载平衡.在Hadoop平台上测试了算法的性能,实验结果表明该算法具有较好的加速比和可扩展性,适合对大数据集挖掘频繁项集.",2016/5/5,2016
CJFD2016,复杂网络中基于WCC的并行可扩展社团挖掘算法,亚森·艾则孜;李卫平;郭文强;,新疆警察学院信息安全工程系;铁道警察学院公安技术系;新疆财经大学计算机科学与工程学院;,计算机应用与软件,复杂网络;;社团挖掘;;并行算法;;可扩展性,"WCC(Weighted Community Clustering)通过复杂网络中社团含有的三角数量来评价社团挖掘算法的性能。在原始的WCC算法中,需要在每次迭代中对所有的社团变化计算WCC值,因而计算量非常大。为了减小社团变化带来的WCC计算量,提出一种并行可扩展的社团挖掘算法。对应用WCC进行社团评价的方法进行分析,提出一种包含预处理、初始划分和划分改进三个阶段的并行社团挖掘算法。在划分改进中,由于每次社团变化都需要计算大量的WCC提升,基于社团的统计量提出一种WCC近似计算方法。大量的真实数据集实验表明,提出的社团挖掘算法与相关算法相比较,不仅社团检测的准确性更高,而且具有更好的并行可扩...",2016/6/15,2016
CJFD2016,一种基于C5.0决策树算法的票房预测研究,吴发翔;钱佳威;刘江帆;,江西财经大学软件与通信工程学院;,科技广场,票房;;预测;;决策树;;百度指数,"本文选取了2015年上映的200部国产电影作为实验数据,将电影票房作为因变量分为8个类别,从用户期待程度、影片自身影响程度、同期竞争力以及基本面四个方向选取一些变量,运用数据挖掘中的C5.0决策树算法构建出了一个票房预测模型。同时对选取的电影票房影响因子进行数据分析,得出不同影响因子对电影票房的预测重要程度,发现百度指数与电影票房之间有着很大的关联度。同时使用了多元Logistic回归分析、贝叶斯网络以及CHAID树方法进行实验,最终发现C5.0决策树效果最好。",2016/4/30,2016
CJFD2016,面向民生科技的智能健康系统发展策略,陶永;孙立宁;刘文勇;王田苗;匡绍龙;,北京航空航天大学航空科学与技术国家实验室(筹);中国航空工程科技发展战略研究院;苏州大学机电工程学院;北京航空航天大学生物与医学工程学院;北京航空航天大学机械工程及自动化学院;,科技导报,智能健康;;健康大数据;;精确诊疗;;生物三维打印;;微创手术;;助老助残,"围绕中国老龄化社会与民生科技发展对智能健康系统的需求迫切,介绍了智能健康系统的内涵与特征,阐述了健康大数据挖掘、个性化植入/介入生物三维打印、个体化精准诊疗、生肌电融合及助老助残等智能健康系统的基础科学问题与关键技术。围绕智能健康系统的应用领域、基础研究领域,介绍了国际研究的创新前沿与进展,国内智能健康系统的研究现状、优势单位与进展情况。",2016/5/13,2016
