SrcDatabase-来源库,Title-题名,Author-作者,Organ-单位,Source-文献来源,Keyword-关键词,Summary-摘要,PubTime-发表时间,Year-年
CJFD2016,Hadoop支持下海量出租车轨迹数据预处理技术研究,吕江波;张永忠;,兰州交通大学;兰州市勘察测绘研究院;,城市勘测,轨迹数据;;Hadoop;;大数据;;数据预处理;;并行计算,"海量出租车轨迹数据预处理是轨迹数据挖掘和应用的前提。出租车轨迹数据是典型的大数据,传统的数据处理技术无法解决大规模出租车轨迹数据误差分析和处理问题,文章在分析轨迹数据误差来源和误差类型的基础上,提出基于Hadoop的海量出租车轨迹数据预处理模型,使用Hive实现轨迹数据误差统计分析,设计MapReduce并行处理程序实现轨迹数据预处理。实验结果表明,该模型可以有效解决大规模出租车轨迹数据预处理问题,处理方式可靠性较高,大大提高了轨迹数据预处理效率,为后期轨迹数据深入挖掘和分析奠定了基础。",2016/6/30,2016
CJFD2016,关联规则挖掘以改进朴素贝叶斯,俞杰;丁晓剑;崔鹏;,信息系统工程重点实验室;,舰船电子工程,朴素贝叶斯;;条件独立性假设;;项目集,"朴素贝叶斯算法是建立在条件独立性假设上的,但是在实际应用中,类属性条件独立假设并不成立。针对这个问题,结合关联规则方法构造一个改进的朴素贝叶斯分类器。通过挖掘感兴趣的和频繁的项目集,深入研究样本算法中的属性联系。使随后运用朴素贝叶斯方法的各个属性尽量属性独立,达到朴素贝叶斯分类器的要求。实例标签方法改善了朴素贝叶斯的分类性能。",2016/5/20,2016
CJFD2016,基于投影的高效用项集挖掘算法,王敬华;罗相洲;吴倩;,华中师范大学计算机学院;,小型微型计算机系统,投影;;高效用;;频繁项集;;模式挖掘,"随着高效用模式挖掘算法在实际应用中的重要性逐步显著,因而其得到了越来越多的关注和研究,但是已知的一些算法存在着多遍数据集扫描以及会产生大量候选项集、时效性不高等问题.这些问题使得高效用模式的挖掘效率大大降低,故本文提出一种新的基于投影的高效用项集挖掘算法HUPMP(high utility pattern mining on projection).采用基于投影的方式将项集的信息存储在数组中,能有效的减少前人基于树结构建树所产生的耗时.同时HUPMP算法将多次数据集扫描减少为只需要进行两次数据集的扫描便可挖掘出所有的高效用模式.另外,针对会产生大量候选项集的问题,提出了一种不同于闭包属性的新性...",2016/6/15,2016
CJFD2016,近场通信技术的安全研究进展与发展趋势,张玉清;王志强;刘奇旭;娄嘉鹏;姚栋;,中国科学院大学国家计算机网络入侵防范中心;西安电子科技大学综合业务网理论及关键技术国家重点实验室;北京电子科技学院;,计算机学报,近场通信技术;;安全威胁;;研究进展;;发展趋势;;网络安全;;信息安全;;网络空间安全,"随着移动互联网和移动支付的发展,NFC技术因其天然的安全特性和便利性,成为运营商、银行、厂商等热捧的对象.由于涉及到移动支付和敏感信息的传输,该技术也受到安全研究人员和攻击者的广泛关注.虽然国内外安全专家和学者对NFC安全问题已进行了一定的研究,但目前还没有详细和全面介绍最新安全研究成果的论文.为解决此问题,该文分析和总结了国内外最新的研究成果,并对NFC安全问题未来的研究方向进行了展望.首先,介绍了NFC技术的基本特性、通信过程、协议栈、工作模式等,分析了该技术面临的安全威胁,包括通信安全、安全漏洞、安全元件、恶意软件、网络钓鱼等内容.然后,通过分析相关研究工作,总结了NFC技术的安全研究现...",2015/11/19 12:32,2016
CJFD2016,CGRMB-LDA:面向隐式微博的主题挖掘,李继云;黄昀;陈捷;,东华大学计算机科学与技术学院;,计算机应用,微博;;主题挖掘;;评论组;;转发微博;;潜在Dirichlet分配;;隐式微博,"由于微博文本短、词量少、语法风格随意的特点,因此微博中包含大量因缺少主题词汇而无法分析话题归属的微博,即隐式微博。提出改进的基于LDA的生成模型考虑评论组和转发微博的CGRMB-LDA模型,利用微博间评论关系、转发关系和上下文关系扩展隐式微博,明确隐式微博的主题归属,采用吉布斯采样的方法来求解模型从而得到主题集和微博所属主题。在真实数据集上的实验表明,CGRMB-LDA模型能有效地对微博特别是隐式微博进行主题挖掘。",2016/6/10,2016
CJFD2016,基于K-means聚类算法的公交行程速度计算模型,高曼;韩勇;陈戈;张小垒;李洁;,中国海洋大学信息科学与工程学院;,计算机科学,公共交通;;平均行程速度;;K-均值聚类算法;;数据融合;;数据挖掘,"定位与无线装置在公交系统中的广泛应用使得获取实时公交数据成为可能。为挖掘这些数据中蕴含的道路交通状况信息,提出了一种基于K-means聚类算法的数据融合模型,来计算相邻公交站点间的平均行程速度。首先对K-means聚类算法进行改进:(1)聚类数K不是预先设定的固定值,而是不重复样本数的平方根,不同路段不同时段K值不同;(2)初始聚类中心不是随机选取,而是根据K值按一定规则选取。其次利用改进的算法对样本数据进行聚类,然后对各类数据进行加权融合,计算出平均行程速度。最后通过折线图对青岛市4个城区的行程速度进行分析,挖掘交通流的演变规律。研究结果为交通管理、居民出行等提供了强有力的支持。",2016/6/15,2016
CJFD2016,软件开发中的活动模式挖掘,吉才盈;代飞;李彤;蒋旭东;,云南大学软件学院;云南省软件工程重点实验室;,计算机科学,过程挖掘;;原子活动;;活动模式;;折叠;;软件过程,"如何获取实际运作的软件过程(而非经验过程)是一个关键问题。软件过程的事件数据呈现记录多、无明确活动与独具过程特性的特点,使得现有的业务过程挖掘方法难以被有效应用。首先获取事件日志的原子活动;然后采用折叠的方法从软件项目开发实例中挖掘活动模式,获取软件过程,对不同时期的软件开发行为进行分析;最后通过一个开源项目的实际案例来验证该方法。",2016/6/15,2016
CJFD2016,点击欺诈群体检测与发现,董亚楠;刘学军;李斌;章玮;,南京工业大学计算机科学与技术学院;中国人民解放军73677部队;,计算机应用研究,点击欺诈;;欺诈群组;;孤立点检测;;贝叶斯分类,"针对目前存在大批网络用户,以群体形式来欺诈点击的问题,提出了一种检测点击欺诈群组的方法。首先使用频繁项集挖掘算法来发现共同点击过大量广告的个体用户,作为疑似欺诈组。然后,在对组内用户点击行为属性分析的基础上,运用孤立点检测方法找到与组内其他用户有显著差异的疑似欺诈用户。最后,运用贝叶斯分类方法对检测到的所有疑似欺诈成员分类,得到真正的欺诈群组和欺诈用户。在真实的数据集上进行的实验,验证了该方法的可行性和有效性。结果表明,该方法为点击欺诈检测问题提供了一条新的思路。",2015/9/29 11:19,2016
CJFD2016,大数据下微博推荐算法,张磊;吾守尔·斯拉木;买买提依明·哈斯木;于清;,新疆大学多语种信息技术实验室;,激光杂志,数据挖掘;;社交网络;;并行计算;;推荐系统,"为了提高微博推荐算法的准确率和解决社交网络平台海量信息的问题。基于LDA(Latent Dirichlet Allocation)三层模型提出C-LDA(Collaborative Latent Dirichlet Allocation)四层模型,该模型不仅考虑被转发者对转发者的影响而且考虑了关注者产生的影响。综合特征词热度、用户负样本反馈以及遗忘曲线等因素改进吉布斯采样算法,使用改进后的吉布斯采样算法近似求解C-LDA模型。然后运用模型中用户与微博的主题概率向量计算相似度,进行Top-K微博推荐。与以往方法相比,该方法适用于具有时效性和互动性的微博应用场景,推荐的效果更加理想。最后基于Had...",2016/6/25,2016
CJFD2016,基于评论的隐式社交关系在推荐系统中的应用,赵亚辉;刘瑞;,北京航空航天大学软件开发环境国家重点实验室;,计算机应用研究,推荐系统;;矩阵分解;;评论数据;;隐式社交关系,"传统推荐系统研究很少利用评论数据来提高推荐性能,评论数据富含用户对物品的评价观点,有助于建立用户间或物品间的关联。针对如何利用评论数据改善推荐效果,提出了一种基于评论的隐式社交矩阵分解模型。模型利用评论间的相似性构建用户间和物品间的隐式社交关系,并将该隐式关系集成到社交推荐框架中,改进了传统矩阵分解推荐模型。实验表明,基于评论数据的隐式社交关系在多个数据集上使传统矩阵分解算法的RMSE降低了约3%。特别是当系统面临用户冷启动困境时,即只有少量用户评分数据可被收集到时,推荐提升效果更为显著,这表明丰富的评论数据能够被转换为改善推荐系统的有用知识。",2015/9/29 11:20,2016
CJFD2016,大数据时代数据处理技术对审计的影响研究,李记超;,重庆理工大学;,商场现代化,大数据;;审计模式;;审计方法;;完善建议,"随着信息技术特别是数据收集处理整合技术的发展,人类迎来了大数据时代。大数据时代大数据技术的产生和发展,影响着社会经济的各个方面,对审计技术和方法也产生了不可忽视的影响。先进的数据采集、挖掘、分析技术和方法,为审计提供了新技术新方法,促进了审计方式的发展、推动了审计模式的转变。研究大数据对审计的影响并提出相应的完善建议与要求对审计变革具有重要的意义。",2016/5/30,2016
CJFD2016,个性化推荐技术在政府网站中的应用,孙虹;,交通运输部科学研究院;,电子技术与软件工程,个性化推荐技术;;Web挖掘;;政府网站;;电子政务,"随着信息技术的不断发展,我国很多省市地区都建立了自己的门户网站,并逐渐开始完善自己的电子政务系统,但是很多政府网站的内容在信息推荐方式上非常的单一,大多数都只是通过关键字关联来推荐政府网站中的相关信息,导致公民在浏览政府网站的时候无法顺利的找到自己需求的信息,因此将电子商务中广泛运用的个性化推荐技术运用到政府网站中是非常有必要的,个性化推荐技术能够实现对用户的主动推荐,从而提供个性化的服务,本文从个性化推荐技术的核心技术以及研究内容、技术等方面,讨论政府网站中个性化推荐技术的应用。",2016/6/22 10:32,2016
CJFD2016,大数据在企业精益管理中的探索与应用,时小麟;薛训明;陆琨;石蕴玉;汪飞;,安徽中烟工业有限责任公司;,电脑知识与技术,大数据;;数据挖掘;;应用探索,"""大数据""是近年来兴起的热门词汇,并在很短时间内迅速渗透到每个行业,成为重要的生产因素。基于大数据的预测、分析将逐步融入企业管理和决策中。大数据技术和思维将影响企业管理与决策的各个环节,本文通过实例介绍了大数据在卷烟制造企业的应用。",2016/5/26 11:27,2016
CJFD2016,基于商业智能的数据仓库技术在警情决策支持系统中的应用探讨,贺一峰;,新疆警察学院信息安全工程系;,信息通信,商业智能;;数据仓库;;决策支持系统,"以往的线性结构类数据库有很多缺陷:例如数据散乱、数据格式不一致、数据可分析能力不强等等。因此,文章引进数据仓库技术,在解析系统构造的前提下,分析数据仓库技术的运用情况。基于商业智能的警情决策支持系统应用数据挖掘技术以及专家决策树的分析推理能力,构建出公安警情决策支持系统的框架,提升对现有公安大数据的分析研判处理能力。",2016/5/15,2016
CJFD2016,基于智能交通数据下的否定关联规则实验研究,孙剑斐;叶娅;,河南师范大学新联学院;,电子世界,智能交通;;数据挖掘;;否定关联规则,"目前,交通系统中的数据增长越来越快,特别是公交系统的数据采集和技术分析日益纷杂,伴随着数据的快速增长无疑是告知我们智能交通的大数据时代已经来临。当然,公交数据这类资源和其它资源相比,又有着其特殊性,一种快速且高效的公交数据采集方法,对于城市的公交系统有着其重要的作用,倘若数据这类资源不能得到有效利用,那么给市民出行带来将会是一种沉重的负担。本文主要利用大量公交IC卡刷卡的相关数据进行有效处理与分析,对否定关联规则算法进行深化研究。",2016/7/23,2016
CJFD2016,基于关联规则和复杂系统熵聚类的郭蓉娟治疗失眠“昼夜两方”用药规律研究,邹聪;郭蓉娟;袁清洁;,朝阳区太阳宫社区卫生服务中心;北京中医药大学附属东方医院;北京中医药大学;,中医临床研究,郭蓉娟;;失眠;;关联规则;;聚类算法,"目的:基于中医传承辅助系统(V2.5)软件,探讨郭蓉娟教授治疗失眠的用药规律与经验。方法:收集郭蓉娟教授门诊治疗失眠的病案,录入""中医传承辅助系统"",采用改进互信息法、复杂系统熵聚类、无监督的熵层次聚类等无监督数据挖掘方法,明确处方中各药物的使用频次及药物之间的关联规则,分析郭蓉娟教授治疗失眠的用药经验。结果:对筛选出的206首处方进行分析,确定处方中药物的使用频次,药物之间的关联规则,挖掘出16个核心组合和8首新处方。结论:郭蓉娟教授治疗失眠多用柔肝滋肾、疏肝清肝之品。",2016/5/10,2016
CJFD2016,关于中医药科学数据建设的思考,崔蒙;杨寅;,中国中医科学院中医药信息研究所;,中国中医药图书情报杂志,中医药;;科学数据;;虚拟研究院,"从中医药文献数据库、《中医药学主题词表》的研制到中医药信息数字化虚拟研究院、基于结构型数据库的数据挖掘,中医药数据建设取得了显著的成绩。但中医药科学数据在建设和利用中也存在一些问题,需要思考。中医药科学数据建设需要采用虚拟研究院模式,必须有稳定的队伍。中医药科学数据建设与利用必须符合中医药学自身规律,建立适合自身数据处理的方法。中医药科学数据建设的理论和方法学问题,不可单纯引进其他学科的理论和方法,而应该在中医药理论指导下借鉴这些理论和方法解决中医药数据建设的难点。",2016/8/15,2016
CJFD2016,面向医疗领域的大数据应用系统研究,张敬谊;,万达信息股份有限公司;,信息技术与标准化,医疗健康;;大数据;;应用服务;;大数据系统,"针对医疗健康领域中海量异构业务数据在传统信息化系统框架下无法高效处理和分析等问题,研究了医疗数据的特点及满足行业应用需求的大数据在存储处理、分析、应用管理支撑等方面的关键技术,提出了面向医疗领域的大数据系统技术框架,为促进大数据技术与医疗服务应用的深度融合提供参考借鉴。",2016/7/10,2016
CJFD2016,大数据背景下高校信息化建设的思考,李燕萍;,泉州工艺美术职业学院;,漳州职业技术学院学报,大数据;;高校信息化;;数据化,"以近年来快速发展的大数据为背景,介绍大数据的内涵及关键技术,结合高校对数据资源、信息化建设的需求,就未来高校信息化、数据化发展趋势,分析高校建立大数据和基于大数据面向全校师生提供在线教学、科学化管理、个性化服务的综合服务平台遇到的问题、挑战和机遇。并结合大数据技术、云技术、物联网等对高校信息化建设的影响提出初步探讨。",2016/6/15,2016
CJFD2016,浅谈大数据技术在广播电视监测中的应用,郭巍;,国家新闻出版广电总局监管中心;,计算机与网络,大数据;;有效数据;;智能分析;;混合架构,"随着广播电视监测播出形态的多样化,广播电视监测系统所涉及的领域逐步扩大,监测数据的体量也越来越大,如何从海量的监测数据中获取到有价值的信息,已经逐步成为目前广播电视监测工作者们面临的主要问题。本文重点介绍了大数据技术的特点和在广播电视监测中的应用前景,为监测数据的有效分析提供了参考。",2016/7/12,2016
CJFD2016,基于关联规则挖掘的跨网络知识关联及协同应用,黄晓雯;严明;桑基韬;徐常胜;,中国科学院自动化研究所模式识别国家重点实验室;中国—新加坡数字媒体研究院;,计算机科学,跨网络关联;;关联规则挖掘;;视频推荐,"随着社交媒体的兴起,各种社交媒体服务应运而生,社交媒体多源化现象越来越明显。一种基于关联规则挖掘的方法可以用来分析研究社交媒体多源现象,即通过同一个用户与不同社交媒体上多源数据的行为交互,挖掘社交媒体多源数据知识关联,进而设计跨网络协同的视频推荐应用。本研究框架主要分为3个步骤:(1)基于主题建模的知识发现,对用户和视频进行主题建模,得到其在主题层上的表示;(2)基于关联规则挖掘的跨网络知识关联,以跨网络共同用户作为连接不同网络的桥梁,利用关联规则的方法挖掘不同网络间的知识关联;(3)基于跨网络知识发现的冷启动视频推荐,将用户和视频映射到同一主题空间并进行主题匹配,最终进行视频推荐。实验结果表...",2016/7/15,2016
CJFD2016,基于矩阵的Apriori算法改进,宋文慧;高建瓴;,贵州大学大数据与信息工程学院;,计算机技术与发展,关联规则;;Apriori算法;;矩阵;;M-Apriori算法,"文中介绍了经典Apriori算法的原理、思想和步骤,以及基于矩阵的Apriori算法。针对Apriori算法需要多次扫描数据库和产生大量候选项集的缺点,提出了一种基于矩阵的Apriori算法的改进方法。该方法的不同之处在于矩阵的构建方法,通过对事务数据库的一次整体扫描,把事务数据库中的数据转换成一个上三角矩阵,然后通过访问上三角矩阵中的元素就可直接得到频繁1项集和频繁2项集,再根据经典的Apriori算法,利用频繁2项集得到频繁3项集,依此进行下去。该算法因为有上三角矩阵的引入,故可以适当地减少访问事务数据库的次数,同时还减少了大量候选项集的产生,尤其是二次候选项集,节约了存储空间。实验结果表...",2016/5/25 17:09,2016
CJFD2016,第三方支付粗糙复杂网络知识发现方法研究,曹黎侠;黄光球;李艳;,西安建筑科技大学管理学院;西安工业大学理学院;,计算机科学与探索,第三方支付;;粗糙复杂网络;;时间序列分析;;知识发现,"第三方支付平台的可持续发展是一个错综复杂的问题,解决问题的关键之一是平台潜在客户的挖掘。建立了第三方支付粗糙复杂网络,通过对该粗糙复杂网络的上下近似度、度分布和度的概率主值的研究,构建了第三方支付粗糙复杂网络知识发现模型,给出了基于粗糙集理论的时间序列分析法的求解方法。第三方支付粗糙复杂网络知识发现方法的研究,为第三方支付平台潜在客户的挖掘提供了定量化可操作的方法。提出了粗糙复杂网络的有关概念,以及第三方支付粗糙复杂网络的度分布,为第三方支付有关问题的研究奠定了理论基础;知识发现方法的研究,适应了动态知识系统更新的需求,因此有着广泛的应用前景。",2016/2/3 11:26,2016
CJFD2016,一种新的链接预测方法在复杂网络中的应用,李奋华;,运城学院计算机科学与技术系;,电脑知识与技术,数据挖掘;;链接预测;;复杂网络;;无标度;;聚类信息,"作为复杂网络分析的一项重要任务,链接预测已经被应用到诸多领域,例如:个性化推荐、决策支持系统和犯罪调查等。常用的链接预测方法主要是基于网络拓扑结构的方法,没有考虑网络的聚类信息因素。实际上,网络的聚类结果包含了对链接预测很重要的信息。在此基础上,一种基于聚类信息和网络特征的链接预测模型被提出,并在人造和真实网络数据集上进行了验证,具有较好的预测效果。",2016/8/9 16:14,2016
CJFD2016,中医医案数据库的构建及其应用研究,翁晓兰;申力;贾佳;吕瑛;陈裕;杨晓娟;,浙江中医药大学;上海生物信息技术研究中心;,浙江中医杂志,中医医案;;数据库;;名老中医经验;;数据挖掘;;医案分析,"文章构建了由中医数据库与方剂筛选系统相结合的名老中医临床信息分析平台,利用结构化医案方剂录入模块将临床病例数据化,利用医案方剂分析系统模块进行分析挖掘,形成知识挖掘。应用方面,结合浙江省中医院吴良村教授的门诊病历,开展肺癌疾病关乎中医治疗的医案实例分析。",2016/8/16,2016
CJFD2016,商务智能实践教学内容设计与方法研究,胡敏;,北京信息科技大学信息管理学院;,教育现代化,商务智能实践;;模块化教学,"本文主要研究信息管理专业商务智能实践教学内容、方法和基本步骤。课程按照知识点难易,可以做两类划分,一是课程总体分为基础内容模块和高级主题模块;二是对较为复杂的章节或算法,或对单个知识点的基础和高级模块的划分。商务智能实践课程需要让学生实现由问题找方法,进而深入理解方法的过程,需要学生对数据准备、数据挖掘、结果分析的三个阶段有深刻的认识。",2016/8/29,2016
CJFD2016,挖掘专利知识实现关键词自动抽取,陈忆群;周如旗;朱蔚恒;李梦婷;印鉴;,中山大学计算机科学系;广东第二师范学院计算机科学系;暨南大学信息科学技术学院;珠海魅族科技有限公司;,计算机研究与发展,背景知识;;关键词抽取;;专利数据;;支持向量机;;信息检索,"关键词是人们快速判断是否要详细阅读文件内容的重要线索,关键词自动抽取在信息检索、自然语言处理等研究领域均有重要应用.设计了一种新的关键词自动抽取方法,使计算机能够像人类专家一样,利用知识库对目标文本进行学习和理解,最终自动抽取出关键词.专利数据因其数据量庞大、内容丰富、表达准确、专业权威而被选中作为知识库来源.详细讨论了专利数据的特性,挖掘不同专利间的知识关联,针对某一知识领域构造背景知识库,在此基础上进行目标文本的关键词自动抽取.与目标文本相关的专利文集中每个专利的专利发明人、权利人、专利引用和分类信息都被用于在不同的专利文档之间发现关联性,利用关联信息扩充背景知识库,获得目标文档在各个相关...",2016/8/15,2016
CJFD2016,基于协议分析与模糊测试的SIP漏洞挖掘研究,李进东;王韬;吴杨;雷东;,军械工程学院信息工程系;,计算机工程,会话初始协议;;协议分析;;漏洞挖掘;;模糊测试;;测试用例,"针对会话初始协议(SIP)可能存在的安全漏洞以及对SIP漏洞挖掘研究工作不足的问题,基于协议分析与模糊测试,提出一种SIP协议漏洞挖掘方案。该方案在分析SIP协议语法、格式和会话流程的基础上,对可能出现漏洞的SIP消息生成对应的畸形数据包作为模糊测试的测试用例,并在会话建立的过程中随机发送畸形数据触发测试目标,在监视到SIP客户端发生异常时记录异常信息,并分析导致异常的错误是否能被利用。实验结果表明,该方案能更全面地挖掘出由协议分析结果和模糊测试发现的SIP漏洞,提高挖掘数量和效率。",2016/8/15,2016
CJFD2016,基于广电网络ODS进行运营数据分析,李志刚;李俊杰;,广东省广播电视网络股份有限公司江门分公司;广东省广播电视网络股份有限公司清远分公司;,中国新通信,ODS;;运营数据,"随着广东广电开始进入全面的视频和数据业务运营阶段,各种经营活动将逐步向精细化迈进。三网融合的大背景下,未来的竞争将考验广电运营商采集和分析数据的能力。对于现有的广电,缺少对数据挖掘和分析的经营分析系统,如何理解数据、规范数据、运用数据、实现数据从信息到价值的提升,成为摆在管理者面前一个重要课题。",2016/7/20,2016
