SrcDatabase-来源库,Title-题名,Author-作者,Organ-单位,Source-文献来源,Keyword-关键词,Summary-摘要,PubTime-发表时间,Year-年
CJFD2016,环境激励下结构模态辨识的识别概率直方图方法研究,陈太聪;李盈盈;苏成;马海涛;,华南理工大学土木与交通学院亚热带建筑科学国家重点实验室;,振动工程学报,模态辨识;;随机子空间;;稳定图;;识别概率直方图,"在环境激励下辨识结构模态时,系统阶次作为关键计算参数不易准确判定,通常采用基于假设系统阶次的稳定图方法来辅助进行,但其中稳定轴的判定较为主观,容易遗漏真实模态及引入虚假模态。基于数据挖掘技术,提出识别概率直方图(Identification-probability Histogram,IpHist)的新方法,对不同假设系统阶次下通过随机子空间识别得到的多组备选模态,根据频率容差和模态置信度容差准则进行一致性聚类,继而计算群组聚类结果的识别概率,并绘制相应的识别概率直方图,最后选取识别概率大的结果作为结构模态结果。通过IASC-ASCE结构健康监测工作组提供的4层框架Benchmark模型算例,...",2016/8/15,2016
CJFD2016,记忆计算:概念、特性及研究进展,郭斌;陈荟慧;李文鹏;於志文;姜佳君;王文辉;,西北工业大学计算机学院;,计算机科学,普适计算;;记忆计算;;情境感知;;数字记忆;;移动及可穿戴设备,"随着信息技术的发展,尤其是移动互联网与物联网的发展,有关个人工作和生活的数据呈指数型增长。这些海量的数据中蕴含着丰富而有价值的个人信息,如何从这些数据中挖掘出有价值的信息成为当前信息领域的重要问题。针对该问题,介绍了普适计算领域新兴起的研究主题——记忆计算。记忆计算旨在通过各种带感知和计算功能的设备,比如智能手机、可穿戴设备等,实时感知和捕获用户线上线下活动的数据,分析并挖掘其内在价值,进而组织和管理有意义的记忆数据,实现基于情境的记忆数据呈现,以辅助个体记忆,支持社群交流与协作。讨论了基于移动情境感知的记忆计算的概念、特性、系统模型以及当前研究的关键技术与挑战,综述了记忆计算在生活日志、记忆...",2016/9/15,2016
CJFD2016,分治策略下的代价敏感属性选择回溯算法,黄伟婷;赵红;祝峰;,闽南师范大学计算机学院;闽南师范大学粒计算及其应用重点实验室;,计算机科学与探索,粗糙集;;粒计算;;代价敏感;;属性选择;;自适应分治,"代价敏感属性选择是数据挖掘的一个重要研究领域,其目的在于通过权衡测试代价和误分类代价,获得总代价最小的属性子集。针对经典回溯算法运行时间较长的缺点,结合分治思想,提出了一种改进的回溯算法。改进算法引入了两个相关参数,根据数据集规模自适应调整参数,并按参数大小拆分数据集,降低问题规模,以提高经典回溯算法的执行效率。针对较大规模数据集的实验结果表明,与经典的回溯算法相比,改进算法在保证效果的同时至少提高20%的运算效率;与启发式算法相比,改进算法在保证效率的同时取得了具有更小总代价的属性集合,可应用于实际问题。",2015/12/9 11:03,2016
CJFD2016,基于改进的关联规则挖掘算法的用户兴趣挖掘,李珊;邵兰洁;孙丽云;,燕京理工学院信息科学与技术学院;,计算机时代,关联规则;;置信度;;数据挖掘;;用户兴趣挖掘,"研究发现,传统的关联规则挖掘算法在用户兴趣挖掘的应用中,摒弃置信度这个度量值。究其原因,在于网站结构中置信度不能准确度量用户兴趣。提出了一个可以替代传统置信度的、在网站环境下能正确反映用户兴趣的确定性的度量值,并结合用户的浏览速率进行用户兴趣挖掘。对比实验结果表明,此方法挖掘用户兴趣的效果明显。",2016/9/15,2016
CJFD2016,信息分析视角下的大数据分析平台构架研究,肖源;郝杰;刘莹;王涛;,中国人民大学信息资源管理学院;北京市西城区第一图书馆;中国人民大学信息学院;,情报科学,大数据;;信息分析;;大数据分析;;平台构架,"研究大数据下的数据分析平台构架的发展前沿,供信息分析研究人员借鉴。通过网络调查与文献资料收集,对现有成熟的大数据分析平台构架进行梳理,从共性和差异两方面进行比较,从共性分析思想、共性开源思想、共性领域、技术架构、核心技术和特色功能6个方面提出研究框架。选取4种典型大数据分析平台进行比较分析,总结可供我国信息分析领域借鉴的启示,提出一种广泛性的大数据智能信息分析平台,并总结大数据分析平台构架发展展望。",2016/9/5,2016
CJFD2016,基于CRM的酒店管理信息系统的分析与设计,吴晶;,陕西职业技术学院;,电子设计工程,酒店管理信息系统;;CRM;;模块化;;流程设计,"为了提高酒店行业的效率,保证酒店在激烈的市场竞争中能够盈利,提出了基于CRM的酒店管理信息系统的设计方案。本文阐述了CRM的基本原理和特点,对酒店管理信息系统的需求进行了分析,在此基础上对基于CRM的酒店管理信息系统进行了模块化的设计。最后给出了系统设计的流程图,并给出了网站模块、后台管理模块两个重要模块的设计。理论和实际应用表明,基于CRM的酒店管理信息系统能提高酒店效率20%以上,并能对酒店的盈利有很大的促进,达到了预期的研究目标。",2016/9/14 16:48,2016
CJFD2016,基于Hadoop平台的内容相似度与PageRank的垃圾短信识别融合模型,叶志雄;朱丽芳;刘钢庭;李启文;王丹弘;,中国移动通信集团广东有限公司;,广东通信技术,垃圾短信;;Hadoop;;内容相似度;;PageRank;;贝叶斯,"垃圾短信是一种包含有欺诈、骚扰等内容的异常短信,不仅损害通信行业的形象,浪费通信卡资源,还会产生商业诈骗,引发客户不满。垃圾短信以商业、广告类和欺骗类信息为主要内容,其特征明显区别于正常短信;同时,客户之间的短信发送行为是一种真实的社交关系。基于此,论文对垃圾短信的识别采用基于Hadoop大数据平台的模型融合方法,在常规的内容相似度模型基础上,对短信发送行为构建PageRank社交技术模型,通过对上述模型加权融合,最后得出批量的高疑似垃圾短信,实验结果表明融合模型效果较优。",2016/9/15,2016
,,,,,,,,
