SrcDatabase-来源库,Title-题名,Author-作者,Organ-单位,Source-文献来源,Keyword-关键词,Summary-摘要,PubTime-发表时间,Year-年
CJFD2016,关联规则挖掘以改进朴素贝叶斯,俞杰;丁晓剑;崔鹏;,信息系统工程重点实验室;,舰船电子工程,朴素贝叶斯;;条件独立性假设;;项目集,"朴素贝叶斯算法是建立在条件独立性假设上的,但是在实际应用中,类属性条件独立假设并不成立。针对这个问题,结合关联规则方法构造一个改进的朴素贝叶斯分类器。通过挖掘感兴趣的和频繁的项目集,深入研究样本算法中的属性联系。使随后运用朴素贝叶斯方法的各个属性尽量属性独立,达到朴素贝叶斯分类器的要求。实例标签方法改善了朴素贝叶斯的分类性能。",2016/5/20,2016
CJFD2016,基于连续值信息系统的模糊规则抽取,吉家锋;裴峥;,西华大学数学与计算机学院;西华大学无线电管理技术研究中心;,济南大学学报(自然科学版),信息系统;;模糊规则;;命题抽取;;规则抽取,"基于模糊隶属度函数和模糊蕴含算子,对于连续值信息系统和决策信息系统,提出抽取简单语言描述命题和复合语言规则的方法。抽取实验的结果表明,通过设置不同的阈值,该方法可获得不同支持度的直观结果,为获得信息系统的整体分布信息和可能蕴含的规则提供帮助。",2015/5/5 9:43,2016
CJFD2016,IDC运营的大数据分析与DCIM,任华华;,阿里巴巴集团技术保障部;,工程建设标准化,IDC运营;;大数据分析;;基础设施管理;;可靠运维;;绿色节能;;决策依据,"本文阐述了IDC运营需要大数据分析,DCIM是进行大数据分析的有效工具,能够为IDC运营带来价值;DCIM关注数据的整合、关联、挖掘与分析,并根据分析结果优化IDC运营;指出DCIM大数据分析是IDC运营不可或缺的工具,亟需针对具体运维需求进行深度开发和有效运用。",2016/5/28,2016
CJFD2016,电网企业数据资产监测机制研究,冯楠;贾大江;李燕;,国网山西省电力公司;国网山西省电力公司管培中心;,山西电力,数据资产;;数据资产管理;;数据资产监测机制,"数据资产监测作为数据资产管理体系的重要组成部分,是数据资产质量的重要保证,从电网企业数据资产监测机制的作用和范围入手,提出了数据资产监测的具体内容,并对数据资产监测方式及关键技术等方面进行了阐述。",2016/6/30,2016
CJFD2016,基于投影的高效用项集挖掘算法,王敬华;罗相洲;吴倩;,华中师范大学计算机学院;,小型微型计算机系统,投影;;高效用;;频繁项集;;模式挖掘,"随着高效用模式挖掘算法在实际应用中的重要性逐步显著,因而其得到了越来越多的关注和研究,但是已知的一些算法存在着多遍数据集扫描以及会产生大量候选项集、时效性不高等问题.这些问题使得高效用模式的挖掘效率大大降低,故本文提出一种新的基于投影的高效用项集挖掘算法HUPMP(high utility pattern mining on projection).采用基于投影的方式将项集的信息存储在数组中,能有效的减少前人基于树结构建树所产生的耗时.同时HUPMP算法将多次数据集扫描减少为只需要进行两次数据集的扫描便可挖掘出所有的高效用模式.另外,针对会产生大量候选项集的问题,提出了一种不同于闭包属性的新性...",2016/6/15,2016
CJFD2016,近场通信技术的安全研究进展与发展趋势,张玉清;王志强;刘奇旭;娄嘉鹏;姚栋;,中国科学院大学国家计算机网络入侵防范中心;西安电子科技大学综合业务网理论及关键技术国家重点实验室;北京电子科技学院;,计算机学报,近场通信技术;;安全威胁;;研究进展;;发展趋势;;网络安全;;信息安全;;网络空间安全,"随着移动互联网和移动支付的发展,NFC技术因其天然的安全特性和便利性,成为运营商、银行、厂商等热捧的对象.由于涉及到移动支付和敏感信息的传输,该技术也受到安全研究人员和攻击者的广泛关注.虽然国内外安全专家和学者对NFC安全问题已进行了一定的研究,但目前还没有详细和全面介绍最新安全研究成果的论文.为解决此问题,该文分析和总结了国内外最新的研究成果,并对NFC安全问题未来的研究方向进行了展望.首先,介绍了NFC技术的基本特性、通信过程、协议栈、工作模式等,分析了该技术面临的安全威胁,包括通信安全、安全漏洞、安全元件、恶意软件、网络钓鱼等内容.然后,通过分析相关研究工作,总结了NFC技术的安全研究现...",2015/11/19 12:32,2016
CJFD2016,TopicEye:一种基于可视化分析的探索来源不同话题的可交互方法,赵昉宇;,天津大学软件学院可视化分析与计算机图形学重点实验室;,计算机与现代化,可视分析;;焦点+上下文技术;;分层;;话题建模;;用户可交互,"为了更好地支持不同语料源中话题的集中分析,提出一种可视化分析的方法,可将不同来源文本中相关或独立的话题进行紧密聚类,构成一幅话题全景图,实现高效地交互式话题分析。该方法首先采用相关话题建模的方法,从不同来源的文本中抽取话题,然后,提出一系列交互式的可视化方案,从不同的角度,清晰地展示每个话题的观点和话题之间的关系,使用户可以更深入地分析和理解随着时间的变化,不同来源的文本之间的关系和各自的特点。该可视化分析方案不仅是可交互的,而且能从不同的层次和粒度来表现文本话题之间的关系。最后,将该方法应用于3种来源的论文集,并与专家共同对其进行定性评估,通过对现实世界的案例研究,验证该方法的有效性和鲁棒性...",2016/5/15,2016
CJFD2016,基于K-means聚类算法的公交行程速度计算模型,高曼;韩勇;陈戈;张小垒;李洁;,中国海洋大学信息科学与工程学院;,计算机科学,公共交通;;平均行程速度;;K-均值聚类算法;;数据融合;;数据挖掘,"定位与无线装置在公交系统中的广泛应用使得获取实时公交数据成为可能。为挖掘这些数据中蕴含的道路交通状况信息,提出了一种基于K-means聚类算法的数据融合模型,来计算相邻公交站点间的平均行程速度。首先对K-means聚类算法进行改进:(1)聚类数K不是预先设定的固定值,而是不重复样本数的平方根,不同路段不同时段K值不同;(2)初始聚类中心不是随机选取,而是根据K值按一定规则选取。其次利用改进的算法对样本数据进行聚类,然后对各类数据进行加权融合,计算出平均行程速度。最后通过折线图对青岛市4个城区的行程速度进行分析,挖掘交通流的演变规律。研究结果为交通管理、居民出行等提供了强有力的支持。",2016/6/15,2016
CJFD2016,软件开发中的活动模式挖掘,吉才盈;代飞;李彤;蒋旭东;,云南大学软件学院;云南省软件工程重点实验室;,计算机科学,过程挖掘;;原子活动;;活动模式;;折叠;;软件过程,"如何获取实际运作的软件过程(而非经验过程)是一个关键问题。软件过程的事件数据呈现记录多、无明确活动与独具过程特性的特点,使得现有的业务过程挖掘方法难以被有效应用。首先获取事件日志的原子活动;然后采用折叠的方法从软件项目开发实例中挖掘活动模式,获取软件过程,对不同时期的软件开发行为进行分析;最后通过一个开源项目的实际案例来验证该方法。",2016/6/15,2016
CJFD2016,大数据背景下海洋数据管理的挑战与对策,黄冬梅;赵丹枫;魏立斐;杜艳玲;王振华;,上海海洋大学信息学院;,计算机科学,海洋;;大数据;;数据存储;;数据质量;;数据安全,"空天地底海洋立体观测技术的飞速发展催生了呈指数级增长的多精度、多频度、大覆盖、多模态的海洋数据。然而,目前的研究主要集中于通用大数据,针对海洋数据的专门研究仍处于起步阶段。海洋数据的时空性、多源多类性、海量性、敏感性等特性为其管理带来了新的挑战。阐述了海洋数据的特点和海洋数据管理的基本架构,探讨了海洋数据在数据存储、数据质量、数据安全等环节面临的挑战,分析了相应的对策,为海洋科学与工程技术的研究提供了重要的参考与依据。",2016/6/15,2016
CJFD2016,点击欺诈群体检测与发现,董亚楠;刘学军;李斌;章玮;,南京工业大学计算机科学与技术学院;中国人民解放军73677部队;,计算机应用研究,点击欺诈;;欺诈群组;;孤立点检测;;贝叶斯分类,"针对目前存在大批网络用户,以群体形式来欺诈点击的问题,提出了一种检测点击欺诈群组的方法。首先使用频繁项集挖掘算法来发现共同点击过大量广告的个体用户,作为疑似欺诈组。然后,在对组内用户点击行为属性分析的基础上,运用孤立点检测方法找到与组内其他用户有显著差异的疑似欺诈用户。最后,运用贝叶斯分类方法对检测到的所有疑似欺诈成员分类,得到真正的欺诈群组和欺诈用户。在真实的数据集上进行的实验,验证了该方法的可行性和有效性。结果表明,该方法为点击欺诈检测问题提供了一条新的思路。",2015/9/29 11:19,2016
CJFD2016,大数据下微博推荐算法,张磊;吾守尔·斯拉木;买买提依明·哈斯木;于清;,新疆大学多语种信息技术实验室;,激光杂志,数据挖掘;;社交网络;;并行计算;;推荐系统,"为了提高微博推荐算法的准确率和解决社交网络平台海量信息的问题。基于LDA(Latent Dirichlet Allocation)三层模型提出C-LDA(Collaborative Latent Dirichlet Allocation)四层模型,该模型不仅考虑被转发者对转发者的影响而且考虑了关注者产生的影响。综合特征词热度、用户负样本反馈以及遗忘曲线等因素改进吉布斯采样算法,使用改进后的吉布斯采样算法近似求解C-LDA模型。然后运用模型中用户与微博的主题概率向量计算相似度,进行Top-K微博推荐。与以往方法相比,该方法适用于具有时效性和互动性的微博应用场景,推荐的效果更加理想。最后基于Had...",2016/6/25,2016
CJFD2016,基于半监督深度信念网络的图像分类算法研究,朱常宝;程勇;高强;,北京化工大学信息学院;,计算机科学,半监督学习;;深度信念网络;;受限波尔兹曼机,"近年来,深度学习在图像、语音、视频等非结构化数据中获得了成功的应用,已成为机器学习和数据挖掘领域的研究热点。作为一种监督学习模型,成功的深度学习应用往往要求较大的高质量的训练集。基于此,研究了多个受限波尔兹曼机组成的深度信念网络,结合半监督学习的思想,使用较小的训练集提高深度网络模型的分类准确性。分别采用了Knn,SVM和pHash 3种方法来学习非标示数据集,实验结果表明半监督深度信念网络比传统多层受限波尔兹曼机在图像分类准确率方面提高了约3%。",2016/6/15,2016
CJFD2016,大数据在企业精益管理中的探索与应用,时小麟;薛训明;陆琨;石蕴玉;汪飞;,安徽中烟工业有限责任公司;,电脑知识与技术,大数据;;数据挖掘;;应用探索,"""大数据""是近年来兴起的热门词汇,并在很短时间内迅速渗透到每个行业,成为重要的生产因素。基于大数据的预测、分析将逐步融入企业管理和决策中。大数据技术和思维将影响企业管理与决策的各个环节,本文通过实例介绍了大数据在卷烟制造企业的应用。",2016/5/26 11:27,2016
CJFD2016,浅谈大数据技术及其在土木工程中的应用,黄国豪;,梅县第一建筑工程公司;,江西建材,大数据;;土木工程;;信息管理,"随着网络技术的不断发展,数据信息量日渐庞大、复杂,大数据技术在一定程度上可以高效地处理庞大的数据的信息,深入挖掘其潜在价值。现如今,大数据技术已广泛应用于各行各业,尤其针对数据量巨大的土木工程行业的应用及其有效,发展前景良好。本文先简单介绍了大数据及其技术概念,在针对土木工程,分析大数据技术具体的两方面应用,最后提出未来的发展前景、道路。",2016/9/30,2016
CJFD2016,大数据时代高校数据管理的思考,马鸿健;张耘凡;王关祥;车路;王娇;,山东农业大学;,科技视界,数据管理;;数据采集;;数据分析,"随着高校信息化应用范围的逐步扩大,以及物联网、云计算、移动互联等新型信息技术的广泛应用,高校信息化建设逐渐进入了大数据时代。面对迅速增长的教育信息资源,海量信息的存储和利用问题日益严峻,各大高校对于数据采集整合、集中管理、分析挖掘的需求日益明显,都在探索和思考新的应对策略。",2016/6/25,2016
CJFD2016,并行化的高速列车运行状态评估,付小利;王晓乐;吕乾勇;金炜东;,西南交通大学电气工程学院;,计算机工程与设计,高速列车;;状态评估;;特征;;并行化;;K最近邻分类,"为高效评估高速列车运行状态,采用高速列车振动数据时域上的平均值、标准差、有效值等6种统计特征作为特征向量,对列车空气弹簧无气故障状态、列车横向减振器全拆故障状态、列车抗蛇形减振器全拆故障状态、列车正常运行状态进行表征,基于Hadoop平台结合并行化K近邻分类算法进行状态分类评估。实验结果证明,该方法能够很好地评估高速列车的故障状态,有效加快了大数据类问题的分析处理速度。",2016/7/16,2016
CJFD2016,基于智能交通数据下的否定关联规则实验研究,孙剑斐;叶娅;,河南师范大学新联学院;,电子世界,智能交通;;数据挖掘;;否定关联规则,"目前,交通系统中的数据增长越来越快,特别是公交系统的数据采集和技术分析日益纷杂,伴随着数据的快速增长无疑是告知我们智能交通的大数据时代已经来临。当然,公交数据这类资源和其它资源相比,又有着其特殊性,一种快速且高效的公交数据采集方法,对于城市的公交系统有着其重要的作用,倘若数据这类资源不能得到有效利用,那么给市民出行带来将会是一种沉重的负担。本文主要利用大量公交IC卡刷卡的相关数据进行有效处理与分析,对否定关联规则算法进行深化研究。",2016/7/23,2016
CJFD2016,税务数据治理在运营商政务云平台的实现方案研究,金天骄;,华信咨询设计研究院有限公司;,邮电设计技术,税务云;;数据治理;;标准化;;数据质量,"运营商利用自身的网络资源、渠道经验以及数据分析挖掘技术帮助政府部门提高工作效率和服务水平。根据税务治理需求,搭建政务云税务云环境,基于税务云环境开展税务数据治理。通过数据治理实现各类数据的集中定义和管理,为建立统一数据视图、数据仓库、数据集市提供语义基础,同时提供对各类数据的审核管理和维护机制。充分利用大数据、云计算技术,提升数据利用分析水平和数据治理能力,为客户构建一个开放协作的税务数据生态环境。",2016/6/20,2016
CJFD2016,基于关联规则挖掘的跨网络知识关联及协同应用,黄晓雯;严明;桑基韬;徐常胜;,中国科学院自动化研究所模式识别国家重点实验室;中国—新加坡数字媒体研究院;,计算机科学,跨网络关联;;关联规则挖掘;;视频推荐,"随着社交媒体的兴起,各种社交媒体服务应运而生,社交媒体多源化现象越来越明显。一种基于关联规则挖掘的方法可以用来分析研究社交媒体多源现象,即通过同一个用户与不同社交媒体上多源数据的行为交互,挖掘社交媒体多源数据知识关联,进而设计跨网络协同的视频推荐应用。本研究框架主要分为3个步骤:(1)基于主题建模的知识发现,对用户和视频进行主题建模,得到其在主题层上的表示;(2)基于关联规则挖掘的跨网络知识关联,以跨网络共同用户作为连接不同网络的桥梁,利用关联规则的方法挖掘不同网络间的知识关联;(3)基于跨网络知识发现的冷启动视频推荐,将用户和视频映射到同一主题空间并进行主题匹配,最终进行视频推荐。实验结果表...",2016/7/15,2016
CJFD2016,大数据征信业务特征探析,梁宏梅;,中国人民银行长沙中心支行;,征信,征信业务;;大数据;;信用信息,"随着信息技术的快速发展,大数据征信业务应运而生。大数据本身独有的特性,决定了大数据征信业务在征信活动的各个环节上特征鲜明,特别是在信息采集、处理、应用三个方面。信息采集方面的特征表现为:内容丰富、格式不受限制、数量异常庞大、方式主动灵活和渠道广泛多样;信息处理方面的特征表现为:存储智能化、处理快速化、加工个性化和挖掘深度化;信息应用方面的特征表现为:主体多元化、领域广泛化和方式便捷化。",2016/6/29 11:11,2016
CJFD2016,第三方支付粗糙复杂网络知识发现方法研究,曹黎侠;黄光球;李艳;,西安建筑科技大学管理学院;西安工业大学理学院;,计算机科学与探索,第三方支付;;粗糙复杂网络;;时间序列分析;;知识发现,"第三方支付平台的可持续发展是一个错综复杂的问题,解决问题的关键之一是平台潜在客户的挖掘。建立了第三方支付粗糙复杂网络,通过对该粗糙复杂网络的上下近似度、度分布和度的概率主值的研究,构建了第三方支付粗糙复杂网络知识发现模型,给出了基于粗糙集理论的时间序列分析法的求解方法。第三方支付粗糙复杂网络知识发现方法的研究,为第三方支付平台潜在客户的挖掘提供了定量化可操作的方法。提出了粗糙复杂网络的有关概念,以及第三方支付粗糙复杂网络的度分布,为第三方支付有关问题的研究奠定了理论基础;知识发现方法的研究,适应了动态知识系统更新的需求,因此有着广泛的应用前景。",2016/2/3 11:26,2016
CJFD2016,一种新的链接预测方法在复杂网络中的应用,李奋华;,运城学院计算机科学与技术系;,电脑知识与技术,数据挖掘;;链接预测;;复杂网络;;无标度;;聚类信息,"作为复杂网络分析的一项重要任务,链接预测已经被应用到诸多领域,例如:个性化推荐、决策支持系统和犯罪调查等。常用的链接预测方法主要是基于网络拓扑结构的方法,没有考虑网络的聚类信息因素。实际上,网络的聚类结果包含了对链接预测很重要的信息。在此基础上,一种基于聚类信息和网络特征的链接预测模型被提出,并在人造和真实网络数据集上进行了验证,具有较好的预测效果。",2016/8/9 16:14,2016
CJFD2016,中医医案数据库的构建及其应用研究,翁晓兰;申力;贾佳;吕瑛;陈裕;杨晓娟;,浙江中医药大学;上海生物信息技术研究中心;,浙江中医杂志,中医医案;;数据库;;名老中医经验;;数据挖掘;;医案分析,"文章构建了由中医数据库与方剂筛选系统相结合的名老中医临床信息分析平台,利用结构化医案方剂录入模块将临床病例数据化,利用医案方剂分析系统模块进行分析挖掘,形成知识挖掘。应用方面,结合浙江省中医院吴良村教授的门诊病历,开展肺癌疾病关乎中医治疗的医案实例分析。",2016/8/16,2016
CJFD2016,大数据时代背景下的国家安全治理,陈菲;,中南财经政法大学政治学系;,社会科学文摘,非传统安全;美国海军;美国国防部;车牌识别;决策力;谷歌地球;动态趋势;大数据集;研发计划;社交媒体;,"欧美部分国家已经将大数据运用到国家安全、反恐、应急管理等领域,并取得一定成果。在此背景下,欧美学术界越来越关注大数据在这些领域的应用,但是国内学术界对于此类问题的研究还比较缺乏。讨论大数据背景下政府保障国家安全的机会与挑战,思考国家安全治理数据化的突破和变革,显得尤为迫切和必要。大数据与国家安全治理概述大数据由海量数据组成,这些数据的规模之大使得人类无法在一定时间内通过常规软件对其收集、使用和管",2016/7/31,2016
CJFD2016,商务智能实践教学内容设计与方法研究,胡敏;,北京信息科技大学信息管理学院;,教育现代化,商务智能实践;;模块化教学,"本文主要研究信息管理专业商务智能实践教学内容、方法和基本步骤。课程按照知识点难易,可以做两类划分,一是课程总体分为基础内容模块和高级主题模块;二是对较为复杂的章节或算法,或对单个知识点的基础和高级模块的划分。商务智能实践课程需要让学生实现由问题找方法,进而深入理解方法的过程,需要学生对数据准备、数据挖掘、结果分析的三个阶段有深刻的认识。",2016/8/29,2016
CJFD2016,基于协议分析与模糊测试的SIP漏洞挖掘研究,李进东;王韬;吴杨;雷东;,军械工程学院信息工程系;,计算机工程,会话初始协议;;协议分析;;漏洞挖掘;;模糊测试;;测试用例,"针对会话初始协议(SIP)可能存在的安全漏洞以及对SIP漏洞挖掘研究工作不足的问题,基于协议分析与模糊测试,提出一种SIP协议漏洞挖掘方案。该方案在分析SIP协议语法、格式和会话流程的基础上,对可能出现漏洞的SIP消息生成对应的畸形数据包作为模糊测试的测试用例,并在会话建立的过程中随机发送畸形数据触发测试目标,在监视到SIP客户端发生异常时记录异常信息,并分析导致异常的错误是否能被利用。实验结果表明,该方案能更全面地挖掘出由协议分析结果和模糊测试发现的SIP漏洞,提高挖掘数量和效率。",2016/8/15,2016
CJFD2016,基于广度优先搜索的变异加权模糊C-均值聚类算法,翟丽丽;张影;王京;,哈尔滨理工大学高新技术产业发展研究中心;哈尔滨理工大学管理学院;,统计与决策,广度优先搜索;;模糊C-均值聚类;;变异系数赋权;;聚类评价函数,"针对传统模糊C-均值聚类方法(fuzzy C-means,简称FCM)对初始值敏感导致的易陷入局部最优和噪声敏感问题,文章提出一种基于广度优先搜索的变异加权模糊C-均值聚类算法。该算法通过改进具有全局搜索能力的广度优先搜索算法(Breadth Fist Search,BFS)和有效聚类评价函数相结合,确定了接近真实的初始聚类中心,同时能够剔除噪声数据。在此基础上考虑属性噪声对聚类结果的影响问题,引入变异系数赋权法对FCM的目标函数进行改进,进一步提高了FCM算法的抗噪性。实验结果表明,该算法能够有效的克服传统FCM的不足,与其他聚类算法相比,具有较快的收敛速度、更好的聚类准确率及较高的抗噪性。",2016/7/28 11:13,2016
CJFD2016,基于NMF的Web评论情感分类方法研究,任静;刘立波;,宁夏大学信息工程学院;,电脑知识与技术,Web评论;;情感极性分类;;非负矩阵分解;;支持向量机,"Web评论研究技术中,其情感分析就是将评论的情感极性进行褒贬分类的过程。本文将非负矩阵分解(nonnegative matrix decomposition,NMF)和支持向量机(support vector machine,SVM)相结合,构造出一种基于NMF的支持向量机(NMF-SVM)分类算法。该算法利用NMF对初始的""词—文档""向量矩阵进行有效降维,提取潜在语义,最后利用支持向量机对重新构造的""词-文本""向量模型进行情感分类。实验结果证明,该分类算法的准确率优于比传统的SVM算法,具有一定应用价值。",2016/8/9 16:14,2016
CJFD2016,大数据在智能交通领域的应用,陈昱嘉;,,中国公共安全,重点发展方向;基础领域;智能交通领域;智能分析;监控视频;多维数据集;时空域;元数据管理;交通管理;挖掘应用;,"大数据已经成为国家和各个城市在IT基础领域下一步的重点发展方向。大数据是最近最为火爆的技术概念,尤其是在贵阳召开的大数据博览会之后,大数据已经成为国家和各个城市在IT基础领域下一步的重点发展方向。不论政府、企业还是个人,都在关注如何采集数据,以及如何从数据中挖掘出有用的信息,进而创造",2016/7/15,2016
CJFD2016,基于大数据的路桥汽车用户线上2C运营方案研究,张恒;张磊;程新洲;陈崴嵬;,中国联通网络技术研究院;,邮电设计技术,大数据平台;;汽车运营;;用户画像,"通过分析汽车行业的大数据现状,结合目前路桥汽车用户收费模式,提出基于大数据的汽车用户线上运营方案。该方案包括了大数据平台建设和APP业务运营全链条,通过运营商和汽车本身数据分析,形成完善的汽车用户标签,通过APP向用户提供精准的车主、广告和金融等服务,提升车主服务体验,形成基于大数据的运营服务。最后在高端车主画像和挖掘方面进行了研究,通过大数据分析,形成一套高端车主的挖掘算法,为后期精准运营提供了技术参考。",2016/8/20,2016
