SrcDatabase-来源库,Title-题名,Author-作者,Organ-单位,Source-文献来源,Keyword-关键词,Summary-摘要,PubTime-发表时间,Year-年
CJFD2015,面向移动数据安全检测的文本分类算法比较研究,程骏;王健;,北京交通大学计算机与信息技术学院;,无线互联科技,移动数据;;文本分类;;安全检测;;分类算法,"随着移动互联网的普及和发展,移动终端越来越多的承载着互联网的应用和服务,安全问题日益严峻,移动数据安全检测具有重要的意义。文本分类作为一种自动化的数据挖掘技术,应用于移动数据安全检测可以在应用层实现对安全威胁的有效分类检测,具有自动化、高效、跨平台等诸多优势。文章对主流的文本分类算法进行了研究分析,并基于文本分类的思想和移动数据的结构特点,建立了移动数据安全分类模型框架。最后,通过实验进行了文本分类算法的分类效果比较,对今后移动数据安全检测研究中分类算法的选取具有一定的研究和应用指导价值。",2015/12/25,2015
CJFD2016,基于负载均衡和冗余剪枝的并行FP-Growth算法,刘祥哲;刘培玉;任敏;伊静;高钊;,山东师范大学信息科学与工程学院;山东省分布式计算机软件新技术重点实验室;山东财经大学数学与数量经济学院;山东建筑大学计算机科学与技术学院;,数据采集与处理,关联规则;;MapReduce;;冗余剪枝;;FP-Growth算法,"针对现有的并行FP-Growth算法在数据并行分组时存在数据冗余和负载不均的问题,提出了基于负载估算和冗余剪枝的优化算法。首先,在采用高频策略分组时,引入节点任务估算方法,把每个分组中最大模式树的最长路径和支持度作为该分组的估计值,将估计值远大于其他节点的分组进行分割,平均到其他分组中,并且对不同分组中重复的列表元素进行截断,去除冗余数据。实验表明,本文提出的算法能够有效防止并行化的数据倾斜,减少数据冗余,在时间和空间复杂度上要低于以前的并行化FP-Growth算法。",2016/1/15,2016
CJFD2015,基于十字链表的Separate算法研究,陈平;王利钢;,南京信息职业技术学院信息服务学院;,信息化研究,关联规则;;十字链表;;项约束;;频繁项目集,"生成频繁项集是约束关联规则挖掘中最耗时的一步。为提高挖掘的效率,文章提出一种基于十字链表的经典的约束算法(Separate)改进算法(SABCL)。该算法结合Separate算法和十字链表存储的优势,先根据约束条件过滤数据库并产生频繁项目,再利用十字链表存储频繁项目信息,通过遍历十字链表生成满足约束条件的频繁项集,从而避免重复扫描数据库,提高了挖掘效率。在美国蘑菇(mushroom)、象棋(chess)数据集上,对SABCL、Separate算法进行了实验对比,实验结果表明,在相同的条件下,SABCL算法能够快速地生成所有的频繁项集,时间性能优于Separate算法。",2015/10/20,2015
CJFD2016,单飞行事件噪声关联规则挖掘及信念网络表示,徐涛;杨婷婷;谢继文;,中国民航大学计算机科学与技术学院;中国民航大学中国民航信息技术科研基地;,中国民航大学学报,单飞行事件噪声;;关联规则;;信念网络;;FP-Growth-Cube算法,"挖掘各种噪声影响因素与机场噪声之间的关联规则,能够为机场经营者制定有效的降噪措施提供科学依据。先将FP-Growth算法与数据立方体相结合,构造FP-Growth-Cube算法挖掘单飞行事件噪声与各噪声影响因素之间的关联规则,然后通过信念网络可视化表示关联规则。此方法不但直观、清晰,而且克服了关联规则不能表达不同规则之间联系的弱点,图形化地综合表示各因素对噪声的影响。最后,实验从降噪措施之一的机型选择角度,与权威噪声预测软件INM对比,验证了该方法的可行性和有效性。",2016/2/15,2016
CJFD2016,基于污点分析的嵌入式设备固件模糊测试方法,戴忠华;赵波;王婷;邹力;,武汉大学计算机学院;中国信息安全测评中心;,四川大学学报(工程科学版),嵌入式;;固件;;漏洞挖掘;;污点;;危险权重,"针对现嵌入式设备固件的特点,提出一种基于污点分析的改进模糊测试方法。该方法首先从漏洞利用的角度分析固件的攻击面,然后根据攻击面导出相应的安全规则,并在污点分析结果中引入了测试用例危险权重,最后设计了与危险权重相对应的模糊测试用例集合。通过利用该方法对主流设备进行的漏洞挖掘实验,成功发现隐藏于设备固件中的若干零日漏洞。实验结果证明,该方法具备一定的有效性和实用性。",2016/3/15 16:54,2016
CJFD2016,基于事件的证券市场状态变化规则挖掘,姜丽;,上海应用技术学院计算机科学与信息工程学院;,科技创新与应用,事件;;证券市场;;数据挖掘;;ID3算法,"文章在前期市场状态研究的基础上,重点研究了三类影响市场状态的事件,建立了事件模型,并采用改进的ID3数据挖掘算法,得到了一组市场状态在事件刺激下的转化规则。最后,文章对得到的规则进行了分析。",2016/3/28,2016
CJFD2016,基于规则置信度调整的知识挖掘及在烟草科技管理中的应用,王塑;张萍;周新;王乙民;,陕西省烟草公司西安市公司;,计算机应用与软件,知识挖掘;;规则置信度;;信息管理,"介绍信息管理领域中的一个热门研究主题——知识挖掘。知识挖掘旨在从结构化、半结构化的数据中挖掘信息。例如从电子文档、不完备的历史数据中搜索稳定的模式或模型,分析挖掘数据间的交互特征和规律,以辅助管理人员制定、调整规范与标准,构建专家库和知识库。提出知识挖掘的一种改进方法,通过动态规则置信度生成算法提高所获得规则的准确性与适应性,并结合烟草企业科技项目智能辅助管理中的实际应用进行了验证,取得了一定的成效。",2016/3/15,2016
CJFD2016,数字出版领域中大数据技术的应用及前景思考,王兵;李逦;,辽宁行政学院;,数字技术与应用,数字出版;;大数据技术;;DRM,"伴随近几年数字出版的迅速发展,电子图书、期刊、杂志等数字形式的出版物在读者之间得到了普及,大数据技术在数字出版领域得到了广泛的应用。但大数据发展处于起步阶段,在硬件、软件技术方面具有一些缺陷,由此需要一种机制来维护数字出版的良性运作,文章在对大数据技术和数字出版阐述的基础上,对大数据技术中的数字版权管理(DRM)在数字出版领域中的应用进行研究。",2016/2/15,2016
CJFD2015,互联网视听节目监管系统发展思考,陈寒非;,南京市广播电视监测站;,电脑知识与技术,互联网视听节目;;监管系统;;发展,"互联网视听节目监管系统,具有分析各类媒体信息的功能,能对各种形式与格式的信息进行综合处理,以便相关网站对其进行分类与识别。为了提高网络管理效率,加强网络安全监督,实现网络管理智能化的目标。故而文章对节目数据的标准化、节目内容的挖掘深度以及视听监管系统之间的协调能力等方面进行分析,并结合作者多年工作经验,就优化视听监管系统的措施提出自己的观点,以供同行业工作人员参考。",2016/3/1 13:03,2015
CJFD2016,基于差分隐私的频繁项集挖掘研究综述,廖勇;,四川师范大学数学与软件科学学院;,电子技术与软件工程,差分隐私;;隐私保护;;频繁项集挖掘,"频繁项集及其真实支持度都可能泄露数据集中的隐私信息。最近提出的差分隐私保护模型比传统隐私保护模型隐私保护效果更好。首先,介绍了差分隐私保护模型的基本理论。其次,介绍了差分隐私下的几种频繁项集挖掘算法,分析了各个算法的优缺点。最后展望了未来的研究方向。",2016/2/18 15:56,2016
CJFD2016,基于kNN的聚类算法研究,郑诚;俞青云;,安徽大学计算机科学与技术学院;,赤峰学院学报(自然科学版),kNN算法;;k-means算法;;聚类分析;;微博文本聚类,"聚类分析在数据挖掘领域中占有重要地位,到目前为止学者们提出了许多的聚类算法.本文提出了一种基于k NN的聚类算法k-Nearest Neighbor Cluster(k NNC).该算法首先找到每个数据点的k个邻居点,然后设置匹配点数n,通过使用每个点的邻居点进行匹配进而达到聚类效果.本文通过三个实验去验证该算法,并且与k-means算法进行比较.实验结果表明,该算法具有稳定的正确率,而其最大的优点是不需要预先设定聚类簇数,它可以大致的找到聚类的簇数.",2016/4/25,2016
CJFD2016,基于大数据的K-means聚类算法在网络安全检测中的应用,郑志娴;王敏;,福建船政交通职业学院信息工程系;,湖北第二师范学院学报,大数据;;网络安全检测;;K-means聚类算法,"随着云时代的到来,大数据的应用受到了越来越多的关注。大数据的核心在于挖掘数据中蕴藏的价值链,为决策提供可借鉴参考。聚类算法是数据挖掘的一种归类方法,K-means则是基于划分的聚类方法。在网络安全检测中,应用K-means建立网络异常检测模型,可有效提高大数据环境下集中选取数据准确性的能力,控制检测误报率,缩短网络异常数据选取时间。但是,传统的K-means聚类算法在数据类型预处理、初始中心选取和K值确定等方面存在不确定性,导致对入侵检测的效率降低。本文提出一种改进的K-means算法,并通过利用KDDCup99数据集进行仿真实验,证明改进后的K-Means算法的检测准确率与检测效率要优于传统...",2016/2/15,2016
CJFD2016,基于物联网的城市环境卫生监测与GIS预警系统的研究,周子立;,浙江机电职业技术学院;,软件工程,物联网;;环境卫生;;监测;;GIS;;预警系统,"随着经济的发展和城市规模的日益扩大,环境卫生监测与地理信息(GIS)预警系统研究已经被广泛关注。本文介绍了采用M2M物联网高可靠通用通讯网关,实现准确、实时、自动化的数据采集;采用LDAP技术,实现跨层级数据汇总;结合IDSS及数据挖掘技术,为决策提供数据支持;利用Web GIS技术,实现城市环境卫生监测与预警系统的可视化。为相关研究提供了技术支撑,值得推广。",2016/4/5,2016
CJFD2016,基于模糊聚类的数据流概念漂移检测算法,陈小东;孙力娟;韩崇;郭剑;,南京邮电大学计算机学院;南京邮电大学江苏省无线传感网高技术研究重点实验室;,计算机科学,概念漂移;;数据流;;模糊聚类;;可变滑动窗口,"针对数据流中可能出现的概念漂移现象,采用改进的FCM算法进行模糊聚类,提出在大小可变的滑动窗口中通过度量相邻窗口之间的差异性来判断是否发生了概念漂移,并给出了相应的处理方法。实验表明该算法能够有效地检测出数据流中的概念漂移现象,具有很好的聚类效果和很高的时间效率。",2016/4/15,2016
CJFD2016,基于Bloom Filter的去重方法研究,赵艳红;李洪奇;朱丽萍;詹坤林;,中国石油大学(北京)石油数据挖掘北京市重点实验室;腾讯科技(北京)网络媒体事业部;,计算技术与自动化,信息超载;;个性化推荐系统;;Bloom Filter,"在个性化新闻推荐系统中,文章去重是一个重要的模块,避免了同一篇文章被重复推荐的现象。在海量用户场景下,采用传统的基于队列的去重方法将会消耗大量的内存。Bloom Filter是一种空间效率很高的随机数据结构,适用于允许有一定误判率的场景。本文基于Bloom Filter,设计双Bloom Filter位数组结构和Bloom Filter位数组链结构。实验证明,基于Bloom Filter位数组链的去重方法,不仅大大降低了程序对服务器内存要求,而且具有较好的灵活性和扩展性。",2016/3/15,2016
CJFD2016,企业数据仓库的建立与应用,叶翠莲;,昆山钞票纸业有限公司;,计算机与网络,企业数据仓库;日常业务;数据管理系统;企业规模;企业领导层;报表设计;数据集市;数据挖掘;系统架构设计;商业智能系统;,"信息化技术的不断提高和普及,企业除了将信息化系统、ERP系统等应用于企业日常业务中,把手工操作搬到电脑和网络上,对企业日常业务进行操作,对业务数据进行记录、收集和管理。近来,随着企业规模的扩大、业务数据的不断激增,当前的数据管理系统已经不能满足企业尤其是管理层、领导层的需要,企业业务数据对于企业领导层的决策无法保证数",2016/3/26,2016
CJFD2016,高效用项集挖掘算法综述,刘畅畅;,河南大学计算机与信息工程学院;,福建电脑,高效用项集;;效用挖掘;;频繁项集;;数据挖掘,"本文介绍了高效用项集挖掘的基本概念,列举并分析了三个高效用项集挖掘算法,指出了它们的优缺点,最后展望了高效用项集挖掘的未来研究方向。",2016/3/25,2016
CJFD2016,基于信息熵改进的K-means动态聚类算法,杨玉梅;,川北医学院图书馆;,重庆邮电大学学报(自然科学版),K-means算法;;信息熵;;数据挖掘;;动态聚类,"初始聚类中心及聚类过程产生的冗余信息是影响K-means算法聚类性能的主要因素,也是阻碍该算法性能提升的主要问题。因此,提出一个改进的K-means算法。改进算法通过采用信息熵对聚类对象进行赋权来修正聚类对象间的距离函数,并利用初始聚类的赋权函数选出质量较高的初始聚类中心点;然后,为算法的终止条件设定标准阈值来减少算法迭代次数,从而减少学习时间;最后,通过删除由信息动态变化而产生的冗余信息来减少动态聚类过程中的干扰,以使算法达到更准确更高效的聚类效果。实验结果表明,当数据样本数量较多时,相比于传统的K-means算法和其他改进的K-means算法,提出的算法在准确率和执行效率上都有较大提升。",2016/4/15,2016
CJFD2016,Apriori算法在三二分段成绩分析中的应用,苏伟斌;,东莞理工学校;,电子技术与软件工程,Apriori算法;;成绩分析;;数据挖掘,"本文介绍了Apriori算法的基本概念并以本人所在的中职学校计算机专业为例,介绍了使用Apriori算法来挖掘数据之间关联性的方法,找出规律,分析结果,为实际教学工作提供理论支持。",2016/4/19 17:19,2016
CJFD2016,内蒙古电力数据仓库的应用,张瑜;潘红芳;,内蒙古电力(集团)有限责任公司信息通信中心;,电信科学,电力大数据;;数据中心;;数据仓库,"随着电力信息化的发展,电力数据的积累速度越来越快,如何使大数据产生价值、为公司科学发展提供支持的议题被越来越多地提及。内蒙古电力公司从2011年开始建设一体化平台数据中心,当前已经完成了公司各业务口的数据集成工作,为数据利用提供了基础。依据建设的一体化生产经营决策分析系统建设情况,从应用需求、应用技术、数据分析挖掘3个方面介绍了内蒙古电力公司在大数据背景下的数据仓库应用的探索与尝试。总结了建设成果与建设经验,得出做好分析展现应用的关键是需求管理,核心技术是数据挖掘的结论。",2016/4/20,2016
CJFD2016,踪迹聚类下组织实体的重要度排序方法,徐涛;孟野;,中国民航大学计算机科学与技术学院;中国民航大学中国民航信息技术科研基地;,计算机应用,流程挖掘;;组织挖掘;;重要度排序;;社会网络;;复杂网络,"针对简单套用交接网络等社会网络分析方式不能很好地反映踪迹聚类生成的一系列流程的组织实体的重要度的问题,提出了一种踪迹聚类下组织实体的重要度排序方法。首先,对于参与踪迹聚类生成的一系列流程的组织实体构建踪迹聚类与组织实体关系网络;其次,定义基于踪迹聚类与组织实体关系网络的节点重要度评估方法;最后,对踪迹聚类下的各个组织实体节点计算其在关系网络中的重要度评分并排序。实验结果表明,所提方法构建的关系网络相比踪迹聚类下的交接网络能够更准确地反映组织实体的实际重要度;与基于拓扑势的网络社区节点重要度排序算法相比,所提方法的节点重要度排序结果更符合实际业务流程,能更好地区分关系网络中重要度不同的节点。",2016/5/10,2016
CJFD2016,电子商务个性化信息推荐服务计量分析与发展对策研究,王浩;,黑龙江大学信息管理学院;,内蒙古科技与经济,电子商务;;个性化;;信息推荐服务,"采用计量与可视化分析的方法,对我国电子商务个性化信息推荐服务的研究领域进行探索,把握研究的知识结构,为我国电子商务个性化信息推荐服务的发展提供参考。",2016/4/30,2016
CJFD2016,基于数据平台的智能协同设计系统研究,耿明;,中铁第四勘察设计院集团有限公司;,铁道工程学报,数据平台;;智能;;设计;;总线;;协同;;信息标准,"研究目的:目前协同设计系统主要为基于文本库的传统作业系统,设计数据提取、加工、使用、挖掘困难,影响设计进度和质量。智能数据协同设计平台的关键技术、构建方案需要进行深入研究。研究结论:(1)基于数据平台的协同设计关键技术主要有信息标准建立、设计数据及标准结构化、数据标准建立与维护、多专业标准化协同作业模式、应用软件研发、智能设计与在线设计集成、数据挖掘与抽取、系统展现等;(2)智能协同设计系统可大幅提高设计速度与设计质量,可在资源、行为、交付维度单独或同时提供文本(含音视频)、数据、BIM成果;(3)基于数据平台技术的智能协同设计系统是工程设计现代化的发展方向,也是建设协同系统现代化的基础和前提...",2016/4/15,2016
CJFD2016,不确定数据的朴素贝叶斯分类,马恺;,辽宁对外经贸学院;,洛阳师范学院学报,不确定数据;;分类;;朴素贝叶斯,"传统的机器学习和数据挖掘分类算法是在假设数据是完整精确的前提下进行的,然而在实际的应用中,由于数据存在不确定性,使这种假设很难成立.数据的不确定性可能是由多种原因导致的,比如测量错误、隐私保护以及传感器搜集的不确定信息等等.本文研究在不确定数据中使用朴素贝叶斯分类方法进行分类问题.",2016/2/25,2016
CJFD2016,关联规则挖掘算法FP-Growth在高职网络技术专业学生成绩分析中的应用,罗拥军;罗云芳;,广西职业技术学院计算机与电子信息工程系;,河池学院学报,关联规则;;FP-Growth算法;;成绩分析,"从大量的成绩数据中进行数据挖掘并从中获得有价值的信息,是一件非常有意义的研究。以计算机网络技术专业学生10年的成绩作为数据源,运用基于关联规则的FP-Growth算法,研究5门课程之间的关联,为制订该专业人才培养方案提供参考和借鉴。",2016/4/15,2016
CJFD2016,基于用户移动轨迹的个性化健康建议推荐方法,陈万志;林澍;王丽;李冬梅;,辽宁工程技术大学电子与信息工程学院;渤海装备辽河重工有限公司;,智能系统学报,移动医疗;;大数据分析;;移动轨迹;;特征向量;;个性化推荐,"随着移动智能终端的普及,移动医疗应用已成为当前研究的热点。针对移动医疗环境下个性化健康建议推荐问题,依据用户移动轨迹与职业类型间相似性特点,提出一种基于驻点区域特征向量与用户职业特征向量相结合的相似度计算方法,通过构建相似用户组的方式完成组内用户健康建议信息的共享,最终实现在节约医疗资源的基础上为海量用户提供个性化健康推荐服务的功能。算法测试与分析结果表明了方法的有效性和可实施性,在移动医疗大数据分析应用方面具有广阔的前景和实用价值。",2016/3/15 12:39,2016
CJFD2016,基于k-mediods及其改进算法的非法营运车辆识别,帅丹;蓝章礼;李益才;,重庆交通大学信息科学与工程学院;,计算机应用与软件,k-mediods;;距离贡献率;;偶然性;;RFID,"为从大量社会车辆中识别出疑似非法营运的车辆,提高交通管理部门行政执法的目的性和针对性,维护道路运输市场秩序,消除交通安全隐患。结合RFID车辆信息数据提出了基于k-mediods的非法营运车辆识别算法,并针对k-mediods算法缺点进行了基于距离贡献率和算法偶然性的2种改进。非法营运车辆识别的实现,首先需要提取出车辆RFID数据,并对其进行预处理,进而得到车辆运行行为数据,再利用PCA处理得到车辆运行特征数据,最后通过k-mediods算法聚类分析识别出非法营运车辆。实验结果表明,算法流程清晰,能够有效地识别出非法营运车辆。同时通过对算法进行改进,提高了算法稳定性和对非法营运车辆的正确识别数...",2016/5/15,2016
CJFD2016,基于MapReduce和矩阵的频繁项集挖掘算法,周国军;龚榆桐;,玉林师范学院数学与信息科学学院;,微电子学与计算机,MapReduce;;Hadoop平台;;矩阵;;频繁项集;;关联规则,"为了能高效地从大数据集中挖掘所有频繁项集,提出了一种基于MapReduce和矩阵的频繁项集挖掘算法.该算法将事务数据库转化为矩阵,按照垂直划分方法将矩阵分解成多个规模相同的子矩阵,根据MapReduce模型将子矩阵分配给计算机集群的节点,各节点并行对子矩阵计算候选项集的支持度.该算法在执行过程中产生的通信量较少,实现了节点计算任务的负载平衡.在Hadoop平台上测试了算法的性能,实验结果表明该算法具有较好的加速比和可扩展性,适合对大数据集挖掘频繁项集.",2016/5/5,2016
CJFD2016,基于聚类匿名化的差分隐私保护数据发布方法,刘晓迁;李千目;,南京理工大学计算机科学与工程学院;,通信学报,差分隐私;;隐私保护;;聚类;;数据发布;;匿名化,"基于匿名化技术的理论基础,采用DBSCAN聚类算法对数据记录进行聚类,实现将个体记录匿名化隐藏于一组记录中。为提高隐私保护程度,对匿名化划分的数据添加拉普拉斯噪声,扰动个体数据真实值,以实现差分隐私保护模型的要求。通过聚类,分化查询函数敏感性,提高数据可用性。对算法隐私性进行证明,并实验说明发布数据的可用性。",2016/5/25,2016
CJFD2016,基于SVD算法的智能新闻推荐系统的设计与实现,洪英汉;郭才;,韩山师范学院;,电脑知识与技术,SVD算法;;智能推荐;;数据挖掘,"针对目前综合信息发布平台信息数据量多、内容杂、分类不科学,导致网络访客淹没在信息海洋中。该文提出了基于SVD技术的智能新闻推荐算法,首先定义用户的兴趣爱好模型,根据用户访问网站的日志,不断调整用户的兴趣爱好模型,实时为客户提供精准的内容推荐。该算法的设计符合目前综合信息服务平台的实际需求,系统的实现证明该算法应用的效果良好,同时具备可扩展性。",2016/5/11 16:22,2016
CJFD2016,复杂网络中基于WCC的并行可扩展社团挖掘算法,亚森·艾则孜;李卫平;郭文强;,新疆警察学院信息安全工程系;铁道警察学院公安技术系;新疆财经大学计算机科学与工程学院;,计算机应用与软件,复杂网络;;社团挖掘;;并行算法;;可扩展性,"WCC(Weighted Community Clustering)通过复杂网络中社团含有的三角数量来评价社团挖掘算法的性能。在原始的WCC算法中,需要在每次迭代中对所有的社团变化计算WCC值,因而计算量非常大。为了减小社团变化带来的WCC计算量,提出一种并行可扩展的社团挖掘算法。对应用WCC进行社团评价的方法进行分析,提出一种包含预处理、初始划分和划分改进三个阶段的并行社团挖掘算法。在划分改进中,由于每次社团变化都需要计算大量的WCC提升,基于社团的统计量提出一种WCC近似计算方法。大量的真实数据集实验表明,提出的社团挖掘算法与相关算法相比较,不仅社团检测的准确性更高,而且具有更好的并行可扩...",2016/6/15,2016
CJFD2016,面向民生科技的智能健康系统发展策略,陶永;孙立宁;刘文勇;王田苗;匡绍龙;,北京航空航天大学航空科学与技术国家实验室(筹);中国航空工程科技发展战略研究院;苏州大学机电工程学院;北京航空航天大学生物与医学工程学院;北京航空航天大学机械工程及自动化学院;,科技导报,智能健康;;健康大数据;;精确诊疗;;生物三维打印;;微创手术;;助老助残,"围绕中国老龄化社会与民生科技发展对智能健康系统的需求迫切,介绍了智能健康系统的内涵与特征,阐述了健康大数据挖掘、个性化植入/介入生物三维打印、个体化精准诊疗、生肌电融合及助老助残等智能健康系统的基础科学问题与关键技术。围绕智能健康系统的应用领域、基础研究领域,介绍了国际研究的创新前沿与进展,国内智能健康系统的研究现状、优势单位与进展情况。",2016/5/13,2016
