SrcDatabase-来源库,Title-题名,Author-作者,Organ-单位,Source-文献来源,Keyword-关键词,Summary-摘要,PubTime-发表时间,Year-年
CJFD2015,邮件关系网络中关键人物识别研究,陈立新;,江西理工大学;,科技广场,邮件关系网络;;安然邮件数据集;;关键人物,"电子邮件是当前广泛使用的网络通信工具,邮件关系网络反映了人物间的社会关系,因此利用邮件数据识别出关系网络中的关键人物是数据挖掘领域的热点课题。本文以安然公司(Enron)邮件网络数据集为研究对象,通过一种综合评价算法来找出安然公司高管的组织结构及关键人物,主要从通信行为和邮件内容两个方面进行分析并验证该算法的有效性。",2015/10/30,2015
CJFD2015,基于电子商务大数据分析的指标体系研究,林敏;龚让声;,福建师范大学闽南科技学院;厦门华天涉外职业技术学院;,河南科技,电子商务;;大数据;;指标体系,"在电子商务中的信息流、物流和资金流三大平台中,每天将产生海量的大数据,而电子商务信息系统最核心的能力是对大数据进行处理、分析和挖掘。本文重点介绍电子商务大数据分析的指标体系。通过电子商务大数据分析的指标体系的研究,可以使大数据驱动电子商务运营精细化,提升运营效果和业绩。",2015/8/5,2015
CJFD2015,城市交通大数据技术及智能应用系统,熊刚;董西松;朱凤华;季统凯;,中国科学院自动化研究所复杂系统管理与控制国家重点实验室;中国科学院云计算中心;青岛智能产业技术研究院;,大数据,城市交通;;大数据;;云计算;;物联网,"城市交通大数据具有种类繁多、异质性、时空尺度跨越大、动态多变、高度随机性、局部性和生命周期较短等特征,如何有效地采集和利用交通大数据,满足高时效性的交通行政监管、交通企业经营管理、交通市民服务等应用需求,是城市交通和智慧城市面临的前所未有的机遇和挑战。重点分析总结了城市交通大数据的若干研究内容及核心技术,提出了城市交通大数据智能应用系统解决方案,列举了几种典型应用,在城市交通和智慧城市领域的大数据研发和应用领域进行了初步探讨。",2015/11/20,2015
CJFD2015,Hadoop在金融大数据的应用,闵凉宇;,首都经济贸易大学信息学院;,时代金融,Hadoop;;大数据;;HDFS;;MapReduce;;金融,"在当今信息化时代的背景下,数据存储量已经达到PB级,原有的关系型数据库已经不能满足要求,然而Hadoop借鉴Google的GFS和Map Reduce思想,可以适应大数据时代的4V[1]要求,而且现在已成为Big Data时代的关键部件,金融业是以数据为基础的行业,正是大数据的用武之地。",2015/11/20,2015
CJFD2015,决策系统在K-means算法中的应用,朱俚治;,南京航空航天大学信息中心;,计算机与数字工程,聚类;;决策系统;;K-means算法,"如今的聚类算法在数据挖掘和信息安全方面已有相当的应用。事实上在大数据时代之中,为了识别已知的或未知的数据则需要将通过数据聚类的算法来计算和实现。数据聚类算法是一种智能性的算法,其可以使得机器通过自我的学习来识别已知和未知的数据。目前的数据聚类算法,有基于划分的聚类算法、基于层次的聚类算法等各种的聚类算法。但在这些聚类算法中经典的算法仍然是基于距离的聚类算法,如K-means算法。因此论文的作者在查阅了一些关于距离聚类的算法之后,提出了将粗糙集中决策系统在K-means算法中进行首次的应用,这是论文的创新点。",2015/12/20,2015
CJFD2015,无线通信网络节点间通联关系的发现与更新算法,张攀峰;王世练;张炜;张尔扬;,国防科学技术大学电子科学与工程学院;,通信对抗,增量式PCA;;通联关系发现;;关联规则挖掘;;更新算法,"无线通信网络的节点间通联关系发现问题是网络层面通信对抗的一个重要问题。由于很难直接获得无线通信网络中节点间的通联关系,利用各节点的通信行为数据来进行通联关系发现是一个有价值的方向。考虑到各节点间的通信行为的关联,利用数据挖掘中的关联规则挖掘方法可以有效地从通信行为数据库中发现节点间的通联关系,将通联关系的发现问题转为关联规则挖掘问题,但现有的算法都不能高效地解决通信行为数据库变化时的通联关系更新问题。提出了一种针对无线通信网络进行节点间通联关系发现和更新的新算法。算法主要基于增量式PCA算法和矩阵变换,能够有效地从变化的庞大通信行为数据库中进行通联关系发现和更新。仿真实验表明算法在时间复杂度和...",2015/9/15,2015
CJFD2015,大数据处理流程及存储模式的改进,孙红;郝泽明;,上海理工大学光电信息与计算机工程学院;上海现代光学系统重点实验室;,电子科技,大数据;;数据存储;;数据分析;;Hadoop;;标签云,"结合大数据的特点,提出以标签云改进方案来快速识别网络热搜词,同时考虑到传统的数据仓库在查询、存储结构化数据方面的优势,在目前学者提出的数据仓库与Hadoop平台结合的基础上,提出了协作模式中与以往不同的数据迁移方式,即使用数据中间件,并通过相同数量记录导入Hadoop的时间比较,得出文中所提的数据迁移方法较Sqoop方法更具优势的结论。",2015/12/15,2015
CJFD2015,构建档案大数据应用平台的探析,陈琦;,泉州市投资贸易促进协调服务中心;,办公自动化,档案大数据;;应用平台;;建设,"档案应用大数据涉及整个档案管理系统在大数据时代发展理念、管理体制、和技术创新等方面的重大变革。通过以云计算技术取代传统的档案管理系统,数据治理和建设全国统一的档案数据模型和行业级档案数据中心,搭建集约化的档案大数据应用平台。通过档案数据的采集、智能处理、数据挖掘与智能检索三个层次,实现档案大数据应用系统开发工作。在档案应用大数据建设过程中,档案管理部门要以科学的态度,坚持实事求是的工作作风,注重档案数据应用的基础工作。制定切实可行的发展规划;提升档案管理部门大数据环境下的工作能力;大力培养档案大数据技术专业型人才。",2015/11/15,2015
CJFD2015,K-means聚类分析在就业管理系统中的应用研究,王志伟;王利军;,安徽经济管理干部学院;,电脑知识与技术,就业管理;;聚类分析;;数据,"学生就业管理系统可以采集毕业生的就业调查数据信息,并且可以对数据进行选择和转换以便数据挖掘的顺利完成,利用SPSS软件进行K-means聚类分析,从而得到有价值的信息,为学生管理工作和教学方案的修改制定提供参考。",2015/12/25 9:15,2015
CJFD2016,一种新型的技术形态识别方法——基于SAO语义挖掘方法,郭俊芳;汪雪锋;李乾瑞;朱东华;,北京理工大学管理与经济学院;,科学学研究,形态分析法(MA);;SAO语义挖掘;;技术机会分析(TOA);;形态结构;;染料敏化太阳能电池(DSSCs),"形态分析法作为一种面向未来的系统分析方法,已被广泛运用于技术机会识别和技术预测等领域。但现有形态分析方法中,形态结构构建过程对领域专家有较强的依赖。虽有学者尝试引入定量分析方法,但单纯以词频为依据选择特征词,忽略了词间的影响,存在无法展示技术/部件的目的、构成和语义关系等缺陷,限制了技术预测的效果。因此,本文引入主语-谓语-宾语(SAO)语义挖掘方法,提出一种新型的技术形态识别方法,并以德温特专利数据为基础,描述了专利技术形态识别的过程,验证了该方法的可行性和有效性。该方法弥补了基于关键词方法的不足,增强了定量方法对技术形态识别中的应用,减少了技术形态定义对专家知识的依赖,提高了技术形态识别的...",2016/1/15,2016
CJFD2015,基于聚类权重调度的大数据采样技术,耿德志;,晋中学院信息技术与工程学院;,世界有色金属,大数据;;采样;;数据聚类;;权重调度,"通过大数据优化采样提高对大数据的分析和调度能力。传统方法中对大数据的采样技术采用奈奎斯特采样定律,当大数据的特征信息出现非线性特性时,采样精度不高。提出一种基于聚类权重调度的大数据采样技术,进行大数据的分布式数据结构分析和时间序列模型构建,采用模糊C均值聚类方法进行大数据的聚类权重调度算法设计,以此为基础实现大数据的特征提取和特征采样。仿真实验结果表明,采用该方法进行大数据的信息采样,能有效提高采样精度,在大数据挖掘和特征提取方面具有重要意义。",2015/12/21 15:54,2015
CJFD2016,面向多源城市出行数据的可视化查询模型,汪飞;张繁;吴斐然;顾天瑜;高思远;赵烨;鲍虎军;,浙江大学CAD&CG国家重点实验室;湖南师范大学数学与计算机学院;浙江工业大学计算机科学与技术学院;肯塔基州立大学计算机学院;,计算机辅助设计与图形学学报,多源城市出行数据;;可视化查询;;查询模型;;可视分析,"多源城市出行数据为理解城市现象和享受城市生活带来了机遇.利用统计物理学和数据挖掘技术,人们在多源城市出行数据的研究上取得了很大进展,但是基于可视分析方法的研究甚少.为此,提出了一种可视化查询模型旨在解决应用可视分析方法研究多源城市出行数据时所面临的数据组织和可视表达上的挑战.查询模型从数据抽象,数据组织和管理,查询交互界面以及可视化分析等方面进行探讨,介绍了相关方法和技术.最后实现了查询模型的实例系统并通过典型案例证明了查询模型的有效性.",2016/1/15,2016
CJFD2016,基于模糊关联规则的微博用户潜在兴趣发现,牛朝林;高茂庭;,上海海事大学信息工程学院;,计算机系统应用,潜在兴趣;;关联规则;;主题模型;;加权;;微博,"针对微博用户兴趣随时间变化的特征,提出一种基于模糊关联规则的潜在兴趣发现方法(PIDFAR),利用LDA主题模型表达微博主题分布,通过时间加权的方式计算出用户现在兴趣的主题分布,进行模糊关联规则挖掘,得出关联规则集合以表示和发现用户兴趣随时间发生变化的一般规律,最后根据关联规则集合中关联规则和用户现在兴趣的主题分布来计算相似度,取相似度较高的关联规则的后项的集合组成用户的潜在兴趣.实验表明,PIDFAR方法能够使得用户潜在兴趣的发现过程脱离用户的好友群体限制,相比基于协同过滤技术的潜在兴趣发现方法明显提高了发现微博用户潜在兴趣的准确率.",2016/1/15,2016
CJFD2016,基于编辑图的XML文档相似性研究,徐沛娟;齐福慧;李卓;王利民;,吉林大学计算机科学与技术学院;,计算机工程与应用,可扩展标记语言(XML);;可扩展标记语言(XML)相似性;;编辑图;;编辑脚本;;拆分;;子路径集,"目前关于XML文档相似性算法有很多种,其中基于编辑距离的方法是很重要的一类。目前已发表的基于编辑距离的算法中,编辑图算法由于其计算高效率的特点成为研究的出发点。首先介绍了编辑图算法的思想,由于它在计算过程中对同层兄弟节点的顺序有很强的依赖性,因此不能准确有效地比较数据无序的数据中心的XML文档相似性。针对该问题,在编辑图算法思想的基础上,结合路径算法的思想提出拆分编辑图算法。实验结果表明,拆分编辑图算法降低了编辑图算法中对兄弟节点次序的依赖性,更适合于数据中心的XML文档相似性比较,而且所得结果更加准确有效。",2014/5/29 16:13,2016
CJFD2016,基于MapReduce的并行SFLA-FCM聚类算法,苟杰;马自堂;,解放军信息工程大学三院;,计算机工程与应用,聚类;;模糊C均值算法;;混合蛙跳算法;;MapReduce,"模糊C均值算法(Fuzzy C-Means,FCM)是目前应用比较广泛的一种聚类算法。FCM算法的聚类质量依赖于初始聚类中心的选择并且易陷入局部极值,结合混合蛙跳算法(Shuffled Frog Leaping Algorithm,SFLA)较强的搜索能力,提出一种基于MapReduce的并行SFLA-FCM聚类算法。该算法利用SFLA算法的子群内模因信息传递和全局信息交换来搜索高质量的聚类中心,根据MapReduce编程模型设计算法流程,实现并行化,使其具有处理大规模数据集的能力。实验证明,并行SFLA-FCM算法提高了的搜索能力和聚类结果的精度,并且具有良好的加速比和扩展性。",2015/8/20 16:41,2016
CJFD2016,一种基于MapReduce的文本聚类方法研究,李钊;李晓;王春梅;李诚;杨春;,北京交通大学软件学院;山东省计算中心(国家超级计算济南中心);山东省计算机网络重点实验室;山东省电子政务大数据工程技术研究中心;,计算机科学,文本聚类;;MapReduce;;K-means;;信息损失,"在文本聚类中,相似性度量是影响聚类效果的重要因素。常用的相似性度量测度,如欧氏距离、相关系数等,只能描述文本间的低阶相关性,而文本间的关系非常复杂,基于低阶相关测度的聚类效果不太理想。一些基于复杂测度的文本聚类方法已被提出,但随着数据规模的扩展,文本聚类的计算量不断增加,传统的聚类方法已不适用于大规模文本聚类。针对上述问题,提出一种基于MapReduce的分布式聚类方法,该方法对传统K-means算法进行了改进,采用了基于信息损失量的相似性度量。为进一步提高聚类的效率,将该方法与基于MapReduce的主成分分析方法相结合,以降低文本特征向量的维数。实例分析表明,提出的大规模文本聚类方法的聚类...",2016/1/15,2016
CJFD2016,基于局部加权重构的化工过程数据恢复算法,郭金玉;袁堂明;李元;,沈阳化工大学信息工程学院;,计算机应用,数据挖掘;;缺失数据;;数据恢复;;k近邻规则;;局部加权重构;;化工过程,"针对化工过程数据中存在缺失数据的问题,在保持局部数据结构特征的基础上提出了基于局部加权重构的化工过程数据恢复算法。通过定位缺失的数据点并以符号Na N(Not a Number)标记,将缺失的数据集分为完备数据集和不完备数据集。不完备的数据集按照完整性的大小依次找到它们在完备数据集中相应的k个近邻,根据误差平方和最小的原则,求出k个近邻相应的权值,用k个近邻及相应的权值重构出缺失的数据点。将该算法应用在不同缺失率下的两种化工过程数据中并与望最大化主成分分析(EM-PCA)法和平均值(MA)两种传统的数据恢复算法相比较,该算法的恢复数据误差最小,并且计算速度相比EM-PCA算法平均提高了2倍。实...",2016/1/10,2016
CJFD2015,客户关系管理系统在企业中的应用研究,尹蔓卓;,渤海大学信息科学与技术学院;,信息技术与信息化,企业;;管理系统;;客户关系,"随着信息技术和经济全球化的发展,现代企业之间的竞争也逐渐激烈,而现代企业间竞争的核心竞争力资源就是客户关系,因此实现良好客户关系管理对企业具有重要意义,而客户关系管理系统在企业中的有效应用有利于为企业提供管理工具和技术保障。本文主要研究客户关系管理系统的主要组成部分以及各部分的功能,介绍客户关系管理系统主要产品,最后探究客户关系管理系统在企业中的具体应用。",2015/12/15,2015
CJFD2016,基于位置签到数据的城市分层地标提取,王明;胡庆武;李清泉;秦龙焜;,武汉大学遥感信息工程学院;深圳大学空间信息智能感知与服务重点实验室;武汉大学测绘遥感信息工程国家重点实验室;,计算机学报,位置服务;;位置签到(Check-In);;地标;;POI;;显著度;;分层;;云计算,"为了及时准确地获取用于智慧位置服务的城市层次性空间知识,该文提出了一种依据签到属性显著度的差异从位置签到数据中提取城市分层地标的方法.首先,针对传统基于调查问卷的公众认知度计算方法存在的不足,该文从位置签到数据中的签到次数、签到用户数和用户影响因子3个方面入手讨论POI显著度的影响因素,进而提出了一种基于签到数据的POI显著度计算模型;然后,利用Voronoi图对POI空间作用范围进行分割并结合邻域分析与合并算法逐层迭代,形成了基于签到POI显著度与Voronoi图的分层地标提取算法;最后,以北京市的位置签到数据为例,进行了POI显著度计算与分时分层地标提取,通过与现有实体、网络地图资料的比对...",2014/12/19 0:07,2016
CJFD2015,大数据在酒店管理系统中的应用,杨慧慧;邓薇;陈冲;,东华理工大学软件学院;,科技广场,酒店管理系统;;大数据分析;;Tableau,"酒店管理行业的发展越来越依托于数据的分析,大数据的收集、清洗优化、挖掘及整合研究分析,给酒店的经营管理提供了巨大的帮助。本文采用Tableau作为分析工具,对酒店管理系统中的酒店预订模块、客户入住模块、客户结算模块中产生的数据进行大数据分析,准确的找出酒店经营存在的问题,使酒店管理决策者实现业务的提升。",2015/12/30,2015
CJFD2016,基于云计算平台的并行DBSCAN算法,蔡永强;陈平华;李惠;,广东工业大学计算机学院;,广东工业大学学报,大规模数据库;;DBSCAN算法;;重叠分区;;映射/归约,"DBSCAN算法是一种典型的基于密度的聚类算法,具有速度快、可以发现噪声的优点,但在处理大规模数据时出现聚类效率低、内存和I/O消耗大、聚类精度降低的问题,集群式计算机技术特别是云计算技术的发展提供了解决DBSCAN算法缺陷的方案.文中提出了数据预分区的并行PMDBSCAN算法,该算法在聚类之前对数据分区预处理,利用并行编程模型MapReduce实现DBSCAN算法并行化,结合重叠分区思想,减少I/O消耗.实验结果表明,在大规模数据集上,PMDBSCAN算法聚类有效提高了聚类的速度、减少了I/O消耗、改善了聚类的质量.",2016/1/15,2016
CJFD2016,数据仓库技术在医院信息化建设方案实现中的应用价值,李韬;冯佳莉;张屹;于树新;,河北北方学院附属第一医院信息管理处;河北北方学院附属第一医院肾内科;,中国医药导报,数据仓库;;联机事务处理;;信息化建设;;数据挖掘,"目的探讨数据仓库技术在医院信息化建设方案中的应用价值。方法于实施基于数据仓库技术的医院信息化建设前(2013年全年)向河北北方学院附属第一医院(以下简称""我院"")门诊患者发放医院医疗服务满意度调查问卷,选取500份合格问卷作为对照组;实施基于数据仓库技术的医院信息化建设后(2014年全年),向我院门诊患者发放相同问卷,选取500份合格问卷作为研究组;比较两组对门诊服务的综合满意度、等待时间、诊疗时间、医护人员工作绩效情况。结果研究组总满意度显著高于对照组(38.20%比19.00%);研究组等待总时间显著短于对照组[(30.21±8.73)比(62.89±10.75)min];研究组实际诊疗总...",2016/2/5,2016
CJFD2016,基于中医三路脉象诊断机制的脉诊数字化系统研制,史伟;刘卫兰;王伟浩;,洛阳职业技术学院;,电脑编程技巧与维护,中医脉诊;;数字化系统;;三路脉象;;数据挖掘,"中医脉诊数字化系统包括数据采集装置、信号通信装置和数据分析设备等。硬件系统可以实现对寸关尺三路脉象信号的釆集、分析和处理;软件部分将脉象的位、数、形、势和脉图的各项特征参数作自动分析处理。同时结合中医望诊和问诊(以人机对话形式),采用数据挖掘的方法建立起病名与脉象之间、证型与脉象之间的关联性,综合中医八纲辩证的思路,为被测者提供健康状况的指导。",2016/2/18,2016
CJFD2015,C4.5算法在高职学校成绩分析中的应用,卜阳;,江苏省徐州医药高等职业学校;,佳木斯职业学院学报,数据挖掘;;决策树;;成绩分析;;C4.5算法,"本文采用C4.5算法构造决策树的方法,对学生的成绩进行分析并找出影响成绩的主要因素和规则,给教师调整教学环节提供参考,对学生管理工作提出意见,从而指导教育教学工作。",2015/12/15,2015
CJFD2016,一种回声状态神经网络分类挖掘教学演示模型,王华秋;,重庆理工大学计算机科学与工程学院;,计算机时代,回声状态神经网络;;分类模型;;MATLAB组件;;Windows应用程序,"回声状态神经网络分类算法是一种重要的数据挖掘方法,是处理大数据分类的重要工具。但该算法原理比较抽象,从公式推导的角度很难让学生深刻理解,因此提出利用MATLAB数学软件实现回声状态神经网络分类算法,将其编译成.NET平台的COM组件,由Visual C#.NET集成开发环境下的应用程序调用编译后的MATLAB的COM组件,实现回声状态神经网络的分类模型。",2016/2/15,2016
CJFD2015,云计算环境下的数据挖据算法研究,张一名;,山西林业职业技术学院;,信息化建设,云计算;;数据挖掘;;研究,"基于项目协同过滤推荐算法是云计算环境下的数据挖据算法,用于解决Amazon.com中千万级的用户和产品数据挖掘和推荐。并且在如此海量的数据规模下,将已有的平台迁往云平台己大势所趋。本章将介绍基于项目协同过滤算法的并行化实现和性能分析。",2015/12/15,2015
CJFD2016,大数据助力信息安全解析,李卓璟;,永州一中;,信息化建设,大数据;;信息安全;;运用,"大数据已经成为了当前我国科技行业发展的一个重要领域,这种大数据技术的应用在很多方面都能够发挥出较为理想的作用和价值,本文就重点围绕着大数据在信息安全中的运用进行了简要的分析和探讨。",2016/2/15,2016
CJFD2015,DegreeTree:学者谱系构建系统,郝泽慧;孟小峰;,中国人民大学信息学院;,计算机研究与发展,学者谱系;;实体链接;;实体识别;;数据集成;;社会网络,"Web数据的不断丰富,使构建学者的社会网络成为可能,但是国内目前鲜有系统挖掘学者的师生关系.DegreeTree系统借助Deep Web数据集成技术从互联网上自动集成计算机领域的学位论文,进行数据清洗、实体识别、实体关系抽取和实体链接,由数据源模块、语义构建模块、查询处理模块、数据展示模块组成.由于学者的单位信息可能发生改变,匹配同一学者不同时期的导师、学生身份至关重要,该系统用学位论文的年份、授予单位、关键词、分类号等属性完成这一实体链接过程.用户使用DegreeTree系统可以查询以学者为中心的谱系图,并编辑修改错误或缺失信息.",2015/10/15,2015
CJFD2016,基于SVM的局部潜在语义分析算法研究,谭光兴;刘臻晖;,江西财经大学信息管理学院;,计算机工程与科学,文本分类;;局部潜在语义分析;;支持向量机;;奇异值分解;;S-LLSA,"针对现有的Web文本分类与表示方法中出现的各种分类效果与性能优化等问题,基于局部潜在语义分析的理论原理,利用支持向量机分类优势,设计出一种基于文档与类别之间相关度的生成局部区域的算法,即S-LLSA。该算法在语义分析使用矩阵的奇异值分解过程中引入不同类别信息,分析特征词的局部特征,使用支持向量机分类器计算文本对类别的相关度参数,并应用于局部区域生成过程。通过实验表明,S-LLSA算法有效解决了局部区域如何进行局部奇异值分解问题,有效提高并优化了Web文本分类效果,更好地表示了Web文本潜在语义空间。",2016/1/15,2016
CJFD2016,基于多标记学习的汽车评论文本多性能识别,张晶;李德玉;王素格;,山西大学计算机与信息技术学院;,计算机工程与科学,多标记学习;;文本处理;;汽车评论;;多方面识别,"针对汽车产品评论文本中出现的多方面性能,提出一种基于多标记学习的汽车评论文本多方面性能识别方法。首先,结合文本挖掘方法,利用多标记文本特征选择方法选取特征,将非结构化的文本转化为结构化的多标记数据集。在此基础上,使用四种多标记分类方法,对待识别的评论文档标注一个或多个方面标记。最后,以八种多标记评价指标评估方面识别的性能。在新浪汽车评论语料上的实验表明,方面识别的子集准确率达到了95%,验证了方法的可行性。",2016/1/15,2016
