SrcDatabase-来源库,Title-题名,Author-作者,Organ-单位,Source-文献来源,Keyword-关键词,Summary-摘要,PubTime-发表时间,Year-年
CJFD2012,基于模糊决策树的高校就业数据挖掘研究,杨断利;张锐;王文显;,河北农业大学信息科学与技术学院;河北农业大学现代科技学院;,河北农业大学学报,模糊决策树;;就业中文;;数据挖掘,"随着高等学校招生规模的扩大,大学生就业形势日益严峻。数据挖掘技术可以从大量的历史数据中发现内在的规律和联系。对高校学生就业进行数据挖掘,可发现潜在规律,为就业指导提供决策依据。决策树分类方法是一种有效的数据挖掘方法,但该方法不能很好地处理数据模糊性和不确定性问题。本文提出将模糊决策树算法引入高校就业数据挖掘,解决了数据模糊性和不确定性的问题,生成的知识表示方式自然,易于理解,并且具有更强的分类能力及稳健性。",2012/3/15,2012
CJFD2012,数据挖掘技术在高校教学管理中的应用,江敏;徐艳;,泰州师范高等专科学校;,电脑知识与技术,教学管理;;数据挖掘;;关联规则;;决策树,"作为教育信息化的重要组成部分,高校教学管理系统中收集了大量的教学信息,但大多没有得到很好的挖掘和研究,所以数据挖掘在高校教学管理系统中的应用具有现实意义。该文介绍了数据挖掘技术的基本原理和解决问题的方法,并讨论了一种将数据挖掘技术与高校教学管理系统相结合的方法,提高了高校教学管理的工作效率,实现了教学资源安排的合理性,在高校教学信息化建设方面做出了新的探索。",2012/8/25,2012
CMFD2008,关联规则挖掘算法的研究与应用,焦亚冰,,山东师范大学,数据挖掘;;关联规则;;Apriori算法;;教学评价,"随着计算机技术,特别是数据库技术的发展,在各行业数据库中积累了大量的数据。如何发现隐含在这些数据中的规则和知识,并辅助决策,成了要解决的问题。数据挖掘技术的出现和发展为此提供了有力的支持。数据挖掘就是从大量的、不完备的数据中,提取出事先未知的、但具有价值的信息和知识的过程。 关联规则挖掘是数据挖掘的一个重要研究分支,主要用于发现数据集中项之间的相关联系。由于关联规则形式简洁、易于解释和理解并可以有效地捕捉数据间的重要关系,从大型数据库中挖掘关联规则问题已成为数据挖掘中最成熟、最重要、最活跃的研究内容。 教学评价依据一定的教学目标与教学规范,对教学活动以及教学成果给予价...",2008/4/5,2008
CMFD2008,数据挖掘在房地产客户关系管理中的应用研究,吕圣军,,浙江工业大学,房地产;;客户关系管理(CRM);;关联规则;;Apriori算法,"客户关系管理(CRM)是企业的一种商业策略,它在现代企业中扮演越来越重要的角色,是企业提升竞争力的必经之路。在客户关系管理流程中,如何将大量的客户资料和交易数据转化为能够为企业决策提供支持的各种信息是房产企业面临的一个重要问题。 面对快速增长的海量数据收集,企业需要有力的数据分析工具将丰富的数据转换成有价值的知识。数据挖掘是一个从大量数据中提取有用的、有趣的知识的处理过程。数据挖掘发现的知识模式有多种不同的类型,常见的模式有:关联模式、分类模式、聚类模式、决策树等。本文着重介绍了关联模式(关联规则)的基本概念、常用的算法和改进算法,以及研究现状,并指出关联规则挖掘是当前的热门...",2008/1/1,2008
CJFD2009,公安数据仓库和数据挖掘应用研究,麦永浩;杨超;,湖北警官学院;,警察技术,数据仓库;;数据挖掘;;公安,"本文对公安数据仓库的建设进行了研究,对公安数据挖掘的一些方法进行了探讨,分析了公安数据仓库和数据挖掘的整体框架。",2009/3/7,2009
CJFD2009,数据挖掘研究综述及其在国土资源信息化中的应用研究初探,王永刚;,中国科学院遥感应用研究所;北京市国土资源局;,国土资源信息化,数据挖掘;;空间数据挖掘;;国土资源,"本文系统论述和总结了数据挖掘和空间数据挖掘的概念、技术方法和研究现状。详细介绍了目前主流的数据挖掘厂商及解决方案。文章最后简要分析了数据挖掘技术在国土资源行业中的研究现状,并对如何利用这些新技术为国土资源业务管理与决策支持提供帮助进行了初步探讨。",2009/4/20,2009
cjfd2001,基于小波理论的数据挖掘方法研究,张德干;郝先臣;徐凌宇;杜庆东;赵海,东北大学信息科学与工程学院;东北大学信息科学与工程学院;东北大学信息科学与工程学院;东北大学信息科学与工程学院;东北大学信息科学与工程学院 辽宁沈阳110006 ;辽宁沈阳110006 ;辽宁沈阳110006 ;辽宁沈阳110006 ;辽宁沈阳110006,小型微型计算机系统,数据挖掘;;小波理论;;小波变换;;带通滤波;;信号提取;;信息融合;;水电站,"小波理论在信号处理、图象处理、模式识别、计算机视觉、多传感器信息融合等方面呈现出强劲的发展势头 .数据挖掘能从大量的、不完全的、有噪声的、非稳定的、模糊的和随机的数据中 ,提取人们事先不知道的但又是潜在有用的信息和知识 .本文基于国内外的最新研究成果 ,对小波理论和数据挖掘技术进行了研究 ,提出了基于小波理论的数据挖掘方法 ,并通过实验进行了可行性验证 ,从而为此技术的广泛应用提供了依据",2001/8/21,2001
cjfd2001,一种文本分类数据挖掘的技术,杨斌;孟志青,湘潭大学信息工程学院;湘潭大学信息工程学院 湖南湘潭411105 ;湖南湘潭411105,湘潭大学自然科学学报,文本挖掘;;文本分类;;数据挖掘;;VSM,"挖掘的理论和应用研究是数据挖掘领域一个新的重要分支 ,介绍了一种文本数据挖掘方法 .首先 ,论述了文本挖掘的意义和重要性 ,探讨了文本挖掘的定义和文本分类的一些形式 ,然后讨论了一个以数据预处理、特征提取、特征表示和特征匹配等文本分类的一些关键理论问题 ,并给出了一个基于该方法的文本分类系统的实验结果 ,实验结果表明了该方法的可行性",2001/12/30,2001
CMFD2015,基于时间序列挖掘的探地雷达数据分析研究,段丽丽,,山东师范大学,探地雷达;;时间序列;;数据挖掘;;动态弯曲距离,"随着人类文明的不断发展、科学技术的突飞猛进以及对大自然认识的日益深入，人类对地球表面下的空间产生了愈来愈急迫与深入的探知需求。探地雷达(Ground PenetratingRadar, GPR)，是近几年发展起来的具备最大潜力的浅地表层遥感技术，它具有速度快、低损耗、分辨率高的突出优点。探地雷达采集的资料记录包含有丰富的地质信息，使得探地雷达资料的处理和解释变成了矿藏勘查、地质勘探等领域中一项很重要的工作。为了获得更多详尽有效的地层信息，发现和开采更多的资源，就需要寻找快速而有效的方法以提取探地雷达信号中的有效信息，挖掘和解释其代表的现实意义。 时间序列挖掘作为数据挖掘领域的重要分支，是...",2015/5/30,2015
CJFD2015,一种基于Hadoop的大数据挖掘云服务及应用,何清;敖翔;庄福振;罗平;,中国科学院计算技术研究所;,信息通信技术,大数据;;数据挖掘;;云服务;;Hadoop,"大数据潜在价值的发现依靠的是数据挖掘技术,但时间成本、技术门槛和价格因素等方面的原因使得相当多的数据拥有者没有享受到大数据所带来的利益。若数据挖掘以服务方式提供给数据拥有者将有可能对他们带来极大帮助。文章介绍一种基于Hadoop的大数据挖掘云服务WMCS的平台架构,分析其在政府和证券行业的相关应用,具体阐述WMCS的前后台架构以及并行化算法实现方法示例。基于WMCS,在面向政府管理的网络事件子话题分析和面向证券行业的新闻情感分析两个原型应用上的效果表明,该平台具有良好的效果与广泛的应用前景。",2015/12/15,2015
CJFD2016,应用驱动的大数据挖掘,李涛;刘峥;周绮凤;,南京邮电大学计算机学院;佛罗里达国际大学计算机学院;厦门大学自动化系;,中兴通讯技术,大数据;;数据挖掘;;应用驱动;;FIU-Miner;;高端制造业,"认为大数据挖掘的核心和本质是应用、数据、算法和平台4个要素的紧密结合。从大数据的特点出发,结合大数据挖掘的案例,提出大数据挖掘中的平台架构、数据获取和预处理、算法的选择和集成都是应用驱动的。强调大数据挖掘的目标来自实际应用的真实需求,只有结合具体应用数据和适合应用的算法,利用高效处理平台的支撑,并将挖掘到的模式或知识应用在实践中,才能体现大数据挖掘的真正价值。",2016/2/29 16:13,2016
CMFD2012,数据挖掘中的聚类方法及其应用研究,张俊生,,天津理工大学,移动通信;;数据挖掘;;聚类分析;;客户关系管理;;网络优化,数据挖掘技术是近年来随着数据库和人工智能逐渐发展起来的一门新兴科学。作为一种新的数据提取工具，它能够自动地、智能地把数据转换成有用的信息和知识，决策制定者可以根据这些信息和知识，制定出有效的商业策略。正因为数据挖掘具有如此巨大的商业前景，所以该技术引起了学术界和商业界的广泛关注。 聚类分析是数据挖掘的一种方法。我们面对海量数据的时候，首先必须要做的就是对它进行归类，而对于原始数据进行归类的一种行之有效的方法就是聚类分析法。聚类分析的应用十分广泛，在生物学领域里，聚类分析可以推导动植物的分类，基因的分类分析。在商务市场领域，聚类分析可以帮助市场分析工程师从客户的基本信息库中发现不同的客户群...,2012/1/1,2012
CMFD2012,基于时间序列的关联规则数据挖掘在证券中的应用,叶翔,,南昌大学,数据挖掘;;关联规则;;时间序列;;股票;;比特串,"股票的趋势研究一直是股民关心的问题,研究的方法有很多。本文使用了数据挖掘的一个重要分支,关联规则方法来挖掘股票间的联动关系,统计3只股票带时序上涨的情况在过去的某个时间段中出现的次数。如果出现次数多,也就是支持度和置信度都较大,那么当“股票A第Ta天上涨且股票B第Tb天也上涨”的情况出现时,可以考虑在Tc天买入第三只股票。这里的Ta,Tb和Tc可取任意值。得出的规则可以用来辅助股票投资。 本文的主要研究内容包括以下几个方面： (1)对国内关于股票方面的关联规则挖掘的相关文献进行分析和总结,对股票挖掘过程进行了深入探讨,对挖掘过程中的数据预处理、算法、关联规则兴趣度这三个方面已有的一...",2012/6/5,2012
CJFD2011,基于函数型数据分析的数据挖掘功能研究,王凯平;,山东大学管理学院;,统计与决策,函数型数据;;数据挖掘;;模式,"数据挖掘功能是数据挖掘研究与应用的一个重要方面。数据挖掘功能用于指定数据挖掘任务中要找的模式类型。当前,数据挖掘的功能所处理的主要是传统的数据,对于函数型数据的研究还不是很多。文章探讨了数据挖掘中可以挖掘的几种函数型数据模式,包括数据描述、分类、聚类和回归。",2011/2/28,2011
CJFD2011,数据仓库和数据挖掘技术在保险公司中的应用,杨杉;何跃;,四川大学锦城学院;四川大学工商管理学院;,计算机技术与发展,数据挖掘;;人寿保险;;客户流失;;客户理赔,"随着我国保险市场的开放,我国保险业的垄断格局被打破,竞争也日趋激烈。保险业作为传统数据处理密集型行业之一,已经积累的大量业务数据。如果能够根据保险公司的实际情况,构建数据仓库平台,利用数据挖掘技术挖掘其中蕴涵的知识和信息,就能有效地制定市场策略,以及时把握市场机会。结合A人寿保险公司的实际情况,详细设计和实现了A人寿保险公司的数据仓库,接着以该数据仓库为数据源,分别实现了客户流失挖掘模型和客户理赔风险模型,利用直观的图表方式将数据挖掘的结果展示出来。最后给出了模型的验证与评价方法,得出了有价值的结论,可以为保险公司的决策层提供参考。",2011/6/10,2011
CJFD2014,数据挖掘研究现状及发展趋势,张莉;,合肥工业大学;淮北职业技术学院;,赤峰学院学报(自然科学版),数据挖掘;;信息处理;;发展方向,"随着网络技术的不断迅速发展,大型数据库开始不断出现,而如何从大量数据中获取有特定意义的知识成为了当前技术需要解决的重要问题,由此出现了数据挖掘这种新型的信息处理技术.主要从数据挖掘概念出发,介绍了数据挖掘中的几种比较常见的处理方法的概念与特点;同时也详细的总结了当前情况下在这一方面的研究现状,并最终指出了该技术在未来几年的发展方向.",2014/9/25,2014
CJFD2013,基于校园GIS的空间数据挖掘系统原型,于永玲;李向;宗思生;施进发;,郑州航空工业管理学院;,计算机技术与发展,空间数据挖掘;;系统原型;;数字校园;;关联规则;;GIS,"为了建立数字校园信息平台,必须对校园GIS数据进行分析和挖掘。文中提出将校园GIS与数据挖掘系统进行集成,空间数据库系统负责空间信息抽取,GIS实现对挖掘结果进行可视化显示。搭建一个空间数据挖掘原型系统模型,利用设计的挖掘算法,挖掘出空间数据库中隐含的知识,并将空间数据挖掘结果进行可视化输出。该原型系统已成功应用于某高校校园GIS,不仅可以挖掘显示知识(校园每个教学楼的上座率),还可以发现隐藏在校园GIS中的隐式知识,是对现有空间数据挖掘系统的有益改进和补充。",2013/9/29 15:44,2013
CMFD2010,数据挖掘技术在高校学生成绩分析中应用的研究,张莉,,中国石油大学,数据挖掘;;数据仓库;;决策树;;聚类,"努力提高学生的成绩是每一所高校的目标,学生成绩是评估教学质量的重要依据。现在高校规模不断扩大,学生数量越来越多,随着社会的发展,影响学生学习成绩的因素也越来越多,学生成绩分析就更加重要。对学生成绩进行分析,从大量数据存在的关系、规则中研究学生成绩,预测成绩发展趋势,从而对教师的教学环节提出有针对性的建议,对学生管理工作有的放矢,提高授课和学习效果已显得非常重要。故本文引进了近年来兴起的数据挖掘技术用于高校学生成绩分析,以找到影响学生成绩的根本原因及所映射到的相关问题原因,从而可以制定相应的措施,提高教学质量。 本文在数据仓库和数据挖掘知识透彻理解的基础上,首先系统研究数据...",2009/12/1,2010
CMFD2002,中文文本数据挖掘研究,杨斌,,湘潭大学,数据挖掘;文本挖掘;文本分类;文本关联;文本挖掘器,"随着Internet的大规模普及和企业信息化程度的提高，有越来越多的信息积累，其中绝大部分均以文本形式存在。这样，文本挖掘( Text Mining )作为数据挖掘的一个新主题而出现，引起了人们极大的兴趣，同时，它也是一个富于争议的研究方向。国内中文文本挖掘(CTM, Chinese Text Mining)的研究刚刚开始，面向中文语料的文本挖掘目前还没有像样的系统，还存在许多问题亟待解决。文中，我们对此进行了研究。 首先，我们从理论上对文本挖掘进行了探讨。我们在数据挖掘概念的基础上进行扩展，给出了文本挖掘的定义，通过分析其特点，描述了中文文本挖掘的处...",2002/4/1,2002
CMFD2004,数据仓库和数据挖掘技术在税务系统的应用,陈安,,安徽大学,数据仓库;多维数据模型;数据集市;数据挖掘;关联规则;决策支持;联机分析处理,数据库是决策支持技术的关键，数据库技术的成熟也是数据仓库技术提出的基础，而数据仓库和数据挖掘技术是决策支持新技术，它将成为一体化信息支持系统的核心技术。 基于上述的各类技术，本文阐述了如何应用数据仓库的技术建立税务系统数据仓库，分析了多维数据模型、元数据，数据仓库的系统结构、技术要求。最终建立了税务系统的数据仓库。由于在税务系统当前的业务处理系统有多种数据源，本文重点给出了实现数据预处理中的数据清理、集成、转换和数据装载的相应策略。并在建立的事实表上进行了OLAP(联机分析处理)操作，通过这些操作实现数据仓库在税务系统的应用。研究了数据仓库的逻...,2003/5/8,2003
,,,,,,,,
